es_en_TRANSOFMERS	VerConf
I repeat again today what I said on 31 January (see S/PV.6710), it is unacceptable that the Council should be prevented from assuming its responsibilities.	1
Takes note of the development of the human rights due diligence policy, encourages [the Mission] to continue to implement it fully, and requests the Secretary-General to report to the Council on progress made in the implementation of that policy;	0
Organized crime, deeply rooted in political and social life, together with extremism, endangers the very foundations of the principles and values that we are trying to infuse into the new institutions that have been established there and to make our efforts useless.	1
[D] stresses the responsibility of all parties and armed groups in [the affected country] to take appropriate measures to protect the civilian population of the country, in accordance with international humanitarian law, international human rights law and international refugee law, in particular by avoiding any indiscriminate or excessive use of force in populated areas.	1
Abdelrahman Mouhamad Zafir al-Dabidi al-Jahani is associated with Al-Qaida or a cell, affiliated entity, splinter group or derived from it for âparticipating in the financing, planning, facilitation, preparation or commission of acts or activities executedâ by Jabhet al-Nusra, alias of the Al-Nusra Front for the Peoples of the Levant (QE.A.137.14), âor performed in or under his name, together with or in support of himâ and ârecruiting for himâ.	1
The issue of the full deployment of the civilian police component of UNOMIG, as decided by the Security Council, remains unresolved.	0
In addition to analysing the List, the Team reviews the implementation of the three sanctions measures: the assets freeze, the travel ban and the arms embargo.	0
In discussing the development challenges facing Afghanistan, recent developments highlight a bleak picture of the security situation.	1
Rogerio Lobato was proposed to the post of Secretary of State for Defence, but he declined the position after General Taur Matan Ruak threatened to abandon the defence force. Roque Rodrigues was appointed.	1
The members of the Council also considered the report of the Secretary-General (S/2000/632), which indicated that significant progress had been made in the political and military fields, but that the Government of Guinea-Bissau continued to face numerous challenges in restoring lasting peace, stability and sustainable development.	0
âThe Security Council reiterates its demand for full civilian control of the armed forces.	1
According to Afghan officials, the total number of insurgency deaths in 2010 exceeded 50 per cent of the total of the previous year and the number of civilians injured increased by one third.	0
The bill, which will be submitted to Parliament, provides that at least 30 per cent of parliamentary seats should be reserved for women; that one district in each constituency at the local council level should be allocated to women candidates; and that political parties should assign âsafeâ posts to women candidates.	0
The Council authorized the deployment of the United Nations Operation in Burundi (ONUB) with a maximum of 5,650 military personnel, including 200 observers and 125 staff officers, as well as up to 120 civilian police officers, and with appropriate civilian personnel; ONUB, which would be deployed as from 1 June 2004 for an initial period of six months, would be constituted at the outset by the forces of the African Mission in Burundi.	0
However, we are concerned by reports that tensions between the Government party and the opposition parties have intensified.	1
This in itself presents new challenges, such as establishing new approaches to curbing incitement to terrorism and violent extremism and taking into account the relationship between security and development.	0
Since its establishment in June 2005, the Special Court on the Events in Darfur has handed down judgements in five cases.	1
6. Stresses that it is fully prepared to impose targeted measures against individuals designated by the Committee in accordance with paragraphs 9, 11 and 14 of resolution 1572 (2004), which have been determined, inter alia, that:	1
(b) Not to impose effective measures to prevent the rape of Ethiopian women and girls;	0
24. Syrian troops were invited to Lebanon by the President of Lebanon, Suleiman Franjieh, in May 1976, in the early stages of that country's civil war.	0
UNIFEM, UNFPA In post-conflict countries, advocacy for strategies to address the gender dimensions of reconstruction through needs assessment and transitional mechanisms.	0
Finally, Afghans urgently need to take the lead in the fight against drugs.	1
However, the Monitoring Team recommends that the Security Council remind Member States that the sanctions regime requires them to prevent the use of the Internet, directly or indirectly, from their territory or by their nationals from outside their territory to provide, sell or transfer technical information, assistance or training relating to military activities to listed individuals and entities.	1
A recent notable case was Mali, in which the Council did not respond to the Secretary-General's request to establish a group of experts to investigate the identity and activities of those involved in transnational and organized crime in Mali and the subregion, and to study their impact on overall stability, with the possibility of imposing targeted sanctions.	1
First, with the World Bank, a workshop for parliamentarians in Pakistan on the importance of laws in combating the financing of terrorism.	0
In accordance with paragraph 11 of resolution 1963 (2010), the Committee, with the assistance of its Executive Directorate, held a special meeting on 28 September 2011 to commemorate the tenth anniversary of the adoption of resolution 1373 (2001) and its own establishment.	0
The Programme of Action contains concrete suggestions for improving national legislation and controls and international assistance and cooperation, and calls upon States to address the special needs of children affected by armed conflict.	0
Since the beginning of the political impasse, following the elections of 29 March, the Secretary-General has expressed concern about the process and politically motivated violence.	1
At the seminar, which took place at United Nations Headquarters in New York, the participating prosecutors were able to analyse the difficulties with which they routinely deal in prosecuting terrorist crimes, and to exchange information on the processes carried out against terrorists in an effective and satisfactory manner, respecting the rule of law and human rights.	0
However, intercommunal tensions remain high in some regions, and there have been several attacks.	0
The Committee encourages its Executive Directorate to continue to focus on the implementation of resolution 1624 (2005), in particular by giving due attention to relevant issues such as the role of new information and communication technologies; the promotion of dialogue, including at the national level, in order to promote tolerance, diversity and inclusion; the development of strategic partnerships between governmental and non-governmental actors; the identification of the role of victims of terrorism; and the need to prevent terrorists and their supporters from using institutions for their own benefit.	0
On 24 November, in the Council Chamber, the Chairperson of the Committee established pursuant to resolution 1591 (2005) concerning the Sudan, Ambassador MarÃ­a Cristina Perceval (Argentina), presented the relevant quarterly report and updated the Council on the activities of the Committee during the reporting period. She referred, inter alia, to collaboration with Member States in the region to identify information gaps and communicate capacity-building needs to promote the implementation of sanctions.	0
Many of them told similar stories according to which they had been arrested, manipulated, blindfolded and stripped naked by the Internal Security Forces while being questioned about Mr. Abu Adass and his relations with Islamic groups, most of whom shared the opinion of their interrogators that Mr. Abu Adass was a lonely and introverted person who did not have enough intelligence to commit such a crime.	0
In his latest report on the protection of civilians in armed conflict (S/2012/376), the Secretary-General indicated that the state of protection of civilians remained dire and that there was a clear need for policy commitments to translate into concrete improvements for the protection of civilians on the ground.	1
379. Third, since the investigation and prosecution would relate to persons who enjoy authority and prestige in the country and exercise control over the State apparatus, it seems unlikely that a special court will be established through an agreement between the Government and the United Nations to investigate and prosecute members of the same Government.	0
The Government of the Central African Republic has repeatedly expressed a strong preference for direct assistance to build the capacity of its national forces and has established contacts with a number of potential bilateral partners.	0
The extent to which State institutions, the police and the national army are present and functioning in these areas varies considerably.	0
There will be a risk that the tension will focus on the status to the detriment of the rules.	1
Its establishment has responded to allegations of violations of international human rights law and international humanitarian law in conflict situations and in situations of high levels of violence, often (but not exclusively) related to electoral or political processes in which serious human rights violations have occurred.	1
Non-EU States independently develop their regulatory framework for combating terrorism and incorporate into their domestic legislation the offences stipulated in international counter-terrorism instruments.	0
The Assistant Secretary also provided an update on vehicles, items and equipment taken by armed opposition groups in recent incidents with the Force.	0
Consequently, climate change was not only exacerbating existing threats to international peace and security; it was also in itself a threat to international peace and security.	1
The Prosecutor regretted that the security situation in Libya had worsened, that political instability had increased and that, as a result, the prevailing climate was not conducive to closing the impunity gap in the country.	1
78. The Sudanese armed forces are conventional armed forces responsible for protecting and maintaining internal security.	0
Support should be provided to advance justice sector reform, in close collaboration with the United Nations country team, and to establish accountability mechanisms and strengthen existing mechanisms in the defence and security forces.	0
With the support of the World Food Programme (WFP), the Government also continued its efforts to provide food assistance to vulnerable population groups affected by food insecurity, including the Ministry of Health's Mother and Child Nutrition Programme (47,000 beneficiaries as at 30 June), the Ministry of Education's School Feeding Programme (241,000 beneficiaries), and the Food for Work Programme (600 beneficiaries) for communities affected by food insecurity. On 27 May, with the technical and managerial support of WFP, a factory of nutritious compound foods was opened for distribution through the Mother and Child Nutrition Programme.	0
The Chairman noted the continuing concern of some countries regarding the scope of the high-risk area.	1
(a) Analyse the evolution of risks and threats;	1
The Commission cannot accept the Government's position that statistics on the work of the committees indicate a much lower incidence of the crime of rape than indicated by sources such as the United Nations, the African Union and other national and international organizations.	1
Stressing that it remains a matter of considerable concern that terrorists are sheltered and that all Member States should cooperate fully in the fight against terrorism in order to locate, deny safe haven and bring to justice, in accordance with the principle of extradition or prosecution, all those who support, facilitate, participate in, or attempt to participate in the financing, planning, preparation or commission of terrorist acts or who harbour their perpetrators,	0
Finally, we must caution that it is not in the interest of international peace and security for the international community, including the Security Council, to use the plight of the Arab peoples for their own sake and to effect regime change.	1
The Council reiterates its intention to continue to combat impunity vigorously and to hold accountable by appropriate means.	1
While the regime's air strikes on civilian areas, the Syrian armed forces have besieged entire cities.	0
Also demands that the parties to the conflict cease immediately all violations and abuses committed against children, and requests the Secretary-General to ensure that: (a) the situation of children continues to be monitored and reported on, in particular in the reports referred to in the [relevant paragraph] of the present resolution, including through enhanced cooperation with the actors responsible for their protection; and (b) dialogue with the parties to the conflict continue to develop and implement time-bound action plans to end the recruitment and use of children and other violations of international human rights and humanitarian law against children;	1
(v) To encourage all States, pursuant to paragraph 8 of resolution 1977 (2011), to prepare, on a voluntary basis, national implementation action plans, with the assistance of the Committee established pursuant to resolution 1540 (2004), as appropriate, outlining their priorities and plans for the implementation of the key provisions of resolution 1540 (2004), and to submit such plans to the Committee;	0
:: Establishment and use of effective measures to investigate and prosecute serious violations of humanitarian and criminal law at the local and/or international levels (since the start of the operation).	0
Uganda's only interest and unequivocal demand has been for LRA terrorists to be disarmed, detained and brought to justice as soon as possible.	1
Condemnation of the illicit trade in small arms and light weapons	1
Unfortunately, there are also numerous examples where fact-finding mechanisms could have contributed to establishing the truth, ensuring accountability and preventing further violations of human rights, but where the Council failed to take effective action because of political considerations.	1
âThe Security Council condemns all violations of international law, including international humanitarian law, human rights law and refugee law, committed against civilians in situations of armed conflict.	1
The European Union stressed that the creation of any Somali national military force should take place within the framework of a national security and stabilization plan, and in accordance with the statement of the President of the Security Council of 14 July 2005.	0
Brigadier General Taur Matan Ruak declined President GusmÃ£o's request to attend the demonstration and instead sent the F-FDTL Chief of Staff, Colonel Lere Annan Timor.	1
I strongly condemn the use of toxic chemicals of all kinds by any party to the Syrian conflict.	1
Several States have not yet put in place procedures to identify and freeze terrorist assets without delay.	0
Even when the State has made valid reservations to certain provisions of the Covenant, the prohibition of unrecognized detention, hostage-taking or abductions is absolute.	0
In the closed consultations that followed, the Special Representative and the Special Envoy addressed some issues related to security sector reform and the establishment of a rapid reaction force within FARDC, the electoral process and the general elections.	0
âThe Security Council expresses its grave concern that the continued instability and growing security vacuum in the Central African Republic continue to negatively affect operations against LRA and contribute to strengthening LRA in the country.	1
Decides that the travel ban imposed under paragraph 1 (b) shall not apply to the persons described in paragraph 9, where the Committee determines, on a case-by-case basis, that entry or transit is justified, also decides that such exemptions approved by the Committee may be granted only for the period requested for travel to the specified place or places, instructs the Committee to take a decision on such requests, as well as requests for modification or extension of prior exemptions, or a request by a Member State to revoke previously granted exemptions within 10 days of their receipt, and affirms that, notwithstanding any exemptions relating to the travel ban, listed individuals continue to be subject to the other measures described in paragraph 1 of this resolution;	0
At the same time, Germany and the European Union have repeatedly condemned the terrorist atrocities that have resulted in the deaths of hundreds of Israelis.	1
About 8 a.m. hours of the second day in the wadi, I was raped for the first time.	0
The Government did not accept recruits from all tribes.	1
Security Council resolution 1373 (2001) already requires States to take certain measures to suppress terrorism and the recruitment of members of terrorist groups, to prevent the movement of terrorists and to bring them to justice.	0
According to some estimates, more than 700 villages in the three Darfur states have been totally or partially destroyed, and the Commission was also informed that the police had assessed the destruction and recorded the number of villages destroyed by more than 2,000.	0
âThe Security Council reiterates its demand to all parties to an armed conflict to cease immediately and comprehensively all forms of violence against women and girls, including acts of sexual violence.	1
The Government of Jordan stresses the need for the Government of Israel to stop immediately and completely the acts of violence and destruction it is carrying out in the Gaza Strip, as well as throughout the Occupied Palestinian Territory; to put an end to its policy of deliberate destruction of Palestinian infrastructure and housing; and to cease immediately its extrajudicial killings and the imposition of collective punishments and other practices against the Palestinian people.	1
A real understanding of the challenges facing each country is developing individually.	1
Secondly, even if it could prove such a legitimate ground, the asylum seeker is subject to the exclusionary exceptions of article 1, paragraph F, which deprive the international protection afforded by refugee status to those guilty of heinous acts and serious common crimes and ensure that such persons do not abuse the institution of asylum in order to avoid responding to the law for their acts.	1
âThe Security Council stresses that no attempt to disrupt the peace and transition process in the Democratic Republic of the Congo, including through support for armed groups, will be tolerated.	1
âThe Security Council reiterates its equally strong condemnation of all violations of applicable international law related to the recruitment and use of children by parties to armed conflict, as well as cases of repeated recruitment, killing and maiming, rape and other sexual violence, abductions, attacks on schools or hospitals and denial of humanitarian access by parties to armed conflict.	1
All the houses in the village were burned down and the bodies of the victims were buried in mass graves outside the village.	0
The struggle for power manifests itself in various ways and aims to gain the support of the different social forces that coexist in civil society and public opinion in order to gain more popular support or influence.	0
âThe Security Council reiterates its readiness to impose sanctions on individuals and entities that provide shelter, finance, facilitate, support, organize, train or incite individuals or groups to commit acts of violence or terrorism against other States or their citizens in Somalia or the region, in accordance with its relevant resolutions, and other regional networks, as well as individuals, groups, undertakings and entities that do not break all their links with Al-Qaida and associated groups, including Al-Qaida in the Islamic Maghreb (AQMI), `Movement for Unity and Jihad in West Africa' (MUJAO) and Ansar Eddine, in accordance with resolution 2083 (2012).	1
I am concerned that this vote and this stalemate in Parliament could undermine the important achievements that Somali stakeholders and their partners have made.	1
(b) To continue to identify the needs of States with regard to improving their institutions and strengthening the rule of law, and to proactively incorporate human rights and the rule of law in its recommendations for technical assistance to States, in order to strengthen national systems to bring terrorists to justice and enhance international cooperation;	0
Stressing that improved dialogue and broader understanding among civilizations, in an attempt to prevent indiscriminate attacks on different religions and cultures, and addressing unresolved regional conflicts and the full range of global challenges, including development challenges, will contribute to international cooperation that is, in turn, necessary to sustain the broadest possible fight against terrorism,	0
Many States should also continue to address issues such as radicalization, violent extremism and cross-border movements of terrorists.	0
Most States in the subregion have enacted legislation to regulate the import and export of arms.	0
The victim stated that she knew 19 of the women who were raped but that there were many more. I thought there were about 50 in total.	0
15. On 2 December, NATO completed its military mission in Bosnia and Herzegovina with an official ceremony in Camp Butmir, Sarajevo.	0
The authorities also noted that small arms and light weapons from previous conflicts in the region continued to circulate.	0
Progress in eliminating the Syrian chemical weapons programme	0
Evidence shows that in addition to the civilian killed in Rai Kotu, two other civilians died during the night.	0
Although the Commission rejects the fact that at the meeting on 8 May the former Prime Minister instructed Rai Los to âeliminateâ his political opponents, it is convinced, on the basis of all the information before it, that there is a reasonable suspicion that the former Prime Minister was at least aware of the distribution of PNTL weapons to civilians.	1
There was widespread support for efforts to neutralize the threat posed by ADF and other armed groups, such as FDLR, in eastern Democratic Republic of the Congo, as mandated by resolution 2147 (2014).	0
This is an important fact, as it led to a significant increase in the level of frustration and hatred of the affected population, including supporters or alleged supporters of opposition parties and community groups, towards the police and security forces.	1
Emphasizing that the United Nations has a central role to play in the global fight against terrorism, and welcoming the adoption by the General Assembly of the United Nations Global Counter-Terrorism Strategy (resolution 60/288 of 8 September 2006), the institutionalization of the Counter-Terrorism Implementation Task Force, in accordance with General Assembly resolution 64/235 of 24 December 2009, which will further strengthen the efforts of the Counter-Terrorism Implementation Task Force to ensure overall coordination and coherence of the activities of the United Nations system, including in the field, and the call for greater participation of Member States in the work of the Task Force (resolution 64/297),	0
The arrest and physical assault of United Nations personnel is totally unacceptable.	1
In the same resolution, the Council also established some exemptions from the specific measures. On 5 December 2011, the Security Council adopted resolution 2023 (2011), by which it extended the restrictive measures applied to Eritrea in relation to the âdiaspian taxâ and the mining and financial services sector of that country.	0
Urges States and all other parties to armed conflict to make every effort to prevent violations of international humanitarian law against civilians, including journalists, media professionals and their associated personnel.	1
In some cases, the national response to contain the virus involved excessive use of force or quarantine of communities in conditions below recognized levels of human dignity.	0
From 18 February to 13 March, the Royal Moroccan Army conducted a series of planned military exercises in the vicinity of Awsard, involving some 1,200 soldiers of infantry, cavalry and artillery units already stationed in the Awsard subsector.	0
Notes that the excessive accumulation and destabilizing effect of small arms and light weapons represent a significant obstacle to the delivery of humanitarian assistance and can exacerbate and prolong conflicts, endanger civilians and undermine the security and confidence necessary for the restoration of peace and stability...	1
It should be noted that other Lebanese senior representatives, such as former Prime Minister Najib Miqati, have stated that âthere should be no weapons inside or outside the campsâ.	1
