es_en_DEEP	VerConf
With the exception of San Pedro and Abidjan, the ports and coastline lacked the infrastructure necessary to import significant quantities of weapons and military equipment.	0
We consider that Armenia's position constitutes a clear challenge to the conflict resolution process and a serious threat to regional and international peace and security.	1
The socioeconomic challenges facing Afghanistan are significant.	1
All of this occurred despite repeated condemnations of these inhuman acts in Council resolutions 1820 (2008), 1888 (2009) and 1960 (2010), resolutions that became beacons of hope for millions of women and girls who were victims. of abuses around the world.	1
The members of the Council once again expressed their deep indignation at all the killings, abductions, rapes or torture of all Iraqi citizens and nationals of other States carried out by ISIL, as well as the recruitment and use of children.	0
Organized crime, deeply rooted in political and social life, together with extremism, endangers the very foundations of the principles and values ​​that we are trying to instill in the new institutions that have been established there and make our efforts may result. useless.	1
It was reported that detainees were systematically subjected to physical and mental suffering as punishment for their alleged affiliation with or support for the rebels and in order to obtain information or confessions.	0
1) If the offender has destroyed, damaged, transferred, rendered useless or used (in particular exhausted or consumed) any property that could be confiscated under paragraphs 1 and 2 of article 70 or when the offender has otherwise prevented confiscation of these assets, the court may order the confiscation of funds up to the amount corresponding to their value; The value of the property that could be subject to confiscation may be calculated by the court.	1
Some of its recommendations to the Sudanese authorities can and should be implemented immediately, for example to provide the International Committee of the Red Cross and United Nations human rights monitors with full and unhindered access to all detainees in regarding the situation in Darfur.	0
Abdelrahman Mouhamad Zafir al Dabidi al Jahani is associated with Al-Qaida or a cell, affiliated entity, splinter group or derivative thereof by "engaging in the financing, planning, facilitation, preparation or commission of acts or activities carried out" by Jabhet al- Nusra, alias Al-Nusra Front for the Peoples of the Levant (QE.A.137.14), "or carried out in or under its name, together with it or in its support" and "recruit for it."	1
On behalf of the Security Council Committee established pursuant to resolution 1540 (2004), I have the honour to inform you that the Committee has agreed to hold an open-ended meeting, as provided for in its report on the modalities for conducting a comprehensive review of the status of implementation of resolution 1540 (2004) pursuant to paragraph 8 of resolution 1810 (2008) (S/2009/170).	0
The work of organizations such as UNESCO, UNDP and the United Nations Alliance of Civilizations, focused on conflict prevention, creating a culture of peace, eradicating poverty and promoting sustainable development and social inclusion through education, culture and communication in Africa, has become essential.	0
Gender-sensitive procedures and criteria for determining entitlement to relief and social services E.1 Formulation, implementation and evaluation of policies and strategies on mainstreaming a gender perspective in all programmes. reconstruction and rehabilitation after conflicts.	0
In this regard, we request the African Union Commission, in close cooperation with ECOWAS and with the support of international partners, including in particular the United Nations, the European Union and other international stakeholders, to take all necessary measures, including but not limited to among them the convening in Mali, no later than February 2015, of a meeting of Ministers of Defense and Security and the chiefs of staff and the heads of the intelligence and security services of the countries of the region, in order to carry out the necessary studies to establish these mechanisms.	0
Naturally, we are deeply concerned about the situation in the states of South Kordofan and Blue Nile, given their geographical proximity to our country.	1
First, transnational crime and lax border controls can weaken state authority.	0
A coherent and comprehensive report of the results and conclusions of the crime scene investigation has been submitted to the Commission.	0
Finally, I call on the Security Council to stand in solidarity with Nigeria in this critical period and to provide it with whatever support is necessary to prevent further destabilization and violence, particularly in the hard-hit northeastern States.	0
In that sense, we want to go further and say that we believe that the only way to improve security and stability in Somalia is to enable the Somali security forces to control the most violent insurgents and to allow the Government to expand its areas of authority as much as possible if peace negotiations fail.	1
Council members, in their remarks, expressed serious concern over recent developments, highlighted the need to establish border security mechanisms, and called on the two sides to take measures to normalize their relations.	1
Urges the international community to provide support and assistance to enable States to fulfill their responsibilities regarding the protection of refugees and other persons protected by international humanitarian law.	0
The Security Council must recognize that combating violent extremism is an essential element of the international community's response to this threat.	1
Many times the attacks lasted several hours.	0
The Commission notes that crimes of sexual violence committed in Darfur can be considered rape, crimes against humanity, or sexual slavery, a crime against humanity.	0
Several members of the Group expressed their strong support for resolution 2185 (2014) and the first briefing by the heads of police components as an important basis for the Group's work on the police aspects of peacekeeping operations .	0
j) Unlawful detention, abusive treatment in Eritrean prisons, and inhuman treatment and poor quality of food and accommodation in detention camps;	0
Encourages them to redouble their efforts to provide security to civilian populations in their territory, including foreigners whom they host as refugees.	0
One such group is the National Movement for Reform and Development (MNRD). On 6 June, the MNRD released a manifesto declaring that it was not a party to the ceasefire agreement concluded in April between the Government, the Sudan Liberation Movement and Army and the Justice and Equality Movement, and that he was going to fight against the Government.	1
However, the security situation remains of real concern to all, despite a decrease in security-related incidents in December 2011 and January 2012 compared to the two-month period covered by last year's report.	1
It is part of a mantra constantly repeated before this Council, which by no means turns out to be true, which ignores both Palestinian responsibilities and Israeli rights, and which fails to recognize the enormous difficulties that Israeli forces face in trying to protect their citizens and minimizing the damage to Palestinian lives when the terrorists they face show as little concern for Palestinian lives as they do for Israelis.	1
- Condemn and request the immediate cessation of incitements to violence against civilians in situations of armed conflict.	1
While Al-Qaida, the Taliban and their associates may not have advanced structures and systems to ensure operational control of their followers, they do have an effective military capability, as demonstrated, for example, by the insurgency in Afghanistan. At the tactical and operational level, Al-Qaida, the Taliban and their associates have used both military and civilian equipment, such as short-range radios and mobile and satellite phones.	1
2. Decides that all States shall take the following measures with respect to Osama bin Laden, members of the Al-Qaida organization and the Taliban and other individuals, groups, enterprises and entities associated with them listed on the list prepared pursuant of resolutions 1267 (1999) and 1333 (2000), which will be updated periodically by the Committee established pursuant to resolution 1267 (1999), hereinafter referred to as "the Committee":	0
The report should also indicate the contributions that the Council could make to promote the effective implementation of existing humanitarian law standards, and should identify whether there are significant gaps in existing legal standards by reviewing recent reports in this regard.	0
The Russian Federation once again calls on the Israeli and Palestinian sides to show restraint and a high level of responsibility, and to refuse unilateralism.	1
Recalling its resolution 2133 (2014) and the publication by the Global Counter-Terrorism Forum of the "Algiers Memorandum on Good Practices in the Prevention of Kidnappings by Terrorists for Ransom and the Denial of Their Benefits", strongly condemning the acts of kidnapping and hostage-taking committed by terrorist groups regardless of their purpose, including raising funds or obtaining political concessions, expressing its determination to prevent acts of kidnapping and hostage-taking committed by terrorist groups and to secure the release of hostages safely and without ransom or political concessions being paid, in accordance with applicable international law, calling on all Member States to prevent terrorists from benefiting directly or indirectly from the payment of ransoms or political concessions and to ensure the safe release of hostages, and reaffirming the need for all Member States to cooperate closely in cases of kidnapping and hostage-taking by terrorist groups,	1
Al-Qaida in Iraq (AQI) (QE.J.115.04) recently changed its name to the Islamic State in Iraq and the Levant (ISIL) in order to legitimize its operations in the Syrian Arab Republic and distance itself from the brand. Al-Qaida.	1
In the deliberations on the role of the President, several participants recognized that two "traps" had to be avoided: first, trying to achieve national objectives to direct the work of the Council towards specific interests; and secondly, assuming a type of leadership that is too isolated and formulaic.	0
Whatever the reason, if the attackers' intention had been to annihilate the group, they would not have spared the life of one of the brothers.	0
In fact, Azerbaijan itself violates these resolutions, which call on the interested parties to engage in negotiations within the framework of the OSCE Minsk Group and through various contacts between them.	1
However, concern remains for the 2.3 million people who continue to be in a crisis situation.	1
Our main concern in this regard is the fact that, according to the report, none of the eight standards have yet been fully met.	1
It is unacceptable that attempts are made to destabilize the internal situation in Lebanon by carrying out political assassinations.	1
The Special Representative regretted that the human rights situation continued to be marked by ongoing violations and warned that the situation could even worsen with the adoption and implementation of a new draft law on security.	1
A travel ban may be particularly useful if used against individuals who provide financial resources to Al-Qaida and the Taliban and who may find it difficult to use a false identity or otherwise circumvent restrictions on their movement.	0
I must report, with great concern, an escalation in criminal acts and attacks against United Nations and humanitarian personnel.	1
If missions did not fulfill their responsibilities to protect civilians, this was detrimental to other tasks entrusted to them, not to mention the loss of life and suffering that this caused.	1
Consider referring situations of genocide, crimes against humanity or war crimes to the International Criminal Court.	0
r) Gather and evaluate information, monitor, report and make recommendations regarding the implementation of measures, including the implementation of the measure indicated in paragraph 1 a) of this resolution with respect to preventing the use of the Internet for criminal purposes by Al-Qaida and other individuals, groups, companies and entities associated with it; conduct case studies, as appropriate; and thoroughly examine such other relevant matters as may be indicated to it by the Committee;	0
One State had established in 2010 a multidimensional diversity and social cohesion program aimed at promoting mutual respect and a sense of belonging for all, as well as building community resilience.	0
The Security Council expresses its grave concern at the increasing entrenchment of terrorist elements, including Al-Qaida in the Islamic Maghreb (AQIM), affiliated groups and other extremist groups, in the Sahel and the consequences for countries in the region and beyond.	1
Accordingly, the Secretary-General has called recent events in Zimbabwe a "catastrophic injustice".	1
The pillaging of villages and the appropriation of livestock, crops, household goods and other personal belongings of the population by Government forces and the militias under their control undoubtedly constitutes a war crime.	0
3. Political tensions surrounding the 2012 elections intensified during the reporting period. On 9 September 2011, retired Brigadier General Julius Maada Bio, SLPP presidential candidate, was injured in an attack on the convoy he was traveling in by APC supporters in Bo, in the southern region of the country.	0
At the 6900th meeting of the Security Council, held on 15 January 2013, in connection with the Council's consideration of the item entitled "Threats to international peace and security caused by terrorist acts", the Presidency made the following statement in Council name:	0
- In an increasingly globalized world it has become increasingly easier for terrorists to exploit advanced technologies, communications and resources for their criminal objectives;	1
That the Government of Kuwait's request for a claim relating to immovable property in relation to a deceased detainee be rejected as in reality a request to submit the immovable property portion of the claim late outside the established filing deadline, and request the secretariat to inform the Government of Kuwait in this regard.	1
While Hezbollah's actions are deplorable and, as I have already said, Israel has the right of self-defense, the excessive use of force must be condemned.	1
For example, most States have yet to criminalize the financing of terrorism and declare it a predicate offense in relation to money laundering.	1
The victim stated that she knew 19 of the women who were raped but that there were many more. She thought there were about 50 in total.	0
The MDC candidate has little or no access to Zimbabwe's media; he is prohibited from campaigning freely; and there are reports that the state has confiscated campaign buses and vehicles, allegedly because they were not properly registered.	1
The Department formulated a gender action plan to integrate gender perspectives into its conflict prevention, peacebuilding and peacebuilding activities.	0
Recalls the prohibition of the forced displacement of civilians in situations of armed conflict, which violates the obligations of the parties under international humanitarian law.	0
The Security Council reiterates its readiness to impose sanctions on persons and entities that shelter, finance, facilitate, support, organize, train or incite persons or groups to commit acts of violence or terrorism against other States or their citizens in Somalia. or in the region, in accordance with its relevant resolutions, and to other regional networks, as well as to individuals, groups, companies and entities that do not sever all their links with Al-Qaida and associated groups, including Al-Qaida in the Maghreb (AQIM), the 'Movement for Unity and Jihad in West Africa' (MUJAO) and Ansar Eddine, in accordance with resolution 2083 (2012).	1
On April 14, 2011, the Coordinator met with Mr. Khaled Al-Jarallah, Undersecretary of the Ministry of Foreign Affairs of Kuwait, who indicated that the task of finding the mortal remains of the Kuwaiti victims should not be "mixed" with what that could happen in the political relations between Iraq and Kuwait.	0
We urgently call for you to intensify your support for the collective initiatives that our States will undertake, within the framework of the Nouakchott Process, to address the threat that terrorism, violent extremism and transnational organized crime pose to peace and security. international security.	1
A notable recent case was Mali, where the Council did not respond to the Secretary-General's request to create a group of experts to investigate the identity and activities of those involved in transnational and organized crime in Mali and the subregion, and study its impact on general stability, with the possibility of imposing selective sanctions.	1
32. Welcomes the regular reporting by the Government of Afghanistan on the content of the List and the effects of targeted sanctions in terms of countering threats to the peace, stability and security of Afghanistan and supporting the Afghan-led reconciliation initiative;	0
The UNOCI police component also provides technical support and advice to the integrated command center in relation to security sector reform.	0
Since August 2005, the United Nations Security and Rule of Law Program has been providing technical and financial support to a law enforcement seminar and training course for the Somalia Police Force in Kampala.	0
However, it is unlikely that the FARDC contingents deployed in the province will be able to establish effective and sustained control throughout Katanga and substantially limit the Mayi-Mayi's ability to harass the local population and illegally exploit natural resources. .	0
With regard to the role of the Security Council in reparations, it was noted that on several occasions the Council was encouraged to take action in relation to that aspect of accountability, for example, in addition to recommending the referral of the situation to The International Criminal Court's International Commission of Inquiry for Darfur also recommended that the Council establish an international compensation commission, a proposal that received little attention and was not followed up by the Council.	0
Noting once again with deep concern the continued hostilities by foreign militias and armed groups in the eastern part of the Democratic Republic of the Congo and the threat that these hostilities pose to the holding of elections in the Democratic Republic of the Congo,	1
The Security Council notes with concern that terrorism continues to constitute a serious threat to international peace and security, the enjoyment of human rights and the socio-economic development of all Member States, as well as undermining global stability and prosperity, which is The threat has become more diffuse, with an increase in terrorist acts in various regions of the world, including acts motivated by intolerance or extremism, and expresses its determination to combat this threat.	1
Reaffirming its resolutions 1265 (1999) and 1296 (2000) on the protection of civilians in armed conflict, its various resolutions on children and armed conflict and on women, peace and security, as well as its resolution 1631 ( 2005) on cooperation between the United Nations and international organizations in the maintenance of international peace and security, and further reaffirming its determination to ensure respect for and follow-up to these resolutions,	0
Abductions of women were also reported in the El Geneina area of ââWestern Darfur.	0
Article 21, paragraph 2, of the annex to Security Council resolution 1757 (2007) states that if the Special Court has not completed its activities at the end of its current mandate, "the Agreement shall be extended to enable it to complete its work." within the period or periods determined by the Secretary-General in consultation with the Government [of Lebanon] and the Security Council."	0
Finally, I would like to make some recommendations for any fact-finding mechanism being established:	0
:: Conduct further verifications in areas where the initial review of reports has revealed gaps in information or implementation in relation to all aspects of the resolution covering all required measures, for each type of weapon or their respective delivery systems and related materials, including modification of matrices where useful	0
In the future, these regional organizations, and in particular the European Union, should play the most prominent role in Kosovo.	0
My Government appreciates the numerous expressions of condemnation and indignation that this atrocity has provoked. We are especially grateful for the Security Council's swift reaction to this gruesome crime.	1
However, he did not know how many had been released or how many remained detained.	0
The Democratic People's Republic of Korea also uses propaganda to incite nationalist hatred towards the official enemies of the state, namely Japan, the United States of America and the Republic of Korea, and their citizens.	0
As a result, some Committee members who did not have information on a name or had been part of the consultations may have felt marginalized in the decision-making process; Although a more open exchange could have occurred at Committee meetings, all members had the opportunity, and often exercised it, to request more details when they considered it important.	0
Under the leadership of my Special Representative, UNOMIG continued its work to promote stability in the conflict zone and advance dialogue between the Georgian and Abkhazian parties on political and security issues, the return of refugees and internally displaced persons and economic cooperation, objectives that were supported by the high-level meeting of the Group of Friends held in Geneva under the presidency of the United Nations (see S/2003/412, para. 3).	0
At the same time, it is imperative that all Somali parties, especially the transitional federal institutions, honor their promises to resolve the enormous political, economic and security challenges before them.	1
I am pleased to report that funds have been secured to establish a law library under the custody of the Rabouni refugees (see S/2007/619, para. 41).	0
Supporting the restoration and extension of a minimum level of State authority to areas free of armed groups requires a greater commitment from the Government to assign State officials, especially police officers and judicial and prison personnel, to these areas. providing them with the necessary resources.	0
"The Council expresses its appreciation to the countries participating in the United Nations Stabilization Mission in Haiti (MINUSTAH) and hopes that the countries that have committed to contribute troops and civilian police will make every effort to expedite the prompt deployment of their staff.	0
:: Systematic coordination is maintained between the civil and military components of the mission and with humanitarian agents in order to consolidate the knowledge acquired regarding the protection of the civilian population.	0
On the ground, the situation is complex and disturbing, especially for minority communities.	0
Efforts continued to recruit members from minority communities to work in the Corps.	0
In all of those conversations, I was heartened to find a convergence of views: we were all amazed at the much progress Liberia has made since the fighting ended in 2003, but we all fully realized how daunting the challenges Liberia still faces and that Ultimately, we cannot take anything for granted.	1
The Council condemns any unilateral action that aims to create situations on the ground that undermine the results of the negotiations.	1
The political debate is likely to intensify as several election-related appeals have already been filed in court.	1
Banning illegal cross-border movement is vital in the fight against terrorism, drug trafficking and commercial smuggling.	1
Turkey is fully aware of the intentions of the Government of the Syrian Arab Republic, which have been manifested through various forms of aggression and provocation, including attacks on innocent civilians across the border.	0
Members also expressed their determination to continue collaborating with the Government to consolidate the progress made and ensure a stable environment for democratic governance, economic growth and humanitarian assistance. Asia	0
Condemning all attacks against United Nations peacekeepers and humanitarian personnel, regardless of who they are, and emphasizing that those responsible for such attacks must be brought to justice.	1
The Commission concludes that the incidents of torture could constitute a crime against humanity and that, given the discriminatory nature of the attacks, they could also constitute a crime of persecution as a crime against humanity.	1
He also highlighted the risk of the conflict escalating with the resumption of the migration period, the elections and the lack of dialogue.	1
We categorically condemn this morning's ruthless attack on the shrines of Iman Ali al-Hadi and Imam Hassan al-Askari in Samarra, and we share the outrage of the Iraqi people at this crime, which is another deliberate attempt by Al-Qaida to sow dissent and confront religious currents in Iraq.	1
