es_en_TRANSOFMERS	VerCoop
" The Security Council also reiterates its grave concern about the consequences of instability in northern Mali for the Sahel region and elsewhere, and stresses the need to react rapidly to this crisis, using a strategic and comprehensive approach, in order to ensure the territorial integrity of Mali and restore its stability and prevent the spread of instability to other Sahel States.	0
However, I remain concerned that restrictions on the freedom of movement of United Nations military observers seeking to visit the units, barracks and strongholds of the parties for verification purposes continue.	0
Under the UNIPSIL non-State actors project, the Political Parties Registration Commission continued to play a key role in implementing capacity-building programmes for political parties, including their women and youth sections, to mitigate and resolve conflicts.	0
The Commission recommends that the following persons be prosecuted for the illegal possession, use and circulation of weapons by the PNTL on 8 or 21 May, or both: Rogerio Lobato, Eusebio Salsinha, Antonio da Cruz, Vicente da ConceiÃ§Ã£o, alias Rai Los, Mateus dos Santos Pereira, alias Maurakat, Leandro Lobato, alias Grey Harana, Antonio Lurdes, alias 55, Marcos da Silva Piedade, alias Labadae, Francisco and Santa Cruz.	0
The Committee seeks to ensure that the List is dynamic in nature and is aligned with the evolving Al-Qaida hazard.	0
- To request troop- and police-contributing countries to ensure their proper training so that they are better aware of and able to address issues relating to the protection of personnel involved in United Nations peacekeeping operations and other relevant missions authorized by the Security Council in order to protect civilians.	1
In recent years, a number of States in the subregion (such as Bosnia and Herzegovina, Bulgaria and Serbia) have ratified some of the most recent instruments in this area.	0
The end result should be stable and sustainable, therefore artificial deadlines should not be established.	1
- To request that parties to an armed conflict comply strictly with the applicable rules of international humanitarian law and human rights law relating to the protection of women and girls affected by armed conflict.	1
- To call upon parties to armed conflict to take appropriate measures to refrain from all forms of sexual violence and to prevent and protect all persons from such violence, including by:	1
They expressed the hope of hosting East Timor at the United Nations.	1
âThe Security Council reaffirms its commitment to the protection of civilians in armed conflict and to the continued and full implementation of all its previous relevant resolutions, including resolutions 1265 (1999), 1296 (2000), 1674 (2006), 1738 (2006) and 1894 (2009), as well as all its resolutions on women, peace and security, children and armed conflict, and peacekeeping, and all relevant statements by its President.	1
The Government and the United Nations country team, with input from the World Bank, prepared a booklet on the Millennium Development Goals, which sets out the current situation in Timor-Leste and explains the policy implications of achieving the targets and indicators.	0
Five of the 12 sanctions regimes of the Security Council incorporate inclusion criteria related to violations of international human rights law and international humanitarian law, including participation in violations of the rights of children and women in conflict situations.	0
" The Security Council underlines the need for Member States in post-conflict situations, in consultation, inter alia, with civil society, including women's organizations, to address the specific needs and priorities of women and girls in their national strategies to improve their socio-economic conditions, their participation in income-generating activities and their access to education and basic services.	0
Training courses on the issue of sexual exploitation and abuse; development of policies and procedures on the organizational aspects of victim assistance.	0
In addition, following its recovery by Government forces, the city had hosted more than 11,000 displaced persons, who had been tried to assist as best as possible.	0
Members of the Council stressed that UNMEE was established at the invitation of the two parties and is ready to assist them in implementing the Algiers Agreements.	1
Demands that all parties to armed conflict immediately take appropriate measures to protect civilians, including women and children, from all forms of sexual violence, including, inter alia, the application of appropriate military discipline measures and the application of the principle of command responsibility, the training of troops on the categorical prohibition of all forms of sexual violence against civilians, the rebuttal of myths that fuel sexual violence and vetting candidates for national armed forces and security forces to exclude those associated with serious violations of international humanitarian law and international human rights law, including acts of sexual violence.	1
12. In view of the deep mistrust among the Lebanese people regarding their judicial and security authorities, the Commission has become a source of high expectations and hopes for change, as well as an intermediary between the Lebanese people and their authorities.	1
The conversation lasted from 5 to 10 minutes, during which the shooting continued.	0
We called on our people to join the Popular Defense Forces. They responded by enlisting and began to comply with the orders of the government as part of the state military apparatus."	0
1. Syria once again highlights the initiative it proposed more than 20 years ago for the holding, under the auspices of the United Nations, of an international conference to define terrorism and to make a difference between terrorism and the struggle of peoples against foreign occupation.	1
The current programme of work made substantial progress in raising awareness among parliamentarians, through events organized in Geneva with the Inter-Parliamentary Union and in St. Petersburg, Russian Federation, with parliamentarians from CIS countries.	1
At its 44th formal meeting, on 1 May 2014, the Working Group considered the report of the Secretary-General on children and armed conflict in Mali (S/2014/267), covering the period from January 2012 to December 2013.	1
âThe Security Council calls upon all parties to armed conflict to comply with their obligations under international humanitarian law to protect and not to attack medical personnel, provided that they refrain from actions that adversely affect their civilian status and medical facilities, as well as from using medical infrastructure in combat.	1
(b) Address gaps in the criminalization of the financing of terrorism and include it as a predicate offence for money-laundering, as well as those relating to the freezing of terrorist assets, including the provision of adequate safeguards and the inclusion of humanitarian exemptions in freezing procedures;	1
(a) To build the capacity of its legislation regimes relating to money-laundering and combating the financing of terrorism, with a particular focus on financial intelligence units, the freezing of terrorist funds and assets and the regulation of charitable organizations;	0
Similarly, the Force Commander gave us, pursuant to court order No. 206/1735 of 18 February 2005, written authorization from that party, reference 36/2005 of 18 February 2005, which included the order to keep the cars of the Hariri motorcade in the barracks, to cover them with tarpaulins and to place them in custody, all of which was done.	0
It also urges the Secretary-General to seek to enhance the role and contribution of women in United Nations field operations, especially as military observers, civilian police, human rights specialists and humanitarian actors.	1
I have the honour to inform you that I have received a request from the Government of Pakistan to establish an international commission in connection with the assassination on 27 December 2007 of the former Prime Minister of Pakistan, Mohtarma Benazir Bhutto.	1
Members of the Council expressed their deep concern at the continuing crimes in Libya.	0
Initial measures Solving a crime of this magnitude requires a strong management capacity, clear functions, coordination and access to sufficient competencies, human resources, equipment and means of assistance.	1
MONUSCO has begun planning and preparing military operations against FDLR, taking into account that it is a scattered group that is hidden among the local population.	0
âThe Security Council particularly welcomes the decision of the Secretary-General to give priority, for the remainder of his mandate, to the work of the Organization aimed at consolidating the rule of law and transitional judicial institutions in conflict and post-conflict societies.	1
The Committee will therefore transmit these recommendations to the Counter-Terrorism Committee established pursuant to resolution 1373 (2001).	1
10. Declares its readiness to address situations of armed conflict in which civilians are targeted or humanitarian assistance to civilians is deliberately impeded, including by considering appropriate measures available to the Council in accordance with the Charter of the United Nations, and takes note, in this regard, of the relevant recommendations contained in the report of the Secretary-General;	1
The Council reaffirms that in order for a society that has experienced conflict or is recovering from conflict to recover from past abuses against civilians and to be able to prevent them in the future, it is imperative to end impunity.	1
This case is an example not only of mass killings of civilians, but also of unlawful confinement, accompanied by summary executions, rape and other abuses.	0
I would also like to convey my appreciation to the troop- and police-contributing countries to the Mission.	1
The Team also held frequent discussions with the expert group established in support of the 1540 Committee to ensure appropriate synergy between the work of the Arms embargo Team and the work of the experts of the 1540 Committee on the Non-Proliferation of Weapons of Mass Destruction among non-State actors.	1
(d) To adopt a victim-centred and human rights-based approach to trafficking in persons, in particular by recognizing the right of victims to remain in the country and by giving them access to legal protection and basic services such as medical treatment, education and employment opportunities equivalent to those accorded to their own citizens.	1
(f) To cooperate with the other relevant Security Council sanctions committees and the Committee established pursuant to paragraph 6 of its resolution 1373 (2001);	1
In addition to the dramatic increase in the flow of arms into Somalia, both contenders are also active in distributing arms and ammunition to their militias, equipping their men with combat elements, obtaining and storing food, medicines, fuel and other essential items to participate in a continuous combat, organizing themselves into military-type structures, intensifying the recruitment and training of militias, and devising strategies and plans to militarily defeat the adversary.	0
The Commission also recognizes the need to provide compensation to persons who have suffered as a result of the events of April and May.	1
H. Preventing and responding to acts of sexual exploitation and abuse committed by United Nations officials, related personnel and partners;	0
This makes it even more necessary to intensify efforts to properly establish and implement a travel ban targeting listed individuals, in particular those closely related to networking and facilitation activities.	0
The work of organizations such as UNESCO, UNDP and the United Nations Alliance of Civilizations, focusing on conflict prevention, the creation of a culture of peace, poverty eradication and the promotion of sustainable development and social inclusion through education, culture and communication in Africa, has become critical.	0
As long as States do not impose any obligation on listed individuals to abide by the travel ban, they will not find it risky to try to avoid it.	0
The present report of the Security Council Committee established pursuant to resolution 1518 (2003) covers the period from 1 January to 31 December 2009.	1
In this regard, it is significant that the Security Council, in its resolution 1963 (2010), encourages the Executive Directorate to discuss with Member States, with their consent, the possible development of comprehensive and integrated national counter-terrorism strategies that include attention to the factors leading to terrorist activity, in accordance with their obligations under international law; and the importance attached by resolution 1963 (2010) to the role that regional and subregional organizations can play in combating terrorism, in particular by enhancing the capacity of Member States to fully implement resolution 1373 (2001) and facilitating the provision of technical assistance.	1
15. Declares its readiness to consider the desirability and feasibility of establishing interim security zones and corridors to protect civilians and channel assistance in situations where the threat of genocide, crimes against humanity and war crimes is being addressed to the civilian population;	1
Encouraged by the desire to continue to assist Lebanon in the search for the truth and in giving effect to the criminal responsibility of the participants in this terrorist act,	0
:: Reports of the Secretary-General: on safety and security of humanitarian personnel and protection of United Nations personnel (A/68/489), on the protection of civilians in armed conflict (e.g. S/2013/689), and relevant reports on Security Council mandates (e.g. report of the Secretary-General on Somalia (S/2014/140).	1
âThe Security Council further reaffirms its determination to combat by all means possible threats to international peace and security caused by acts of terrorism, in accordance with the Charter of the United Nations.	1
72. Requests the Committee to submit orally, at least once a year, through its Chairman, a report on the overall work of the Committee and the Monitoring Team and, where appropriate, in conjunction with the reports of the Chairs of the Counter-Terrorism Committee and the Committee established pursuant to resolution 1540 (2004), expresses its intention to hold informal consultations on the work of the Committee at least once a year, on the basis of reports submitted to it by the Chairman of the Committee, and also requests the Chairman of the Committee to hold regular briefings for all interested Member States;	1
I encourage the Congolese authorities to hold accountable all those responsible for the massive rape and looting committed in Walikale in July and August 2010.	0
Given the large transfers of workers'remittances to the subregion and the widespread use in the region of informal non-banking transfer mechanisms, it is of priority importance that measures be taken to regulate alternative remittance systems and prevent the misuse of non-profit organizations for these purposes.	0
The Office encourages communities to exercise self-monitoring and combat polarization of views without government intervention, which is a more durable way to prevent radicalization within communities.	1
The Council encourages the establishment or strengthening, as appropriate, of subregional or regional mechanisms for cooperation, coordination and exchange of information, including cross-border customs cooperation and information exchange networks, with a view to preventing, combating and eradicating the illicit trade in small arms and light weapons across borders.	1
In addition, in accordance with the policy guidance adopted by the Committee on 25 May 2006, the Executive Directorate should also continue to advise the Committee on issues relating to international human rights law, refugee law and humanitarian law with regard to the identification and implementation of effective measures to implement resolution 1373 (2001), as well as on ways to ensure that the measures taken by Member States to implement the provisions of resolution 1624 (2005) comply with their obligations under international law, in particular international human rights, refugee and humanitarian law.	1
The note proposes that the Security Council initiate a formal âstrategic reviewâ process to explore how the intersection of cross-border crime and terrorism can affect its conflict prevention and resolution efforts, particularly in Africa, and to review the tools at its disposal to reduce the strategic space that cross-border crime provides to terrorist groups.	1
In addition, the group assigned to Western Darfur visited refugee camps in Chad and the group assigned to Southern Darfur visited the National Security Detention Centre in Nyala.	1
The Team reminds States that, contrary to what is implied by the High-level Panel on Threats, Challenges and Change and others, the Committee has long established criteria for listing or de-listing.	0
9. Calls upon States that have not yet done so to consider ratifying the instruments of international humanitarian law, human rights and refugee law and to take appropriate legislative, judicial and administrative measures to comply with their obligations under those instruments;	1
Shots were heard throughout the night, particularly in western Dili, where F-FDTL had established positions in Rai Kotu, Taci Tolu and Beduku. Rumours that F-FDTL had killed 60 persons gained strength on 29 April and spread rapidly thereafter, to the point where the registration number of the F-FDTL truck allegedly used to transport the bodies, in boxes or in a container, from Taci Tolu to the Viqueque district on 1 May 2006 was mentioned.	0
(y) To consult with representatives of relevant international organizations, such as the International Air Transport Association (IATA), the International Civil Aviation Organization (ICAO) and the World Customs Organization (WCO), in order to promote knowledge of and compliance with measures relating to the travel ban and arms embargo;	1
25. Recognizes that the conflict affecting Afghanistan and the urgency that the Government of Afghanistan and the international community attach to the peaceful resolution of the conflict require timely and expeditious changes to the List, including the addition and delisting of individuals and entities, urges the Committee to decide in a timely manner on de-listing requests, requests the Committee to review periodically each entry on the List, including, where appropriate, through the examination of individuals deemed to meet the conditions of reconciliation, persons whose entries do not contain identification data, persons reported to have died, and entities reported or confirmed to have ceased to exist, instructs the Committee to establish guidelines for such reviews in line, and requests the Monitoring Team to circulate to the Committee every six months:	1
In the discussions on the role of the President, several participants acknowledged that two "traps" should be avoided: first, trying to achieve national objectives to direct the work of the Council towards specific interests; and second, taking a kind of leadership that is too remote and formalistic.	1
According to the provisional verbatim record of the 4688th meeting of the Security Council, held on 20 January 2003 (S/PV.4688), the members of the Council made comments, suggestions and proposals on the following topics: international instruments; international cooperation; role of international, regional and subregional organizations; assistance; and Security Council Committee established pursuant to resolution 1373 (2001) (hereinafter referred to as the Counter-Terrorism Committee).	1
Four States have explicitly introduced measures to suppress the recruitment of terrorists.	1
Five States are not yet parties to the Firearms Protocol, but almost all have adopted OAS legislation criminalizing the illicit manufacture, possession and trafficking of small arms and light weapons, ammunition and explosives.	0
On 18 November, the Council held a briefing and consultations on the reports of the Secretary-General on the activities of the United Nations Assistance Mission for Iraq (UNAMI) (S/2014//774) and on the search for missing Kuwaiti and third-country nationals and missing Kuwaiti property, including national archives (S/2014/776).	1
56. Encourages Member States, when defreezing the assets of a deceased person or an entity that has been reported or confirmed to have ceased to exist as a result of the delisting, to recall the obligations imposed by resolution 1373 (2001) and, in particular, to prevent the thawed assets from being used for terrorist purposes;	1
While terrorism is not explicitly mentioned as a recurrent fact, it is certainly a source of concern, as many of the above-mentioned factors could encourage terrorist acts in the region.	0
Encourages troop- and police-contributing countries, in consultation with the Secretary-General, to consider possible measures to increase the awareness and responsiveness of their personnel involved in United Nations peacekeeping operations to protect civilians, including women and children, and to prevent sexual violence against women and girls in conflict and post-conflict situations, and to deploy, wherever possible, a higher percentage of women in police or peacekeeping forces.	1
The European Union's decision to start negotiations on a stabilisation and association agreement is an essential element in this regard.	1
:: An appeal to the Security Council to establish, in coordination with the African Union, an international force to neutralize armed groups, support national reconciliation and build democratic and stable institutions in Libya	1
There can be nothing more urgent in Sierra Leone than the maintenance of peace, security and stability in the country.	1
Reaffirming the need to combat by all means, in accordance with the Charter of the United Nations, threats to international peace and security caused by terrorist acts,	0
Reiterating the need for all States and non-State parties to conflicts to comply fully with their obligations under applicable international law, including the prohibition of all forms of sexual violence,	1
I have the honour to transmit herewith the report of the Security Council Committee established pursuant to resolution 2048 (2012) concerning Guinea-Bissau, which reports on the activities of the Committee between 1 January and 31 December 2014.	1
The Council calls upon Member States to increase their cooperation at the international and regional levels, based on common and shared responsibility, and their cooperation with UNODC and the International Narcotics Control Board, in order to address illicit production, demand and trafficking in drugs, and to identify emerging trends in drug trafficking.	1
âThe Security Council calls upon the parties to refrain from the use of force and to resolve their differences by peaceful means, to normalize their relations, to promote stability between the two countries and to lay the foundations for sustainable peace in the region.	1
" In the context of the completion of the Mission's mandate on 31 December 2010, the Security Council commends, without prejudice to the primary responsibility of the Government of Chad, the contribution of MINURCAT to the protection of refugees, internally displaced persons and humanitarian actors in eastern Chad and its efforts to enhance the capacity of the Chad Integrated Security Detachment (DIS).	1
It was the Jamal Suliman Mohamad Shayeb case in the village of Halouf in connection with the killing of 24 people, including women and children, looting of property and burning of the village.	0
Three States have adopted procedures to prohibit the extradition of persons to States where they run the risk of being subjected to torture or persecution.	0
The technical investigation concluded, inter alia, that the damage observed at the front of the aircraft appears to indicate that the aircraft was penetrated by a large number of objects with high energy from outside the aircraft.	0
As the relevant case law maintains, responsibility for a crime other than that agreed in the common plan arises only if, in the circumstances of the case, it was foreseeable that one or other members of the group would commit it and the accused voluntarily took that risk.	0
He also visited the El-Aayoune refugee camp.	1
The trucks in which Government soldiers were travelling were later used to transport the loot looted in the village.	0
âThe Security Council stresses the urgency of disbanding and disarming all illegal armed groups.	1
All States of the subregion have established their jurisdiction over the relevant offences in their domestic legislation.	0
âThe Security Council reaffirms its commitment to the full and effective implementation of its resolutions on the protection of civilians in armed conflict and recalls previous statements on the issue made by its President.	1
(e) To submit to the Committee a comprehensive programme of work for its consideration and approval, as necessary, in which the Monitoring Team describes in detail the activities envisaged to carry out its functions, including proposed travel, based on close coordination with the Counter-Terrorism Committee Executive Directorate and the 1540 Committee expert group in order to avoid duplication of effort and strengthen synergies;	1
