es_en_DEEP	VerConf
Noting that the situation in the region continues to be a threat to international peace and security,	1
The main risk is that Africa becomes a training ground, a recruiting base and a transit point for terrorists and a centre for mobilising funds for other illicit activities.	1
The Security Council calls on all parties to armed conflicts, including non-State parties, to end such practices.	1
That State stated that cooperation between government and civil society was an essential part of efforts to prevent people from resorting to terrorism and noted that it was increasing its efforts to detect and investigate hate speech on the Internet.	0
The two leaders laid the foundations for a continued dialogue between Lebanon and the Palestinians, which in my opinion constitutes an important measure to definitively overcome a difficult past and reaffirm the sovereignty and political independence of Lebanon.	0
In return, the authorities in Belgrade should end the obstruction tactic that prevents Kosovo Serbs from participating in Kosovo's public institutions. The "empty chair policy" carries a great risk, the risk that the history of Kosovo will be written without the Kosovo Serbs.	1
Only one of the eight States in this subregion has enacted adequate legislation covering all terrorist offences; Four States have passed laws covering only some of these crimes.	0
The full and complete implementation of the travel ban could have real benefits in the fight against Al-Qaida and Taliban terrorism, but available data suggest that its effects are currently limited.	0
The CPN-Maoist has often specifically targeted girls and has managed to recruit large numbers, many of whom have joined in order to escape traditional restrictions.	0
Half an hour later, three other jeeps from Chad arrived at the scene, supported by a military helicopter, and a new confrontation took place with the Sudanese military unit, in which a soldier and several civilians were injured.	0
First, as the Security Council has recognized on several occasions, under international law, when acts of gross violations of international human rights standards and serious violations of international humanitarian law are committed that may constitute crimes under international law, Internationally, States have the obligation to investigate and, if there is sufficient evidence, prosecute the person allegedly responsible for violations.	0
In that context, we continue to be concerned about the most vulnerable citizens of Timor-Leste: the poor and the displaced.	1
In one case in Deleba, Western Darfur, the victim was beaten to death.	0
Strongly condemns the recruitment and use of child soldiers by parties to armed conflicts in contravention of international obligations applicable to them, the killing and mutilation of children, rape and other acts of sexual violence committed mainly against girls, kidnapping and forced displacement, denial of children access to humanitarian aid, attacks on schools and hospitals, as well as trafficking, forced labor and all forms of slavery and all other violations and abuses committed against children affected by armed conflicts.	1
The Council underlines the importance of national ownership, constructive dialogue and partnership between national authorities and the international community to help address priority peacebuilding needs and the underlying causes of recurrent instability.	0
The information presented for this study leaves no doubt that, in the view of many States, incitement to commit acts of terrorism continues to pose a serious risk and threat in much of the world, albeit at different levels.	1
The Commission failed to confirm a claim made by the Government that some wounded soldiers and civilians had been killed inside the hospital.	1
Promote and support good conflict information management	0
We cannot fail to express our concern at the worsening security situation in regions that previously enjoyed relative calm.	1
Their tactics are classic terrorism: forcing political change through assassinations and intimidation. Al-Qaida is a takfiri movement that claims to be the only one that follows the authentic teachings of Islam and justifies the violence it exercises by stating that it is a consequence of the sacred obligation of defense against all those who disagree, who are therefore infidels and can be attacked.	0
Even worse, the activities of these terrorist groups constitute a serious threat to the peacebuilding efforts and peacekeeping missions of the international community, such as those in Somalia and Mali.	1
The current embargo could have a greater impact on the Taliban if this were taken into account and all non-state actors in Afghanistan were prevented from purchasing weapons, with the necessary exemptions for humanitarian and other reasons authorized by the Government of Afghanistan or the Council of security.	0
As Prosecutor, I will deal with any judicial challenges of President Al-Bashir and other suspects in court.	1
In the week of June 19 to 26, in the Bay region, about ten people were killed and another nine were injured in fighting between subclans of the Digil-Mirifle clan in the area, including the Leysan, Luway and Yantar.	0
"Weapons of Mass Destruction and Nonproliferation as a Best Business Practice" followed by an exercise	0
Furthermore, neither the characteristics nor the flight maneuvers of the planes before the attacks can in any way be interpreted as warning signs, as they were clearly part of the attacks.	0
One State noted that, while its constitution guaranteed the right to freedom of expression, that right may be subject to reasonable restrictions, including those applicable to verbal expressions amounting to incitement.	0
Authorities in North Kivu have since arrested several people suspected of links to Nkunda.	0
Political pressures on UNMIK have increased significantly, and attempts have been made to question the role conferred upon it by resolution 1244 (1999) and the Constitutional Framework.	1
The program will not apply to people considered international criminals or terrorists, such as members of Al-Qaida.	1
The Council will exercise particular vigilance against those who may seek to impede the transition process, in particular those who may contravene the arms embargo on the Democratic Republic of the Congo or refuse to participate in the disarmament, demobilization and reintegration processes; of disarmament, demobilization, reintegration, repatriation or resettlement, and integration of the armed forces of the Democratic Republic of the Congo.	1
Therefore, United Nations bodies engaged in the fight against terrorism should address these fissures more seriously and with greater dedication.	1
It is the people of Sudan who alone can decide through a truly participatory process whether or not a truth and reconciliation commission is appropriate for the country and at what stage it should be established.	0
In most States, measures related to border control, internal security and law enforcement are fully implemented, although some have not submitted sufficient information to allow the situation to be assessed with respect to some specific aspects. (a) Encourage the adoption of measures to improve the ability to promptly freeze funds and assets linked to terrorism in most States, and protect the non-profit sector from misuse for the financing of terrorism;	0
It is recommended that the United Nations take the following urgent and concrete measures to help maintain and strengthen the AMISOM presence in Somalia:	1
The Security Council condemns the deaths of innocent civilians and human rights violations that have taken place in the eastern part of the Democratic Republic of the Congo and calls for a full investigation into these incidents.	1
The Security Council reiterates that the growing threat posed by foreign terrorist fighters is part of the emerging issues, trends and developments related to resolutions 1373 (2001) and 1624 (2005), and encourages the Counter-Terrorism Committee to hold meetings in 2015 with the participation of Member States and relevant international and regional organizations to explore how to prevent the movement of foreign terrorist fighters and prevent terrorists from exploiting the Internet and social media to recruit and incite the commission of terrorist acts, while respecting human rights and fundamental freedoms, and in line with other obligations under international law, and in this regard notes the importance of the Committee holding meetings in the affected regions on issues related to the mandate of the Committee.	1
We urge the Government of Haiti to take strong measures to prevent such violence and ensure that those responsible for such acts are brought to justice.	1
Council members expressed deep concern about the crimes that continued to be committed in Libya.	1
We also wish to express our concern that the recurrence of such incidents could lead to a situation of instability in the region that makes a peaceful solution to the situation in Kosovo that is acceptable to the parties difficult.	1
In the absence of such guidelines, including the determination of selection criteria for cases to be investigated and prosecuted, the committees did not have guidance on appropriate methods for investigating crimes that constitute serious violations of human rights.	0
At these meetings, the Committee obtained valuable information both on the application of the sanctions regime and on the threat posed by Al-Qaida and its associates, and officials from the intelligence and security services of different countries had the opportunity to interact with each other and with the Team and to exchange information.	1
The firing of Qassam rockets from Gaza continues even as we speak; these rockets are deliberately directed at the civilian community, aimed at innocent civilians, who are terrorized as they lie in their beds, sit in their living rooms, or take their children to school.	1
g) The obligation to take precautions to minimize accidental loss and damage caused by attacks, such that each party must make every effort to ensure that the targets are military objectives and to choose means or methods of combat to minimize loss of civilian life;	0
The Council condemns all other violations of international law, including international humanitarian law, human rights law and refugee law, committed against children in situations of armed conflict.	1
The military fired mortar shells at unarmed civilians.	0
(d) The armed confrontation between F-FDTL soldiers and PNTL agents at the latter's headquarters on 25 May, which resulted in numerous injuries and the death of one F-FDTL soldier, Bure.	1
Homemade firearms. Molotov "Cocktails." Improvised rockets manufactured in metalworking workshops.	0
Creation of a gender and development unit at Headquarters and a network of gender focal points at national and regional levels.	0
Citizens caught practicing Christianity suffer severe punishments in violation of the right to freedom of religion and the prohibition of religious discrimination. B. Discrimination	0
The population of these neighborhoods was subjected to acts of violence and extortion committed by the security forces.	0
Regarding the military aspects of security sector reform, the Government has made clear that it wishes to rely heavily on bilateral aid to increase the capabilities of the military.	1
They perceive the Kosovo Serbs as tools of Belgrade and, therefore, as part of a lingering threat to their future.	1
In fact, because there is a history of foreign interference in the region, such recommendations will not only be suspect in the eyes of various segments of society, but may also have the capacity to aggravate the problem.	1
Therefore, with the support of the international community and the parties to the conflict, the ceasefire agreement can be fully implemented seriously.	0
Despite these efforts, security concerns remain in Mogadishu, due to the presence of militias from various factions, as well as independent militias or militias associated with businessmen and sharia courts.	0
On March 24, the Council of Ministers approved the national media policy, which outlines the Government's position on media development.	0
The Commission notes that there is no evidence that the deaths of eight police officers and the injuries to 27 others were not the result of spontaneous acts carried out by various individuals, completely outside the orders issued by the F-FDTL commanders.	0
Council members held a general exchange of views on various issues, including the situation in the West Bank and Gaza Strip, including the urgent need to rebuild and reform the infrastructure of the Palestinian Authority with strong support from donors, the situation on both sides of the Blue Line, and the various diplomatic efforts underway, including preparations to convene an international conference on the Middle East.	0
My Government considers that they are not only contrary to international law, but also undermine the concept of the rule of law, a fundamental element in the fight against terrorism.	1
The second is to urgently ask once again that the Security Council adopt indispensable measures to stop the bloodshed in Syria.	1
This requires a clear position, especially, honestly speaking, on the part of the United States of America.	1
The PNTL's actions were publicly denounced, calling it excessive and disrespectful towards a prominent former resistance fighter.	1
Beyond the scope of immediate application of the sanctions, the delegations showed special interest in exchanging their experiences in the field of the reintegration of terrorists into society.	0
The Mission has reassessed its operational commitments in light of the limited reinforcements authorized by the resolution.	0
The law enforcement mechanism is also poor when it comes to crimes between different ethnic groups.	0
The Office encourages communities to practice self-policing and combat polarization of opinions without government intervention, which is a more lasting way to prevent radicalization within communities.	0
The Security Council encourages Member States to continue to cooperate among themselves in the fight against piracy and armed robbery at sea off the coast of Somalia, underlines the primary responsibility of the Somali authorities in combating piracy and armed robbery at sea off the coast of Somalia, and requests the Somali authorities, with the assistance of the Secretary-General and relevant United Nations entities, to adopt without delay a comprehensive set of laws against piracy and declare an exclusive economic zone in accordance with the United Nations Convention on the Law of the Sea.	0
The police, deployed at the edge of the camp, showed no interest in confronting the Janjaweed.	0
We consider it unacceptable for us to deviate from this principle since the fragile situation in the province could lead to widespread destabilization.	1
In the private consultations that followed, Council members expressed their support for UNSMIL and noted the efforts made by the Interim Government to achieve stabilization.	0
But we are also against extrajudicial executions and we condemn them.	1
Currently, some 47 non-state armed groups are believed to have been or are in possession of MANPADS.	0
It is clear that the situation in Darfur does not meet the conditions necessary for the application of these provisions.	1
In his report, the Secretary-General notes that some progress has been made in most of these areas, except for the essential issue of local government reform and, in particular, decentralization, where the progress, by comparison, is not enough.	1
The Security Council highlights the important role of regional and subregional organizations in combating the illicit trade in small arms and light weapons, and the need for the mandates of peacekeeping operations to take into account, where appropriate, regional instruments that empower States to detect and trace illegal small arms and light weapons.	0
As indicated in the report of the Secretary-General (S/2004/634), this is a truly daunting challenge.	1
In the medium term, the focus would be to control mining areas, eliminate the threat posed by Ituri armed groups and restrict the presence of the FDLR in certain areas with a view to facilitating the process of disarmament, demobilization, repatriation, reintegration and rehabilitation.	1
The Working Group facilitated and co-chaired an international conference on national and regional counter-terrorism strategies, at which participants defined a set of principles that Member States and regional organizations should take into account when formulating their respective strategies.	0
While we are pleased to note that some 10 million Afghan voters have already been registered, we remain concerned that a sufficient number of voters have not yet been registered in the south and southeast of the country, mainly due to security considerations.	1
In JelisiÄ, the Appeals Chamber observed that "as regards proof of concrete intention, it is possible to infer it, in the absence of concrete direct evidence, from various facts and circumstances, such as the general context, the perpetration of other systematically negligent acts directed against the same group, the magnitude of the atrocities committed, the systematic victimization of certain people due to their membership in a certain group, or the repetition of destructive and discriminatory acts.	0
5. Condemns once again in the strongest terms all acts of violence or abuse committed against civilians in situations of armed conflict in violation of applicable international obligations, in particular with respect to: i) torture and other prohibited treatment, ii ) gender and sexual violence, iii) violence against children, iv) the recruitment and use of child soldiers, v) human trafficking, vi) forced displacement and vii) the intentional denial of humanitarian assistance, and demands that all parties end such practices;	1
Furthermore, the OIC insists that the Security Council must fulfill its responsibility to maintain international peace and security and act immediately to implement its relevant resolutions in order to promote the achievement of a just, lasting and peaceful solution to this protracted and tragic conflict, and realize the inalienable rights of the Palestinian people.	0
Some even admitted that the Government followed the rebels to the villages because that was where they were hiding, and that the destruction was a result of the fighting that followed.	0
The Government did not accept recruits from all tribes.	1
Recalling the statement of its President (S/PRST/2011/9) of 2 May 2011, noting that Osama bin Laden will never again perpetrate acts of terrorism,	1
I was in Afghanistan for four days at the end of June to assess the humanitarian situation, due to growing concerns about the seriousness of humanitarian and protection of civilians issues.	1
The Monitoring Team has intensified its efforts to establish links with experts from academia and civil society to increase understanding of the changing nature of the danger posed by Al-Qaida and the individuals and entities associated with it, through dialogue with specialists and competent academic bodies.	1
The Human Rights Committee has clearly enunciated this right in its general comment No. 27. On several occasions, the Committee on Economic, Social and Cultural Rights has stated that forced evictions are incompatible in principle with the requirements of the International Covenant on Economic Rights. , Social and Cultural.	1
Some observers remain unconvinced of the significance of the threat and others criticize the prioritization of chemical, biological, radiological or nuclear terrorism over other aspects of terrorism or other types of threats.	1
After monitoring the passage of displaced people into Kosovo and interviewing people of ethnic Albanian origin in the southern part of Serbia proper, the Office of the United Nations High Commissioner for Refugees (UNHCR) reported that these People had fled out of fear of being caught in the crossfire, as well as general concern about the build-up of police and military forces in the Presevo Valley.	1
The Security Council recalls its demand that all parties to an armed conflict fully comply with their obligations under international law relating to the protection of civilians in armed conflict, including journalists, media professionals and related personnel.	1
Although the United Nations Assistance Mission in Afghanistan and the Independent Electoral Commission had until then relied on civilian observers to de-escalate conflicts, such a mechanism may not be sufficient to address the most serious threats.	1
a) Analyze the evolution of risks and threats;	1
We remain concerned that, despite all attempts to restore peace and security, efforts to stabilize the eastern region of the Democratic Republic of the Congo have recently been hit by major setbacks.	1
The use of lethal force in these situations must respect the principles of distinction and proportionality, and those responsible for its violation must be held accountable.	0
The Commission cannot accept the Government's position that the statistics of the work of the committees indicate a much lower incidence of the crime of rape than that reported by sources such as the United Nations, the African Union and other national and international organizations.	1
Given this clear threat to international peace and security, we hope that the Security Council will act without the double standards that characterize it on this issue and will urgently and decisively adopt the draft resolution submitted by Algeria on behalf of the countries that make up the Group of Arab States.	1
In this context, it reaffirms that the primary cause of the crisis in Angola is the refusal of UNITA to comply with the basic provisions of the Lusaka Protocol and reiterates its demand that UNITA abide by its obligations to demilitarize and allow the extension of the administration of the State to the territories it controls.	1
The purpose of the meeting was to initiate a dialogue with the private sector, to better understand the difficulties that the financial community was experiencing in implementing the sanctions regime, to find ways to simplify compliance and make it more economical and effective, and to develop ideas for its improvement.	0
Regarding the human rights situation in the Democratic Republic of the Congo, he stressed the importance of justice, respect and accountability, as well as good governance and respect for human rights, in addressing the root causes of conflicts and said that the Democratic Republic of the Congo had made some progress on these issues in recent years.	0
The Council considers the possibility of using the International Commission of Inquiry established in accordance with Article 90 of Additional Protocol I to the Geneva Conventions.	0
Many times, only victims represented by lawyers obtain a satisfactory amount of compensation.	0
Its topics include campaign financing, electoral activities and public order, access to mass media and the misuse of government resources for political purposes.	1
The Security Council recognizes that the human rights of women and girls are at particular risk in armed conflict and post-conflict situations, and notes that in a number of such situations members of civil society involved in Women's human rights issues can be targeted.	1
On 26 July, the Council issued a press statement condemning the terrorist attack against the United Nations Interim Force in Lebanon (UNIFIL) in which six French United Nations peacekeepers were injured. United. Thematic and other issues	1
We could continue mentioning the widespread poverty, the problems of natural resource management, the thousands of refugees and internally displaced persons, to which we must add thousands of ex-combatants waiting to be reintegrated, the weak and unreformed security sectors, massive human rights violations and many other threats that could instigate a new conflict.	1
We have to admit that we are very concerned about the current situation in Afghanistan.	1
Also demands that the parties to the conflict immediately end all violations and abuses committed against children and requests the Secretary-General to ensure that: (a) the situation of children continues to be monitored and reported, particularly in the reports mentioned in [relevant paragraph] of this resolution, including through improved cooperation with the bodies responsible for their protection; and b) continue dialogue with parties to the conflict to formulate and implement time-bound action plans to end the recruitment and use of children and other violations of international human rights and humanitarian law committed against children;	1
We emphasize the tragic consequences that these messages recently had in other places on the continent.	1
24. Urges the International Working Group, which will receive regular reports from the Mediation Group, and the sanctions committee established pursuant to resolution 1572 (2004) of 15 November 2004, to carry out strict evaluation, monitoring and monitoring progress made on the issues mentioned in paragraphs 14 to 18 above;	0
On behalf of the Security Council Committee established pursuant to resolution 1373 (2001) on combating terrorism, I have the honor to submit the report of the Committee to the Security Council for its in-depth review of the work carried out by the Committee. and its Executive Directorate from 2011 to 2013 (see annex).	0
