es_en_TRANSOFMERS	VerCoop
We also agreed that the parties should re-establish a genuine, much-needed dialogue and proceed, without further delay, to the dismantling of militias, the disarmament, demobilization and reintegration of combatants, as well as to the organization of free, fair and credible elections.	1
In monitoring the use of compensation for environmental problems, the Commission should take into account the final results of the oil-contaminated Saudi Arabian coastal monitoring and assessment study, in particular the Commission's compensation for claim No. 5000451.	1
The Council looks forward to the follow-up meeting to be held in Port-au-Prince on 22 and 23 September, taking into account the priorities defined by the interim cooperation framework of the Government of Haiti.	1
Bosnia and Herzegovina expresses concern at the current political impasse in the establishment of a new government and the definition of a clear constitutional reform process.	0
In view of the above, the National Commission visited a number of areas in Darfur states where, according to some allegations, forced displacement or ethnic cleansing took place.	1
In the medium term, particular efforts would be made to control mining areas, eliminate the threat posed by armed groups in Ituri and restrict the presence of FDLR in certain areas with a view to facilitating the disarmament, demobilization, repatriation, reintegration and rehabilitation process.	0
States should strengthen their legal frameworks to criminalize the illicit manufacture, possession and trafficking of small arms and explosives.	0
The Executive Directorate proposes three small adjustments in its organization and operational practices to better reflect the changing priorities and proposed new activities.	1
At the same time, Cuba expresses its condemnation of suicide bombings and other acts directed against Israeli civilians, innocent victims of the spiral of violence caused by the policy of its Government, while opposing the manipulation of such isolated acts to question the exercise of self-defence by the Palestinian people and to justify actions, both selective and large-scale, against the Palestinian population.	0
The movements, recognizing Algeria's constructive and credible role in promoting and seeking a definitive solution to the crisis, expressed their full confidence in the continuation of efforts and the increased participation of Algeria in the search for the desired final settlement of the conflict.	1
During the reporting period, UNIFIL was once again hampered in its area of operations, endangering, in some cases, the safety and security of United Nations peacekeepers.	0
It was also noted that incidents involving the use of rocket-propelled grenades, a relatively heavy form of artillery for pirates, had declined from 43 in 2011 to 3 in 2013.	0
The Council welcomed the 8 April ceasefire agreement, expressed its full and active support for the efforts of the African Union to establish the ceasefire commission and the protection unit, and called on the Sudanese parties to facilitate the immediate deployment of inspectors in Darfur.	1
There was no military need to cause the destruction and devastation that took place.	0
Effectively carrying out protection tasks requires the involvement of a wide range of actors, as well as close consultations between, for example, the Security Council, the Secretariat and troop- and police-contributing countries, prior to the establishment of a peacekeeping mission and throughout its life cycle.	0
I believe that the task of clarifying the fate of missing Kuwaiti and third-country nationals is urgent and should not be subject to the influence of political factors and considerations.	1
It encourages States in particular to strengthen physical security and stockpile management, destroy surplus and obsolete small arms and light weapons, mark all small arms and light weapons at the time of their manufacture and importation, strengthen export and border controls and monitor brokering activities.	1
In particular, I welcome the establishment by the States members of the Commission and Benin of a regional counter-terrorism strategy, and urge that joint efforts to address the threat posed by Boko Haram be carried out in a manner consistent with international human rights standards.	1
âThe Security Council recalls its resolutions and presidential statements on post-conflict peacebuilding, in particular S/PRST/2009/23, S/PRST/2010/20, S/PRST/2011/2 and S/PRST/2011/4, and reaffirms the critical importance of peacebuilding as a foundation for building sustainable post-conflict peace and development.	1
Welcomes the commitment to combat the scourge of international terrorism expressed by States, inter alia, in the debates of the plenary meetings of the General Assembly held from 1 to 5 October 2001, calls upon all States to accede as soon as possible to the relevant international conventions and protocols related to terrorism, and encourages Member States to make progress in this direction,	1
Participants discussed comprehensive approaches to addressing the factors leading to the spread of extremism and terrorism in the region and how best United Nations entities can help respond to the phenomenon and its impact on peace, security and stability.	1
The summary executions were directed against the Nande ethnic group and the Pygmies, who were forced to flee to the forests for the first time to escape persecution due to their alleged collaboration with the Congolese Coalition for Democracy/Liberation Movement (RCD/ML).	0
" The Security Council welcomes the Secretary-General's intention to visit the Sahel region later this year with the President of the World Bank Group and looks forward to a briefing to the Security Council following that visit.	1
However, concern continues for the 2.3 million people who continue to be in crisis.	0
With the support of UNDP and funding from the United Nations Peacebuilding Fund, the Anti-Corruption Commission established a secretariat to manage the implementation of the national anti-corruption strategy.	0
Furthermore, the OIC insists that the Security Council must fulfil its responsibility to maintain international peace and security and act immediately to implement its relevant resolutions in order to promote the achievement of a just, lasting and peaceful solution to this protracted and tragic conflict and to realize the inalienable rights of the Palestinian people.	1
:: Strengthening, where appropriate, cooperation with other subsidiary bodies of the Council, especially the Security Council Committees established pursuant to resolutions 1267 (1999) and 1540 (2004) and their experts, including on information exchange, visits and technical assistance.	1
The main aspects of the statement of the ChargÃ© d'affaires, as well as the exchange of views among the members of the Working Group, are reflected in the summary contained in the relevant conclusions (S/AC.51/2014/2).	1
It is recommended that the United Nations take the following urgent and concrete steps to help maintain and strengthen the AMISOM presence in Somalia:	0
- To urge parties to armed conflict to respect the professional independence of journalists, media professionals and related personnel.	1
- To request States and regional and subregional organizations to take measures to limit and reduce the illicit trade in small arms and light weapons, such as voluntary collection and destruction, effective stockpile management, embargoes, sanctions and legal measures against institutional actors, individuals and entities involved in such activities.	1
The deployment of MINUSTAH police personnel is being adjusted to allocate as many resources as possible to the electoral process.	0
It was important to address the persistent criticism of the regime's justice and transparency so that the Committee could focus more fully on combating the threat posed by Al-Qaida and the Taliban.	0
We are also deeply concerned about the worsening scourge of terrorism and violent extremism in the Sahelo-Saharan region, as well as the close links between armed terrorist groups and transnational organized crime, particularly in the areas of drugs and trafficking in persons, money-laundering and illicit arms trafficking.	0
Even so, in Port-au-Prince, the sharp increase in violence and crime, including kidnappings, generated serious concern among the population during May and June.	0
The Executive Directorate will provide such training sessions to customs officers, border police and financial intelligence units in the first quarter of 2014.	0
3. It is necessary to identify and prosecute members of death squads;	0
In addition, Eritrea's restraint dramatically affects the security of United Nations peacekeeping forces and their operations, to the extent that it has become unsustainable to continue to occupy small posts in isolated locations -- which make up 18 locations out of a total of 40 -- and is no longer operationally viable.	0
Affirming its determination to take appropriate and effective measures to combat any threat to international peace and security caused by the proliferation of nuclear, chemical and biological weapons and their means of delivery, in accordance with its primary functions as set out in the Charter of the United Nations,	1
At my request, Prime Minister Seniora and President Abbas met in Paris on 18 October to discuss issues related to the presence of Palestinian refugees in Lebanon.	1
I encourage the Government of Iraq to quickly take further practical steps to fulfil its obligations under paragraph 14 of Security Council resolution 1284 (1999).	1
The Ombudsman may engage in a dialogue with these States in order to determine:	1
Since the establishment of the Counter-Terrorism Trust Fund, CTED has been more efficient in managing voluntary contributions to support its activities.	1
Reaffirming its resolution 1373 (2001) of 28 September 2001, and reiterating its support for international efforts to eradicate terrorism, in accordance with the Charter of the United Nations,	1
Humanitarian workers were frequently harassed and assaulted in incidents of banditry.	0
With regard to border and export controls, Malaysia's Strategic Trade Act 2010 entered into force on 1 January 2011, and Finland adopted a new Export Control Act.	0
The three Missions also hope to expand their cooperation in the chartering of large-capacity passenger aircraft for troop rotations; the establishment of a joint regional procurement office; and the upgrading of MONUC facilities in Entebbe, Uganda, which already serves MONUC, ONUB and UNMIS to provide transit accommodation for troops and a primary point of entry for shipments to the three Missions, among other functions.	1
Some of the detainees at the disposal of the Moroccan authorities began a hunger strike which lasted from early August until 29 September.	0
They can train combatants, plan their activists in innovative ways and carry out attacks. Lashkar-e-Tayyiba (QE.L.118.05) continues to provide specialized training to terrorists, including in the manufacture of improvised explosive devices. Al-Qaida in the Arabian Peninsula (AQPA) (QE.A.129.10) remains an important source of technological innovation.	0
This affects the Mission's ability to rapidly deploy uniformed personnel to protect civilians at risk in the west of the country if the situation so requires, as well as to support the overall activity of the United Nations country team.	0
It has been reported that FDLR elements have been dispersed in South Kivu and that their ability to move freely through population centres and to attack civilians has been restricted; however, the attack capacity of FDLR cannot be underestimated, particularly given that FARDC has limited resources in the area, has little military training, suffers from a lack of discipline and, in addition, sometimes collaborates with FDLR commanders.	0
The United Nations country team is currently engaged in a dialogue to review the action plan, including 168 projects, and to further institutionalize development planning, including community-based approaches such as the reconciliation and peaceful coexistence mechanism and UNDP-led conflict reduction programming.	1
Currently, some 47 non-State armed groups are believed to have been or are in the possession of MANPADS.	0
No State could fight terrorism alone, because the transnational nature of the terrorist threat required cooperation and coordination with other States.	1
To request that parties to an armed conflict strictly comply with the rules of international humanitarian law and human rights law prohibiting rape, sexual slavery, forced prostitution, forced pregnancy, forced sterilization or any other form of sexual violence.	1
âThe Security Council underlines the relevance of the recommendations of the Financial Action Task Force in support of the implementation of resolutions 2170 (2014) and 2178 (2014), including its recommendation to States to implement cash declaration or disclosure systems for incoming and outgoing currency transport, and other measures to address the threat that some foreign terrorist fighters and facilitators are acting as money carriers for terrorist organizations.	1
In fact, it is vital that there be a greater presence of the United Nations, but if the added value of our Organization is to be fully exploited, the necessary means, both in terms of troops and security, as Mr. Eide recalled a few minutes ago, will have to be available.	0
UNHCR provided training to relevant officials from Belarus and Ukraine to ensure effective and appropriate implementation of refugee status determination standards under the 1951 Convention.	0
As Chairman of the Counter-Terrorism Committee of the Security Council and as one of the first promoters of the Global Coalition against Terrorism, the Republic of Croatia strongly condemns international terrorism in all its forms and manifestations and, bearing in mind the danger that terrorism will be countered by other threats to international peace and security -- such as the proliferation of weapons of mass destruction, transnational organized crime and cyber terrorism -- calls for stronger cooperation at the global level for the suppression of this scourge of today.	0
We take this opportunity to examine the political and security situation in the Sahelo-Saharan region, as well as efforts to overcome existing difficulties and promote lasting peace, security and stability.	0
The Algiers Agreement obliges both parties, under article 1, paragraph 1, to âabstain from the use or threat of forceâ.	1
The success of counter-terrorism measures depends to a large extent on the coordination of the efforts of the international community to suppress the various forms of support for terrorism, in particular its financing.	1
The fact that the massacres perpetrated by Government forces and the Janjaweed appear to have systematically targeted the Fur, Masalit, Zaghawa and other politically motivated African tribes indicates the discriminatory nature of the killings and can therefore be described as persecution as a crime against humanity.	0
:: Fact-finding mechanisms should be established early enough during a crisis to contribute to the prevention of future violations;	1
In February, more than 20 armed robberies along the Guiglo-DuÃ©kouÃ© highway were reported, while 10 armed attacks were reported in Bangolo. On 23 March 2008, an Ivorian defence and security force soldier was killed in DuÃ©kouÃ© by unidentified armed bandits.	0
In addition, violations of the cordoning of the crime scene were known to have occurred on several occasions.	0
If one of them attempts to leave the besieged area of eastern Ghouta, the Syrian regime's snipers directly kill him, resulting in dozens of civilian casualties every month.	0
It demands that the rebel armed groups put an immediate end to the violence and calls on all parties to re-establish dialogue within the framework of the Sirte Agreement of 25 October 2007.	0
(g) The obligation to take precautions to minimize accidental loss and damage caused by attacks, so that each party should make every effort to ensure that targets are military targets and to choose means or methods of combat to minimize the loss of civilian life;	0
It is recommended that the Committee strengthen and, as appropriate, institutionalize its cooperation with international non-proliferation mechanisms, other United Nations bodies, the Group of Eight, regional and subregional organizations and, where appropriate, nuclear-weapon-free zones, which could provide added value in the implementation of resolution 1540 (2004), by expanding formal and informal working relations with those bodies.	0
16. Expresses its deep solidarity with the victims of terrorism and their families, and encourages the Counter-Terrorism Committee Executive Directorate to take into account the important role that victims and survivors networks can play in the fight against terrorism, in close cooperation with the Counter-Terrorism Implementation Task Force and its relevant working groups;	1
In May 2004, all aspects of police training were grouped into a separate programme and agreement has been reached on the establishment of a training system throughout Bosnia and Herzegovina.	1
- To urge troop- and police-contributing countries to take appropriate measures to prevent sexual exploitation and abuse by their personnel, including predeployment and in-theatre training to promote and ensure compliance with the provisions of the Secretary-General's bulletin on special measures for protection from sexual exploitation and abuse (ST/SGB/2003/13).	1
Expressing its concern about all human rights violations and abuses, the Council calls upon the Libyan authorities to investigate and bring to justice the perpetrators of such acts, including those committed against children.	1
Thus, where no State objects or submits a delisting request or where the information submitted is insufficient or contradictory, the matter could be referred to the Office of the Ombudsman.	1
18. Takes note of the entry into force of the 1997 Convention on the Prohibition of the Use, Stockpiling, Production and Transfer of Anti-personnel Mines and on Their Destruction and the 1980 Amended Protocol on Prohibitions or Restrictions on the Use of Mines, Trapped Weapons and Other Devices (Protocol II) annexed to the 1980 Convention on Prohibitions or Restrictions on the Use of Certain Conventional Weapons Which May Be Deemed to Be Excessively Injurious or to Have Indiscriminate Effects, recalls the relevant provisions contained therein, and takes note of the beneficial effect that their application will have on the safety of the civilian population;	0
The Commission, on the basis of a thorough analysis of the information gathered in the course of its investigations, determined that the Government of the Sudan and the Janjaweed were responsible for serious violations of international human rights law and international humanitarian law amounting to crimes under international law.	0
- Undertakes to improve coordination with the Peacebuilding Commission and looks forward to the Commission's consideration in 2010 and recommendations on how to further enhance its role;	1
I am pleased to note that the Council recognized the importance of increased coordination and exchange of information among actors involved in monitoring the arms embargo.	1
(d) With the contribution of the Committee's working group on assistance and its working group on cooperation with international organizations, including the Security Council committees established pursuant to resolutions 1267 (1999) and 1373 (2001), where appropriate, will continue to organize and participate in outreach activities at the international, regional and subregional levels; be prepared to emphasize and engage in assistance programmes; promote the exchange of experiences, lessons learned and effective practices; and be willing to facilitate offers or requests for assistance;	0
The mission assessed the institutional, technical, security, legal and political preparations for the elections; identified areas where support was required; and called for greater participation of women and youth, greater institutional transparency, and mechanisms to prevent political and electoral conflicts.	1
The gradual disappearance of the green line continues to be based on an overall threat assessment; consultations with the integrated command centre; and the improvement of the overall security situation, including the identification of a low probability of military clashes between former belligerents.	1
Moreover, neither the characteristics nor the flight manoeuvres of the aircraft prior to the attacks can in any way be interpreted as warning signals, as they were clearly part of the attacks.	0
In one of the incidents, in Korcha-Turgu, early in the morning, one day in August 2003, hundreds of Janjaweed Arabs dressed in green military uniform and riding horses and camels surrounded and attacked the village and began shooting at men and boys.	0
However, let no one be mistaken: my country is also ready to resist the unilateral declaration of independence unceasingly until a compromise solution is seen.	0
The holding of the first open meeting of the Peace and Security Council on children affected by armed conflict and its proposal to appoint an African Union Special Envoy for Children in Africa also merited approval.	1
Conceived as an internal mechanism to enhance expertise and coherence and contribute to activities related to the main work of the Executive Directorate, these clusters will initially be established in the following functional areas:	0
Owing to the lack of infrastructure in the country, a mechanism may need to be established to facilitate the administration and distribution of this support.	1
Furthermore, the Security Council calls upon all parties to take appropriate and necessary measures to ensure respect for the principles of refugee protection and their obligations under refugee law, including the civilian and humanitarian character of refugee camps.	1
24. Urges Member States, in response to the demonstrable achievements of the parties in restructuring their police officers, to redouble their efforts to provide, through voluntary funding and in coordination with the International Police Task Force, training, material and assistance to local police forces in Bosnia and Herzegovina;	1
Despite the fact that former President CompaorÃ© went to the country on the radio that same day, to announce the withdrawal of the bill and declare a state of emergency, violent protests intensified in Ouagadougou and spread beyond the capital.	0
For its part, the case of the Eritrea-Ethiopia Claims Commission shows that mechanisms for payment and enforcement of a third party's decisions in respect of massive claims may create major difficulties.	0
(e) The Committee will attach great importance to coordination with experts from other subsidiary bodies of the Security Council relevant to counter-terrorism in preparing visits and streamlining reporting;	1
34. Stresses the importance of consultations and cooperation between the United Nations, the International Committee of the Red Cross and other relevant organizations, including regional organizations, in improving the protection of civilians in armed conflict;	1
(a) To ensure the effective protection of civilians, including humanitarian personnel and human rights defenders, who are in imminent danger of physical violence, including violence by any of the parties involved in the conflict;	1
It was reported that detainees were systematically subjected to physical and mental suffering as punishment for their alleged affiliation or support to the rebels and for the purpose of obtaining information or confessions.	0
The Council calls upon [the affected State] to immediately implement appropriate procedures to address the issue of property rights and to put an end to all discrimination against [the minority population] in providing social benefits and reconstruction assistance.	1
In CÃ´te d'Ivoire, the Group established close liaison with the political, police and military branches of UNOCI.	0
- To urge humanitarian and development organizations to take appropriate measures to prevent sexual exploitation and abuse by their personnel, including predeployment and in-theatre training and, in the case of United Nations actors, to promote and ensure compliance, including by civilian personnel in United Nations peacekeeping and other relevant missions, with the provisions of the Secretary-General's bulletin on special measures for protection from sexual exploitation and abuse (ST/SGB/2003/13).	1
The Committee also held an exchange of views on three nominations made by a Member State on 31 October.	1
A. Recruitment and use of children by armed forces and armed groups The Nepal Task Force on Children and Armed Conflict, established pursuant to Security Council resolution 1612 (2005), monitored the recruitment of children by the Maoist army and CPN-Maoist affiliated organizations during the post-ceasefire recruitment campaign that reached its peak in November 2006.	0
They once again urged the Afghan parties to work together for peace and the establishment of a broad-based, fully representative multi-ethnic government.	1
The Team's report examines the reasons why many States still do not recognize the full potential of the sanctions regime.	0
I call on the Lebanese authorities to make every effort to arrest those responsible and bring them to justice.	1
The Congolese Government has indicated that it will stand firm with regard to the deadline of 2 January 2015.	0
