es_en_TRANSOFMERS	VerCoop
It is also recommended that the Government of Nepal make a clear commitment to the reintegration of children associated with armed forces and armed groups, and to improve legal mechanisms for the protection of children by criminalizing their recruitment and prosecuting those who violate children's rights.	1
2. Urges all States to cooperate, inter alia, to strengthen the security of their international borders, in particular by combating the use of fraudulent travel documents and, to the extent possible, by applying more effective procedures for the detection of terrorists and security of transport, with a view to preventing persons guilty of the acts referred to in paragraph 1 (a) from entering their territory;	1
These treaties contain certain provisions that are particularly relevant to the armed conflict currently in Darfur, including: (a) the right to life and freedom from arbitrary deprivation of life; (b) the right not to be subjected to torture or cruel, inhuman or degrading treatment or punishment; (c) the right not to be subjected to arbitrary arrest or detention; (d) the right of any person deprived of liberty to be treated with respect for the inherent dignity of the human person; (e) the right to move freely, choose one's residence and not to be arbitrarily displaced: (f) the right to property; adequate housing and not to be subject to forced expulsion; (g) the right to health; (h) the right to adequate food and water; (i) the right to a fair trial; (j) the right to an effective remedy for any serious violation of human rights; (k) the right to reparation for human rights violations; and (l) the obligation to bring to justice perpetrators of human rights violations.	0
At the same time, I fully support the plans of the African Union to lead an assessment mission in November to study future peacekeeping needs in the region.	1
I am aware of Pakistan's determination and efforts to unravel the truth and bring to justice those who have financed or participated in this terrorist act as perpetrators, organizers, sponsors and conspirators to be held accountable for their actions.	1
9. Urges all States to cooperate fully with the Committee established pursuant to paragraph 6 above in the performance of its tasks, including by providing such information as the Committee may require in accordance with this resolution;	1
Many of them told similar stories according to which they had been arrested, manipulated, blindfolded and stripped naked by the Internal Security Forces while being questioned about Mr. Abu Adass and his relations with Islamic groups, most of whom shared the opinion of their interrogators that Mr. Abu Adass was a lonely and introverted person who did not have enough intelligence to commit such a crime.	0
To take no action on such a dangerous group on the unfortunate pretext that it poses no threat from the Government is to renounce the essential responsibility of any State, that is, to ensure the security of its citizens.	0
First, the effective implementation of the sanctions regime is directly related to the quality of information available on those to whom it applies.	0
The Los Palos report identified problems in relations between ex-combatants and new recruits.	0
8. Regional and subregional organizations should work with the Counter-Terrorism Committee and other international organizations to facilitate the dissemination of best practices in the fight against terrorism and to assist its members in fulfilling their obligations in that regard.	1
Council members further emphasized that national reconciliation, the preservation of a climate of security and stability, the administration of justice and the reconstruction of the country ultimately depended on the people and Government of Haiti.	1
International crimes such as crimes against humanity and war crimes committed in Darfur may not be less serious or less heinous than genocide.	1
Several delegations were of the view that internal situations, in particular the conflict in South Sudan, did not allow for decisions leading to the resolution of outstanding issues.	0
220. The Commission recommends that special measures be taken to ensure the dignity and prevent the retraumatization of victims in judicial and non-judicial proceedings. VI. Conclusions and results A. Conclusions	1
Organized crime and corruption have been characterized as the greatest threats to the stability of Kosovo and the sustainability of its institutions.	0
âThe Security Council stresses the urgent need to strengthen military and police institutions in Libya.	0
Regional imbalances in total voter registration rates should be a serious warning in this regard.	0
âThe Security Council looks forward to the report of the High-level Panel on United Nations System-wide Coherence in the Field of Development, Humanitarian Assistance and the Environment, and hopes that it will play an important role in ensuring a coordinated United Nations approach to the issue of women and peace and security.	1
(d) Emitting the declaration of exceptional risk for the purposes of article 1 (c) (ii) of the Convention on the Safety of United Nations and Associated Personnel in cases where they believe that the circumstances warrant it, and inviting the Secretary-General to caution him when, in his view, the circumstances warrant such a declaration;	1
7. Stresses the importance of ensuring that the Committee continues to function effectively during the incorporation of the support structure of the Committee into the Counter-Terrorism Committee Executive Directorate, and in this regard decides that the Committee will continue to operate under its current support structure until it decides, in consultation with the Secretary-General, that its Executive Directorate is in a position to function;	1
Stresses that effective disarmament, demobilization and reintegration programmes for children, based on the best practices described by the United Nations Children's Fund and other relevant child protection actors, are crucial to the well-being of all children who have been recruited or used by armed forces and groups in violation of applicable international law, and is a critical factor for durable peace and security, and urges national Governments and donors to ensure that such community programmes receive adequate resources and funding in a timely and sustained manner.	1
In this context, the European Union reminds Israel of its obligation to ensure full and safe access to humanitarian organizations, including the United Nations Relief and Works Agency for Palestine Refugees in the Near East (UNRWA).	0
âThe Security Council reiterates its strong support for the adoption by the General Assembly of the United Nations Global Counter-Terrorism Strategy (resolution 60/288 of 8 September 2006) and the institutionalization of the Counter-Terrorism Implementation Task Force, in accordance with General Assembly resolution 64/235, to ensure overall coordination and coherence of the activities of the United Nations system against terrorism, as well as the full participation, within its mandates, of the relevant subsidiary bodies of the Security Council in the work of the Task Force and its working groups, and welcomes the adoption of resolution 64/297 by the General Assembly.	1
A key issue of interest to both parties concerns the de-listing of Taliban from the Consolidated List established pursuant to resolutions 1267 (1999) and 1333 (2000), which is a matter of the Committee's exclusive competence.	1
While I will continue to insist with those States that have not yet responded to my request for contributions for a multinational force and would ask it to continue to assist me in finding a country willing to take the lead in the force, I would like to submit to the Council the attached proposals for alternative options (see annex).	1
It is difficult to find ways to measure success, and the resilience shown by those subject to sanctions raises questions about the impact and highlights shortcomings.	0
:: On 16 November 2014, regime forces fired mortar shells at the Wood Mosque in Rural Damascus, wounding four civilians and causing significant damage.	0
96. The Committee noted that the National Security Forces Act, as amended in 2001, conferred on the security forces very broad powers, including the authority to make arrests without charge and without making detainees available to the judicial authority for a period of up to nine months.	0
Emphasizing that the coordinated and comprehensive return of refugees and displaced persons from all over the region remains essential for lasting peace,	1
I have the honour to inform you that, in its capacity as President of the Security Council for the month of August, the United Kingdom plans to hold a briefing on 19 August, the date of World Humanitarian Day, which will focus on the protection of humanitarian workers under the agenda item on the protection of civilians in armed conflict.	1
The task of operating in that environment was not easy, but UNDOF had evolved as a mission and had adjusted its operations to respond to the challenges posed by the environment of conflict and internal confrontations that had recently increased in intensity and severity.	0
It is therefore proposed to establish an international compensation commission, consisting of fifteen members, ten appointed by the Secretary-General of the United Nations and five by an independent body from the Sudan.	1
(b) To prevent the entry into or transit through its territory of such persons, on the understanding that nothing in this paragraph shall oblige a State to refuse entry into or require the departure from its territory of its own nationals and that this paragraph shall not apply when entry or transit is necessary for judicial proceedings or when the Committee established pursuant to resolution 1267 (1999) (the âCommitteeâ) determines, for each particular case, that entry or transit is justified;	1
On 20 November, Australian Foreign Minister Julie Bishop chaired a briefing on the theme âPeacekeeping operations: the role of police in peacekeeping and post-conflict peace-building operations.â This was the first meeting in the Council's history devoted to police issues.	1
In this regard, we are particularly concerned about the lack of progress in the area of freedom of movement of minorities, sustainable returns and significant representation of minorities in government structures and in the public sector at large.	0
11. Encourages in this regard the Government of Burundi, in collaboration with all international partners, to develop a disarmament, demobilization and reintegration strategy and to lay the foundations for the sustainable socio-economic reintegration of demobilized soldiers, ex-combatants, returning refugees, displaced persons and other vulnerable groups affected by the conflict, in particular women and children, in accordance with Security Council resolutions 1325 (2000), 1612 (2005), 1674 (2006) and 1820 (2008);	1
In this regard, the Security Council encourages all States in the region to sign and implement the Code of Conduct as soon as possible, and calls upon them to continue to take effective measures at the national level to combat piracy and armed robbery at sea in the Gulf of Guinea.	1
Several regional cooperation mechanisms have been established to enhance the capacity of States to prevent incitement and deny safe haven in the Latin American and Caribbean region.	0
Consequently, most of the human rights violations that took place on these two days can be described as a massacre in which units of security forces and parallel forces acting in coordination or collusion with them repeatedly carried out summary executions, torture, disappearances and arbitrary detentions.	0
1. Pursuant to paragraph 4 of Security Council resolution 1956 (2010), in which the Council requested the Government of Iraq to submit a written report to the Council by 1 May 2011 on the progress made in the transition to a mechanism to replace the Development Fund, we wish to inform the Council that the Government of Iraq has finalized the arrangements that will ensure a full and effective transition to the mechanism.	0
These recommendations will draw on the lessons learned from previous interventions in Haiti, including the need for a balanced approach to strengthening the police, the judiciary and correctional institutions at the same time.	1
âThe Security Council reiterates its equally strong condemnation of all violations of applicable international law related to the recruitment and use of children by parties to armed conflict, as well as cases of repeated recruitment, killing and maiming, rape and other sexual violence, abductions, attacks on schools or hospitals and denial of humanitarian access by parties to armed conflict.	0
Encourages Member States, the Office for the Coordination of Humanitarian Affairs, the Department of Political Affairs, the Department of Peacekeeping Operations, the Office of the United Nations High Commissioner for Refugees, the United Nations Relief and Works Agency for Palestine Refugees in the Near East, the Office of the High Commissioner for Human Rights, the United Nations Development Programme and other relevant United Nations agencies and offices to continue to cooperate, also taking into account the content of resolutions 1325 (2000) on women, peace and security and 1379 (2001) on children in armed conflict; welcomes the holding of regional seminars and encourages Member States to provide them with operational and financial support.	1
âThe Security Council stresses the importance of assisting Member States in promoting the full and equal participation of women in electoral processes and post-conflict constitutional reforms.	1
It should be noted that approximately one week (22 May 2005) before the second battle of Baidoa, a large consignment of arms from Yemen through the arms trade networks arrived at the Bakaaraha market.	0
Small arms shipments to conflict areas from abroad are generally small consignments -- a small and steady influx of weapons across porous borders.	0
Thus, in view of the potential threat posed by the demonstration to the regime and public order, the highest authorities of the State indicated that even if the decree prohibiting demonstrations had not been promulgated, they would not have allowed or tolerated the march.	0
Stresses the responsibility of the United Nations country task forces for monitoring and reporting and United Nations country teams, within their respective mandates, to ensure effective implementation of their resolutions on children and armed conflict, to monitor progress and to report thereon to the Secretary-General, in close cooperation with his Special Representative for Children and Armed Conflict, and to ensure a coordinated response to children and armed conflict issues.	1
On 2 June, 21 June and 25 September 2005, Lebanese personalities were subjected to car bombings in Beirut, killing Samir Qassir and George Hawi, and wounding May Chidiac. On 12 July 2005, another assassination attempt was made against Lebanese Defence Minister Elias Murr, resulting in one person being killed and several others, including the Minister, being injured.	0
The United Nations Interregional Crime and Justice Research Institute, at the request of Working Group 2 of the Contact Group on Piracy off the Coast of Somalia and with the support of the Government of Italy, organized two meetings of the informal expert working group in 2013 to draft a set of guidelines, standards and best practices on the use of private armed protection personnel on board merchant ships, for use by private sector companies and interested Governments.	1
While each situation of refugees and internally displaced persons is unique, displacement and statelessness exacerbate gender inequalities and enhance the discrimination and hardship faced by women and girls.	0
Although neither side seems willing to return to war, there is a worrying pattern of escalation of tension and destabilization that could lead to large-scale confrontation and endanger the lives of civilians.	0
However, these sites will continue to require protection; while KFOR's willingness to provide protection to religious sites is critical, a solution based on military forces cannot be reached.	0
Much has been said about the financing of terrorism through drugs, including in international conventions and Security Council resolutions.	1
As noted above, the Executive Directorate has also established particularly close relations with selected regional and subregional organizations, including the Caribbean Community and the Inter-American Committee against Terrorism of the Organization of American States, in the Americas; the African Centre for the Study and Research of Terrorism, the African Union, the Group for Combating Money Laundering in Eastern and Southern Africa, the Economic Community of West African States (ECOWAS), the Programme of the Intergovernmental Authority on Development for Capacity-building against Terrorism, the Intergovernmental Action Group against Money Laundering in West Africa and the Southern African Development Community, in Africa; the Committee of Experts on Assessment of Counter-Money Laundering and Financing of Terrorism, the Council of Europe, the European Union, Eurojust, the Organization for Security and Cooperation in Europe, the Shanghai Cooperation Organization and the Commonwealth of Independent States, in Europe; the Pacific Islands Forum in the Pacific; and the Asian Development Bank, the Association of Southeast Asian Nations and the South Asian Association for Regional Cooperation, in Asia.	1
In my meeting with the highest Congolese authorities, including President Joseph Kabila, I raised with them the issues of due process in trials and the use of the death penalty.	1
The most coherent government perspective on the conflict was presented by a committee established by the Minister of the Interior as the President's representative for Darfur.	1
Noting that the situation in the region remains a threat to international peace and security,	0
" The Security Council urges all parties to armed conflict, including non-State parties, to put an end to such practices.	0
Beyond the immediate scope of sanctions, delegations expressed particular interest in exchanging their experiences in the area of the reintegration of terrorists into society.	1
Therefore, with the support of the international community and the parties to the conflict, the ceasefire agreement can be implemented seriously.	1
There had been numerous contacts with the Government of Morocco, which, before accepting the resumption of travelling diplomacy activities, had called for a meeting to clarify issues relating to the most recent report of the Secretary-General (S/2014/258) and considered that this would allow the process to move forward in the best possible way.	1
The authorities recognized that members of the Albanian ethnic minority had been victims of social and institutional discrimination and accepted that confidence-building measures, such as the integration of ethnic Albanians into the local police force and their increased representation in political institutions, would contribute to significantly reducing tensions and creating long-term stability in the region.	1
Although this ban is reinforced by strict border controls, many citizens continue to take the risk of fleeing, especially to China.	0
In its resolution 1963 (2010), the Security Council encouraged the Executive Directorate to work with Member States to develop comprehensive and integrated national counter-terrorism strategies.	1
The law enforcement mechanism is also weak with regard to offences between different ethnic groups.	0
The potential risks to bringing the non-signatory parties to the negotiating table include the insistence of the parties on unrealistic preconditions for negotiations; another risk is the intransigence of the parties to and during negotiations; such risks can be mitigated by establishing unified positions within the international community on the peace process and by maintaining close dialogue with the parties; another risk is that regional or international partners will develop parallel initiatives on the peace process that weaken this element of the framework.	0
In that regard, we believe that destructive measures, aimed at obtaining unilateral political benefits, should be categorically condemned.	0
UNODC continued to provide counter-terrorism technical assistance to East African countries, for example, in close consultation with national authorities in Djibouti, Ethiopia, Kenya and Somalia, developed long-term assistance programmes to strengthen their criminal justice response to terrorism cases in accordance with the rule of law and with due respect for human rights.	0
Terrorist threats to this region are somewhat different in origin and nature, but their effects are similar.	0
A military adviser from the Department of Peacekeeping Operations (DPKO) answered questions from Council members.	1
The PNTL files show that the PNTL General Commander signed the delivery of an F2000 automatic machine gun and 2,000 cartridges to the Minister of the Interior.	0
At those locations, the Group was informed that there had been no recruitment recently, but that if a conflict broke out again in CÃ´te d'Ivoire that could change.	0
In the Hiraan region of central Somalia, heavy fighting on 7 and 8 July between the Galje'el and Jajele sub-clans of the Hawiye clan over land and water control in western Beletweyne resulted in 36 deaths and 70 injuries.	0
- To mandate the establishment of appropriate and adapted mechanisms at the local level for truth and reconciliation (e.g. technical assistance, funding and reintegration of civilians into communities).	0
Urging all States, international bodies and regional organizations to allocate adequate resources, including through international partnerships, to address the ongoing direct threat posed by Al-Qaida, Osama bin Laden and the Taliban and associated individuals, groups, undertakings and entities,	1
The Commission shall commence its activities on a date to be determined by the Secretary-General, which shall be communicated to the Government of Pakistan.	1
In paragraph 7 of the annex to my letter of 8 August 2005, it was indicated that the cash security of the 249 letters of credit that had expired on 31 December 2004 would continue to be maintained in the United Nations Iraq account until 30 November 2005 in order to be able to make payments to vendors if authentication documents confirming that the goods had been delivered during the period of validity of the letters of credit were received; however, in the course of recent consultations with the relevant authorities, the Government of Iraq requested an extension of this deadline for receipt of authentication documents until 31 December 2005 in order to allow more time for processing.	1
:: Provide information to Member States and international organizations, upon request, to assist them in submitting more effective offers or requests for assistance, as appropriate, for the implementation of relevant obligations under resolutions 1540 (2004), 1673 (2006) and 1810 (2008), using the matrix as a reference tool to facilitate technical assistance	0
2. Decides also that all States, in accordance with their national procedures, shall adopt and implement appropriate and effective laws prohibiting all non-State actors from manufacturing, acquiring, possessing, developing, transporting, transferring or using nuclear, chemical or biological weapons and their means of delivery, in particular for terrorist purposes, as well as attempts to engage in any of the above-mentioned activities, participate in them as accomplices, assist or finance them;	1
With regard to internal coordination, many Asian States have established centralized agencies or bodies whose mandate is to coordinate counter-terrorism efforts and analyse related information, including with regard to incitement.	0
:: Deficiencies in policies, planning and preparedness with regard to the protection of civilians; threats and challenges related to the implementation of mandates in the field; how lessons learned and challenges faced by troop- and police-contributing countries in the protection of civilians can best be incorporated into future strategies and guidance; what to do to ensure that all peacekeeping personnel receive the same level of training in the protection of civilians;	1
- To request parties to an armed conflict to protect United Nations peacekeeping operations and other relevant missions authorized by the Security Council, as well as humanitarian organizations, from the effects of mines and explosive remnants of war and to provide information on the location of mines and explosive remnants of war known to them in the territory in which the mission and organizations are operating or are operating.	1
The project will be implemented by the United Nations Office for Project Services (UNOPS) and implemented by municipalities in the Pristina and Gnjilane regions.	0
The adoption of the Statute of the International Criminal Court, followed by the Statute of the Special Court for Sierra Leone, can be considered the culmination of a legislative process that in a matter of a few years led to the crystallization of a set of customary rules applicable to internal armed conflicts and the criminalization of serious breaches of those rules, in the sense that serious violations of those rules may give rise to individual criminal responsibility.	0
