es_en_DEEP	VerConf
We have turned to the Council on several occasions to urge Israel to end its military attacks, ensure the protection of the civilian population and end the illegal punitive measures that are causing a deliberate human catastrophe in the Gaza Strip.	1
During the march, the Royal Moroccan Army informed the Force Commander that it had ordered its troops to observe the situation.	0
He was not satisfied with his observations at the crime scene but hoped that the situation would improve the next day as responsibilities had been distributed at the meeting held earlier.	1
When the situation in Haiti is discussed within the framework of the United Nations, attention is almost always focused on so-called security issues, and urgent attention to serious structural, economic and social problems is minimized, for all practical purposes. social problems that afflict the country.	1
These international enforced disappearances are unique in their intensity, scale and nature.	0
Most potential witnesses residing outside the State expressed fears about testifying, even confidentially, because they feared for the safety of their families and assumed that their behavior continued to be clandestinely monitored by the authorities.	1
A senior Al-Itihaad leader in charge of training camps purchased AK-47 assault rifles, PKM machine guns, RPG-7 rocket launchers, F1 hand grenades, grenade launchers, 60 and 82 millimeter mortar ammunition on the weapons market. Irtogte between November 7 and 21, 2004. The same individual purchased 2 PKM machine guns, 10 SG-43 medium machine guns, 120 Tokarev TT-33 pistols and 60 magazines for AK-47 assault rifles on November 27, 2004, as well as 16 PKM machine guns and ammunition for RPG-7 rocket launchers on 15 January 2005 (S/2005/153, annex II).	0
At the same time, my delegation believes that the elected representatives of ethnic minorities in the Assembly, in particular the Serbian representatives, would achieve better results and greater benefits for their electorate if they adopted a more participatory attitude, instead of withdrawing from the legislature when faced with difficult situation.	1
We condemn terrorism in all its forms and manifestations, because it violates the most fundamental right of human beings: the right to life.	1
On 17 October, the Nigerian Chief of Defense Staff announced that a cessation of hostilities with Boko Haram had been agreed upon, following talks facilitated by the Government of Chad in N'Djamena. On October 19, the Government of Chad indicated that negotiations were continuing to reach a ceasefire agreement and the release of the students kidnapped in Chibok. On November 4, the Federal Government of Nigeria announced that no agreement had been reached, but that talks would continue.	0
First, security concerns remain paramount.	1
On 12 November, another suicide bomb attack took place at a school in Kontagora, Niger State, injuring dozens of people. On November 25, two girl suicide bombers killed more than 45 people in the Maiduguri market. On November 27, a bomb explosion in the Maraba-Mubi area of ââAdamawa State killed at least 40 people. On November 28, an attack on the central mosque in Kano left at least 120 dead and 270 injured.	0
22. Recalls the request made in resolution 2178 (2014) to the Analytical Support and Sanctions Monitoring Team to submit, in close cooperation with all relevant United Nations counter-terrorism bodies, a report to the Committee arising from resolutions 1267 ( 1999) and 1989 (2011), within 180 days, on the threat posed by foreign terrorist fighters who are recruited by ISIL, FAN and all groups, companies and entities associated with Al-Qaida, or who are join them, and reiterates that this report should also address trends regarding foreign terrorist fighters joining and collaborating with all terrorist groups on the Al-Qaida Sanctions List 1267, and should include oral briefing to the Committee, which will in turn report orally to the Security Council at its next regular counter-terrorism briefing on those operating in Africa.	0
We urge all Member States to take immediate steps to implement the obligation contained in resolution 2036 (2012) to prohibit the trade in Somali charcoal, especially by those most active in that trade.	1
In addition, there are concerns that the intense exchange of drugs for weapons in Afghanistan could lead to the financing of terrorism in neighboring Central Asian States through the sending of money by couriers.	1
We have noted with concern that the Secretary-General believes that many of the factors that fueled the 2006 crisis are still present in society, making it vulnerable to instability.	1
The Afghan authorities and the international community must clearly state that such behavior is unacceptable.	1
AQIM's arsenal could currently include sophisticated anti-aircraft weapons from Libya, although these are unlikely to be operational.	1
The state has imposed openly discriminatory restrictions against women in an effort to maintain the sexist stereotype of the pure and innocent Korean woman.	0
Promoting the participation of women through the creation of conflict prevention committees that have a balanced proportion of both genders and include representatives of civil society.	0
i) Support, including through its political mediation work, the completion of disarmament, demobilization and reintegration activities of [national] armed groups or their effective integration into the army, which would continue to depend on their prior receipt of adequate training and equipment;	0
The Personal Envoy added that contacts were continuing and indicated that the Government of Morocco had on several occasions expressed its disappointment with the content of the latest report and briefing that the Personal Envoy had made to the Council at the informal consultations in April 2014. .	1
However, the situation remains worrying, since the long borders that separate us are difficult to control.	1
Last year, as military operations against armed groups intensified, MONUSCO increased the logistical support provided to FARDC troops by 226%.	0
11. The two strands, one Lebanese, the other from the United Nations, have led to a unified complementary investigation carried out by the Commission and the Lebanese authorities.	0
Although the ASEAN Convention on Combating Terrorism has not yet entered into force, the ASEAN Treaty on Mutual Legal Assistance has been ratified by nine States and is in force.	0
The Mission continued to coordinate support for the implementation of the national strategy on sexual and gender-based violence, within the framework of which five programs are being implemented relating to prevention and protection, the fight against impunity, multisectoral assistance, reform of the security sector, and data and distribution in the district of Ituri and South Kivu.	0
a) Refrain from providing any type of support, active or passive, to entities or individuals involved in the commission of acts of terrorism, in particular by repressing the recruitment of members of terrorist groups and ending the supply of weapons to terrorists ;	1
The Congolese Government has indicated that it will remain firm regarding the January 2, 2015 deadline.	1
Of note is ongoing law enforcement cooperation through the Regional Center for Combating Cross-Border Crime of the South-East European Cooperation Initiative and the recently created Secretariat of the Convention on Police Cooperation in South-East Europe.	0
The groups' frequent requests for donations, as well as their claim that they cannot launch attacks due to lack of money, have led to greater emphasis on the inclusion of financiers on the List.	1
I am deeply concerned that sexual violence against girls will continue to undermine prospects for peaceful coexistence in Darfur for many years.	1
At the same time, I fully support the African Union's plans to lead an assessment mission in November to study future peacekeeping needs in the region.	0
2. Reaffirms the need for full respect of the military agreements concluded with the United Nations Mission for the Referendum in Western Sahara (MINURSO) regarding the ceasefire and calls upon the parties to fully adhere to these agreements;	0
Since the end of the last term in mid-March 2005, relations between the Transitional Federal Government and the opposition have worsened severely, greatly increasing the likelihood of a major military confrontation between the two.	0
However, some Mogadishu leaders accused the President of going to Ethiopian territory to acquire weapons and troops for his future activities in Somalia.	1
The impunity of these high-ranking officials is unacceptable and prevents communities emerging from conflict from recovering sustainably.	1
In any case, the regime continues to encounter obstacles in the courts, although it is true that the Committee has not yet been able to demonstrate the effectiveness of the process adopted by the Ombudsman.	1
Some concerns have been expressed about the fairness of registration, most recently raised by several presidential candidates.	1
The European Union is deeply concerned about the cycle of vicious violence currently taking place in Israel and the occupied territories.	1
It is clear that the mass destruction of villages carried out by Government forces and the Janjaweed was not justified by military needs.	0
The strategy would also address the investigation of terrorist acts and the prosecution of their material authors, to bring terrorists and their supporters to justice.	0
Furthermore, further progress has been made in establishing an intelligence fusion cell under the tripartite mechanism. On 16 and 17 August, a delegation from the United States of America, accompanied by military officers from Rwanda, Uganda and the Democratic Republic of the Congo, visited Kisangani to assess the progress made in this regard.	0
At the outset, I would like to reiterate that the European Union is deeply concerned about the situation in Somalia and the regional repercussions of its conflict.	1
In The Gambia, opposition groups spoke out against state authorities over a lack of accountability for alleged human rights violations. On 4 November, former Chief of Defense Staff General Lang Tamba and six other defendants appealed to the Supreme Court against the death penalty for conspiracy and treason handed down by the High Court in July 2010 and confirmed by the Court of Appeals in October 2012.	0
Looking ahead, I urge the parties to the peace process -- the Government of Mali and the armed groups represented -- to use this pause in negotiations to demonstrate political leadership and forge the compromises necessary to reach an agreement in Algiers .	0
We are particularly concerned about the uncontrolled proliferation of weapons in Libya and beyond its borders as a result of the conflict.	1
In a widely reported comment to the residents of Kulbus, a town that the rebels had failed to capture in December 2003, the President said: "Our priority from now on is to eliminate the rebellion, and our target is anything found "outlaw... We will use the army, the police, the mujahideen and the horsemen to crush the rebellion." The Minister of Justice told the special delegation of the European Parliament's Committee on Development and Cooperation during his visit in February 2004: "the Government has established some kind of relationship with the Janjaweed.	0
The Security Council reaffirms the need to fight all forms of terrorism and that no terrorist act will succeed in setting Iraq back on its path towards peace, democracy and reconstruction, a path in which it has the support of its people , the Government of Iraq and the international community.	0
1. Condemns in the strongest terms all acts of terrorism, whatever their motivation and whenever and by whomever they are committed, which constitute one of the most serious threats to peace and security;	1
Acknowledging that the Council's work had changed considerably over the past 15 years, one speaker noted that the trend had always been towards greater clarity.	0
Uganda's sole interest and unequivocal demand has been that the LRA terrorists be disarmed, arrested and brought to justice as soon as possible.	1
In March 2014, UNODC will organize a seminar for Namibia on international cooperation in criminal matters related to terrorism, transnational organized crime and corruption.	0
Under the overall guidance of Mission Headquarters, the heads of MONUC regional offices are responsible for developing and implementing regional action plans to prevent sexual exploitation and abuse in their respective areas.	0
One State cited the example of persons who had been denied entry over the past decade on suspicion of involvement in international terrorist activities.	1
In plenary consultations, Council members expressed concern about the continued deterioration of the humanitarian situation and condemned violations of international humanitarian law by all parties to the Syrian conflict.	1
We note that the enduring challenges facing the police in Timor-Leste should not be underestimated.	1
The flight was canceled and a crisis was averted only after the commander of the Licorne Force, General Irastorza, telephoned the FANCI Chief of Staff, General Mangou, to tell him that said flight would be considered a hostile act.	0
Despite everything, the situation inside Kosovo is still worrying.	1
In its fourteenth report, the Team examined the threat by Al-Shabaab, an entity affiliated with Al-Qaida in East Africa based in Somalia, to launch attacks against regional Governments and the international community (S/2013/467, para. 10 ).	1
The Security Council urges the Government of the Democratic Republic of the Congo to accelerate the investigation into the mass rape committed in November 2012 by FARDC elements in Minova and bring those responsible to justice.	0
Reiterates its demand that all parties to armed conflict put an end completely and with immediate effect to all acts of sexual violence, and its call for those parties to make and implement concrete and time-bound commitments to combat sexual violence, which must be include, among other things, the provision of clear orders through chains of command prohibiting sexual violence, and accountability for failure to comply with those orders, the prohibition of sexual violence in codes of conduct and manuals of the military and police forces or their equivalent, and to make and fulfill specific commitments regarding the timely investigation of alleged abuses; further calls upon all relevant parties to armed conflicts to cooperate, within the framework of these commitments, with the appropriate staff of United Nations missions monitoring their implementation; and calls upon the parties to designate, as appropriate, a high-level representative to ensure compliance with such commitments;	1
Since the existence of militias and so-called parallel forces has been determined, the President of the Republic and the Government of National Reconciliation have the obligation to take all necessary measures to put an end to their activities.	0
The bill, which will be presented to Parliament, establishes that a minimum of 30% of parliamentary seats must be reserved for women; that one district in each constituency at the local council level should be awarded to female candidates and that political parties should allocate "safe" seats for female candidates.	0
Apparently, the population not only aspires but demands that more plural and representative governments generate tangible benefits for citizens.	1
Measures that could weaken confidence or damage the outcome of negotiations must be suspended and reversed.	1
The number of attacks against national and international security forces, officials of public institutions and humanitarian personnel has increased. The number of attacks against polling stations and threats against registration teams has increased.	1
This fundamental provision of the resolution, which has not yet been implemented, reaffirms the decision to which all Lebanese adhered in the 1989 Taif Agreement, after the end of the civil war.	1
One delegation expressed concern that despite the designation by the Council, Ocean Maritime Management vessels continued their operations, including calling at foreign ports, and proposed that the Committee remind Member States of their obligation to enforce measures resulting from the designation, in particular by seizing the entity's vessels and freezing its assets.	1
In practice, both commissions made inquiries about the true property rights for restitution purposes, instead of granting compensation, in line with the political will to prioritize the return of people who had been displaced as a result of ethnic discrimination and hostilities to their places of origin over other durable solutions.	0
The fact-finding mission considered that, since the credibility of the Lebanese authorities leading the investigation had been questioned, an independent international investigation was necessary to uncover the truth.	0
It is important to give women, who are the first victims of violence in all its manifestations, a leading role in maintaining peace and consolidating peace, and it is even more important and urgent to do so in the prevention process. of conflicts.	1
229. The Commission recommends the establishment of an independent and well-organized police and military oversight mechanisms.	0
At the same time, Germany and the European Union have previously repeatedly condemned the terrorist atrocities that have led to the deaths of hundreds of Israelis.	1
However, the Monitoring Team recommends that the Security Council remind Member States that the sanctions regime obliges them to prevent the Internet from being used, directly or indirectly, from their territory or by their nationals outside its territory to provide, sell or transfer technical information, assistance or training relating to military activities to persons and entities included on the List.	1
Very few States have fully updated their legal frameworks to include specific counter-terrorism laws.	0
The region's natural resources, cross-border crime and the availability of small arms due to past armed conflicts leave the subregion potentially exposed to money launderers, international criminals, drug traffickers and terrorist groups.	0
In this regard, the Council encourages countries affected by the LRA that have not already done so to establish standard operating procedures for receiving LRA minors and entrusting them to civilian child protection entities.	0
Following informal consultations, on 14 September the Council unanimously adopted resolution 1560 (2004), submitted by the German delegation, extending the mandate of the United Nations Mission in Ethiopia and Eritrea (UNMEE) until 15 March 2005, approved the adjustments in UNMEE, including its presence and operations, recommended by the Secretary-General in paragraphs 13 to 18 of his report, and requested the Secretary-General to continue to closely monitor the situation, in order to review the mandate of the Mission in the light of progress made in the peace process and changes made to UNMEE.	0
MONUSCO should continue to prioritize monitoring and reporting violations of international humanitarian law and human rights law, including killings, sexual violence and grave violations against children, while supporting Government action to address the legacy of widespread violations with transitional justice mechanisms and improved measures against impunity.	0
However, terrorism will continue to have its adherents, especially in places where the most vocal political protests have failed, and although Al-Qaida will never have widespread support, attacks will continue.	0
I repeat today what I already said on January 31 (see S/PV.6710): it is unacceptable that the Council is prevented from assuming its responsibilities.	1
In 45 countries in sub-Saharan Africa, UNESCO produced an overview map of existing policies and resources to describe how a culture of peace is fostered.	0
60. Decides, in order to assist the Committee in fulfilling its mandate and to support the Ombudsman, to extend the mandate of the current New York-based Monitoring Team, established pursuant to paragraph 7 of resolution 1526 (2004), and to of its members, for a further period of 30 months, under the direction of the Committee and with the functions set out in Annex I, and requests the Secretary-General to adopt the necessary arrangements for this purpose;	0
This was largely possible thanks to the leadership of Prime Minister GusmÃ£o as well as the cooperation of all political parties represented in parliament, including the opposition, which demonstrated its willingness to move forward on an issue of national priority.	0
13. Stresses the need to ensure that all international efforts are aimed at strengthening MISCA and mobilizing the necessary resources in its favor in order to enable it to effectively execute its mandate and pave the way for the potential deployment of a United Nations operation. United Nations peacekeeping, in accordance with the relevant provisions of Security Council resolution 2127 (2013).	0
The Security Council further condemns terrorism in all its forms and manifestations, however it is committed and by whomever it is committed.	1
The Secretary-General warns unequivocally that none of the eight standards have been fully met so far.	1
On March 4, he urged the issuance of arrest warrants against state officials, provoking popular outrage and weakening hopes for peace and stability.	1
However, we remain concerned that too much emphasis is placed on visits to developing countries.	1
In that attack, 17 police officers, all of them from African tribes, were also killed.	0
3) The offender will be punished with a prison sentence of 5 to 15 years and in addition, if the court deems appropriate, with the confiscation of property, or with an exceptional sentence:	1
These actions can be considered as indirect participation in deceiving public opinion and disregarding the position of the Syrian Government regarding events taking place on its own territory. This is an irresponsible incitement to all kinds of violent acts, providing international cover for international terrorist acts undertaken by terrorist groups against Syria, its interests and its people.	1
On 5 November, the Council held consultations on the Syrian Arab Republic and heard a briefing, presented by videoconference from Beirut by the Special Adviser to the Secretary-General, Sigrid Kaag, on the implementation of resolution 2118 (2013) and the elimination of the chemical weapons program of the Syrian Arab Republic.	0
ISAF troops must fully fulfill their mandate to eradicate threats emanating from Afghanistan.	1
b) In cooperation with the Office of the High Commissioner for Human Rights, monitor and report on the human rights situation, including the situation of returning refugees and displaced persons.	0
The Security Council also reiterates its support for the Special Representative of the Secretary-General, Mr. Ahmedou OuldAbdallah, for his efforts to advance the political process in Somalia.	0
However, it is inadmissible to attempt to justify, based on a valid security concern, measures that indiscriminately affect an entire people, in violation of international humanitarian law.	1
This makes the irresponsible and threatening rhetoric of Iran's leaders all the more alarming.	1
The German Government strongly condemns these acts of violence.	1
He has refused to arrest Ali Kushayb and Ahmad Harun.	1
In the United Arab Emirates, the Customs Central Intelligence unit enters information into risk profiles contained in the electronic customs clearance system.	0
Instructs the Commission to carry out an analysis on the financing of ECOWAS activities in order to ensure that the institutions have sufficient resources.	1
The Commission recommends that consideration be given to expanding the pool of candidates for these positions to maximize the possibility of recruiting the most qualified individuals.	0
2. Urges all States to cooperate, inter alia, to strengthen the security of their international borders, in particular by combating the use of fraudulent travel documents and, to the extent possible, by implementing more effective terrorist detection procedures and transport security, with a view to preventing persons guilty of the acts referred to in paragraph 1 (a) from entering its territory;	0
If differences in the transitional federal institutions are not addressed, the current political stalemate could generate deeper divisions and undermine the very institutions that the people of Somalia so ardently long for and that the international community and the United Nations are prepared to support.	1
However, despite increased attention to this issue and positive progress, there remain numerous obstacles on the ground to the implementation of mandates, particularly with regard to the continued lack of clarity surrounding the concept and implementation of protection of civilians, internal and external coordination mechanisms, early warning and rapid response systems, support to host government security forces and contingent capacity and resourcing .	1
Border Intelligence Service guards are directly under the command of the Military Intelligence Service officers of the division to which they are assigned and are also subject to the ordinary chain of command of the armed forces.	0
