es_en_DEEP	VerConf
Particular attention should be paid to the large number of elections scheduled until 2013 in the region, which, while a positive development, could also exacerbate tensions and intensify violence and instability.	0
Sanctions list of the Security Council Committee established pursuant to resolution 1718 (2006)	0
10. Reiterates the importance of all States identifying, and where necessary adopting, appropriate procedures to fully implement all aspects of the measures described in paragraph 1, strongly urges all Member States to implement international standards incorporated in the forty revised recommendations on combating money laundering and the financing of terrorism and proliferation formulated by the Financial Action Task Force, in particular recommendation 6 on targeted financial sanctions relating to terrorism and financing of terrorism;	1
Insisting that the coordinated and comprehensive return of refugees and displaced persons from across the region remains essential for lasting peace,	0
The weapons, which were in bags (30 or 40), were left in the care of the weapons custodian on board the US ship and were then handed over to the Yemeni authorities.	0
These trends are manifested in several contemporary conflict situations on the Council's agenda.	1
The Security Council expresses concern that aircraft or other means of transportation leaving territory controlled by ISIL and FAN could be used to transfer gold or other valuables and economic resources for sale on international markets, or to transfer weapons and materiel for use by ISIL and AAF, and notes that individuals or entities involved in such activities may be included on the Committee's list arising from resolutions 1267 (1999) and 1989 (2011); Expresses concern about reports that items of archaeological, historical, cultural and religious importance are being illegally removed from territory controlled by ISIL and AAF that can generate income for these groups, and calls on Member States to adopt appropriate measures to prevent this illegal trade; and in this regard, reminds all States that they must ensure that no funds, financial assets or economic resources are provided, directly or indirectly, to ISIL, the FAN or any of the other persons, groups, companies and entities associated with Al -Qaida; and looks forward to the in-depth consideration by the Al-Qaida Committee of the relevant recommendations regarding further measures to impede such activities contained in the report of the Al-Qaida Sanctions Monitoring and Analytical Support Team under of resolution 2170 (2014), in order to further hinder the activities of these groups.	1
President Abbas also told me that "the illicit transfer of substantial quantities of weapons to refugee camps through some Palestinian groups represents a risk to Lebanon and does not help the Palestinian cause."	1
31. The State considers the spread of Christianity to be a particularly serious threat since it ideologically challenges the official cult of personality and provides a platform for political and social interaction and organization outside the limits of the State.	0
Having determined that the situation in Somalia continues to constitute a threat to international peace and security in the region,	1
Pakistan is deeply concerned by the report's conclusion that the humanitarian and economic challenges facing the Sahel region have been exacerbated as a fallout from the Libyan crisis.	1
Even so, in Port-au-Prince, the sharp increase in violence and crime, including kidnappings, generated serious concern among the population during May and June.	0
Given the large transfers of workers' remittances to the subregion and the widespread use in the region of resorting to informal non-bank transfer mechanisms, it is of priority importance that measures be adopted to regulate alternative systems for sending remittances and prevent the use of non-profit organizations for these purposes.	0
We call on Israel to take further steps to eliminate settler outposts in accordance with the road map and address the growing threat of settler extremism.	1
The Group adopted the structure of a round table in which representatives of the Federal Government of Somalia and regional anti-piracy authorities held deliberations together with the United Nations and European Union bodies and Oceans Beyond Piracy.	0
The Security Council reiterates its strongest condemnation of cases of desecration, damage and destruction of sacred places and places of historical and cultural importance, especially, but not exclusively, those declared World Heritage by UNESCO, including those in the city of Timbuktu .	1
These include a number of detainees held by the National Security and Intelligence Service in a secret location in Khartoum, which the Commission discovered and inspected.	0
The European Union also expressed support for my Special Representative's statement of 8 September 2005, which stressed that there could be no military solution to the problems faced by the transitional federal institutions.	0
With the support of the World Food Program (WFP), the Government also continued its initiatives to provide food assistance to vulnerable population groups affected by food insecurity, including the Maternal and Child Nutrition Program of the Ministry of Health ( 47,000 beneficiaries as of June 30), the School Feeding Program of the Ministry of Education (241,000 beneficiaries), and the Food for Work Program (600 beneficiaries), aimed at communities affected by food insecurity. On May 27, with the technical and managerial support of WFP, a nutritious compound food factory was inaugurated for distribution through the Maternal and Child Nutrition Program.	0
The Committee encourages its Executive Directorate to continue to focus on the implementation of resolution 1624 (2005), in particular by paying due attention to relevant issues such as the role of new information and communications technologies; promoting dialogue, including at the national level, to promote tolerance, diversity and inclusion; the creation of strategic partnerships between governmental and non-governmental agents; determining the role of victims of terrorism; and the need to prevent terrorists and their supporters from using institutions for their own benefit.	0
I have the honour to inform you that, in your capacity as President of the Security Council for the month of August, the United Kingdom has planned to hold a briefing on 19 August, World Humanitarian Day. The meeting will focus on the protection of humanitarian workers, under the agenda item on the protection of civilians in armed conflict.	0
The Minister of the Interior, Mr. Lobato, arrived at the headquarters wearing a bulletproof vest and in a state of great agitation shouting "kill them all."	1
I would also like to convey my appreciation to the countries that contribute troops and police to the Mission.	0
As stated in a political statement released in March 2003, "the Sudan Liberation Movement and Army is a national movement that aims, together with other like-minded political groups, to address and resolve the fundamental problems of the entire Sudan.	0
Demands that parties to the conflict immediately take appropriate measures to protect civilians, especially women and children, from all forms of sexual violence, in accordance with resolution 1820 (2008).	1
Prosecutors in the Netherlands subsequently sought to ban and dissolve the organization and turn over any credit balances in the organization's bank account to the state, but the court ruled that the government had not proven that Al-Haramain's branch in the Netherlands, separate and distinct from the international organization, had supported terrorism. Prosecutors in the Netherlands announced that they intended to appeal the court's ruling, and obtain more information about Al-Haramain and Al-Aquil from the United States.	1
c) Liaise with the Government [of the affected country] and the Office of the United Nations High Commissioner for Refugees (UNHCR) to support efforts to relocate refugee camps near the border, and provide to UNHCR the necessary logistical support for this, when possible and on a reimbursable basis;	0
The Mission's policy group on sexual exploitation and abuse is completing the development of a UNOCI code of conduct in this regard and participates in the country network addressing these issues.	0
During the Committee's informal consultations on 22 May, the Monitoring Team Coordinator made an oral presentation on the current threat posed to international peace and security by Al-Qaida and its associates.	1
Gulbuddin Hekmatyar (QI.H.88.03) is primarily considered a threat to peace and security in Afghanistan.	1
At the meeting held on 21 May, specific reference was made to the issue of weapons, as expressed in paragraph 93.	0
The Committee also carries out periodic reviews of the names of persons whose death, and entities whose extinction, has been reported.	0
The Security Council strongly condemns the continued violence and human rights violations by all armed groups, including summary executions, sexual and gender-based violence and the large-scale recruitment and use of children, demands that all armed groups to immediately end all forms of violence and destabilizing activities and for their members to disperse, lay down their weapons and demobilize children from their ranks, all immediately and permanently, and reiterates that those responsible for violations of human rights and international humanitarian law must be held accountable for their actions and must be disqualified from joining the FARDC or other elements of the state security forces.	1
The Council underlines its readiness to take action against any party seeking to undermine the peace process, in particular by failing to comply with the cessation of hostilities or by obstructing talks, peacekeeping operations or humanitarian aid.	1
To improve the situation, it is necessary to implement the law -- especially the law on the elimination of violence against women -- that criminalizes and penalizes violent practices that harm women and girls.	1
In relation to border and export controls, Malaysia's Strategic Trade Act 2010 came into force on 1 January 2011, and Finland passed a new export control law.	0
Equipment for weapons detection and surveillance has been installed at Azerbaijan's international border crossings.	0
The decision to expel humanitarian workers and silence others with threats of expulsion or attempts to restrict the freedom of movement of the African Union-United Nations Hybrid Operation in Darfur (UNAMID) are part of this reduction policy. the oversight capacity of the international community.	1
78. The Sudanese armed forces are conventional armed forces responsible for protecting and maintaining internal security.	0
The victim heard other young women screaming and thought they were also being raped.	0
Climate change was therefore not only exacerbating existing threats to international peace and security; It also constituted in itself a threat to international peace and security.	1
Furthermore, Israel has regularly continued aerial violations of the Blue Line, in direct violation of Security Council resolution 1701 (2006).	1
First, although Sierra Leone is the most advanced member of the West African Coast Initiative, the slow pace of progress elsewhere is impeding data sharing and early warning.	1
The fruit terminal at the port of Abidjan is evidently a strategic location for the unloading of military items and equipment and UNOCI must intensify its surveillance tasks there.	1
Some rebel groups have directly impeded humanitarian work by looting cars and trucks and putting pressure on, and even kidnapping, national staff of humanitarian organizations.	0
The Sudanese Penal Code and Criminal Procedure Law do not provide for substantive or procedural provisions that could be applied to the special situation of crimes committed during an armed conflict.	1
At the third tripartite meeting between Angola, the Democratic Republic of the Congo and UNHCR, held in Luanda on 28 and 29 March, it was agreed to establish a working group to deal with the return of some 80,000 Angolan refugees in the Democratic Republic of the Congo.	0
Instead of the famous 2014 World Cup logo, which is made up of three victorious hands holding the globe forming the prestigious cup, the Palestinian Authority cartoon shows a "trophy" of three hands holding three people whose arms are raised in an attitude of surrender.	1
In accordance with paragraph 18 of Security Council resolution 2100 (2013), France submitted four reports to the Council outlining six combat actions that were carried out in response to an "imminent and serious threat" and highlighted the work carried out by the liaison and operational support detachments for MINUSMA, as well as the support provided by French forces to the medical assistance provided to the wounded.	1
There will be a risk that tension will focus on the statute rather than the rules.	1
As will be noted later, this determination of Iraq's state responsibility is based on its violation of jus ad bellum (the prohibition on the threat or use of force, set out in Article 2(4) of the Charter) rather than on its violations of jus in bello (violations of international humanitarian law), which are the main area of ââfocus of the Eritrea-Ethiopia Claims Commission's determinations.	0
Colonel Reis and Mr. Malik had a heated argument.	1
Council members expressed deep concern at reports that hostilities had resumed and at the humanitarian consequences of this.	1
The Team has already contacted the regional offices of the Office for Disarmament Affairs, with the aim of increasing the exchange of information (especially regarding the management of ammunition stockpiles, which proved to be a problem in the case of Libya).	0
v) Collaborate with competent international and regional organizations in order to promote knowledge and compliance with the measures;	0
Timor-Leste continues to face significant challenges related to poverty reduction and the creation of employment opportunities, particularly for young people.	1
These humiliating, discourteous, intolerable and threatening statements by the President of Uganda constitute a manifest violation of the provisions of the Charter of the United Nations, in particular paragraph 4 of Article 2 which clearly provides that "the Members of the Organization, in their relations "shall refrain from resorting to the threat or use of force against the territorial integrity or political independence of any State, or in any other manner incompatible with the Purposes of the United Nations."	1
I urge Lebanese leaders to resume and expedite their deliberations on developing a national defense strategy and make tangible progress. The end result of that process must be that there are no weapons without the consent of the Government of Lebanon and that there is no authority other than that of that Government.	1
The Committee encourages the Executive Directorate to intensify its dialogue with Member States and regional organizations, particularly during its visits, on the development of comprehensive and integrated counter-terrorism strategies, the improvement and refinement of existing structures and the implementation of mechanisms to strengthen the capacity of States and organizations to articulate strategies, to take full advantage of country visits to advise Governments in the formulation of these strategies and to continue to work in close collaboration with the Office and working groups of the Counter-Terrorism Implementation Task Force.	0
Mainstreaming gender issues into needs assessment and resource allocation in post-conflict reconstruction efforts.	0
In Egypt, we continue to call for a peaceful and immediate transfer of power to a civilian Government.	1
During the reporting period, negotiations between the parties to reach a mutually acceptable solution that would allow the people of Western Sahara to exercise their right to self-determination have remained at an impasse.	1
12. Calls upon the Committee, in cooperation with the Committee established pursuant to resolution 1373 (the "Counter-Terrorism Committee"), to inform it of what further concrete measures States could take to implement those indicated in the paragraph 1 of this resolution;	0
This follows political bargaining in the Somali National Reconciliation Conference, which relies heavily on the power of militia leaders and their clan associations.	0
Lieutenant Colonel Falur ordered the soldiers to return fire.	0
Establishment of support systems for victims of gender-based violence.	0
Although neither side appears willing to return to war, there is a worrying pattern of escalating tensions and destabilization that could lead to full-scale confrontation and endanger civilian lives.	1
The Commission also recommends that measures to break the cycle of impunity include the exercise of universal jurisdiction by other States, as indicated in this report.	0
Following the adoption of resolution 2100 (2013), in which the Security Council established MINUSMA and supported the preservation of cultural heritage as part of its mandate, UNESCO has continued to collaborate with United Nations partners to integrate the safeguarding of cultural heritage into the peacekeeping operation and recovery work.	0
[I]nvites the [affected State], with the assistance of the international community, to continue working towards the establishment of an impartial and transparent justice system, including the reconstruction and reform of the prison system, in order to strengthen the rule of law throughout the country and eliminate impunity.	0
At the 5659th meeting of the Security Council, held on 12 April 2007, in connection with the Council's consideration of the item entitled "Threats to international peace and security caused by terrorist acts", the President of the Security Council made a statement the following statement on behalf of the Council:	0
[C]alls upon parties to armed conflict to take all feasible precautions to protect civilians, including children, from the effects of mines and other explosive remnants of war, and in this regard encourages the international community to support the efforts of countries to remove landmines and other explosive remnants of war, and to provide assistance for the care, rehabilitation and economic and social reintegration of victims, including persons with disabilities.	0
The third factor was the insufficient presence of the police and the fourth was the interference of foreign agents in Darfur.	0
This special meeting sought to take the first step to raise regional awareness of the Al-Qaida sanctions regime and encourage greater collaboration between the Committee and the countries of the Sahel and the Maghreb.	0
In 1993, that vision was blurry, to say the least. At that time it was impossible to define the final objectives that would come close to addressing the concerns of both peoples.	1
These challenges, together, exert political pressure on governments and have direct and dangerous impacts on peace, security and stability in the affected countries.	1
The meetings will include regular reporting by working groups responsible for monitoring progress on national monitoring and implementation, assistance, cooperation with international organizations, including Security Council Committees established pursuant to resolutions 1267 (1999). and 1373 (2001), and transparency and disclosure in the media.	0
Mr. Malik wanted to send UNPOL officers with Colonel Reis to meet with Brigadier General Ruak, to which Colonel Reis refused, believing that the presence of more blue-shirted police officers would aggravate the situation. .	1
There remains a lot of tension, especially in the northeastern area, where there have been several clashes between FARDC units and Mayi-Mayi groups. On 10 and 11 August, FARDC exchanged fire with a Mayi-Mayi group near the Lunga gold mine, about 200 kilometers from Kalemie, and took control of the area.	0
However, we are concerned by recent developments that reveal increased tensions between members of local communities and International Security Assistance Force contingents.	1
Introducing changes to the police structure of Bosnia and Herzegovina will require the support of international police experts.	0
Statements such as that Palestinians do not love their children or that Palestinians send their children to their deaths because they hate Israel are racially charged words that reflect a kind of attitude that should be rejected outright, which I am now trying to do. .	1
- Aware that the activities of these armed groups are detrimental to the peace and security of the region and endanger the electoral process of the Democratic Republic of the Congo	0
All of this requires an extremely determined fight against entrenched non-state actors, whose existence represents a threat and an obstacle to the full exercise of the sovereignty of the Afghan State.	1
12. Given the deep mistrust among the Lebanese people towards their judicial and security authorities, the Commission has become a source of great expectations and hopes for change, as well as an intermediary between the Lebanese people and their authorities. .	0
The Security Council calls on Burundi to prevent any support from its territory to armed groups in the Democratic Republic of the Congo.	1
However, there remains a possibility of a complete collapse of public order, in addition to a collapse of the fragile economy and a disintegration of autonomous institutions.	1
At its 2013 summit, the Group of Eight declared its "unequivocal rejection" of terrorist financing through ransom payments.	1
The last group is made up of new members who have been radicalized or are in the process of becoming radicalized as a result of world events or the actions in their communities of extremists who have already been seduced by the message of Al-Qaida, and even to through pages or chat rooms on the network.	0
Many challenges remain in combating impunity, due in particular to the limited capacity of judicial authorities, both civilian and military, to carry out independent and thorough investigations and offer protection to victims and witnesses.	1
The Committee also welcomes the efforts of the Executive Directorate to continue to cooperate closely with the experts of the Security Council Committees established pursuant to resolution 1540 (2004) and resolutions 1267 (1999) and 1989 (2011), in particular through the regular exchange of information and reports on missions and the preparation of joint documents and statements by the Chairpersons of the Committees to the Council.	0
However, it remains a matter of deep concern that parties, both movements and militias, continue to use children as combatants.	1
The Monitoring Group is convinced that these people use the income obtained in this way to maintain their militias and purchase weapons.	0
The Team has also sought to raise awareness of Al-Qaida sanctions within the commercial airline sector by working closely with the International Civil Aviation Organization (ICAO), the International Air Transport Association (IATA) and private industry. .	0
Regarding the debate on modifying the procedures, the Team agrees that as part of any reform the more legal character that the Council has tried to give to the regime in recent years should be promoted, for example by introducing the criterion of " associated with" set out in resolution 1617 (2005), as well as summaries of the reasons for listing and review mechanisms provided for in resolution 1822 (2008).	0
iii) Cooperation with international organizations, including the Security Council Committees established pursuant to resolutions 1267 (1999) and 1373 (2001);	0
States should ensure that counter-terrorism measures are administered and directed by appropriate law enforcement agencies and should create dedicated counter-terrorism units to take advantage of the expertise of those institutions.	0
The disarmament of militias is a priority issue, especially in the period preceding an electoral campaign, given the potential for politically motivated violence to break out.	1
The United States must desist from this deliberate disregard, a practice it has maintained for almost seven years and which has led to the deterioration of the situation in the region.	1
The Security Council commends the continued efforts of the Contact Group on Piracy off the Coast of Somalia to coordinate international measures in various aspects of the fight against piracy.	0
The Security Council invites the Secretary-General to continue to provide it with relevant information and analysis where it considers that it may contribute to improving its work on the protection of civilians in armed conflict, and to continue to include, where appropriate, in the reports to it present in writing on matters before the Council observations on the protection of civilians in armed conflict.	0
The district court originally ruled that the state had not proven that Al-Haramain's branch in the Netherlands, separate and distinct from the international organization, had supported terrorism.	1
The Security Council also expresses concern about rising tensions in the Ituri region and calls on all parties to exercise restraint.	1
The Team's report examines the reasons why many States still do not recognize the full potential of the sanctions regime.	1
The commission also noted that the Democratic People's Republic of Korea had abducted or forcibly disappeared more than 200,000 people from China, Japan, the Republic of Korea and other countries, even after the end of the Korean War.	0
Police weapons were stolen in Wadi Haggam.	0
