es_en_TRANSOFMERS	VerConf
However, there is still little information on the level of enforcement.	1
(b) To continue to work in close coordination and cooperation with INTERPOL and donor States and organizations to facilitate technical assistance aimed at developing the capacities of law enforcement agencies and providing equipment and facilities to States in need;	0
Unless addressed by the Government, those problems could pose serious threats to the security and stability of Timor-Leste.	1
1. Decides that all States shall take the following measures with respect to individuals and entities designated prior to this date as the Taliban and the other individuals, groups, undertakings and entities associated with them, as specified in section A (âTaliban associated personsâ) and section B (âTaliban associated entities and other groups or undertakingsâ) of the Consolidated List of the Security Council Committee established pursuant to resolution 1267 (1999) and 1333 (2000) from the date of adoption of this resolution, as well as other individuals, groups, undertakings and entities associated with the Taliban that constitute a threat to the peace, stability and security of Afghanistan designated by the Committee established pursuant to paragraph 30 (hereinafter referred to as âthe Listâ):	1
In other respects, however, progress has not met expectations, and many challenges remain.	1
One way in which States could take all these issues more fully into account would be to incorporate them into comprehensive and integrated national counter-terrorism strategies, which would pay attention to the factors leading to terrorist activity.	0
That was why, as soon as it saw the undesirable presence of the Ugandan rebels of the Lord's Resistance Army, my Government did not hesitate to formulate an ultimatum for them, prompting them to leave the national territory immediately.	1
In turn, the Committee should continue to promote greater ownership of the sanctions regime and provide effective support to the national efforts of States seeking to contain the threat of Al-Qaida and the Taliban.	1
The Council underlines its readiness to take action against any party seeking to undermine the peace process, in particular through non-compliance with such a cessation of hostilities or the obstruction of talks, peacekeeping operations or humanitarian aid.	1
There are unsubstantiated indications that money carriers carry money from one country to another from ransom payments and drug trafficking.	0
Where possible, Governments are working with their territories to encourage them to create appropriate internal rules in that area, but in many cases legislative frameworks need to be improved.	0
In all those talks, I was encouraged to find a convergence of views: we were all amazed at the many progress that Liberia has made since the fighting ended in 2003, but we are all fully aware of the daunting challenges that Liberia still faces and that, ultimately, we cannot take anything for granted.	1
Combating terrorist rhetoric and violent extremism	0
The task of operating in that environment was not easy, but UNDOF had evolved as a mission and had adjusted its operations to respond to the challenges posed by the environment of conflict and internal confrontations that had recently increased in intensity and severity.	0
The freedom of movement of UNIFIL and the safety and security of its personnel are essential for the effective implementation of the mandate of the Force.	0
Today we have no doubt that the real intention was to prevent the details of his vandalism while acting under the orders of the Central Intelligence Agency.	1
As indicated in the report of the Secretary-General on the situation in Abkhazia, Georgia (S/2005/657) dated 19 October 2005, there has been a positive development since last summer in the process of resolving the conflict in that region.	0
The proposed budget for MONUC for the full 12-month period from 1 July to 30 June 2006, including the requirements for support to the elections and additional civilian police authorized by the Council in its resolution 1621 (2005), is currently being prepared and will be submitted to the General Assembly for its consideration and decision.	0
The negative effects of the situation in Libya will continue to increase, posing a sustained threat to peace and stability in the region, and China expresses its deep concern in this regard.	1
AQIM's arsenal could now include sophisticated anti-aircraft weapons from Libya, although they are unlikely to be operational.	1
- Consider imposing arms embargoes and other measures aimed at preventing the sale or supply of arms and related materiel of all kinds to parties to an armed conflict who commit violations of applicable rules of international law.	1
The Group also visited the Niangoloko police checkpoint and inspected the âmovement registerâ but noted no irregularities; there had been some confiscations of handguns and handguns.	0
Reiterating its deep concern at the threat of terrorism and the risk that non-State actors may acquire, develop, use or traffic in nuclear, chemical and biological weapons and their means of delivery,	1
Conduct of the investigation ordered by the first investigating judge of the Beirut military court into the investigations and anything that might shed light on the investigation into the explosion that caused the death of former Prime Minister Hariri and others.	0
The three States visited by the Committee had played an active role in establishing police agencies and units specialized in combating terrorism and in ensuring that they were provided with the necessary training and tools to carry out their tasks in various related areas of counter-terrorism.	0
I am deeply concerned that sexual violence against girls continues for many years to undermine prospects for peaceful coexistence in Darfur.	1
Organization of a comprehensive training course for all country representatives on humanitarian issues, with a focus on gender awareness.	0
Calling upon all parties to the armed conflict to cease immediately and completely all acts of sexual violence against civilians, in accordance with resolutions 1325 (2000), 1820 (2008), 1888 (2009) and 1889 (2009), the recruitment and use of children, in accordance with resolutions 1612 (2005) and 1882 (2009), and indiscriminate attacks against civilians, in accordance with resolution 1894 (2009),	1
When the situation in Haiti is addressed within the framework of the United Nations, attention is almost always focused on the so-called security issues, and the urgent attention to the serious structural, economic and social problems afflicting the country is minimized for all practical purposes.	1
As Chairman of the Counter-Terrorism Committee of the Security Council and as one of the first promoters of the Global Coalition against Terrorism, the Republic of Croatia strongly condemns international terrorism in all its forms and manifestations and, bearing in mind the danger that terrorism will be countered by other threats to international peace and security -- such as the proliferation of weapons of mass destruction, transnational organized crime and cyber terrorism -- calls for stronger cooperation at the global level for the suppression of this scourge of today.	1
âThe Security Council reiterates its concern at the growing connection, in many cases, between terrorism and transnational organized crime, illicit drugs, money-laundering and illicit arms trafficking, and emphasizes the need to promote coordination of efforts at the national, subregional, regional and international levels to strengthen the international response to this serious problem and this great threat to international peace and security, and encourages the United Nations Office on Drugs and Crime to continue its efforts in this regard, in collaboration with other relevant United Nations entities.	1
The mission witnessed a growing spiral of violence, in the midst of which peacekeepers were subjected to direct attacks by extremists.	0
âThe Security Council recalls its resolution 2048 (2012) and, in this regard, reiterates its readiness to consider further measures, including, if it deems necessary, targeted sanctions against persons who undermine efforts to restore constitutional order.	0
Welcoming the results of the Consultative Peace Jirga held on 6 June 2010, in which 1,600 Afghan delegates representing a broad section of all ethnic and religious groups, government officials, religious scholars, tribal leaders, Afghan civil society and Afghan refugees residing in Iran and Pakistan held discussions on ways to end insecurity and developed a plan for lasting peace in the country,	0
In collaboration with the University of Seychelles and experts of the Centre, UNODC developed a curriculum for the police, coast guard and other law enforcement officials involved in the investigation of piracy and maritime crime.	0
States should be able to apply the required legal measures, such as seizure of funds, whenever there is suspicion of money-laundering or financing of terrorist acts.	0
On 24 March, the Council of Ministers adopted the National Policy on Social Media, which outlines the Government's position on media development.	0
The Security Council looks forward to the findings and recommendations of the mission.	0
Following the arrival of troops loyal to President Yusuf and his deployment in an area near Jawhar, south of the population, in early September, it was reported that Trade Minister Muse Sudi Yallahow had sent several âtechnical vehiclesâ to reinforce his troops in Balad, south of Jawhar.	0
Approximately half of States carry out customs controls to combat illegal trafficking in small arms and light weapons, ammunition and explosives, but there is still a need to strengthen customs controls and train customs officers.	0
It is essential for any military or paramilitary operation to be successful that the commanders be able to exercise control, assess the prevailing situation and plan and coordinate their action vertically and horizontally through the command structure. As Al-Qaida, the Taliban and their associates carry out such activities, they must be provided with the necessary means, including communications equipment.	1
We emphasize the issue of violence to express our impatience regarding the urgency of finding satisfactory solutions to the enormous challenges to the unity of Iraqi society.	1
It was not fully parked online if we consider how the force of the explosion affected a red Ford vehicle, which was probably parked directly in front of the Mitsubishi.	0
The academy will be an important institution for the implementation of the new curriculum and for supporting the implementation of the road map for the reconstruction of the civilian police force.	0
He also referred to dangerous outbreaks of violence in Lebanon between the Lebanese Armed Forces and Fatah al-Islam armed men in the vicinity of Palestinian refugee camps.	0
Subsequently, prosecutors from the Netherlands sought to prohibit and dissolve the organization and to hand over to the State any credit balance from the bank account of the organization, but the court ruled that the Government had not shown that the branch of Al-Haramain in the Netherlands, separate and distinct from the international organization, had supported terrorism; prosecutors from the Netherlands announced that they intended to appeal the court's ruling, and to obtain more information on Al-Haramain and Al-Aquil from the United States.	1
Most States in Western Europe, Eastern Europe and Central Asia and the Caucasus subregions already have extensive counter-terrorism legislation.	0
Condemning all attacks on United Nations peacekeepers and humanitarian personnel, whoever they are responsible for, and emphasizing that those responsible for such attacks must be brought to justice.	1
The international community must therefore take the necessary steps to prevent Israel from persisting in the deplorable destructive policy it had undertaken in Gaza, and it must stress its rejection of all such Israeli practices, which violated international law and international humanitarian law.	1
Depending on the circumstances of each case, such persons may be suspected, in accordance with the doctrine of unlawful association, of having committed crimes against humanity involving the killing of civilians, forced confinement of civilians and forced transfer, and the war crime of destruction of civilian objects.	0
Some States in the region are implementing the 2005 European Union Strategy to Combat Radicalisation and the Recruitment of Terrorists, which aims to disrupt the activities of networks and individuals leading to terrorism; to ensure that the discourse of majority opinion prevails over extremism; to promote more intensely security, justice, democracy and opportunities for all."	0
Mr. Le Luong Minh (Viet Nam): Terrorism is a common concern of all members of the United Nations and of the international community at large.	1
In particular, they noted that the amended version of the Independent Electoral Commission Act did not provide for the representation of the Forces nouvelles in its local bodies and did not proclaim the primacy of the Commission over the National Institute of Statistics in the electoral process.	1
The personal interests of those who oppose the establishment of a legitimate government have always been present and the Monitoring Group has highlighted in its previous reports this central problem in Somalia, which continues to exist and has become the main theme of its third report: primarily, the continuing trend towards the intensification of possible violence to protect deep-rooted vested interests.	1
Thus, for example, the ruling in the Jagre al-Jadi al-Makbul et al. case describes how a combination of 39 policemen and members of the Popular Armed Forces left the inhabitants of Thabit at the mercy of a large contingent of Fursan attackers.	1
Calls upon all States to take urgent measures to fully implement resolution 1373 (2001) and to assist each other in this task, and emphasizes the obligation of States to refuse financial assistance and all other forms of support and shelter for terrorists and those who support terrorism,	1
Members of the Council expressed their deep concern at the continuing crimes in Libya.	1
We strongly condemn these practices, which constitute a flagrant violation of international norms and humanitarian law, and we therefore urge the international community, the Quartet and all others concerned to intervene immediately and decisively to demand that Israel put an end to such acts, which pose a serious threat to peace and security in the Middle East region; violence only generates violence; the region will be trapped in a vicious circle from which it will find it difficult to escape.	1
By contemplating initiatives that in fact reward this strategy, the Council would only embolden extremists and undermine the letter and spirit of the road map.	1
Mr. Å imonoviÄ believed that accountability was essential to reconciliation and that efforts should also be made to prosecute members of armed groups who had committed serious human rights violations.	0
For example, most States still have to criminalize the financing of terrorism and declare it a predicate offence in relation to money-laundering.	1
Of particular concern is the pattern of alleged serious misconduct by Haitian National Police officers, including the alleged involvement of a group in the summary execution of at least nine persons on 20 August during a football match in the Martissant area of Port-au-Prince.	0
The note proposes that the Security Council initiate a formal âstrategic reviewâ process to explore how the intersection of cross-border crime and terrorism can affect its conflict prevention and resolution efforts, particularly in Africa, and to review the tools at its disposal to reduce the strategic space that cross-border crime provides to terrorist groups.	0
In an increasingly globalized world, it has become easier for terrorists to exploit advanced technologies, communications and resources for their criminal objectives;	1
In 13 of the cells there were two detainees, while in seven of them there was only one.	1
I also take this opportunity to stress my concern over the problems related to the federal and governor elections to be held in Nigeria in February 2015, and the serious risks of violence from Boko Haram attacks or the contested election results.	1
One such group is the National Movement for Reform and Development (MNRD). On 6 June, MNRD released a manifesto declaring that it was not a party to the ceasefire agreement concluded in April between the Government, the Sudan Liberation Movement/Army and the Justice and Equality Movement, and that it was going to fight the Government.	1
9. Requests the Secretary-General to make arrangements to support the work of the monitoring mechanism, as an expense of the Organization and from a United Nations Trust Fund established for this purpose, affirms that this Trust Fund will be established by the Secretary-General, encourages States to contribute to the Fund and to provide, through the Secretary-General, personnel, equipment and services to the monitoring mechanism, and also requests the Secretary-General to keep the Committee established pursuant to resolution 1267 (1999) regularly informed of financial arrangements in support of the mechanism;	0
The use of lethal force in such situations must respect the principles of distinction and proportionality, and those responsible for their violation must be held accountable.	0
The Commission was unable to confirm a Government allegation that soldiers and wounded civilians had been killed inside the hospital.	1
The review process has resulted in confirmation of the retention on the List of any person who, although not on the List for this reason alone, is known primarily for playing a role in the ideological justification of Al-Qaida-related violence in front of new recruits or in front of a wider audience, despite the fact that sanctions themselves have little impact on the primary instrument of those individuals, namely, the ability to communicate and persuade using the Internet.	1
The situation in Syria is a source of deep and growing concern for the United Nations.	1
We were even hampered in condemning the violence and in adopting a peaceful plan drawn up by Syria's own neighbours.	1
However, the financial and other institutions involved in implementation do not yet have this change in mind, and the Team recommends that the Committee and States find a way to disseminate it.	0
Despite these challenges, we cannot fail to recognize that approximately 50 per cent of the Afghan population lives in areas where responsibility for security has been transferred to the Afghan security forces.	1
5. Notes that such means of financing or support include, inter alia, the use of proceeds derived from criminal activities, including the illicit cultivation, production and trafficking of narcotic drugs and their precursors;	0
14. Invites the Secretary-General to bring to its attention situations where refugees and internally displaced persons are vulnerable to threats of harassment or where their camps are vulnerable to infiltration by armed elements and where such situations may constitute a threat to international peace and security, expresses in this regard its readiness to examine such situations and, where necessary, to take appropriate measures to contribute to the establishment of a safe environment for civilians threatened by conflict, in particular by providing support to relevant States in this regard, and recalls in this regard its resolution 1208 (1998) of 19 November 1998;	0
Mainstreaming gender analysis into post-conflict needs assessment and training: piloting a gender-sensitive post-conflict needs assessment.	0
I condemn in the strongest terms the reprehensible attacks on people who help the Somali people to fight organized crime that hinders the development of their country.	1
- Criminal liability of legal persons or entities shall be established for the commission of offences related to the financing of terrorism;	0
As I said earlier, the application of double standards in dealing with terrorism and terrorist groups is also a matter of serious concern that seriously undermines the efforts of the international community in its fight against terrorism.	1
Cooperation with international organizations, including the Security Council Committees established pursuant to resolutions 1267 (1999) and 1373 (2001);	0
According to official Australian sources, training includes the manufacture of bombs and suicide bomber techniques.	0
Its terrorist practices cover a wide range of activities: bombings, including suicide attacks; hostage-taking resulting in death; the manufacture of explosives; terrorist intelligence operations; terrorist training; document forgery; and the provision of various types of financial or material support, including the financing and administration of a web site used to publish statements and images related to Al-Qaida.	0
The embargo includes âweapons and related materials of all kinds, including weapons and ammunition, military vehicles and equipment, paramilitary equipment and spare parts.	0
There are also significant positive developments: when the armed conflict ended in 1999, there was a virtually complete lack of legislation and economic structures.	0
2. Decides that the individuals previously designated as Taliban and the other individuals, groups, undertakings and entities associated with them whose names shall be listed in section A (âTaliban associated personsâ) and section B (âTaliban associated entities and other groups or undertakingsâ) of the Consolidated List maintained by the Security Council Committee established pursuant to resolution 1267 (1999) concerning Al-Qaida and the Taliban and associated individuals and entities at the date of adoption of this resolution shall no longer be included in the Consolidated List but shall be included in the List described in paragraph 1, and further decides that all States shall continue to take the measures described in paragraph 1 against those listed individuals, groups, undertakings and entities;	0
The High Representative/Special Representative made it clear that, since the Republika Srpska authorities, in particular the Ministry of the Interior, had not arrested persons against whom war crimes had been charged, and since Bosnia and Herzegovina had not joined the North Atlantic Treaty Organization Peace Partnership, the Commission would be mandated to make recommendations with a view to establishing a single and effective police structure throughout Bosnia and Herzegovina.	1
The Secretary-General unequivocally warns that none of the eight standards has been fully complied with so far.	1
The establishment of the special notices of Interpol and the United Nations Security Council was made possible by the extraordinary and close cooperation between the two agencies over the past year and by the agreement between the Interpol general assembly and the 1267 Committee.	0
Reaffirming that terrorism in all its forms and manifestations constitutes one of the most serious threats to peace and security and that all acts of terrorism are criminal and unjustifiable, regardless of their motivation and wherever and by whomsoever committed, and reiterating its unequivocal condemnation of Al-Qaida and other individuals, groups, undertakings and entities associated with it for the continuing and multiple criminal acts of terrorism aimed at killing innocent civilians and other victims, destroying property and seriously undermining stability,	1
Apart from regular meetings of the Council of Arab Ministers of the Interior, there is no regular and institutionalized exchange of operational information in the subregion.	0
We are deeply concerned that violence in the Middle East continues to be perpetrated against each other, despite the fact that the international community and the Security Council have clearly expressed their abhorrence of that situation.	1
Instead of the famous 2014 Football World Cup logo, which is made up of three victorious hands that hold the globe forming the prestigious cup, the Palestinian Authority vignette shows a three-handed "trophy" that grabs three people whose arms are raised in a surrendering attitude.	1
There are also procedural obstacles that limit victims'access to justice.	0
At the same time, one of the issues that continues to be raised by the most intense discussions in the subregion is to ensure that counter-terrorism measures respect human rights obligations.	1
Bilateral donor assistance will also be needed to enable a meaningful response to the security threats posed by drug and arms trafficking.	0
1. Deplores and condemns in the strongest terms the terrorist acts of ISIL and its violent extremist ideology, as well as its ongoing, flagrant, systematic and widespread abuses of human rights and violations of international humanitarian law;	1
In addition, the Council itself has set important precedents, in particular the establishment of commissions of inquiry on Bosnia, Rwanda and Darfur, which paved the way for the international tribunals for the former Yugoslavia and Rwanda in 1993 and 1994, respectively, and the referral of the situation in Darfur to the International Criminal Court in 2005.	0
The Council reaffirms, recalls or reiterates regularly its demand for States to implement existing arms embargoes, because implementation remains a major challenge.	1
