es_en_TRANSOFMERS	VerConf
In West Africa, UNOWA has played a leading role in supporting efforts to implement the Economic Community of West African States Regional Action Plan to Address the Growing Problem of Illicit Traffic in Narcotic Drugs, Organized Crime and Drug Abuse in West Africa.	1
As a result, the observers indicated the need to train lawyers and judicial and law enforcement personnel, as well as the importance of establishing credible guarantees of independence against possible pressures and intimidation by clan members and ethnic communities.	0
However, international human rights mechanisms have raised concerns about violations allegedly committed by intelligence and law enforcement agencies in the course of their investigations and interrogations.	1
The existence of a system of communicating vessels between criminal activities that fuel terrorism in Africa and criminal activities that thrive in other regions of the world cannot be ruled out.	1
This year, in order to guide the pledges of new donors, UNMIK prepared âKosovo: reconstruction 2000â, a programme of reconstruction and public investment to guide donors towards the priorities of the Joint Interim Administrative Structure.	0
The Assistant Secretary-General also believed that inflammatory statements by armed groups threatening to sabotage the elections in areas of eastern Ukraine and to hold their own elections on 2 November, in violation of the Constitution and national law, should be condemned by all.	1
We are disappointed, Mr. President, that, despite your efforts and the efforts of many others, the Council could not condemn that heinous terrorist attack.	1
The Committee provided the Commission with the number of victims suffered and the number of weapons stolen between January 2003 and November 2004. With regard to the army, it stated that 937 soldiers had died, 2,264 had been injured and 629 had disappeared, and that 934 weapons had been stolen; with regard to the police, it stated that 685 officers had died, 500 had been injured and 62 had disappeared, and 1,247 weapons had been stolen; with regard to the security and intelligence services, it stated that 64 officers had died, 1 had been injured and 26 had disappeared, and 91 weapons had been stolen.	0
However, I remain concerned that restrictions on the freedom of movement of United Nations military observers seeking to visit the units, barracks and strongholds of the parties for verification purposes continue.	1
âWeapons of mass destruction and non-proliferation as best business practiceâ, followed by an exercise	0
The French authorities are extremely concerned about the current deterioration of the situation in the northern Gaza Strip last week.	1
We urge Israel to respect its obligations towards the population of the occupied territories.	1
" The Council condemns all attacks by local and foreign armed groups that threaten the population and threaten the peace and stability of the Central African Republic and the subregion, including the attacks against Birao perpetrated by the Patriots Convention for Justice and Peace on 19 July and 24 November.	1
When UNMIK and KFOR requested data on the presence of the Army in the Kosovo Protection Corps, they received a very typical response from the KPC commander, who said that, given his limited competencies, he could not provide further information.	1
Recalling the statement of its President (S/PRST/2011/9) of 2 May 2011, which notes that Osama bin Laden will never be able to carry out terrorist acts again,	1
Terrorism undoubtedly represents one of the most serious threats to international peace and security and remains a major concern not only for African States but for the international community as a whole.	1
6. Urges States and all other parties to armed conflict to make every effort to prevent violations of international humanitarian law against civilians, including journalists, media professionals and their associated personnel;	0
Such a strategy should provide for the way in which States could, on the one hand, adapt the counter-terrorism measures they had adopted to ensure the protection of their basic infrastructures and their citizens and, on the other hand, respond to a terrorist attack in order to mitigate the effects of such an incident, assisting victims and establishing public order.	0
Four of the eight South Asian States have enacted legislation criminalizing the recruitment of terrorists and prohibiting the use of their territories to commit or prepare terrorist acts against other States or their citizens.	0
We have noted with concern that the Secretary-General believes that many of the factors fuelling the 2006 crisis remain present in society, making it vulnerable to instability.	1
One of these detainees was a 15-year-old boy arrested in Nyala, Northern Darfur, in November 2004, when he returned home after work.	0
Fourthly, there are direct threats to the security of mission personnel.	1
The wide range of borders, inaccessible and often open, makes it very difficult to manage effectively and lends itself to the activities of transnational criminal and terrorist groups.	1
Stressing the need to intensify the fight against terrorism at the national level and to strengthen, under the auspices of the United Nations, effective international cooperation in this field based on respect for the principles of the Charter of the United Nations and the rules of international law, including respect for international humanitarian law and human rights,	0
Calls upon all parties to the armed conflict [of the affected country], including members of [a particular armed group], to give clear orders against sexual violence, and further calls upon them to undertake and implement specific commitments on the timely investigation of alleged abuses in order to hold perpetrators accountable, in accordance with resolution 1960 (2010), and to facilitate immediate access to available services for victims of sexual violence;	0
On 2 June, 21 June and 25 September 2005, Lebanese personalities were subjected to car bombings in Beirut, killing Samir Qassir and George Hawi, and wounding May Chidiac. On 12 July 2005, another assassination attempt was made against Lebanese Defence Minister Elias Murr, resulting in one person being killed and several others, including the Minister, being injured.	0
This unpleasant political incident was strongly condemned in a press release issued immediately after the incident by the Office of President Ernest Bai Koroma and in numerous press releases subsequently issued by other political interest groups, including APC and PMDC parties, the Independent Media Commission, the Political Parties Registration Commission and the Campaign for Good Governance.	1
Use of the Internet for terrorist purposes to provide training on explosives	0
The purpose of the meeting was to initiate a dialogue with the private sector, to gain a better understanding of the difficulties faced by the financial community in implementing the sanctions regime, to find ways to simplify compliance and make it more cost-effective and effective, and to devise ideas for its improvement.	0
At the outset, I would like to express our deep concern about the security situation in the country.	1
However, we do not believe that sovereignty demands that the Council remain silent when Governments slaughter their own people, threatening regional peace and security in that process.	1
Encouraged by the desire to continue to assist Lebanon in the search for the truth and in giving effect to the criminal responsibility of the participants in this terrorist act,	0
To condemn and call for the immediate cessation of all acts of violence or abuse committed against civilians in violation of applicable provisions of international humanitarian law and human rights law.	1
Presidential statements on children and armed conflict (S/PRST/2002/12), East Timor (S/PRST/2002/13), elections in Sierra Leone (S/PRST/2002/14), admission of new members (S/PRST/2002/15), Kosovo (S/PRST/2002/16), the Democratic Republic of the Congo (S/PRST/2002/17) and UNDOF (S/PRST/2002/18) were adopted.	0
Preliminary indications are that the explosion took place in Prime Minister Hariri's entourage but the consequences are not yet known.	0
Stressing that the development and maintenance of impartial and effective criminal justice systems should be one of the fundamental foundations of any strategy to combat terrorism and transnational organized crime,	1
In order to expedite the process and ensure the availability of sufficient qualified personnel, the Committee recommends that consideration be given to ways and means of broadening the pool of potential candidates.	0
âThe Security Council reiterates its strongest condemnation of the cases of desecration, damage and destruction of sacred sites of historical and cultural significance, in particular, but not exclusively, those declared World Heritage by UNESCO, including those of the city of Timbuktu.	1
âThe Security Council stresses the urgent need to strengthen military and police institutions in Libya.	1
All States have taken measures to regulate the production, sale and transfer of arms and explosives, although only four have fully implemented such measures.	0
(a) If by his or her act he or she causes serious injury;	0
In mid-November, armed clashes between the Serbian security forces and the self-proclaimed Presevo, Medvedja and Bujanovac Liberation Army (UCPMB) intensified in the ground security zone.	0
While the nature of the consultations will ultimately be determined by the stakeholders themselves, they are expected to involve conferences at the local and state levels throughout Darfur leading to a major conference throughout Darfur.	0
It was high time for the international community to take effective measures to protect and enforce the most basic rights of the Palestinian people and to help put an end to the vicious cycle of violence caused by Israel's continuing illegal occupation of Palestinian territories.	1
While each situation of refugees and internally displaced persons is unique, displacement and statelessness exacerbate gender inequalities and enhance the discrimination and hardship faced by women and girls.	0
We have taken note of the caution of the Secretary-General and the technical assessment mission with regard to security sector reform, and especially with regard to PNTL.	1
I have the honour to refer to Security Council resolution 1606 (2005) of 20 June 2005, by which the Council requested me to engage in negotiations with the Government of Burundi and consultations with all interested Burundian parties to determine how to implement the recommendations contained in the report of the assessment mission (S/2005/58) on the establishment of a mixed truth commission and a special chamber within the Burundian judicial system, and further requested me to report on 30 September on the details of implementation, including costs, structures and timetable.	0
“The Security Council notes with concern the postponement of the first round of the presidential elections, scheduled to be held on 29 November 2009, in accordance with the communiqué of 18 May 2009 of the Permanent Consultative Framework established by the Ouagadougou Political Agreement, which had been approved by all major Ivorian political actors.	1
They therefore told the Commission that the police had been one of the targets of the attacks on villages, but most of all blamed the Janjaweed for those acts.	0
The Royal Moroccan Army also indicated that its efforts had been hampered by the scarcity of resources and the lack of available information on mine-infested areas.	1
At the same time, the underground resistance movement expanded throughout the country and a popular movement was reborn. On 30 August 1999, 78 per cent of the Timorese population voted for the emancipation of the Indonesian administration in the United Nations-sponsored consultation of the people.	0
General Moges concluded his briefing by warning that, with the arrival of the dry season, the risk of renewed hostilities was greater, which was why UNISFA had increased patrols, but stressed that without dialogue it would not be possible to prevent the situation from deteriorating at some point.	1
Several delegations were of the view that internal situations, in particular the conflict in South Sudan, did not allow for decisions leading to the resolution of outstanding issues.	1
It is recommended that United Nations contributions to the stabilization programme be aligned and harmonized as part of the next review of the United Nations Development Assistance Framework (UNDAF).	0
This is a sensitive issue, as there has been a lack of confidence among some police officers from different locations.	1
The second point I would like to address today is our continued concern for the well-being of innocent people in Gaza and in the towns and cities of southern Israel.	1
The weekly quadripartite meetings enabled both sides, as well as UNOMIG and the CIS peacekeeping forces, to maintain an ongoing dialogue on issues related to the security of the zone of conflict.	0
The regime arrested some 47 people; they are believed to have been forced to join the regime forces.	0
The Bir Lahlou base of operations was reinforced by additional military observers from the Tifariti base and the Mission remained in close contact with the Frente Polisario.	0
The Council recalls the importance it attaches to ending impunity and providing justice for crimes committed in Darfur.	1
He said that no one knew who had fired the helicopter, as the incident had occurred near Bentiu, where the armed parties were very close to each other.	0
In October 1980, FACI launched six light combat and training aircraft Dassault/Dornier Alpha Jet CI.	0
:: Deployment of qualified and properly trained international civilian police as a component of peacekeeping operations to enhance the capacity of the United Nations and assist the host State in enforcing the law.	0
The Committee, with the contribution of the Executive Directorate and in close cooperation, as appropriate, with the support office of the Counter-Terrorism Implementation Task Force and relevant entities, as well as with other bilateral and regional assistance providers, will continue to assess technical assistance needs with a view to exploring ways to facilitate the provision of assistance to relevant Member States.	0
We note with concern that the area of security remains problematic.	1
Some concerns have been expressed about the fairness of registration, the most recent of which have been raised by several presidential candidates.	1
With regard to the argument relating to international law, the Team is of the view that one of the reasons for creating a review panel or mechanism is simply to advance legislation in this regard by establishing the standard before it is translated into decisions of national or regional courts or in the practice of Member States.	0
- Consider applying targeted and graduated measures against parties to an armed conflict that threaten peace, attack or obstruct the activities of United Nations peacekeeping or other relevant missions or commit violations of applicable international humanitarian and human rights law.	0
(c) The Commission shall have the authority to determine the place and modalities for interviewing Syrian officials or other such persons as it considers relevant to the investigation;	0
Four States have established policies and measures to curb trafficking in arms and explosives, two have adopted some measures to that end and another has no capacity in this area.	0
Other sources reported that the Janjaweed and soldiers abducted, held confined and repeatedly raped women and girls in the villages they attacked, in military camps and in hiding places, and that they were also tortured to prevent them from escaping.	0
Decides that all Member States shall freeze without delay all funds, other financial assets and economic resources within their territory that are owned or controlled, directly or indirectly, by persons or entities included in [the annex to the resolution imposing sanctions] or [designated by the Sanctions Committee and otherwise order, control or direct the commission of serious human rights violations against persons in [the affected State] or who are complicit in their commission, in particular if they have planned, commanded, ordered or carried out attacks, including aerial bombardments, against the civilian population and facilities, in violation of international law, or have been complicit in the commission of such acts; or persons or entities acting on their behalf or at their direction, or entities owned or controlled by them] and also decides that all Member States shall ensure that their nationals or other persons or entities within their territories do not make funds, financial assets or economic resources available to the individuals or entities included in [the annex to the resolution imposing sanctions] or to persons designated by the Committee.	0
19. Condemns in the strongest terms all sexual and other violence against civilians in armed conflict, in particular against women and children, and undertakes to ensure that all peace support operations implement all possible measures to prevent such violence and to address its impact when it occurs;	1
It was unacceptable that attempts should be made to destabilize the internal situation in Lebanon through the perpetration of political assassinations.	1
These abuses occurred between August 2002 and January 2003.	1
While the command of FFDTL has emphasized the importance of the chain of command in dealing with complaints, there appears to have been no established and detailed procedure regulating how such complaints can be dealt with and dealt with formally.	1
It is therefore largely concerned with aspects of the social contexts that can lead to the spread of terrorism.	1
Overall, Kosovo Serb political groups, whose focus is on Belgrade, have not formulated a clear policy on a number of critical issues, including the future involvement of Kosovo Serbs in the Joint Interim Administrative Structure.	1
It is clear that, when MINURCAT begins to withdraw from Birao on 21 October 2010, it is quite possible that the national forces of the Central African Republic are not immediately in a position to deploy and maintain additional troops.	1
On 5 May 2005, the same trucks carrying arms and food returned to Somalia through the border town of Yeed in the Bakool region. On 7 May 2005, the trucks carrying the weapons arrived in Hudur, capital of the Bakool region, and the weapons were temporarily stored at the Hudur police station.	0
The situation along the Lebanese-Syrian border also remains a matter of concern.	1
There is no doubt that the Committee should bear in mind all international best practices, codes and standards relevant to the implementation of resolution 1373 (2001), while monitoring the implementation of resolution 1373 (2001) by States.	0
A second battalion would be deployed in the southern town of Kamina to protect the airfield; provide a secure environment for the electoral process in its area of operations; monitor the southern Mayi-Mayi and encourage them to participate in the brassage or disarmament, demobilization and reintegration process; support and mentor FARDC, specifically in Kamina.	0
(a) The Maoist army recruited a considerable number of children just before the signing of the Comprehensive Peace Agreement.	0
In addition, the Committee considered that the list of items, materials, equipment, goods and technology related to ballistic missile programmes contained in the annex to its previous report (S/2014/253) replaces the previous list (see S/2012/947) and will be subject to the measures imposed by the Security Council in paragraphs 8 (a), (b) and (c) of resolution 1718 (2006).	1
Retaining that level of funding would render any Government useless, and, more rightly, an authority in occupied territory. If funds were not immediately unblocked, the achievements of State consolidation, including improved governance that would benefit the Palestinian people and the development of law and order security forces in the West Bank, would be jeopardized.	1
However, as I said at the public meeting on Tuesday, the facts must be considered in their context, and the Security Council does not contribute at all to a peaceful solution when it condemns the actions of one of the parties and turns a blind eye to everything else that happens in the region.	1
Blaming others, looking for scapegoats to hold them accountable for failures in Afghanistan and asking those who are already doing more than they should do even more is unfair and unacceptable and will ultimately be counterproductive.	1
In order for States to properly patrol their vast coastlines, coastal guard, navy and customs administrations need to cooperate with each other by exchanging information and sharing surveillance efforts.	0
In addition, the Team's interactions with Member States and the Committee would change significantly if the Team became an arbiter of listing and delisting decisions.	0
What is at stake is undoubtedly very important, as failure to meet the deadline prescribed in the Comprehensive Peace Agreement for the holding of referendums could result in serious consequences.	1
The Council also deplored the adoption by the Kosovo Assembly of that resolution, and agreed with the Special Representative's view that those resolutions and decisions of the Assembly on issues outside its sphere of competence were null and void.	1
The European Union also expressed support for my Special Representative's statement of 8 September 2005, which stressed that there could be no military solution to the problems faced by the transitional federal institutions.	0
On 3 and 7 October, the Council issued press releases condemning the recent attacks against MINUSMA (SC/11587 and SC/11591).	1
Bearing in mind the special nature of resolution 1373 (2001), the continuing threats to international peace and security posed by terrorism, the important role that the United Nations and the Security Council should continue to play in the global fight against terrorism and the need to strengthen the Committee as a subsidiary body of the Security Council in that area, and without setting precedents for other organs of the Security Council,	0
Owing to the lack of State authority, self-defence groups had also been established to protect communities from armed groups, which had often become a source of conflict.	0
The Congolese Government has indicated that it will stand firm with regard to the deadline of 2 January 2015.	1
- List of deaths caused by the regime:	0
- Condemn and call for the immediate cessation of attacks deliberately targeting humanitarian workers.	0
Failure to comply with its obligations under the Charter should have consequences for any Member State, and the Sudan should not be the exception.	1
The United Nations country team is currently engaged in a dialogue to review the action plan, including 168 projects, and to further institutionalize development planning, including community-based approaches such as the reconciliation and peaceful coexistence mechanism and UNDP-led conflict reduction programming.	0
11. Stresses that specialized international and regional organizations have an important role to play in promoting understanding of the terrorist threat, and in facilitating international cooperation in the field of counter-terrorism, especially through the provision of technical assistance and related assistance, as requested.	0
- To contribute, as appropriate, to the development by the authorities... of the capacity of the police and gendarmerie, in particular through crowd control training, and the re-establishment of their presence throughout the territory [of the country concerned].	0
To this end, inter alia, terminology that appears to accept the religious justifications advanced by Al-Qaida should be avoided; the Monitoring Team continues to argue that when non-Muslim commentators or politicians use religious terms to describe Al-Qaida, however convenient, habitual or intentional such use may be, the consequence is that it is more difficult to refute that message and prevent it from taking effect among those to whom it is intended.	1
Noting with deep concern the increasing number of victims, including children, as a result of acts of terrorism motivated by intolerance or extremism in several regions of the world,	0
Since the last report on this issue (S/2012/971), the total number of foreign combatants and Al-Qaida leaders and facilitators killed or captured has decreased.	0
This is a fundamental step forward, in the sense that responsibility for implementation is delegated to the level of police service, which in turn makes the principle of local self-government as easy as possible.	0
Strong measures will be taken to prevent and combat gender-based violence, including sexual exploitation and abuse.	0
Convinced also that the political resolution of the conflict can contribute to the fight against the scourge of terrorism and related activities, which persist in the region, and facilitate their eradication;	0
During its last visit to Damascus from 10 to 15 December 2014, the Declaration Assessment Group continued interviews with the senior staff of the Syrian chemical weapons programme, held technical meetings with the Syrian National Authority and visited two sites.	0
