ar	VerConf
2 - وجمهورية كرواتيا، باعتبارها الدولة التي ترأس لجنة مكافحة الإرهاب التابعة لمجلس الأمن وأحد أوائل الدول التي شجعت على إنشاء التحالف العالمي لمكافحة الإرهاب، تدين بشدة الإرهاب الدولي بجميع أشكاله ومظاهره، وهي، إذ تأخذ في الاعتبار خطر تضافر الإرهاب مع التهديدات الأخرى للسلام والأمن الدوليين - مثل انتشار أسلحة الدمار الشامل، والجريمة المنظمة عبر الوطنية والإرهاب الحاسوبي - تحث على أن يزداد التعاون الدولي قوة لقمع هذه الآفة المعاصرة.	1
وتوصي اللجنة أيضا بألا يحاكم من بين الأشخاص الذين تلقوا أسلحة قوات الدفاع التيمورية في 24 و 25 أيار/مايو سوى الأشخاص الذين استخدموا هذه الأسلحة لاحقا في أنشطة إجرامية.	0
ألا يُقبل طلب حكومة الكويت المتعلق بالمطالبة الخاصة بالملكية العقارية لسجين متوفى، باعتبار أن هذه المسألة تشكل في الواقع طلبا بتقديم مطالبة تخص الجزء المتعلق بالملكية العقارية بعد انقضاء مهلة قبول المطالبات، وأن َيطلُب إلى الأمانة إبلاغ حكومة الكويت بذلك.	1
باء - المحافظة على مسرح الجريمة	0
وتدفقت من جانب إلى آخر عبر هذه الحدود جماعات متنقلة من المحاربين الشبان - المحاربين الإقليميين - الذين يعتبرون الحرب أساسا فرصة اقتصادية.	0
10 - وقدم الناتو قوات إضافية لضمان بيئة آمنة ومأمونة لانتخابات المجلس الوطني ومجالس المقاطعات المقرر إجراؤها في 18 أيلول/سبتمبر (انظر الفقرة 15).	0
وتظل هذه الجماعة إحدى أقوى الجماعات المسلحة المتطرفة في العراق.	1
إلا أن احتمال انهيار النظام والقانون بالكامل، إضافة إلى انهيار الاقتصاد الهش وتفسخ مؤسسات الحكم الذاتي الفلسطينية، لا يزال قائماً.	1
"ويرى مجلس الأمن أن الجزاءات أداة مهمة من أدوات مكافحة الإرهاب، ويشدد على أهمية التنفيذ الفوري والفعال للقرارات ذات الصلة، ولا سيما قراري مجلس الأمن 1267 (1999) و 1989 (2011) باعتبارهما أداة رئيسية في مكافحة الإرهاب.	1
5 - يؤكد من جديد أيضا إدانته بكل شدة لجميع أعمال العنف والاعتداءات التي ترتكب ضد المدنيين في حالات الصراع المسلح، بما يتنافى والالتزامات الدولية السارية بشأن الحالات التالية على وجه الخصوص: '1` التعذيب وغيره من ضروب المعاملة المحظورة، '2` العنف الجنساني والجنسي، '3` ممارسة العنف ضد الأطفال، '4` تجنيد الأطفال واستخدام الجنود الأطفال، '5` الاتجار بالبشر، '6` التشريد القسري، '7` الحرمان المتعمد من المساعدة الإنسانية، ويطالب جميع الأطراف بوضع حد لهذه الممارسات؛	1
وحثت الحكومة الأفغانية اللجنة على الاستجابة بمزيد من المرونة لمقترحاتها الداعية إلى شطب أسماء من القائمة، مبدية مخاوفها من أن عجزها عن تحقيق شطب الأسماء من القائمة يسلبها نظاما أساسيا لمكافأة أعضاء حركة الطالبان الذين ينضمون للمصالحة، مما يعني مخاطرتها بعودتهم إلى القتال.	1
ويبقى إصلاح القطاع الأمني واحدا من التحديات الرئيسية للسلام والاستقرار في الأجل الطويل.	1
(ب) مواصلة تعزيز الأمن في مداخل الحدود وعلى امتداد الحدود المفتوحة لمنع وقمع حركة شحنات الإرهابيين من الأسلحة/المتفجرات عبر الحدود شأنها في ذلك شأن العملات والصكوك القابلة للتداول والدفع لحاملها وتنفيذ أفضل القواعد والمعايير الدولية التي أرستها وكالات متخصصة مثل منظمة الطيران المدني الدولي والمنظمة البحرية الدولية ومنظمة الجمارك العالمية؛	0
فمن جهـة، هناك من رأوا من الطبيعي أن يحدد البلد شروط المواطنة أو الجنسية، بينما أدان آخــــرون من جهــة أخرى استغلال هذا المفهوم لأنه كان أصل الأزمة المتفجرة في كوت ديفوار.	1
ونحن نعتبر موقف أرمينيا تحديا مفتوحا ومباشرا أمام عملية تسوية النزاع وتهديدا خطيرا للسلم والأمن الدوليين والإقليميين.	1
لقد أمضيت أربعة أيام في أفغانستان في نهاية شهر حزيران/يونيه لتقييم الحالة الإنسانية، نظرا للشواغل المتزايدة بشأن صعوبة الأوضاع الإنسانية ومسألة حماية المدنيين.	1
إننا نشعر بقلق شديد حيال حقيقة أن العنف في الشرق الأوسط ما زال يرتكبه جانب واحد ضد الجانب الآخر، بالرغم من الإعراب الواضح للمجتمع الدولي ومجلس الأمن عن الاشمئزاز من تلك الحالة.	1
وقد أجرى فريق الوساطة مناقشات ثنائية مع الحكومة ومجلس التنسيق الذي يتألف من الحركة الوطنية لتحرير أزواد والمجلس الأعلى لوحدة أزواد والحركة العربية لأزواد، وانضم إليهما أشخاص من مجلس التنسيق الثاني للحركات والقوات الوطنية للمقاومة، وفصيل تابع لائتلاف الشعب من أجل أزواد، من جهة، ومن جهة أخرى، مع الحكومة والجماعات المسلحة لائتلاف الخطة التمهيدية الذي يضم مجلس التنسيق الأول للحركات والقوات الوطنية للمقاومة وائتلاف الشعب من أجل أزواد والفصيل الآخر للحركة العربية لأزواد، فضلا عن أفراد من مجموعة طوارق إمغاد وحلفائهم للدفاع الذاتي (غاتيا) دعاهم ائتلاف الخطة التمهيدية.	0
علما بأن عدم قيام قيادة قوات الشرطة بالمعاقبة على الهجمات التي وقعت يومي 23 و 24 أيار/مايو الضالع فيها بعض ضباط من قوات الشرطة، يرجع إلى انهيار التسلسل القيادي، والشقاق الحزبي القائم وإلى محدودية المساءلة في السابق.	1
ومن ثم، فمن رأي اللجنة أن هذه الأعمال قد تشكل جرائم ضد الإنسانية.	1
"ويسلِّم مجلس الأمن بأهمية المساعدة في منع نشوب الصراعات في المستقبل من خلال معالجة أسبابها الجذرية بطريقة مشروعة وعادلة.	0
وسينشأ عنصر مخاطرة يتمثل في تحول الانتباه عن هذه المعايير ليتركز على قضية مركز الإقليم.	1
19 - يشدد في هذا الصدد على أهمية الجهود التي تبذلها الدول الأعضاء من أجل بلورة سبل بديلة غير عنيفة لمنع نشوب النزاعات وتسويتها لكي يأخذ بها الأفراد المتضررون والمجتمعات المحلية المتضررة في الحد من مخاطر نشر الفكر المتطرف الذي يفضي إلى الإرهاب، وعلى أهمية إشاعة بدائل سلمية للخطاب العنيف الذي يعتنقه المقاتلون الإرهابيون الأجانب، ويشدد على الدور الذي يمكن أن يؤديه التعليم في مناهضة الخطاب الإرهابي؛	0
وعقب انتهاء المهمة الميدانية، أنشأت المفوضية كياناً معنياً بالحماية بعد انتهاء المهمة في كوناكري، وذلك لمدة ثلاثة أشهر من أجل تقديم الدعم والمشورة للأشخاص الذين يُخشى تعرّض سلامتهم للخطر، وللحيلولة دون الانتقام منهم.	0
2 - يدعو الحكومة السورية إلى أن تنفذ بشكل واضح كل الالتزامات التي وافقت على الوفاء بها في التفاهم الأولي وعلى نحو ما ينص عليه القرار 2042 (2012)، وهي (أ) وقف تحركات القوات نحو المراكز السكانية، (ب) وقف كل استخدام للأسلحة الثقيلة في تلك المراكز، (ج) إكمال سحب الحشود العسكرية في المراكز السكانية وحولها، وكذلك سحب قواتها وأسلحتها الثقيلة من المراكز السكانية لتعود إلى ثكناتها أو إلى مواقع نشر مؤقتة لتسهيل وقف مستمر لإطلاق النار؛	1
25 - يدعو جميع الدول إلى توخي المسؤولية في إدارة استخدام اليورانيوم العالي التخصيب في الأغراض المدنية، والتقليل من استخدامه إلى أدنى حد ممكن من الناحيتين التقنية والاقتصادية، بما في ذلك من خلال العمل على تحويل مفاعلات البحوث النووية وعمليات إنتاج النظائر المشعة صوب استخدام أنواع وأهداف الوقود من اليورانيوم المنخفض التخصيب؛	0
ووفقا لما تبين أعلاه، فإن هذا النهج يستفيد من فهمها المتزايد للتحديات المتواصلة لمكافحة الإرهاب، وهو فهم اكتسبته من حوارها الفعال مع الدول، بما في ذلك ضمن إطار زيارات التقييم القطرية. وتواصل المديرية التنفيذية القيام بإحالات محددة للحصول على مساعدة تقنية تلبي احتياجات محددة في الدول التي قامت بزيارتها. وهي تفعل ذلك على أساس يستهدف الجهات المانحة التي اعتبرت مستجيبة، إما لأنها مشاركة في برامج تنفذ حاليا في دولة محددة أو لأن لديها اهتماما شديدا وقدرة قوية في المجال التقني ذي الصلة.	0
ولم يحدث أبدا أن قامت حكومة جمهورية أوغندا أو قواتها المسلحة بأي محاولة علنية أو سرية للدخول لأراضي جمهورية الكونغو الديمقراطية لشن هجوم على إرهابيي جيش الرب للمقاومة.	0
107 - وفي 24 تموز/يوليه 2005، انتُهك هذا الاتفاق بسبب قيام القوات الجوية لكوت ديفوار بإعداد طائرتها طراز Mi-24P لعمليات عسكرية رداً على هجوم مزعوم على أنياما.	1
كما يؤكد أن من واجب رواندا أن تستخدم نفوذها القوي لكفالة عدم اتخاذ التجمع الكونغولي إجراءات من هذا القبيل.	1
يدعو جميع الأطراف إلى التعاون الكامل مع اللجنة الدولية المستقلة للتحقيق التي أنشأها مجلس حقوق الإنسان في [تاريخ] للتحقيق في الوقائع والظروف المحيطة بادعاءات وقوع اعتداءات وانتهاكات جسيمة لحقوق الإنسان ارتُكبت في [البلد المعني] ...، ويطلب إلى الأمين العام إحالة هذا التقرير إلى مجلس الأمن وإلى الهيئات الدولية المعنية الأخرى	0
وقدم أيضا معلومات عن الحالة الإنسانية في المناطق التي تسيطر عليها الجماعات المسلحة والتي لا يزال يسودها عدم الاستقرار، ولا سيما في إقليم لوهانسك.	0
في الواقع، إن أذربيجان نفسها تمثل انتهاكا لتلك القرارات، التي تحث الأطراف المعنية على مواصلة المفاوضات في إطار مجموعة مينسك التابعة لمنظمة الأمن والتعاون في أوروبا، وكذلك من خلال اتصالات شتى فيما بينها.	1
ويعرب المجلس عن بالغ قلقه لأن المدنيين لا يزالون يشكلون أغلبية ضحايا أعمال العنف التي ترتكبها أطراف النـزاعات المسلحة، بما فيها الاستهداف المتعمد، والاستعمال العشوائي والمفرط للقوة، واستخدام المدنيين كدروع بشرية، والعنف الجنسي والجنساني، وكذلك جميع الأعمال الأخرى التي تشكل انتهاكا للأحكام ذات الصلة من القانون الدولي الساري.	1
ويطالب المجلس بالوقف الفوري لجميع الهجمات التي يشنها جيش الرب للمقاومة، ويحثه على إطلاق سراح جميع المختطفين، وعلى نزع سلاح محاربيه وتسريحهم.	1
ويتعين عدم منح الإرهابيين وأعوانهم فرصة استغلال الثغرات القانونية في الإفلات من تبعات أفعالهم.	1
دعوة الدول والمنظمات الإقليمية ودون الإقليمية إلى تقديم المساعدة التقنية للشرطة المحلية وموظفي الجهاز القضائي والمؤسسات الإصلاحية (مثل الإرشاد ووضع التشريعات).	1
ولهذا يشكل نزع سلاح الميليشيات إحدى الأولويات، ولا سيما أثناء المرحلة السابقة للحملة الانتخابية بما تنطوي عليه من احتمال وقوع أعمال عنف ذات بواعث سياسية.	1
ولقد أدت هذه الهجمات والاستفزازات بصورة غير مباشرة إلى إعاقة سبل وصول الإغاثة الإنسانية في بعض الأحيان.	0
وما زال يتعين على بعض الدول معالجة الشواغل التي أُبديت فيما يتعلق بمدى مراعاة حقوق الإنسان لدى التعامل مع قضايا الإرهاب (مثلا، فترات الاحتجاز الاستثنائية لدى الشرطة والقيود التي تحد من إمكانيات الحصول على محام).	0
لا تزال الحالة على طول الحدود اللبنانية مع سوريا مقلقة.	1
"ويشعر مجلس اﻷمن بقلق شديد إزاء اﻻعتداءات على العاملين في مجال المساعدة اﻹنسانية، وهي اعتداءات تشكل انتهاكا لقواعد القانون الدولي.	1
وخلال هذه الفترة، أجرى الفريق تحقيقات في مواقع مستهدفة محددة، مثل مخيمات المشردين داخليا، والقرى المدمرة، كما أجرى تحقيقات مع جهات الاتصال بجيش تحرير السودان ومسؤولين حكوميين.	0
وجلب الجنجويد أيضا إلى هذا المعسكر عددا آخر من النساء من القرى المحيطة بالطويلة إثر اختطافهن عقب الهجمات التي تعرضت لها قراهن.	0
وقد أدت عملية الاستعراض إلى تأكيد أن يدرج في القائمة جميع الأفراد الذين، مع أنهم لم يُدرجوا فيها على هذا الأساس حصراً، يُعرفون بصورة رئيسية لدورهم في تقديم مبررات إيديولوجية لدى المجندين حديثاً أو لقاعدة أوسع من الجمهور للعنف المرتبط بتنظيم القاعدة. وهذا على الرغم من أن التدابير الجزائية تحدث في حد ذاتها أثراً ضئيلاً إن لم يكن منعدماً على أداتها الرئيسية ألا وهي: القدرة على الاتصال والإقناع عن طريق شبكة الإنترنت.	1
والخطر الداهم الآن هو أن تصبح أفريقيا معسكراًً لتدريب الإرهابيين وقاعدة لتجنيدهم ونقطة عبور لهم، ومركزاً لحشد الأموال لأنشطة غير مشروعة أخرى.	1
وينبغي أن تكون القوات العسكرية وقوات الشرطة أحسن استعدادا للقيام بمهام الحماية، بما في ذلك منع العنف الجنسي المرتبط بالنزاع.	0
وطلبوا أيضا إلى القوات الجديدة أن تبدأ على وجه السرعة وقبل 15 تشرين الأول/أكتوبر، وبدون شروط مسبقة، عملية التسريح ونزع السلاح وإعادة الإدماج التي وافقت عليها في اجتماع أكرا. وشددوا على ضرورة نزع سلاح كل الجماعات شبه العسكرية وجماعات المليشيات أيضا.	0
إن جمع معلومات موضوعية وموثوق بها ودقيقة في الوقت المناسب بشأن العنف الجنسي المرتبط بالنزاعات أمر حاسم لصياغة استجابات المجلس، فضلا عن تعزيز العمل بغية منع العنف الجنسي.	1
38 - ويشكل انتشار الأسلحة خارج سلطة الدولة، إلى جانب استمرار وجود ميليشيات تمتلك كميات ضخمة من السلاح مصدر قلق كبير لي في ما يتعلق باستقرار لبنان.	1
ويرى وفد توغو أن جميع هذه المسائل تتطلب اتخاذ إجراءات عاجلة لمنع سقوط منطقة الساحل في هوة انعدام الأمن تماما، والذي سيكون أمرا ضارا جدا بتنميتها.	1
إننا جميعا نشعر بالقلق البالغ إزاء تدهور الحالة الأمنية في كوت ديفوار، كما قد يكون المجلس قد شهد في البيان الذي أدليت به في وقت سابق اليوم.	1
ذلك إنه إذا لم تستطع الدول تنفيذ القرارات التي اتخذها المجلس بموجب الفصل السابع من ميثاق الأمم المتحدة دون مخالفة القوانين الخاصة بها، سيفقد المجتمع العالمي القدرة على اتخاذ إجراءات منسقة للتصدي للأخطار التي تهدد السلام والأمن الدوليين.	1
649- على أنه ينبغي لمجلس الأمن أن يتصرف لا ضد الجناة فحسب بل أيضا نيابة عن المجني عليهم.	0
ولا بد أن نذكر مرة أخرى أن العنف الذي انفجر في منطقة غالي هو نتيجة منطقية لتصاعد حالة الانتهاكات الجسيمة لحقوق المواطنين المسالمين من قبل النظام الأبخازي، الذي يشجع على تهريب الأسلحة والمخدرات.	0
ويُعزى هذا الأمر أساسا إلى أن الإرهاب ذو طابع متغير.	1
ولا تزال نيران صواريخ القسام في هذه اللحظة توجه من غزة عمداً ضد السكان المدنيين، مستهدفة المدنيين الأبرياء ومسببة لهم الرعب وهم نائمون في مخادعهم، أو جالسون في غرفهم المعيشية، أو مصطحبون أطفالهم إلى المدرسة.	1
1 - يقرر أن تتخذ جميع الدول التدابير التالية فيما يخص الأفراد والكيانات الذين جرى إدراجهم من قبل تحت اسم حركة الطالبان، وسائر المرتبطين بهم من جماعات ومؤسسات وكيانات وأفراد، على النحو المحدد في الفرع ألف ("الأفراد المرتبطون بحركة الطالبان")، والفرع باء ("الكيانات والجماعات والمؤسسات الأخرى المرتبطة بحركة الطالبان") من القائمة الموحدة للجنة المنشأة عملا بالقرار 1267 (1999) والقرار 1333 (2000)، وذلك اعتبارا من تاريخ اتخاذ هذا القرار، وكذلك سائر الأفراد والجماعات والمؤسسات والكيانات الذين يشتركون مع حركة الطالبان في تشكيل تهديد للسلام والاستقرار والأمن في أفغانستان وفقا لما تقرره اللجنة المنشأة بموجب الفقرة 30 (يشار إليها فيما بعد باسم "القائمة"):	1
وعقب المعركة الثانية للسيطرة على بايدوا، تلقى حبسادي مرة ثانية دعمها لوجستيا من حلفائه في مقديشو.	0
47 - لا تزال الجماعات المدرجة أسماؤها في القائمة والمرتبطة بتنظيم القاعدة وحركة الطالبان تجمع الأموال من خلال وسائل قانونية، من قبيل التبرعات والمؤسسات التجارية المشروعة، وكذلك بصورة غير قانونية عن طريق عمليات الخطف لطلب فدية والابتزاز والاتجار بالمخدرات وفرض الضرائب غير القانونية.	0
وإذ يؤكد الأهمية الحيوية للحوار بين اللجنة المنشأة عملا بالقرار 1267 (1999) ("اللجنة") والدول الأعضاء من أجل تنفيذ التدابير تنفيذا كاملا،	0
ويحث مجلس الأمن، في هذا الصدد، السلطات المسؤولة عن الفترة الانتقالية على اتخاذ إجراءات سريعة لمكافحة الإفلات من العقاب بفعالية وتعزيز العدالة عن طريق كفالة تقديم الجناة إلى العدالة.	0
"ويعرب مجلس الأمن عن عميق القلق إزاء حالة التوتر السائدة في ولايتي النيل الأزرق وجنوب كردفان.	1
68 - وتختلف آراء المسؤولين بشأن فعالية مواد التدريب الإرهابي المتاحة على شبكة الإنترنت إذ أن التوجيهات النظرية مهما كانت كاملة ودقيقة، فإنها تتطلب قدرا من التدريب العملي أو التجربة العملية للمساعدة في التغلب على العقبات التنفيذية().	0
ويشارك الفريق أيضا بنشاط في المنتدى العالمي لمكافحة الإرهاب.	0
وأدان أعضاء مجلس الأمن أيضا الهجمات المتواصلة التي استهدفت قوات الأمن اليمنية في حضرموت في 9 تشرين الأول/أكتوبر، وفي البيضاء في 8 تشرين الأول/أكتوبر، وكان هدفها تقويض الاستقرار في اليمن.	1
وقال رجال الشرطة إنهم يبحثون عن ''إنزا``، وسألوا الشبان عما إذا كانوا قد شاركوا في المسيرة.	0
ولا يمكننا إلا أن نعرب عن القلق على الحالة الأمنية المتدهورة في المناطق التي كانت من قبل هادئة نسبيا.	1
غير أنه من المؤسف أن ثمة أيضا العديد من الأمثلة التي تبيّن ما كانت ستسهم به آليات تقصي الحقائق في كشف الحقيقة وضمان المساءلة ومنع حدوث مزيد من الانتهاكات لحقوق الإنسان، لكن المجلس لم يتخذ عندئذ إجراءات فعالة لاعتبارات سياسية.	1
ويعكف الفريق بالفعل على إقامة الاتصال بالمكاتب الإقليمية التابعة لمكتب شؤون نزع السلاح لتحسين تبادل المعلومات (ولا سيما ما يتعلق منها بإدارة مخزونات الذخائر، التي ثبت أنها مشكلة في حالة ليبيا).	0
إننا ندين جميع الأعمال الإرهابية التي ترتكب في أفغانستان، ولا سيما أحدثها الذي ارتكب ضد السفارة الهندية في كابل، ونعرب عن تعازينا لحكومات وشعوب البلدان المتأثرة ولأسر وأقارب الضحايا.	1
