ar	VerConf
وذلك ما يجعل خطاب التهديد غير المسؤول من جانب القيادة الإيرانية مثيرا لقدر أكبر من الانزعاج.	1
"يعيد مجلس الأمن تأكيد التزامه بتنفيذ قراراته بشأن حماية المدنيين في النـزاعات المسلحة تنفيذا تاما وفعالا، ويشير إلى البيانات السابقة التي أدلى بها رئيسه بشأن هذه المسألة.	0
9 - يطلب إلى الأمين العام أن يعهد إلى فريق الرصد المنشأ عملا بالفقرة 4 (أ) من القرار 1363 (2001)، الذي تنتهي فترة ولايته في 19 كانون الثاني/يناير 2002، برصد تنفيذ التدابير المشار إليها في الفقرة 2 من هذا القرار، لفترة 12 شهرا؛	0
19 - وعلاوة على ذلك، كان يمكن للجنة أن تستفيد في أداء مهمتها المتعلقة بتقصي الحقائق وواجبها في تحديد هوية المرتكبين، من المساعدة التي كان يمكن أن يقدمها لها عدد أكبر من المحققين ورجال القانون والمحللين العسكريين وخبراء الطب الشرعي.	0
إن احتجاز هذا المستوى من التمويل سيصيب أي حكومة بالشلل، ناهيك عن سلطة تحت الاحتلال، وإذا لم يتم الإفراج على الفور عن هذه الأموال، فإن هذا الإجراء سيهدد مكاسب بناء الدولة التي حققتها السلطة الفلسطينية، بما في ذلك تعزيز الحكم الرشيد الذي يعود بالنفع على الشعب الفلسطيني وتطوير قوات الأمن التي تحافظ على القانون والنظام في الضفة الغربية.	1
كما أوضحت مدى اختلاف النظر إلى الخطر، حتى من قبل الدول المجاورة.	1
159 - وأثناء النزاع المسلح الذي وقع في كوت ديفوار في الفترة 2002-2003، قُدر عدد الليبريين الذين كانوا يقاتلون إلى جانب حكومة كوت ديفوار بين 500 1 و 500 2، بينما كان يُعتقد أن قرابة ألف مقاتل كانوا يخوضون الحرب إلى جانب المتمردين الإيفواريين (انظر الوثيقة S/2004/972).	0
20 - ثبت للفريق في أثناء فترة الولاية الحالية أن تدفقات الأسلحة من اليمن إلى الصومال لا تأتي فقط من الجماعات الإجرامية (إلى سوق بكارا للأسلحة كي تشتريها المعارضة)، وإنما أيضا من حكومة اليمن إلى الحكومة الاتحادية الانتقالية مباشرة.	0
59 - توجد لدى جميع الدول سياسات لمكافحة الإرهاب، وتوضح معظم هذه السياسات إدراك هذه الدول لوجود تنظيم القاعدة وحركة طالبان، بالرغم من إمكانية ألا يكون اهتمام دول كثيرة منها منصبا بشكل رئيسي على القائمة الموحدة.	0
"1 - أنه دعم مقدم إلى الحكومة الشرعية المنتخبة. والمدعومة دوليا وبطلب منها. "2 - تهدف تلك المساعدات إلى تقوية قدرات الشرطة والأمن حتى يتمكن الرئيس من الانتقال إلى العاصمة مقديشو لمزاولة أعماله الرسمية، وهذا لا يمكن إلا إذا تم نزع أسلحة العصابات المسلحة بها لصالح الحكومة الشرعية. "3 - إن نزع أسلحة تلك العصابات المسلحة ومسك زمام الأمور بيد السلطة الشرعية يعتبر واحد من أهم التحركات لمحاربة البؤر الإرهابية المسلحة الكامنة في الصومال، وبالتالي فهذا الأمر يتفق مع سياسة كل دول العالم في مكافحة الإرهاب لقطع الطريق أمام احتمالات نشوء 'طالبان` أخرى في الصومال.	0
وستواصل تركيا ممارسة حقوقها المكفولة بموجب القانون الدولي، في إطار من الامتثال التام للقواعد والأنظمة المرعية، كي تحمي مواطنيها وحدودها الوطنية.	0
13 - وفيما يتعلق بتوصية فريق الرصد بشأن دفع فدية للكيانات المدرجة في القائمة (الفقرة 60)، تود اللجنة أن تشير إلى الفقرة 5 من القرار 1904 (2009)، التي يؤكد فيها المجلس أن المقتضيات الواردة في الفقرة 1 (أ) من القرار نفسه تنطبق أيضا على دفع فديات للأفراد أو الجماعات أو المؤسسات أو الكيانات المدرجة أسماؤهم في القائمة الموحدة.	0
وإذ يؤكد أهمية اتفاق أروشا للسلم بالنسبة لحل الصراع في رواندا بالوسائل السلمية وضرورة التزام جميع اﻷطراف من جديد بتنفيذه تنفيذا كامﻻ،	0
ويجري الآن إعداد الميزانية التي اقترحتها لتلك البعثة لفترة الاثني عشر شهرا الكاملة الممتدة من 1 تموز/يوليه 2005 إلى 30 حزيران/يونيه 2006 ، بما في ذلك احتياجات دعم الانتخابات وأفراد الشرطة المدنية الإضافيين الذين أذن بهم المجلس بموجب قراره 1621 (2005)، وسوف تقدم تلك الميزانية إلى الجمعية العامة قريبا لتستعرضها وتتخذ إجراء بشأنها.	0
في الجلسة 5903 التي عقدها مجلس الأمن في 2 حزيران/يونيه 2008، في سياق نظره في البند المعنون "الأخطار التي تهدد السلام والأمن الدوليين من جراء الأعمال الإرهابية"، أدلى رئيس مجلس الأمن بالبيان التالي باسم المجلس:	0
وفي ذلك الصدد، نشعر بعميق القلق بشأن الحالة الأمنية في أفغانستان، التي تدهورت منذ العام الماضي نتيجة للأنشطة القمعية للعناصر المتبقية من الطالبان والقاعدة ومنازعات فيما بين أمراء الحرب وتجارة المخدرات.	1
وستقدم الحكومة خدمة جليلة لنظامها القضائي إذا اتخذت خطوات لإلغاء المرسوم الذي أنشئت بموجبه المحاكم.	1
علما بأن التقارير المتعلقة بالاعتداءات التي تعرضت لها النساء، قد شملت الاغتصاب، وإن لم تقتصر عليه.	0
ويعرب المجلس عن قلقه إزاء الدعم الخارجي الذي تتلقاه الجماعات المسلحة التشادية، حسب ما أفاد به الأمين العام.	1
يدين بشدة استمرار أشكال التمييز والعنف ضد النساء والفتيات، ولا سيما العنف الرامي إلى منع الفتيات من الالتحاق بالمدارس...	1
فالمحاولات الرامية إلى زعزعة الوضع الداخلي في لبنان عن طريق الاغتيالات السياسية غير مقبولة مطلقا.	1
"ويعترف مجلس الأمن بالدعم الذي تقدمه الأطراف الفاعلة الثنائية والمتعددة الأطراف، بما فيها الاتحاد الأفريقي، والاتحاد الأوروبي، ومنظمة التعاون الإسلامي، وجامعة الدول العربية، والمنظمات دون الإقليمية مثل الجماعة الاقتصادية لدول غرب أفريقيا، وتجمع الساحل والصحراء، والهيئة الحكومية الدولية المعنية بالتنمية، واتحاد المغرب العربي، في إطار الجهود الرامية إلى مكافحة الإرهاب في أفريقيا، ويدعو المجتمع الدولي ومنظومة الأمم المتحدة إلى تعزيز تعاونهما مع الهيئات دون الإقليمية المعنية بمكافحة الإرهاب، من قبيل المركز الأفريقي للدراسات والبحوث حول الإرهاب.	0
وأعقب ذلك شجار أدى إلى استدعاء الشرطة إلى مكان الحادث وإلى إطلاق الغاز المسيل للدموع.	0
ويساورني القلق بشكل خاص حيال عدم الاستقرار الذي يمكن أن ينشأ في حال استمر تدهور الحالتين السياسية والاجتماعية - الاقتصادية.	1
وقد يجدر التذكير بأن حكومة إريتريا كانت قد حثت مجلس الأمن، في رسالتها المؤرخة 28 شباط/فبراير 2012 (S/2012/126)، على تحمل مسؤولياته واتخاذ التدابير المناسبة ضد هذه الأعمال التي لا تعد ولا تحصى من أعمال العدوان والاحتلال غير المشروعة.	1
وفي أيار/مايو 2000، قاد الترابي إنشقاقا من "المؤتمر الوطني" نتج عنه إنشاء حزب جديد سمي "المؤتمر الشعبي".	0
ونشعر بقلق خاص إزاء الافتقار إلى تدريب موظفي الخدمة المدنية على المستوى المتوسط، بالإضافة إلى المشاكل الكبيرة التي ما زالت تحيط بالمجال القضائي.	1
وفي كل حالة، يتعرض حقان أساسيان، حق الملكية وحق التنقل، للتقييد، لأسباب يرجح جدا أن يكون منشؤها الاستمرار دون وجه حق في تنفيذ تدابير جزائية صادرة عن مجلس الأمن.	0
وبالإضافة إلى ذلك، استحدثت أربع دول تشريعات تجرم توفير الملاذ الآمن للإرهابيين ومَن يدعمونهم، أفرادا كانوا أو منظمات.	0
642- على أن ما خلصت إليه اللجنة من أن السلطات الحكومية لم تنتهج أو تنفذ في دارفور، مباشرة أو عن طريق الميليشيات الخاضعة لسيطرتها، سياسة تستهدف الإبادة الجماعية لا ينبغي بأي حال من الأحوال أن يعتبر تقليلا من خطورة الجرائم التي ارتكبت في تلك المنطقة.	1
وستتضمن تلك الاجتماعات إفادات دورية من الأفرقة العاملة المسؤولة عن تتبّع التقدم المحرز فيما يتعلق بالرصد وبالتنفيذ على الصعيد الوطني؛ والمساعدة؛ والتعاون مع المنظمات الدولية، بما في ذلك لجنة مجلس الأمن المنشأة عملا بالقرار 1267 (1999) ولجنة مجلس الأمن المنشأة عملا بالقرار 1373 (2001)؛ والشفافية والتوعية الإعلامية.	0
والأسوأ من ذلك أن أنشطة هذه الجماعات الإرهابية تشكل تهديداً خطيراً للجهود التي تبذلها بعثات المجتمع الدولي لبناء السلام وحفظ السلام، كما هو الشأن في الصومال ومالي، على سبيل المثال.	1
والمجلس بتفكيره في اتخاذ مبادرات تكافئ تلك الاستراتيجية عمليا، لن يفعل سوى إكساب الإرهابيين جرأة وتقويض خريطة الطريق نصا وروحا.	1
أولا، بينما تشكل سيراليون العضو الأكثر تقدما في مبادرة ساحل غرب أفريقيا، تعيق وتيرة التقدم البطيء في أماكن أخرى تبادل المعلومات الاستخباراتية والإنذار المبكر.	1
وإذ يقرر أن الحالة في جمهورية الكونغو الديمقراطية لا تزال تشكل تهديدا للسلام والأمن الدوليين في المنطقة،	1
ويمكن بالتالي، بحسب ملابسات كل حالة على حدة، وفي إطار مبدأ العمل الإجرامي المشترك، الاشتباه في أنهم ارتكبوا جرائم ضد الإنسانية بقتل مدنيين وبأعمال الاغتصاب والتعذيب والتشريد القسري للمدنيين؛ وجريمة حرب بشن هجمات عشوائية على المدنيين؛ وبتدمير أهداف مدنية وبأعمال النهب.	0
وقُتل كثيرون وأصيب أكثر من 100 شخص بجراح.	0
وسيعتمد مصير هؤلاء المقاتلين على تجاربهم في الجمهورية العربية السورية، غير أن النزاعات التي شارك فيها متطوعون أجانب من العناصر المنتسبة إلى القاعدة في الماضي أثبتت أن لها أثارا طويلة الأجل فيما يتعلق بحالة التهديدات على الصعيدين المحلي والدولي().	1
٣ - فرض مجلس الأمن، بموجب قراره 1267 (1999)، حظرا جويا وحصارا ماليا محدودين لإرغام حركة الطالبان على الكف عن توفير الملاذ للإرهابيين وتدريبهم، بمن فيهم أسامة بن لادن.	0
ونعتقد أن مسألة دعم مشروعية الحكومة هامة وذلك لوجود علاقة سببية ومن المشروعية وإزالة المقاومة التي يقوم بها جهات فاعلة غير رسمية وشبكات غير رسمية تتسم بها طبيعة القوة في أفغانستان.	1
ونحن إذ ندين بشدة هذه الممارسات لما تمثله من خرق صارخ للمواثيق الدولية والقوانين والأعراف الإنسانية، فإننا ندعو المجموعة الدولية وأعضاء اللجنة الرباعية وكل الأطراف الفاعلة للتدخل الفوري والحازم لحمل إسرائيل على وضع حد لمثل هذه الأعمال التي تشكل تهديدا خطيرا للأمن والاستقرار في منطقة الشرق الأوسط، ذلك أن العنف لا يخلّف إلا العنف مما قد يزج بالمنطقة في دوامة بصعب الخروج منها.	1
إذ يؤكد ضرورة تقديم جميع المدعى ارتكابهم جرائم ضد الأطفال في حالات النـزاع المسلح إلى العدالة عن طريق نظم العدالة الوطنية وآليات العدالة الدولية والمحاكم الجنائية المختلطة في الحالات التي ينطبق فيها ذلك بهدف وضع حد للإفلات من العقاب،	0
''ويكرر مجلس الأمن تأكيد قلقه البالغ من تنظيم الدولة الإسلامية في العراق والشام وجبهة النصرة وغيرهما من الكيانات الإرهابية المرتبطة بتنظيم القاعدة ومما لوجودها وأيديولوجيتها المتطرفة العنيفة وأفعالها من تأثير على استقرار العراق وسوريا والمنطقة، بما في ذلك الآثار الإنسانية المدمرة على السكان المدنيين التي أدت إلى نزوح ملايين الأشخاص، ومما ترتكبه من أعمال عنف تؤجج التوترات الطائفية.	1
''ويعرب مجلس الأمن عن قلقه المتزايد إزاء الأخطار الجسيمة التي يشكلها الاتجار بالمخدرات وما يتصل بذلك من أنشطة الجريمة المنظمة عبر الوطنية فيما يتعلق بتحقيق السلام والاستقرار على الصعيد الدولي في غرب أفريقيا ومنطقة الساحل على نحو ما أشيرَ إليه في استراتيجية الأمم المتحدة المتكاملة لمنطقة الساحل.	1
''ويؤكد مجلس الأمن أن أي محاولة لزعزعة استقرار تشاد بالقوة أمر غير مقبول.	1
وفي 29 تشرين الثاني/نوفمبر 2014، أطلقت طائرات النظام الحربية قذيفتين على مسجد الإمام النووي بالرقة فقتلت 11 شخصا، منهم طفل، وجرحت 16 آخرين.	0
وأشارت إلى أن 69 من العاملين في المجال الإنساني قد قتلوا منذ بداية النزاع، واستخدم العنف الجنسي كشكل من أشكال التعذيب، وبقصد الإيذاء والإهانة والتخويف، وكشكل من أشكال العقاب.	0
118 - والإرهاب هو أحد العوامل الدافعة في عدد متزايد من حالات النزاع، وبخاصة في منطقتي الساحل والمغرب العربي.	1
والفريق على دراية بوجود 15 قضية قُدمت في خمس دول أعضاء، وكذلك أمام محكمة العدل الأوروبية، تطعن في تنفيذ الدول الأعضاء لبعض الجوانب المتعلقة بالجزاءات.	0
ويؤكد المجلس من جديد أن وضع برنامج شامل لبناء السلام مع التركيز بوجه خاص على نزع السلاح وتسريح المقاتلين وتأهيلهم وإدماجهم أمر ستكون له أهميته في مرحلة ما بعد انتهاء الصراع في الصومال، كما نص على ذلك بيان رئيسه المؤرخ 28 آذار/مارس 2002 (S/PRST/2002/8).	0
ويتبلور إدراك حقيقي للتحديات التي يواجهها كل بلد بمفرده.	1
والحالة على أرض الواقع مثيرة للقلق أيضا من الناحية الإنسانية ويؤكد الأمين العام أن العراق يمر بأزمة كبيرة، وصرح بأن الحالة آخذة في التدهور.	1
وإذ يؤكد تأييده للمعاهدات المتعددة الأطراف التي ترمي إلى استئصال أو منع انتشار الأسلحة النووية أو الكيميائية أو البيولوجية، وأهمية قيام جميع الدول الأطراف في هذه المعاهدات بتنفيذها على نحو كامل من أجل تعزيز الاستقرار الدولي،	0
(ح) وضع منهجيات لتحسين فعالية التعاون مع فرادى الدول والمنظمات دون الإقليمية والمنظمات الإقليمية والمنظمات الدولية والترتيبات المتعددة الأطراف التي تتعامل مع ضوابط التصدير والكيانات ذات الصلة داخل منظومة الأمم المتحدة، وتقييم مستوى التعاون بين اللجان المنشأة عملا بقرارات مجلس الأمن 1540 (2004) و 1267 (1999) و 1373 (2001)، والعمل بوجه خاص على تقييم مستوى تبادل المعلومات والتنسيق فيما يتعلق بالزيارات القطرية، وطرح توصيات محددة، حسب الاقتضاء، من أجل تعزيز التعاون.	0
ولا يمكن معالجة ظاهرة المقاتلين الإرهابيين الأجانب عن طريق الوسائل الأمنية وحدها.	0
وبينما تصب الغارات الجوية للنظام وابلا من النيران على المناطق المدنية، فرضت القوات المسلحة السورية الحصار على مدن بأكملها.	0
وقال الممثل الخاص إن المكاسب التي تحققت مؤخرا على صعيد استرجاع الأراضي من تنظيم داعش تبين أن هذه الاستراتيجية، التي تحظى بدعم عسكري دولي، ما فتئت تحرز التقدم.	0
إن جمهورية كوريا الشعبية الديمقراطية ترفض رفضا قاطعا القرار المتعلق بحقوق الإنسان المختلق ضد الجمهورية استنادا إلى مكائد وأكاذيب ومعلومات مضللة والمتخذ رضوخا لقسر الولايات المتحدة وغيرها من البلدان المعادية بطريقة استبدادية وتعسفية.	1
وتشكل هذه التحديات مجتمعة ضغوطا سياسية على الحكومات وتؤثر تأثيرا مباشرا وخطيرا على السلام والأمن والاستقرار في البلدان المعنية.	1
وفي مشاورات مغلقة، قدم المبعوث الخاص إحاطة إلى المجلس بشأن أولوياته، ومشاوراته التمهيدية، وأفكاره في ما يتعلق بسبل المضي قدما. وقال إن بيان جنيف المؤرخ 30 حزيران/يونيه 2014، لا يزال صالحا، وأنه أرسى المعايير العامة للتوصل إلى حل مستقبلي عن طريق التفاوض.	0
وهذه الإجراءات يتم اتخاذها على الرغم من الموقف السلبي الواضح الذي اتخذه الممثل الخاص للأمين العام وتعتبر تحديا للأمم المتحدة ومجلس الأمن.	1
وبموجب الفقرة 8 من القرار نفسه، كلف المجلس اللجنة بتحديد الكيانات والأفراد الذين: (أ) شاركوا في دعم أعمال تهدد السلام أو الأمن أو الاستقرار في الصومال أو وفروا هذا الدعم؛ (ب) انتهكوا الحظر العام الكامل على توريد الأسلحة؛ (ج) عرقلوا إيصال المساعدات الإنسانية إلى الصومال أو الحصول عليها.	0
(ب) معالجة أوجه القصور في تجريم تمويل الإرهاب وضمه إلى غسل الأموال باعتباره جريمة أصلية، ومعالجة القصور في تجميد الأصول التي تخص الإرهابيين وذلك بطرق من بينها بوجه خاص، إرساء ضمانات كافية والنص في إجراءات التجميد على إعفاءات لدواعي إنسانية؛	0
فقد تعرض العاملون في المعونة الإنسانية للمضايقات والاعتداء في كثير من الأحيان أثناء حوادث قطع الطرق.	0
وعلى الرغم من كل ما ذكر أعلاه، ما زلنا نؤمن بأن لا جدوى من الحل العسكري - فعلى عكس ذلك، نحن واثقون أن من شأنه أن يقود إلى نتائج عكسية.	1
كما يدعو مجلس الأمن اللجان الثلاث إلى مواصلة تعاونها مع الفريق العامل المنشأ عملا بالقرار 1566 (2004).	0
ولكن ساد القلق أيضا لأنه لم تلح بارقة أمل في الشرق الأوسط إلا وووجهت بتصاعد العنف والدمار.	1
123 - عندما تشارك المليشيات القوات المسلحة في الهجوم، يمكن القول إنها تعمل تحت السيطرة الفعلية للحكومة، بما يتفق تماما مع مفهوم السيطرة (الذي نص عليه عام 1999 في قضية طاديتش (استئناف)، الفقرات 98-145.	0
وعلى عكس الشائعات الدائرة، فلا يوجد دليل على أن ضباط الشرطة، بمن فيهم الذين أمدتهم قوات الدفاع بالسلاح والملابس الرسمية شاركوا في إطلاق النيران.	0
ويبدو واضحا أن الإرهابيين المدرجين في القائمة ما زالوا قادرين على جمع واستلام الأموال من المتعاطفين معهم من خارج دائرتهم المباشرة.	0
وفي الواقع أن تلك التوجيهات، نظرا إلى تاريخ التدخل الأجنبي، لن تكون محل شك في نظر مختلف قطاعات المجتمع فحسب ولكن يمكن أيضا أن تؤدي إلى تفاقم المشكلة.	1
وأضرب عدد من المحتجزين لدى السلطات المغربية عن الطعام إبان الفترة الممتدة من مستهل آب/أغسطس حتى 29 أيلول/سبتمبر.	0
وتنص الفقرة 2 من المادة 21 من مرفق قرار مجلس الأمن 1757 (2007) على أنه إذا لم تكتمل أنشطة المحكمة الخاصة قبل نهاية ولايتها الحالية، "يُمدد الاتفاق [...] وذلك لمدة (أو مدد) إضافية يحددها الأمين العام بالتشاور مع الحكومة [اللبنانية] ومجلس الأمن".	0
وخلال هذه الفترة، عُزِّزت قاعدة الدعم الخاصة باللجنة وجرى تركيب برامجيات جديدة، الأمر الذي أكسب قاعدة البيانات فعالية مزيدة.	0
وسيتعين على هذه المنظمات الإقليمية - وبخاصة الاتحاد الأوروبي - أن تؤدي في المستقبل أبرز الأدوار في كوسوفو.	0
