ar	VerConf
وعلقت الإنتربول بأنه كلما زادت المعلومات الواردة في الإخطارات الخاصة، ولا سيما بصمات الأصابع والصور وأرقام جوازات السفر في الصيغ المقيدة التوزيع والمتاحة فقط لوكالات إنفاذ القانون في بلدانها الأعضاء، ستزيد فائدتها وسيكون من غير المرجح أن تقع حوادث مثل المشار إليها أعلاه. كما عرضت الإنتربول تقديم التوجيه لأعضائها بشأن نطاق نظام الجزاءات. واقترحت، بالإضافة إلى ذلك، استحداث نقطة استعلام دائمة في الأمم المتحدة للإجابة على الأسئلة وكفالة توفير المعلومات الإضافية ذات صلة في الوقت المناسب عن الأفراد المدرجة أسماؤهم في القائمة عندما تتيحها الدول الأعضاء.	0
وينظر الفريق أيضاً في القلق الدولي المتزايد فيما يتعلق باستعمال الإرهابيين للإنترنت، ويقدم وجهات نظر بشأن هذه المسألة وجميع أنشطة الرصد التي يضطلع بها.	1
228 - وقبل المضي في عرض نتائج تقصي الحقائق الذي قامت به اللجنة، فضلا عن التقييم القانوني لهاتين الحقيقتين، يجدر تقديم بعض الحقائق عن كل من التشريد والدمار، بهدف إعطاء صورة واضحة عن حجم الحالة ونطاقها.	0
ووصل وزير الداخلية لوباتو إلى مقر الشرطة مرتديا سترة ضد الرصاص وهو في حالة من التهيج الشديد صائحا "اقتلوهم جميعا".	1
وقد تتسلل صادرات كوت ديفوار من الماس إلى سلسلة الواردات الخاصة بعملية كيمبرلي، مما يشكل تهديدا لنظام عملية كيمبرلي لإصدار شهادات المنشأ.	1
وعلى المرء، لدى النظر في تطور خطر التحريض، ألا يغيب عن باله أن أشكال ووسائل الاتصال قد تطورت بصورة جوهرية منذ اعتماد القرار 1624 (2005).	1
10 - يكرر تأكيد أهمية قيام جميع الدول بتحديد الإجراءات الملائمة، أو استحداثها عند الاقتضاء، لتنفيذ كل جوانب التدابير المنصوص عليها في الفقرة 1 أعلاه تنفيذا كاملا؛ ويـحـث بقـوة جميع الدول الأعضاء على تنفيذ المعايير الدولية الشاملة المجسدة في التوصيات الأربعين المنقحة الصادرة عن فرقة العمل المعنية بالإجراءات المالية والمتعلقة بمكافحة غسل الأموال وتمويل الإرهاب والانتشار، ولا سيما التوصية 6 المتعلقة بالجزاءات المالية المحددة الأهداف والمتعلقة بالإرهاب وتمويل الإرهابيين؛	1
ولا يمكن للدول أن تضرب بهذا الالتزام الأساسي عرض الحائط بدون أية تبعات لتصرفهما غير القانوني.	1
دعوة أطراف النـزاع المسلح إلى الامتثال لأحكام القانون الدولي المنطبقة واحترام الوضع المدني للصحفيين والإعلاميين والأفراد المرتبطين بهم وكذلك معداتهم ومنشآتهم.	0
وتجدر الإشارة أيضا إلى أن هذا القرار الروسي يتزامن مع قيام الانفصاليين بأعمال استفزازية وبحشد تعزيزات عسكرية مكثفة.	0
إدانة أعمال العنف الجنسي التي ترتكب في سياق النـزاع المسلح والمرتبطة به والدعوة إلى وقفها فوراً.	1
9 - يُلاحظ دعم الأطراف لاتفاق السلام بغرض الإبقاء على قوة تثبيت الاستقرار المتعددة الجنسيات المشار إليها في إعلان الاجتماع الوزاري لمؤتمر تنفيذ السلام المعقود في مدريد في 16 كانون الأول/ديسمبر 1998 (S/1999/139، المرفق)؛	0
وعموما، فإن سياسة التهجم على أفراد بعض القبائل وقتلهم وتشريدهم قسريا لا تدل على وجود نية محددة للإبادة الكلية أو الجزئية لجماعة تميزها مقومات عرقية أو إثنية أو قومية أو دينية معينة.	1
(ب) تشجيع الدول في المنطقة دون الإقليمية على الاستفادة من إنفاذ القانون، وفرص التدريب الأخرى من أجل تعزيز تنفيذ قوانين مكافحة الإرهاب؛	0
- لا يزال الاتحاد الروسي يحتفظ، بصورة غير مشروعة، بقاعدته العسكرية في غودوتا، التي تعمل بدون موافقة من جورجيا، وخلافا للالتزامات الدولية التي تعهدت بها روسيا؛	0
ويحول الافتقار إلى الأرض والوظائف، فضلاً عن حالة انعدام الأمن دون استقرار الكثير من العائدين في مجتمعاتهم المحلية الأصلية.	1
95 - وقد تطلب إنشاء النشرات الخاصة المشتركة بين الإنتربول ومجلس الأمن التابع للأمم المتحدة تعاونا وثيقا غير عادي بين المنظمتين طوال العام المنصرم، وكذلك الاتفاق بين الجمعية العامة والإنتربول واللجنة المنشأة بالقرار 1267 (1999).	0
"ويؤكد مجلس الأمن على الحاجة الملحّة إلى تسريح كل الجماعات المسلحة غير القانونية ونزع سلاحها.	0
ولقد أحرزت الدول تقدما لا بأس به في إنشاء نظم لمكافحة غسل الأموال/مكافحة تمويل الإرهاب، ولكن يلزم مزيد من التعاون الإقليمي على الصعيد العملي.	0
إنها جزء من ترنيمة يجري ترديدها باستمرار أمام هذا المجلس ولا يزيد التكرار من صحتها، تتجاهل المسؤوليات الفلسطينية والحقوق الإسرائيلية على حد سواء، ولا تعترف بالصعوبات المفرطة التي تواجهها القوات الإسرائيلية في محاولتها حماية مواطنيها وتقليل الأذى الواقع على أرواح الفلسطينيين إلى أقصى حد بينما لا يبدي الإرهابيون الذين تواجههم من الاكتراث بأرواح الفلسطينيين أكثر من اكتراثهم بأرواح الإسرائيليين.	1
وضع مبادئ توجيهية عملية لإدراج المنظور الجنساني في عملية التعمير المستدامة في البيئة التي تعقب الأزمات، ومبادئ توجيهية شاملة تكون مرجعا ميدانيا؛ والنظر في مسألة نوع الجنس وإدارة الأراضي والممتلكات في حالات ما بعد الصراع، ووضع مجموعة مواد تكون أرضية للنظر في المسائل الجنسانية فيما يتصل ببرامج الحكم في بيئة ما بعد الصراع.	0
وإذ يعيد تأكيد أن الإرهاب بجميع أشكاله ومظاهره يشكل أحد أخطر التهديدات التي تحدق بالسلام والأمن الدوليين وأن أي أعمال إرهابية هي أعمال إجرامية وغير مبررة، مهما كانت بواعثها وأوقات ارتكابها، وأيا كان مرتكبوها،	1
وفي حين أن إصلاح قوات الأمن من الصلاحيات السيادية للدولة، فإنني أشجع الحكومة على معالجة المسألة الأصيلة، مسألة تماسك الجيش الوطني، وذلك بطرق منها بناء قوات مسلحة مهنية ومجهّزة بالقدر الكافي من المعدات والإمدادات.	0
٨ - ويساورنا أيضا قلقٌ بالغ إزاء تفاقم آفة الإرهاب والتطرف العنيف في منطقة الساحل والصحراء، وإزاء الروابط الوثيقة القائمة بين المجموعات الإرهابية المسلحة والجريمة المنظمة عبر الوطنية، ولا سيما شبكات الإتجار بالمخدرات والبشر وغسل الأموال والإتجار غير المشروع بالأسلحة.	1
وفي بعض الحالات، منع المشردون داخليا من الوصول إلى ماشيتهم ومحاصيلهم الواقعة في مكان قريب، بسبب خطر هجمات الجنجويد خارج المخيمات.	1
:: 14 شباط/فبراير 2005، مقتل رفيق الحريري و 22 آخرين في انفجار ضخم قبالة الواجهة البحرية في وسط بيروت.	0
ويجب أن تتوقف الأعمال التي قد تقلل من الثقة بنتائج المفاوضات أو تضر بها، كما يجب عكسها.	1
وبينما لا تزال القرصنة قبالة ساحل الصومال تشكل تحديا حاسما، فإننا ندعو المجتمع الدولي إلى عدم إغفال أن حل تلك المشكلة يجب أن يتحقق في البر وليس في البحر. ويتعين على الحل الشامل للنزاع الصومالي أن يعالج جميع الأسباب الجذرية للقرصنة، والتحديات الأخرى، بما في ذلك استغلال الموارد البحرية وإلقاء النفايات السمية.	1
وينبغي للدول الأعضاء كذلك أن تتّخذ خطوات لكشف تحرّكات الأسلحة الصغيرة والأسلحة الخفيفة غير المشروعة وتتبُّع خطوط سيرها في الوقت المناسب وبشكل يعوّل عليه.	0
232 - والعـــدد التقـــديري للسكان المتــأثرين بالصراع في دارفور، مضافا إليه عدد اللاجـئين في تشاد (1.65 مليون مشرد و 000 627 شخص متأثر بالصراع بطرق أخرى، و 051 203 لاجئا) يصل إلى رقم مذهل إذ يبلغ حوالي 2.5 مليون شخص متأثر بطريقة أو أخرى - أغلبيتهم العظمى بالتشريد من ديارهم.	0
وفي الساعات الأولى من صباح 11 تموز/يوليه، اقتحم مسلحون مجهولو الهوية منزل السيد عبد القادر يحيى، وهو من النشطاء القديمي العهد وعضو أقدم في مركز البحث والحوار واغتالوه.	0
وتحققت اللجنة من وجود موقعين لمقابر في القرية - واحد قيل إنه يضم جثمانين لرجلين والآخر قيل إنه يضم جثث سبعة رجال، وكلهم ماتوا أثناء الهجوم.	0
وما زالت تيمور - ليشتي تواجه تحديات هامة في الحد من الفقر وإيجاد فرص العمل، لا سيما لسكانها الشباب.	1
وفي هذا الخصوص، يدين المجلس، بأقوى العبارات، استمرار التهديدات وأعمال التخويف ضد عناصر البعثة.	1
ونحن من جانبنا نربط مباشرة بين مسألة المشروعية وإجراء انتخابات تدور الاستعدادات لها في إطار الهيئة المشتركة لإدارة الانتخابات.	1
(أ) يجري رئيس الفرع في مكتب شؤون نزع السلاح استعراضا فنيا للمشروع للبت في مدى اتساقه؛	0
وتطالب التحديات التي تواجهها البلد قادة هايتي بأن تكون لهم إرادة مشتركة موحدة.	1
بيد أن فريق الخبراء أعد تقريرا قويا وذا مصداقية، وبذلك تعترف هيئة دولية لأول مرة بمدى انتهاكات حقوق الإنسان التي ارتُكبت في الأيام الأخيرة من النزاع الوحشي في سري لانكا، حيث لقي ما لا يقل عن 000 10 مدني مصرعه.	0
12 - وفي غضون ذلك، أحرز مزيد من التقدم صوب إنشاء خلية مشتركة للمعلومات الاستخباراتية في إطار الآلية الثلاثية. وفي يومي 16 و 17 آب/أغسطس، زار وفد من الولايات المتحدة كيسانغاني، مصحوبا بضباط عسكريين من رواندا وأوغندا والكونغو، لتقييم التقدم المحرز في إنشاء الخلية.	0
إذ كان معظم الشهود المحتملين المقيمين خارج الدولة يخافون من الإدلاء بأقوالهم ولو في إطار السرية بسبب خشيتهم على سلامة أفراد أسرهم وتصورهم بأن السلطات لا تزال تراقب تصرفاتهم في الخفاء.	1
وندين الاستخدام المفرط للقوة الذي يقوم به الجيش الإسرائيلي في المناطق المكتظة بالسكان مما يُنـزل معاناة وخسائر واسعة النطاق في أعداد غفيرة من المدنيين الفلسطينيين، بمن فيهم الأطفال.	1
إذ يرحب بزيادة تمثيل النساء في البرلمان، وإذ يثني على السلطات [الوطنية]، وإذ يؤكد على ضرورة زيادة دورهن في صنع القرارات المتعلقة بمنع النزاع وحله؛	0
وبعد نصف ساعة، وصلت ثلاث سيارات جيب أخرى من تشاد تساندها مروحية عسكرية وحدثت مواجهة مرة ثانية مع الوحدة العسكرية السودانية مما أدى إلى إصابة جندي وبعض المدنيين.	0
وهدف القاعدة في العراق هو بناء القدرات لشن هجمات كلما تيسرت الأهداف، سواء بواسطة أعضائها أو بالتعاون مع جماعات قائمة تعمل معها أو، أفضل من ذلك، تنساق لأوامرها().	0
ولمحت بعض التقارير، فيما أكد عدد قليل منها، أن أركان جريمة الإبادة الجماعية قائمة في أنماط وطبيعة الانتهاكات التي ارتكبتها الحكومة والمليشيات التابعة لها.	0
"ويشير مجلس الأمن إلى القرارات 1267 (1999)، و 1989 (2011)، و 1373 (2001)، و 1540 (2004)، و 1624 (2005)، وأيضا إلى سائر الصكوك الدولية ذات الصلة بمكافحة الإرهاب، ويشدد على ضرورة تنفيذها بالكامل، ويجدد دعوته إلى الدول أن تنظر في أن تصبح أطرافا في أقرب وقت ممكن في جميع الاتفاقيات والبروتوكولات الدولية ذات الصلة، وأن تفي على نحو تام بالالتزامات المنوطة بها بموجب الصكوك التي هي أطراف فيها، ويلاحظ توصية اللجنة المخصصة المنشأة عملا بقرار الجمعية العامة 51/210، منوها إلى الحاجة إلى إفراد مزيد من الوقت لإحراز تقدم ملموس بشأن القضايا العالقة، ويقرر أن يوصي اللجنة السادسة أن تنشئ، في الدورة التاسعة والستين للجمعية العامة، فريقا عاملا يتولى إتمام العملية المتعلقة بمشروع اتفاقية شاملة بشأن الإرهاب الدولي.	0
103 - لدى ست دول هياكل مؤسسية مناسبة وتعاون بين الوكالات للتعامل مع مسائل مكافحة الإرهاب، ولدى تسع دول أخرى بعض السياسات والإجراءات في هذا المجال.	0
والواقع أن الهجمات كانت في الغالب الأعم توجه عمدا ضد المدنيين وضد الأهداف المدنية.	0
ولذلك، ينبغي لهيئات مكافحة الإرهاب التابعة للأمم المتحدة معالجة أوجه القصور تلك بمزيد من الجدية والتفاني.	1
"ويدين مجلس اﻷمن بشدة استمرار استعمال اﻷراضي اﻷفغانية، وﻻ سيما المناطق التي تسيطر عليها الطالبان، في إيواء اﻹرهابيين وتدريبهم والتخطيط لﻷعمال اﻹرهابية، ويؤكد من جديد اقتناعه بأن قمع اﻹرهاب الدولي أساسي لصون السلم واﻷمن الدوليين، ويصر على ضرورة أن تتوقف الطالبان عن توفير المأوى والتدريب لﻹرهابيين الدوليين ولمنظماتهم، وأن تتخذ تدابير فعالة لكفالة عدم استعمال اﻷراضي الواقعة تحت سيطرتها ﻹقامة منشآت ومعسكرات لﻹرهابيين، أو إعداد أو تنظيم اﻷعمال اﻹرهابية ضد الدول اﻷخرى أو مواطنيها، وأن تتعاون مع الجهود الرامية إلى تقديم اﻹرهابيين الذين صدرت بشأنهم لوائح اتهام إلى العدالة.	1
(ح) تطوير الدور العالمي للمديرية التنفيذية في الاتصالات الاستراتيجية المتعلقة بمكافحة الإرهاب، بسبل منها تقديم إحاطات إلى الأعضاء كافة، والعمل مع قادة العالم وصناع الرأي العالمي، والتواصل مع وسائط الإعلام وغيرها من الجهات المعنية.	0
86 - ينبغي لدول المنطقة دون الإقليمية أن تقوم بما يلي: (أ) مراجعة قوانينها الجنائية بحيث تجرّم بصورة وافية التجنيد بغرض ارتكاب الأعمال الإرهابية أو الانضمام إلى الجماعات الإرهابية؛	0
وفيما يتعلق باحتمال نشوء مواجهة عسكرية، يقول الصوماليون العارفون بحقائق الأمور وغيرهم من المطلعين على دقائق التطورات على كلا الجانبين إن المسألة ليست ما إذا كانت تلك المواجهة سوف تقع، بل متى ستقع.	1
وهذا التزام دولي يجب على الدول الوفاء به لكفالة العدالة لضحايا هذه الأعمال التي تستحق الشجب.	1
"ويشير مجلس الأمن إلى دعمه جهود الأمين العام الرامية إلى إنشاء المحكمة الخاصة للبنان بأسرع ما يمكن باعتبارها وسيلة لإنهاء الإفلات من العقاب في لبنان ولمنع حصول مزيد من الاغتيالات فيه.	0
"لذلك فقد انتهجت الحكومة اليمنية على مدى السنوات العشر الماضية سياسة واضحة تجاه الصومال بقصد إعادة الاستقرار إلى ربوعه وانتهاء الحرب الأهلية ودعم الحكومة المركزية.	0
31 - ورحب كل من الدول والعديد من العناصر الفاعلة الدولية بانفتاح عملية الاستعراض الشامل وحثت لجنة القرار 1540 على أن تواصل هذا النهج وأن تزيد من جهودها المفيدة بالفعل من أجل تحقيق الشفافية وسياسة الشمول.	0
وإذ يؤكد الضرورة الملحة لإجراء الإصلاح الشامل لقطاع الأمن والعمل، حسب الاقتضاء، على نزع سلاح الجماعات المسلحة [الوطنية] وتسريح أفرادها وإعادة إدماجهم ونزع سلاح الجماعات المسلحة الأجنبية وتسريح أفرادها وإعادتهم إلى أوطانهم وإعادة توطينهم وإعادة إدماجهم تحقيقا للاستقرار على المدى الطويل في [البلد المعني]، وإذ يدرك ضرورة تهيئة الظروف الأمنية الكفيلة بتحقيق التنمية الاقتصادية المستدامة، وإذ يؤكد أهمية المساهمة التي يقدمها الشركاء الدوليون في هذه المجالات.	0
ووصف الحالة في مسرح الجريمة بأنها حالة تكتنفها الفوضى.	0
وأشارت دولة أخرى إلى أن المسؤولية الرئيسية للمنع مناطة بالجيش الوطني وإدارة الاستخبارات التابعة له، وأشارت إلى أن وجود مخيمات للاجئين على أراضيها يشكل تحديا كبيرا.	1
ومن خلال مناقشاتنا السابقة، أعربت بلجيكا عن مشاطرتها الشعور بالقلق الذي عبر عنه الأمين العام إزاء الخطر الذي يمثله العنف في العراق لمجتمع ومؤسسات وعملية سياسية في حالة هشاشة حتى الآن.	1
وإذ يساوره بالغ القلق إزاء التهديد الذي يشكله الإرهاب ومخاطر احتياز جهات غير تابعة للدول**، من قبيل الأطراف المحددة في قائمة الأمم المتحدة التي وضعتها وتتابعها اللجنة المنشأة بموجب قرار مجلس الأمن 1267 (1999)، والأطراف التي ينطبق عليها القرار 1373 (2001)، أسلحة نووية وكيميائية وبيولوجية ووسائل إيصالها، أو استحداث تلك الأسلحة والوسائل، أو الاتجار بها أو استعمالها،	1
(ن) التنسيق والتعاون مع جهات الاتصال الوطنية المعنية بمكافحة الإرهاب أو ما يماثلها من جهات الاتصال في البلد الذي تتم زيارته، حسب الاقتضاء؛	0
ويشير مجلس الأمن إلى مطالبته جميع الأطراف في أي نزاع مسلح بالامتثال التام للالتـزامات المنطبقة عليها بموجب القانون الدولي المتعلق بحماية المدنيين في النزاع المسلح، بمن فيهم الصحفيون وموظفو وسائط الإعلام والأفراد المرتبطون بهم.	1
بيد أنه لا تتوافر معلومات تُذكر عن مستوى تنفيذ تلك القواعد التنفيذية.	1
32 - سيسمح برنامج تعزيز السلام الذي أعدته حكومة أفغانستان (انظر الفقرة 16 أعلاه) بعودة المتمردين السابقين إلى المجتمع الأفغاني الرئيسي().	0
وشددنا على ما كان لمثل تلك الرسائل من آثار مأساوية مؤخرا في جهات أخرى من القارة.	1
22 - وبعد رصد تحركات المشردين داخليا باتجاه كوسوفو والتحدث إلى المنحدرين من أصل ألباني المقيمين جنوبي صربيا بالذات، أفادت مفوضية الأمم المتحدة لشؤون اللاجئين أن هؤلاء المشردين فروا خوفا من الوقوع تحت وابل النيران، ونتيجة للقلق العام في حشد قوات الشرطة والقوات العسكرية في وادي بريسيفو.	1
وتقوم لجنة مكافحة الإرهاب، المنشأة عملا بقرار مجلس الأمن 1373 (2001) بدور رئيسي في هذا المجال.	0
وتجدر الملاحظة إلى أن بعض الدول قد بدأت في الآونة الأخيرة باستعراض أو إنهاء حالات الطوارئ.	0
"ويعرب مجلس الأمن أيضا عن قلقه إزاء التوترات المتزايدة في منطقة إتوري ويهيب بجميع الأطراف ممارسة ضبط النفس.	1
ويحثها على مضاعفة جهودها من أجل توفير الأمن للسكان المدنيين على أراضيها، بما في ذلك الأجانب الذين تمنحهم حق اللجوء.	0
ولقد أدنتُ تلك القيود على حرية حركة قوات حفظ السلام التابعة للأمم المتحدة.	1
يحيط علما بوضع سياسة بذل العناية الواجبة في مراعاة حقوق الإنسان، ويشجع [البعثة] على تنفيذها تنفيذا تاما، ويطلب إلى الأمين العام أن يدرج التقدم المحرز في تنفيذ تلك السياسة ضمن تقاريره المقدمة إلى المجلس؛	0
