ar	VerConf
وإضافة إلى ذلك، أصدرت البعثة في 29 تموز/يوليه، تقريرا عن الانتهاكات بسبب إنشاء مركز "ضرائب" أبخازي على بعد 50 مترا من نقطة تفتيش لقوة حفظ السلام التابعة لرابطة الدول المستقلة في انتهاك لبروتوكول غالي المؤرخ 12 أيار/مايو 2005 (انظر S/2005/453، الفقرة 4).	1
وتشدد جنوب أفريقيا على أنه، نظراً لحجم هذه التحديات، فإن المطلوب وضع استراتيجية شاملة تتضمن الأمن، والجهود الإنسانية، والحكم الرشيد، والتنمية الاجتماعية - الاقتصادية.	1
ويجب أن يرفع الحصار فورا للسماح للسكان المدنيين في غزة بالحصول على المياه والعمل والتجارة والرعاية الطبية والتعليم - أي الحصول على حاجاتهم الأساسية.	1
وشدد الأمين العام المساعد في عرضه للتقرير على الخطر المتمثل في احتمال تدهور الحالة الأمنية، بالرغم من الهدوء السائد في المنطقة، ولا سيما نتيجة لإدراج السلطات السودانية أبيي كدائرة انتخابية في الانتخابات الرئاسية لعام 2015.	1
وأعربت الكنيسة الكاثوليكية ومنظمات المجتمع المدني عن قلقها من أن يسهم تخفيف الأحكام إلى إيجاد تصورات عن إمكانية الإفلات من العقاب بالرغم من أن الرئيس أوضح أن تخفيف الأحكام تقرر بالتشاور مع جهات من بينها الحكومة وأعضاء البرلمان وأسر الضحايا والجناة، ووفقا للدستور والقوانين المنطبقة.	1
إلا أنني مازلت قلقا إزاء استمرار فرض قيود على حرية تنقل المراقبين العسكريين التابعين للأمم المتحدة الذين يسعون إلى زيارة الوحدات والمقار والنقاط المحصنة التابعة للطرفين لأغراض التحقق.	1
وبينما أسعدنا تسجيل أكثر من 10 ملايين ناخب أفغاني، نشعر بالقلق لأنه لم يجر تسجيل كاف للناخبين في الأجزاء الجنوبية والجنوبية الشرقية من أفغانستان بسبب شواغل أمنية.	1
ويوصي فريق الرصد اللجنة بأن تضع معايير دنيا لتحديد هوية المدرجين في القائمة وأن تيسر ما تتبعه من إجراءات لشطب الأسماء في حالة وجود أدلة كافية لاعتبار أن حامليها قد فارقوا الحياة.	0
والأهم من ذلك كله أن المساءلة تعني مد يد المساعدة إلى البلد/المجتمع، بعد أن يضع النزاع أوزاره، لتمكين المجتمعات المحلية من طي صفحة الماضي والمضي قدما.	0
وفي الفقرتين 1 و 2 من القرار 2118 (2013)، قرر مجلس الأمن أن استخدام الأسلحة الكيميائية أينما كان يشكل تهديدا للسلام والأمن الدوليين، وأدان بأشد العبارات أي استخدام للأسلحة الكيميائية في الجمهورية العربية السورية.	1
وأنشأت طاجيكستان، في تشرين الأول/أكتوبر 2009، إدارة الرصد المالي (وحدة الاستخبارات المالية) وأعدت، في تشرين الثاني/نوفمبر 2010، مشروع قانون جديد بشأن مكافحة غسل الأموال ومكافحة تمويل الإرهاب.	0
30 - بالنظر إلى تعليق التمويل المتعدد الأطراف، فإن حكومة كوت ديفوار معتمدة على محصول الكاكاو في الحفاظ على قدرتها المالية على الوفاء بديونها وليتسنى لها دفع أجور موظفيها المدنيين بما في ذلك الجيش. وللكاكاو دور مهم في تمويل الجهود التي تبذلها الحكومة للمشتريات العسكرية غير المدرجة في الميزانية أو الممولة من موارد خارجة عن الميزانية، وعلى الرغم من تراجع حجم الإيرادات المحققة من الكاكاو، فإن النسبة المئوية المأخوذة مما هو متوفر لا تزال عالية.	0
80 - أعرب موظفو عملية الأمم المتحدة في كوت ديفوار بانتظام عن شعورهم بالإحباط من عدم وجود استخبارات جيدة لديهم للمتابعة وعدم وجود المهارات الفنية اللازمة لإنجاز ولايتهم.	1
ويواصل العنصر العسكري العمل في ظروف بالغة الصعوبة في الشمال.	0
ويمكن أن تتعثر خطى التقدم بفعل تنافس جداول أعمال الجهات الفاعلة الدولية، وطرح مبادرات موازية، وتقديم بلدان المنطقة الدعم للحركات غير الموقعة، مما يقوض محاولات إقناع تلك الحركات بالانضمام لعملية السلام.	0
ففي غرب دارفور على سبيل المثال، هاجمت قوات المتمردين مركزا للشرطة في تنغافوكا، في تشرين الأول/أكتوبر 2003.	0
"ويكرر مجلس الأمن تأكيد إدانته بنفس القدر من الشدة جميع انتهاكات أحكام القانون الدولي السارية فيما يتعلق بقيام أطراف النزاعات المسلحة بتجنيد الأطفال واستغلالهم ومعاودة تجنيدهم وقتلهم وتشويههم واغتصابهم، وكذا سائر ما ترتكبه تلك الأطراف من أعمال العنف الجنسي والاختطافات والهجمات الموجهة ضد المدارس أو المستشفيات وحيلولتها دون وصول المساعدة الإنسانية.	1
وأوضح أيضا أن عدم انتخاب البرلمان اللبناني لرئيس جديد قوض استقرار لبنان وقدرته على الصمود منذ اندلاع النـزاع في الجمهورية العربية السورية.	1
155 - كما عقد الفريق اجتماعه الثاني في جنيف في أيار/مايو 2005 لرؤساء ونواب رؤساء المخابرات وأجهزة الأمن من ست دول عربية()، مواصلا بذلك مناقشاته بشأن التهديد الذي يشكله تنظيم القاعدة واحتمال اتخاذ تدابير إضافية لمجابهته كي ينظر فيها مجلس الأمن.	0
"يشكر مجلس الأمن الأمين العام على تقريره المؤرخ 3 آب/أغسطس 2004، الذي أعيد إصداره في 23 آب/أغسطس 2004 (S/2004/616)، ويعيد تأكيد الأهمية الحيوية التي يوليها المجلس لتعزيز العدالة وسيادة القانون، والمصالحة الوطنية في مرحلة ما بعد الصراع.	0
وشددت الممثل الخاصة للأمين العام، على أن النساء يعشن في ظروف يرثى لها دون الحصول على الخدمات الصحية والقانونية، ورأت أنه سيكون من الصعب للغاية معالجة هذه الحالة، ولا سيما بالنظر إلى ثقافة الصمت وعدم وجود مؤسسات للتحقيق والمقاضاة.	1
82 - ورغم أن تنظيم القاعدة وحركة الطالبان ومن يرتبطون بهما قد لا تكون لديهم هياكل ونظم معقدة تتيح التحكم في العمليات التي ينفذها أتباعهم، فإنهم مع ذلك يملكون قدرة عسكرية جاهزة للعمل على النحو المشار إليه، ومن أمثلة ذلك المتمردون في أفغانستان. وعلى المستويين التعبوي والعملياتي، يستخدم تنظيم القاعدة وحركة الطالبان ومن يرتبطون بهما معدات عسكرية ومدنية على حد سواء مثل أجهزة الاتصال اللاسلكي القصيرة المدى والهواتف المحمولة والساتلية.	1
يؤكد مجددا على أن إنهاء ظاهرة الإفلات من العقاب أمر أساسي للمجتمعات التي تمر بصراع أو التي تتعافى منه لتحقيق المصالحة مع الماضي بما ارتكب فيه من اعتداءات ضد المدنيين المتضررين من الصراعات المسلحة ومنع وقوع مثل هذه الاعتداءات في المستقبل؛	1
وتملك بعض الدول قدرة على تجميد الأموال والأصول المرتبطة بالإرهاب دون إبطاء، رغم أنها قدرة محدودة في معظم الأحيان.	0
السيد لي لونع مينه (فييت نام) (تكلم بالانكليزية): إن الإرهاب يشكل مصدر قلق تشاطره جميع الدول الأعضاء في الأمم المتحدة والمجتمع الدولي بأسره.	1
وعلى الرغم مما أحرزناه من تقدم ملحوظ، ما زالت البيئة السياسية والأمنية والاقتصادية المعقدة تشكل تحديات كبيرة أمام القادة المنتخبين المكلفين بتطبيع الحالة في بلدنا.	1
وبجانب عواقبها المباشرة فإن الهجوم على آرو شارو وعلى القرى القريبة منها هو مصدر قلق خطير لأنه ربما يشير إلى بدء الاستهداف المتعمد من قبل الميليشيات للسكان المشردين داخليا وعدم قدرة القوات الحكومية، أو عدم رغبتها، في توفير الحماية الفعالة للمخيمات والقرى التي يقيم فيها هؤلاء المشردون.	1
أتشرف بأن أحيل طيه تقرير لجنة مجلس الأمن المنشأة عملا بالقرار 1521 (2003) بشأن ليبريا، الذي يتضمن سردا لما اضطلعت به اللجنة من أنشطة خلال الفترة من 1 كانون الثاني/يناير إلى 31 كانون الأول/ديسمبر 2014. والتقرير، الذي اعتمدته اللجنة، مقدم وفقا لمذكرة رئيس مجلس الأمن المؤرخة 29 آذار/مارس 1995 (S/1995/234).	0
وخضعت هذه الحالات أيضا لتحقيقات أجراها فريق تقصي الحقائق المشترك، المشكل من الطرفين ومن البعثة ومن قوة حفظ السلام التابعة لرابطة البلدان المستقلة، الذي مهمته إثبات ما إذا كانت الحوادث العنيفة تشكل انتهاكات لاتفاق موسكو لعام 1994.	0
وفي هذا الصدد، تلقيت رسالة مؤرخة 6 كانون الأول/ديسمبر 2007 من الممثل الدائم للمغرب لدى الأمم المتحدة (S/2007/714) ورسالة أخرى مؤرخة 12 كانون الأول/ديسمبر 2007 من وزير الشؤون الخارجية والتعاون للمغرب (S/2007/731)، تضمن كل منهما ادعاءات بوقوع انتهاكات لأحكام الاتفاقات العسكرية التي تم التوصل إليها في عام 1991.	1
ولذا فقد حث المجلس على التحول من النهج "القائم على الطلب" إلى بذل جهود "أنشط" لزيادة اهتمام الجهات غير الأعضاء بأعماله.	0
١١ - يعرب عن استعداده للنظر في الطريقة التي يمكن بها لوﻻيات حفظ السﻻم أن تعالج معالجة أفضل اﻷثر السلبي للصراعات المسلحة على المدنيين؛	0
كما يبدو أن معظم الحكومات ملتزم بشدة بكفالة احترام وكالات إنفاذ القانون لحقوق الإنسان، رغم إثارة مخاوف جدية في بعض الحالات بشأن ارتكاب انتهاكات من جانب قوات الأمن.	1
وإذ يشير إلى البيان الرئاسي الصادر عن مجلس الأمن في 9 أيار/مايو 2011 (S/PRST/2011/9)، الذي يلاحظ فيه المجلس أن أسامة بن لادن لن يستطيع بعد الآن ارتكاب أعمال الإرهاب،	1
16 - ويبدو أن النمط الجديد للبعثات الاستكشافية/التنقيبية المشتركة المضطلع بها في إطار اللجنة الفنية الفرعية يشكل نهجا واعدا لتسريع وتيرة التقدم العملي على الأرض.	0
"ولا يزال مجلس الأمن يساوره بالغ القلق إزاء الأنشطة التي تضطلع بها في منطقة الساحل منظمات إرهابية، بما فيها تنظيم القاعدة في بلاد المغرب الإسلامي وحركة التوحيد والجهاد في غرب أفريقيا، ويكرر الإعراب عن إدانته القوية للهجمات الإرهابية التي ارتكبت مؤخرا في المنطقة.	1
وترى اللجنة أنه ينبغي بالطبع اعتبار جميع الأشخاص، بمن فيهم أولئك الذين اتهموا بجرائم جسيمة، أبرياء حتى تثبت إدانتهم في محاكمة عادلة.	0
وأفاد المنسق الخاص أن الهدوء العام مستمر في جنوب لبنان، على الرغم من وقوع بعض الحوادث الأمنية خلال الفترة المشمولة بالتقرير، بما في ذلك إطلاق صواريخ في اتجاه إسرائيل من جنوب لبنان خلال النزاع المتعلق بغزة في تموز/يوليه وآب/أغسطس، ووقوع حادثين أمنيين خطيرين في منطقة مزارع شبعا (القطاع الشرقي).	0
8 - وفي 7 أيار/مايو 2005، عاد العماد ميشال عون بعد 14 عاما في المنفى، وشكل "التيار الوطني الحر" للمشاركة في الانتخابات التشريعية التي بدأت في 29 أيار/مايو، وانتهت بعد أربع جولات في 19 حزيران/يونيه.	0
وهو يدين بشدة الطالبان لما قامت به في تموز/يوليه ١٩٩٩، بعد مضي أسبوع واحد فقط على اجتماع مجموعة "الستة زائد اثنين" في طشقند، من شن هجوم جديد بالرغم من مطالبات المجلس المتكررة بوقف القتال.	1
"ويعيد مجلس الأمن تأكيد الأحكام ذات الصلة بالموضوع من الوثيقة الختامية لمؤتمر القمة العالمي لعام 2005 فيما يخص حماية المدنيين في النزاعات المسلحة، بما في ذلك فقرتاها 138 و 139 المتعلقتان بالمسؤولية عن حماية السكان من الإبادة الجماعية وجرائم الحرب والتطهير العرقي والجرائم المرتكبة ضد الإنسانية.	0
وفي وقت ما بين الساعة 15/13 و30/13، أخبره المقدم أحمد الأسير بالانفجار وأن موكب السيد الحريري كان هو الهدف.	1
10 - في 7 أيلول/سبتمبر، عقد الفريق العامل الرفيع المستوى المشترك بين حكومة تشاد والأمم المتحدة اجتماعه الثالث لتقييم الوضع على أرض الواقع فيما يتعلق بحماية المدنيين وتنفيذ التدابير التي اعتمدتها الحكومة من أجل تنفيذ المهام الواردة في الفقرة 4 من القرار 1923 (2010).	0
(ب) توريد الأسلحة وما يتصل بها من معدات إلى تنظيم القاعدة أو أسامة بن لادن أو حركة الطالبان أو بيعها لهم أو نقلها إليهم؛ أو (ج) التجنيد لحساب تنظيم القاعدة أو أسامة بن لادن أو حركة الطالبان؛ أو	0
وأنشأت سبع دول في تشريعاتها الولاية القضائية الكافية لمقاضاة الجرائم ذات الصلة بالإرهاب، واتخذت خمس دول أخرى خطوات في هذا الاتجاه، في حين لا تتوفر معلومات كافية بشأن تسع دول.	0
وتواصل اللجنة رصد وتقييم الطابع المتغير للتهديد الذي يشكله تنظيم القاعدة والمرتبطون به على السلام والأمن الدوليين، وتكييف نهجها العملياتي وفقا لذلك من أجل كفالة الاستجابة بفعالية وكفاءة لهذه التهديدات.	0
ونحن ندين الهجمات الإرهابية المتكررة بالصواريخ على أهداف إسرائيلية مدنية.	1
١٤ - وانطلقت في الجزائر العاصمة المفاوضات الرسمية لإحلال السلام بين حكومة مالي والجماعات المسلحة في 14 تموز/يوليه، بتيسير من فريق وساطة دولي مؤلف من الأمم المتحدة ومنظمات إقليمية وبلدان مجاورة، وتقوده الجزائر. وترمي المفاوضات إلى تثبيت وقف إطلاق النار والتوصل إلى حل سلمي للنزاع، مع الحفاظ على وحدة مالي الإقليمية. وفي 24 تموز/يوليه، وقعت حكومة مالي والجماعات المسلحة اتفاقا أوليا يضع خريطة طريق لإجراء المزيد من المفاوضات.	0
وإذ يكرر تأكيد قلقه البالغ إزاء مواصلة المليشيات والجماعات المسلحة الأجنبية لأعمال القتال في الجزء الشرقي من جمهورية الكونغو الديمقراطية، وإزاء ما تشكله من خطر على إجراء الانتخابات في جمهورية الكونغو الديمقراطية،	1
يطلب إلى جميع الدول اتخاذ إجراءات عاجلة لتنفيذ القرار 1373 (2001) تنفيذا كاملا، ومساعدة بعضها البعض في القيام بذلك، ويؤكد التزام الدول بحرمان الإرهابيين ومن يدعمون الإرهاب من الدعم المالي والملاذ الآمن ومن جميع أشكال الدعم الأخرى،	1
وقد عدَّلت عمليات السلام التابعة للأمم المتحدة موقفها تبعا لذلك، وهي بذلك تُظهر نزعة متزايدة إلى "التحصين بغرض الاحتماء"، مما يحد من قدرة كل من الأفراد النظاميين والموظفين المدنيين على التعامل مع السكان المحليين، وكسب قلوبهم وعقولهم، والقيام بالوساطة في المنازعات المحلية، وجمع المعلومات - وهي أعمال تكتسي أهمية بالغة من أجل تنفيذ اتفاقات السلام والجهود المبذولة لتسوية النزاعات.	1
وفوق كل ذلك، كانت مخاوفنا تتعلق بإصرار سلطات بريشتينا على تنفيذ ما يسمى بالاستراتيجية الخاصة بشمال كوسوفو في انتهاك سافر لقرار مجلس الأمن 1244 (1999)، الذي لا يزال يشكل الإطار القانوني الدولي الرئيسي للتوصل إلى تسوية في كوسوفو.	1
وليس من الحكمة ولا من المناسب السماح لإريتريا بالتفكير في نجاح محاولتها لابتزاز مجلس الأمن عن طريق أخذ أفراد البعثة رهائن.	0
- أنه أصبح من السهل، في عالم يتزايد عولمة، أن يستغل الإرهابيون التكنولوجيا والاتصالات والموارد المتطورة لتحقيق أهدافهم الإجرامية؛	1
2 - يدعو جميع الدول إلى التعاون، في جملة أمور، على تعزيز أمن حدودها الدولية بوسائل منها مكافحة وثائق السفر المزورة وإلى القيام، قدر المستطاع، بتعزيز الإجراءات المتعلقة بكشف الإرهابيين وأمن المسافرين بهـدف منع الذين ثبت ارتكابهم للتصرف المشار إليه في الفقرة 1 (أ) من دخول أراضيها؛	0
"ويكرر مجلس الأمن مطالبته جميع الأطراف في النـزاعات المسلحة بالوقف الفوري والكامل لجميع أشكال العنف ضد النساء والفتيات، بما في ذلك أعمال العنف الجنسي.	1
وفي عام 1980، أدخلت القوات الجوية لكوت ديفوار الخدمة ست طائرات خفيفة من طراز Dassault/Dornier Alpha Jet CI لأعمال الهجوم والتدريب.	0
وفي الوقت نفسه، يعتقد وفدي أن الممثلين المنتخبين للأقليات العرقية في الجمعية، وخاصة ممثلي الصرب، سيحققون نتائج أفضل وفوائد أكبر لناخبيهم لو انتهجوا نهجا قائما على المزيد من المشاركة، بدلا من الانسحاب من الجمعية كلما واجهوا موقفا صعبا.	1
وخلصت اللجنة إلى أن وزير الداخلية والقائد العام تجاوزا الإجراءات المؤسسية من خلال النقل غير القانوني للأسلحة داخل المؤسسة؛	0
وفي هذا الشأن، بالرغم من معالجة مكافحة الإرهاب بصورة أكثر جدية من قِبَل الأمم المتحدة بشكل عام ومجلس الأمن بشكل خاص، هناك دليل محدود على بذل جهود حقيقية مشتركة لإيجاد استجابة دولية أكبر للإرهاب.	1
إن قرار طرد العاملين في المجال الإنساني وإسكات الآخرين بالتهديد بالطرد، أو محاولات تقييد حرية حركة العملية المختلطة للاتحاد الأفريقي والأمم المتحدة في دارفور تأتي في إطار هذه السياسة المتمثلة في الحد من قدرة المجتمع الدولي على الرصد.	1
وإذ يرحب بجهود السلطات البوروندية لمكافحة الإفلات من العقاب، وبخاصة محاكمة وإدانة بعض مرتكبي مذبحة موينغا،	1
600- وفي ضوء هذه القاعدة القانونية الدولية يجب أن يُنظر إلى التزام السودان بدفع تعويضات عن جميع الجرائم التي ارتكبها في دارفور وكلاؤه ومسؤلوه أو أجهزته بحكم الأمر الواقع.	0
(أ) التشجيع على وضع أهداف قابلة للقياس في مجال الحد من العنف المسلح؛	0
وأنشئت اللجان استجابة لادعاءات أشارت إلى وقوع انتهاكات للقانون الدولي لحقوق الإنسان والقانون الإنساني الدولي في سياق النزاعات()، وكذلك في حالات شهدت درجات عنف مرتفعة ارتبطت في أحيان كثيرة، وإنما ليس بشكل حصري، بالعمليات الانتخابية أو السياسية، وانطوت على انتهاكات جسيمة لقانون حقوق الإنسان().	1
6 - وفي مالي، كاد الإرهابيون أن يدمروا الهياكل الأساسية للدولة، مما أثر على استقرار البلد والمنطقة بأسرها. وما زال تنظيم القاعدة في بلاد المغرب الإسلامي، وجماعة التوحيد والجهاد في غرب أفريقيا، وجماعة أنصار الدين، ينشطون في شمال مالي، مع ما لذلك من آثار تطال البلدان المجاورة. وقد عرَّضوا وجود بعثة الأمم المتحدة المتكاملة المتعددة الأبعاد لتحقيق الاستقرار في مالي وأنشطتها للخطر.	0
ويساور باكستان بالغ القلق إزاء ما خلص إليه التقرير من أن التحديات الإنسانية والاقتصادية التي تواجه منطقة الساحل قد تفاقمت من جراء تداعيات الأزمة الليبية.	1
وأعرب عن استمرار قلقه من الإجراءات الانفرادية والقيود والاستفزازات في الأماكن المقدسة في القدس.	1
ولقي 363 من المقتولين حتفهم على أيدي قوات النظام، بمن فيهم 82 طفلا و 48 امرأة، بينما قتلت الدولة الإسلامية 17 شخصا.	0
