es	MatCoop
La observancia de esas prohibiciones también se ha beneficiado de la notoriedad pública de los sometidos a ellas, que les hace más reconocibles y disminuye la probabilidad de que viajen con una identidad falsa.	1
:: Medidas especiales para proteger a las mujeres y a las muchachas de la discriminación y la violencia basadas en el género, las violaciones y otras formas de abuso sexual (acceso a medidas jurídicas de reparación; centros de crisis, albergues; atención médica; programas de asesoramiento y de otro tipo de asistencia; mecanismos de vigilancia y denuncia).	1
Es igualmente importante que la relación entre las misiones y las Naciones Unidas y otros agentes humanitarios no redunde en desmedro de la independencia y neutralidad de estos agentes ni de la idea que se tenga de ellas.	1
Insta a todas las partes interesadas, incluidos los Estados Miembros, las entidades de las Naciones Unidas y las instituciones financieras a que apoyen el desarrollo y el fortalecimiento de la capacidad de las instituciones nacionales, en particular de los sistemas judiciales y de salud, y las redes locales de la sociedad civil para que presten asistencia sostenible a las víctimas de la violencia sexual en situaciones de conflicto armado y situaciones posteriores.	0
g) La obligación de tomar precauciones a fin de reducir al mínimo las pérdidas y los daños accidentales causados por ataques, de tal manera que cada parte debe hacer todo lo posible para asegurarse de que los blancos sean objetivos militares y elegir medios o métodos de combate para reducir al mínimo las pérdidas de vidas civiles;	1
El Comité aseguró que en Baram los rebeldes habían dado muerte a algunos soldados y a 13 civiles dentro del hospital del lugar.	0
9 de enero de 2006 Timor-Leste-FALINTIL y de las Fuerzas de Defensa de Timor-Leste (F-FDTL) presentan una petición escrita al General de Brigada Taur Matan Ruak y al Presidente Gusmão.	0
En promedio, los ingresos mensuales del Fondo de Indemnización durante el año en curso han sido de aproximadamente 351,2 millones de dólares, y el promedio de los pagos trimestrales de indemnizaciones siguió siendo superior a 1.000 millones de dólares.	1
Al-Qaida seguirá siendo una amenaza residual durante algún tiempo en el Afganistán y también seguirá teniendo cierta influencia en el resto del mundo.	0
En las exenciones de la prohibición de viajar se autorizan los viajes cuando el Comité determine que están justificados por motivos humanitarios, incluidas las obligaciones religiosas, o cuando el Comité llegue a la conclusión de que al conceder una exención se promoverían los objetivos de las resoluciones del Consejo relacionados con el logro de la paz y la reconciliación nacional de Côte d'Ivoire y la estabilidad en la región.	1
Cuatro de los ocho Estados de Asia Meridional han promulgado leyes para tipificar el delito de reclutamiento de terroristas y prohibir la utilización de sus territorios para cometer o preparar actos terroristas contra otros Estados o sus ciudadanos.	0
11. Encomienda al Comité que coopere con los demás comités de sanciones del Consejo de Seguridad, en particular con el establecido en virtud de la resolución 1988 (2011); Inclusión en la Lista	0
El Secretario General estableció los Comités Ejecutivos de Paz y Seguridad y de Asuntos Humanitarios con el fin de proporcionar al personal directivo del más alto nivel un foro en el que debatir y formular estrategias para prevenir los conflictos armados y las emergencias humanitarias y responder a ellos.	1
El régimen de sanciones solo es eficaz cuando es comprendido correctamente, en particular por los Estados Miembros, cuya participación es fundamental para que la Lista sea sólida y su aplicación, adecuada.	1
Condena el uso de [canales nacionales de televisión] y otros medios de información para incitar a la discriminación, la hostilidad, el odio y la violencia, incluso contra [la Misión pertinente de las Naciones Unidas], así como los actos de intimidación y violencia contra periodistas, y pide que se levanten todas las restricciones impuestas al ejercicio del derecho a la libertad de expresión en [el país afectado];	0
También se refirió a peligrosos estallidos de violencia ocurridos en el Líbano entre las Fuerzas Armadas del Líbano y los hombres armados de Fatah al-Islam en los alrededores de los campamentos de refugiados palestinos.	0
El Consejo hace notar también el mandato de la Operación Híbrida de la Unión Africana y las Naciones Unidas en Darfur (UNAMID) y la BINUCA de cooperar y compartir rápidamente información relativa a la amenaza regional que supone el LRA.	1
El mandato de la Comisión consistirá en decidir, mediante arbitraje vinculante, acerca de todas las reclamaciones por pérdida, daños o lesiones causados por un gobierno contra el otro, así como por los nacionales (lo que incluye a las personas naturales y jurídicas) de una parte contra el gobierno de la otra parte o entidades de propiedad o sujetas al control de la otra parte que a) estén asociados con el conflicto que fue objeto del Acuerdo Marco, las modalidades para su aplicación y el Acuerdo de Cesación de Hostilidades, y b) resulten de violaciones del derecho internacional humanitario, incluidos los Convenios de Ginebra de 1949, u otras violaciones del derecho internacional.	1
En la zona de operaciones, el principio de la proporcionalidad sigue siendo una norma en gran medida subjetiva, que se basa en buscar un equilibrio entre la expectativa y previsión de obtener ventajas militares y la pérdida real de vidas de civiles o la destrucción de bienes de carácter civil.	0
Documento: orden de investigación emitida por el primer juez de investigación del Tribunal Militar de Beirut No. 23/2005, de fecha 14 de febrero de 2005.	1
85. Las fuerzas armadas están también compuestas por una unidad operacional denominada Servicio de Inteligencia de Fronteras, cuya función principal es recabar información.	1
Capacitación del resto del personal para que cobre mayor conciencia sobre los derechos humanos y los derechos de la mujer y el niño.	1
Además, decidieron ejercer mayor presión para lograr el desarme de las milicias que operan en la zona oriental de la República Democrática del Congo y negociar tratados bilaterales para la extradición de los líderes de milicias aún en activo.	0
3. Los Estados tienen que llevar ante la justicia a quienes financien, planeen, apoyen o cometan actos terroristas o proporcionen refugio seguro, de conformidad con el derecho internacional y en especial basándose en el principio de extradición o enjuiciamiento;	1
El Gobierno tiene el mandato de formular y ejecutar la política general del país.	1
En la misma reunión, de conformidad con el párrafo 41 de la resolución 2093 (2013), el Coordinador del Grupo de Supervisión para Somalia y Eritrea presentó la evaluación que había realizado el Grupo de los progresos logrados por el Gobierno Federal de Somalia para establecer infraestructura logística de gestión de armas e instaurar procedimientos de control de armas.	0
Las armas, que iban en sacos (30 ó 40), se dejaron a cargo del custodio de armas a bordo del buque estadounidense y luego se entregaron a las autoridades del Yemen.	0
Muchos Estados no han revisado los posibles riesgos de financiación del terrorismo que este sector puede representar, aunque el Reino Unido, en particular, ha establecido mecanismos para evaluar y proteger estas organizaciones y, mediante el programa internacional de la Comisión de Obras de Beneficencia, para lograr una difusión eficaz en el plano internacional y contribuir al fomento de la capacidad en otras partes del mundo.	1
El Comité desempeña una función crucial en las iniciativas antiterroristas de las Naciones Unidas manteniendo, actualizando y mejorando su Lista consolidada de personas y entidades asociadas con Al-Qaida y los talibanes y dando un seguimiento eficaz a la aplicación por los Estados Miembros de las sanciones contra las personas y entidades que figuran en la Lista.	1
Desde junio de 1999 han muerto un total de 103 personas y 394 quedaron heridas en incidentes debidos a minas o a munición sin detonar.	0
El Consejo reitera su más enérgica condena de dichas prácticas, insta a todas las partes en los conflictos armados a que velen por la protección plena y efectiva de la mujer, e insiste en la necesidad de poner fin a la impunidad de los responsables de la violencia por razones de género.	0
A este respecto, el Reino de Marruecos ha cumplido cabalmente, en su momento, sus obligaciones, liberando incluso a los detenidos, entre ellos los militares argelinos, y ofreciendo todas las aclaraciones solicitadas por el Comité Internacional de la Cruz Roja respecto de las denuncias de desapariciones.	1
Aunque en la actualidad sólo los organismos encargados de hacer cumplir la ley tienen acceso a la base de datos de documentos de viaje perdidos o robados, su valor es cada vez mayor a medida que más países presentan información.	1
Reconociendo la importancia de las comunidades locales, el sector privado, la sociedad civil y los medios de comunicación para aumentar la conciencia sobre las amenazas del terrorismo y hacerles frente con mayor eficacia,	1
f) Participar activamente en todas las actividades que se emprendan en el marco de la Estrategia global de las Naciones Unidas contra el terrorismo y brindarles apoyo, incluso a las del Equipo Especial sobre la Ejecución de la Lucha contra el Terrorismo establecido para asegurar la coordinación y coherencia generales de las actividades de lucha contra el terrorismo en el sistema de las Naciones Unidas;	1
Una cuarta terrorista no logró detonar su bomba y fue detenida unos días después.	0
6. Subraya que está plenamente dispuesto a imponer medidas selectivas contra las personas que designe el Comité de conformidad con los párrafos 9, 11 y 14 de la resolución 1572 (2004), sobre las que se haya determinado, entre otras cosas, que:	0
También señalaron que la difusión de una mayor información sobre los efectos perjudiciales de la piratería había producido cambios positivos en antiguos focos de piratería.	0
En estas visitas el Equipo se reunió tanto con órganos nacionales encargados de la supervisión del régimen de sanciones como con los que se ocupaban de cuestiones relativas a la amenaza de los talibanes y Al-Qaida sobre el terreno.	0
También destacó el riesgo de que el conflicto se intensificara con la reanudación del período de migración, las elecciones y la falta de diálogo.	0
En relación con las milicias antes mencionadas se plantea una cuestión jurídica importante: ¿sobre quién, además de los autores materiales, recae la responsabilidad penal de los delitos presuntamente cometidos por los Janjaweed?	0
La retirada de las tropas y los activos militares sirios y la celebración de elecciones legislativas libres y dignas de crédito son requisitos que ya se han cumplido.	1
El Consejo de Seguridad expresa su grave preocupación por el afianzamiento cada vez mayor en el Sahel de elementos terroristas, incluida Al-Qaida en el Magreb Islámico (AQMI), grupos afiliados y otros grupos extremistas, y por sus consecuencias para los países de la región y otros lugares.	0
La Comisión reconoce también la necesidad de ofrecer resarcimiento a las personas que han sufrido de resultas de los acontecimientos de abril y mayo.	0
La UNODC finalizó la construcción de un nuevo bloque para 40 reclusas en la cárcel de Boosaaso en Puntlandia. Se está construyendo otro bloque para 200 reclusos. También se construyó una nueva garita y una armería.	1
Por ejemplo, la dificultad de vigilar las fronteras en la región del Sahel y el Sáhara ha permitido a la Organización de Al-Qaida en el Magreb Islámico* y sus asociados desplazarse con libertad, recaudar fondos mediante el contrabando, comprar armas y explosivos y entrenar a los nuevos reclutas en condiciones de relativa seguridad.	0
En otras palabras, las víctimas ven en los atacantes personas que pertenecen a un grupo diferente y hostil.	0
60. Decide, con el fin de ayudar al Comité a cumplir su mandato y respaldar al Ombudsman, prorrogar el mandato del actual Equipo de Vigilancia con sede en Nueva York, establecido con arreglo al párrafo 7 de la resolución 1526 (2004), y el de sus miembros, por un nuevo período de 30 meses, bajo la dirección del Comité y con las funciones que se enuncian en el anexo I, y solicita al Secretario General que adopte las disposiciones necesarias a tal efecto;	1
Azahari Husin, el fabricante de bombas más conocido de Jemaah Islamiyah hasta su muerte en noviembre de 2005, adiestró, además de un número desconocido de discípulos comunes, a varios otros instructores que siguen en libertad y que pueden transmitir sus conocimientos a células por toda el Asia sudoriental.	1
La actividad forma parte del diálogo en curso entre el programa sobre seguridad e imperio de la ley y el Gobierno Federal de Transición sobre las cuestiones relativas a las minas y el apoyo a los procesos que garantizarán que el Gobierno tenga conocimiento de los instrumentos jurídicos internacionales pertinentes y pueda considerar la posibilidad de participar en ellos.	0
Se ha informado de que elementos de las FDLR han sido dispersados en Kivu meridional y de que se ha restringido su capacidad de circular libremente por los núcleos de población y de atacar a civiles. No obstante, no se puede subestimar la capacidad de ataque de las FDLR, en particular teniendo en cuenta que las FARDC disponen de recursos limitados en la zona, tienen escaso adiestramiento militar, adolecen de una falta de disciplina y, además, colaboran a veces con los comandantes de las FDLR.	0
El Consejo debería integrar las buenas prácticas que van surgiendo en materia de lucha contra el extremismo violento en el centro de su respuesta a la amenaza que plantean los combatientes terroristas extranjeros y alentar a que se dediquen recursos a esos esfuerzos.	1
Después de empezado el proceso de recolección de armas, llegaron otros seis vehículos de las Naciones Unidas que transportaban a oficiales de la UNPOL, entre ellos al Sr. Malik.	1
Es necesario que adopten medidas adecuadas para reprimir la financiación del terrorismo.	0
Así pues, el conflicto no consiste meramente en una situación de tensiones internas y de disturbios interiores, motines o actos esporádicos y aislados de violencia, sino que se cumplen los requisitos de a) existencia de grupos armados organizados que luchan contra las autoridades centrales, b) control por parte de los rebeldes de parte del territorio y c) enfrentamiento armado prolongado, previstos en el artículo 3 común a los Convenios de Ginebra que confieren a esta situación el carácter de conflicto armado interno.	0
A solicitud del Presidente, la Misión de las Naciones Unidas para la Respuesta de Emergencia al Ébola (UNMEER) estableció una pequeña oficina en Bamako, que entró en funcionamiento el 26 de noviembre, bajo la dirección de un gestor de la crisis del Ébola encargado de prestar apoyo al Gobierno para detener el brote del Ébola y fomentar su preparación para combatir la enfermedad. El 13 de diciembre, el último paciente conocido fue dado de alta del hospital.	0
En particular, el Primer Ministro Seniora me ha informado de que se está celebrando un diálogo interno sobre la disposición de la resolución relativa a la disolución y el desarme de las milicias, que ha iniciado recientemente, y está decidido a que concluya con éxito.	0
Algunos Estados tienen la capacidad de congelar sin demora los fondos y activos vinculados al terrorismo, aunque en la mayoría de los casos se trata de una capacidad limitada.	0
En el párrafo 67 de su opinión el Abogado General expone cinco razones por las que el control minucioso no es aplicable en este contexto: a) el carácter preventivo de las sanciones contra Al-Qaida; b) el contexto internacional del acto impugnado; c) la necesidad de alcanzar un equilibrio entre las exigencias de la lucha contra el terrorismo y las de la protección de los derechos fundamentales; d) el carácter político de las evaluaciones del Comité 1267; y e) las mejoras de los procedimientos de supresión de la Lista por el Comité 1267 en los últimos años, particularmente desde la decisión de 2008 del Tribunal de Justicia de la Unión Europea en la causa Kadi.	0
Aunque la Comisión recibió información de una fuente de que alguien cercano al Sr. Hariri y en quien éste confiaba había manipulado los dispositivos de interferencia antes de la explosión, la Comisión no ha podido corroborar esa información.	1
Esos países también se enfrentan a los importantes problemas que entrañan las corrientes transfronterizas de refugiados.	0
b) La Asamblea General y el Consejo de Derechos Humanos deberían ampliar los mecanismos de vigilancia e información sobre los derechos humanos en la República Popular Democrática de Corea que son anteriores al establecimiento de la comisión; se incluyen aquí los informes periódicos del Secretario General y del Alto Comisionado de la Naciones Unidas para los Derechos Humanos así como el mandato del Relator Especial sobre la situación de los derechos humanos en la República Popular Democrática de Corea.	1
Los Estados de la subregión vigilan sus puntos débiles en lo que a tráfico de armas se refiere y han establecido marcos normativos a fin de tipificar como delito el tráfico ilícito y controlar la producción, venta y transferencia de armas y explosivos.	1
A fin de asegurar que haya una rendición de cuentas respecto de los delitos cometidos durante los acontecimientos recientes, es indispensable que las investigaciones, las acusaciones y los juicios se lleven a cabo en forma imparcial y sin interferencia política alguna, y que se compruebe que efectivamente así se ha hecho.	1
En las deliberaciones sobre el papel del Presidente, varios participantes reconocieron que había que evitar dos "trampas": en primer lugar, intentar lograr objetivos nacionales para dirigir la labor del Consejo hacia intereses concretos; y el segundo lugar, asumir un tipo de liderazgo demasiado apartado y formulista.	0
Reafirmando la necesidad de combatir por todos los medios, de conformidad con la Carta de las Naciones Unidas y el derecho internacional, incluidas las normas aplicables del derecho de los derechos humanos, el derecho de los refugiados y el derecho humanitario, las amenazas para la paz y la seguridad internacionales que constituyen los actos terroristas, y destacando a este respecto la importante función que desempeñan las Naciones Unidas en la dirección y coordinación de esta labor,	0
El 25 de mayo, el Presidente del Comité establecido en virtud de la resolución 1267 (1999) relativo a Al-Qaida y los talibanes, Embajador Heraldo Muñoz (Chile), presentó al Consejo su primer informe oral correspondiente a un período de 120 días sobre la labor del Comité y del equipo encargado de prestar apoyo analítico y vigilar la aplicación de las sanciones, según lo previsto en el párrafo 12 de la resolución 1526 (2004).	0
La Misión preguntó a los militares del Gobierno sobre los rumores según los cuales unas 70 personas, en su mayoría musulmanes, habían muerto a manos de soldados del Gobierno después de que éstos recuperaran la ciudad.	0
No obstante, la Dirección Ejecutiva ha observado que, incluso en esos Estados, la atención a las cuatro esferas clave de gobierno (el fortalecimiento del sistema de control de las fronteras; el fomento de la capacidad del sistema de justicia penal para garantizar el estado de derecho; el mejoramiento de la coordinación y el intercambio de información entre los organismos nacionales pertinentes; y el fortalecimiento de la cooperación institucional transfronteriza con los Estados vecinos) parece tener efectos altamente significativos en la capacidad de lucha contra el terrorismo. Eso es cierto incluso en aquellos casos en que el desarrollo en otros sectores es relativamente limitado.	1
43. Reitera la necesidad de estrechar la cooperación que mantienen el Comité, el Comité contra el Terrorismo y el Comité establecido en virtud de la resolución 1540 (2004), así como sus respectivos grupos de expertos, incluso, cuando corresponda, mediante un mayor intercambio de información, la coordinación de las visitas a los países como parte de sus respectivos mandatos, la facilitación y vigilancia de asistencia técnica, las relaciones con organizaciones y organismos internacionales y regionales, y otras cuestiones de importancia para los tres comités, expresa su intención de proporcionar orientación a los comités sobre asuntos de interés común a fin de coordinar mejor sus actividades y facilitar esta cooperación, y solicita al Secretario General que tome las disposiciones necesarias para que los grupos compartan instalaciones cuanto antes;	1
t) Consultar con los servicios de inteligencia y seguridad de los Estados Miembros, incluso por medio de los foros regionales, a fin de facilitar el intercambio de información y reforzar la aplicación de las medidas;	0
La misión fue testigo de una espiral creciente de violencia, en medio de la cual los efectivos de mantenimiento de la paz fueron objeto de ataques directos por parte de los extremistas.	0
El 25 de junio de 2008 el Comité celebró consultas oficiosas con el Grupo de Supervisión restablecido en cumplimiento de la resolución 1811 (2008) y examinó asimismo la solicitud del Consejo de Seguridad contenida en los párrafos 6 y 7 de la resolución 1814 (2008) de que presentara recomendaciones para imponer medidas específicas contra las personas y entidades que bloquearan el proceso de paz o violaran el embargo de armas.	0
El Primer Ministro Latortue pidió al Consejo Electoral Provisional que estudiara este calendario, con el apoyo de la MINUSTAH, teniendo presente que ha de cumplirse el requisito constitucional de que la asunción del Presidente tenga lugar el 7 de febrero de 2006, y que hiciera los cambios oportunos.	0
En el curso de los dos días siguientes un grupo de lugareños somalíes subió a bordo un cañón que se montó en la cubierta superior del Alpha Serengeti.	0
En su último informe sobre la protección de los civiles en los conflictos armados (S/2012/376), el Secretario General indicó que el estado de la protección de los civiles seguía siendo pésimo y que existía una clara necesidad de que los compromisos normativos se tradujeran en mejoras concretas para la protección de los civiles sobre el terreno.	0
El Equipo da cuenta de los progresos hechos por la comunidad internacional para limitar la circulación de los terroristas y de quienes los apoyan, incluida la iniciativa conjunta reciente de la Interpol y el Consejo de Seguridad que dio por resultado la publicación de un aviso internacional, con datos de identidad, descripciones, fotografías e impresiones dactilares, de las personas incluidas en la lista consolidada.	1
El Grupo de Trabajo facilitó y copresidió una conferencia internacional sobre estrategias nacionales y regionales contra el terrorismo, en la que los participantes definieron una serie de principios que los Estados Miembros y las organizaciones regionales debían tener en cuenta cuando formulasen sus respectivas estrategias.	0
Apoyo a la creación de asociaciones y redes de periodistas y defensa de la seguridad de las profesionales de los medios de comunicación y de los medios de comunicación independientes dirigidos por asociaciones de mujeres; fomento de la capacidad en las facultades de periodismo.	0
Casi la mitad de las solicitudes son planteadas por particulares sin asesor jurídico y la Ombudsman toma las medidas necesarias para asegurar que ningún peticionario resulte perjudicado por no tener representación legal.	1
Del 14 al 18 de octubre, la UNOWA y la UNOCA participaron en un taller organizado por la Comisión de la Cuenca del Lago Chad en Yaundé, con miras a elaborar una estrategia regional de lucha contra el terrorismo y examinar la cuestión del establecimiento del equipo de tareas multinacional conjunto.	1
Es más, la participación de un componente civil fuerte es fundamental para la prestación de asistencia humanitaria, el restablecimiento del orden público, el funcionamiento de las instituciones públicas, la reconstrucción, la rehabilitación y la consolidación de la paz para el desarrollo sostenible a más largo plazo.	1
La presencia de la fuerza es crucial para mantener un clima de seguridad que impida que los testigos sean sobornados y les permita acceder sin temor a las instalaciones del Tribunal.	1
Prestación de asesoramiento técnico y en materia de políticas del asesor en cuestiones de género asignado a la oficina regional de apoyo del ONUSIDA para África oriental y meridional para la incorporación de las cuestiones de la mujer y el VIH/SIDA en los programas nacionales de lucha contra el SIDA.	1
Cuatro Estados han adoptado disposiciones jurídicas apropiadas para reprimir el reclutamiento de terroristas.	1
También ayudará al Comité a evaluar las necesidades de asistencia técnica con miras a encontrar medios más eficaces de facilitar la prestación de esa asistencia a los Estados Miembros que la necesitan.	1
b) Si cometiere ese acto durante una situación de estado de emergencia nacional o de estado de guerra.	0
Es por lo tanto indispensable que el mando y control de las operaciones de las fuerzas armadas se ejerzan a nivel central.	0
