es	MatCoop
Los Estados deben establecer más bien un marco jurídico claro, completo y coherente que tipifique expresamente los actos de terrorismo como delitos graves, castigue esos actos según su gravedad, determine la jurisdicción aplicable y facilite a los tribunales el enjuiciamiento de los terroristas.	1
El uso de la fuerza letal en esas situaciones debe respetar los principios de distinción y proporcionalidad, y los responsables de su violación deben rendir cuentas.	0
Mediante la iniciativa de Vigilancia de la Comunidad, la UNMIK ha fortalecido sus vínculos con las comunidades locales.	1
6. Recuerda su decisión contenida en la resolución 1373 (2001) de que todos los Estados Miembros velen por el enjuiciamiento de toda persona que participe en la financiación, planificación, preparación o comisión de actos de terrorismo o preste apoyo a esos actos, y decide que todos los Estados se cercioren de que sus leyes y otros instrumentos legislativos internos tipifiquen delitos graves que sean suficientes para que se pueda enjuiciar y sancionar de modo que quede debidamente reflejada la gravedad del delito:	0
Sin embargo, los flujos de inmigrantes y refugiados en la región, procedentes de zonas en conflicto de Oriente Medio y África, siguen representando un problema para las autoridades de inmigración.	0
En nombre del Comité del Consejo de Seguridad establecido en virtud de la resolución 1540 (2004), y de conformidad con el párrafo 8 de la resolución 1810 (2008) del Consejo de Seguridad, adjunto a la presente un informe sobre la consideración por el Comité de un examen amplio del estado de la aplicación de la resolución 1540 (2004) (véase el anexo).	0
Como parte de la estrategia de transición destinada a establecer una institución policial independiente, se han puesto en marcha los preparativos para la transferencia de las responsabilidades de la Escuela del Servicio de Policía de Kosovo y la Policía de la UNMIK a dicho servicio.	1
Por su esencia, el terrorismo se opone a los valores fundamentales de la humanidad consagrados en la Carta de las Naciones Unidas y los documentos fundamentales sobre derechos humanos.	0
Los Emiratos Árabes Unidos y Jordania han introducido varias mejoras importantes en las políticas de seguridad aérea, los programas y la aplicación de controles de seguridad a nivel de los aeropuertos.	1
Según el Servicio de Actividades relativas a las Minas, los dispositivos explosivos improvisados constituyen un sistema de armas especialmente peligroso debido a su versatilidad, adaptabilidad y método de utilización.	1
Tras haber obtenido la aprobación del Comité, la Dirección Ejecutiva dirigió en septiembre de 2008 una misión conjunta a Madagascar, en la que participaron el Comité y el Equipo Especial sobre la Ejecución de la Lucha contra el Terrorismo.	1
El consorcio creará y mantendrá un archivo en línea para recopilar y poner a disposición de investigadores, analistas y encargados de la formulación de políticas las versiones no editadas de las exposiciones de los participantes del Grupo de Contacto que reflejen sus opiniones acerca de las iniciativas internacionales emprendidas desde 2008 para combatir la piratería frente a las costas de Somalia.	1
Condené esas restricciones a la libertad de circulación del personal de mantenimiento de la paz de las Naciones Unidas.	0
La amenaza de Al-Qaida y los talibanes	0
El concepto de crear inventarios de referencia organizando un estudio de las armas pequeñas como etapa inicial de la elaboración de proyectos está empezando a establecerse y ha resultado útil en la elaboración y evaluación de proyectos.	1
El fenómeno de los combatientes terroristas extranjeros no puede abordarse exclusivamente desde el ámbito de la seguridad.	1
El 13 de marzo de 2014, luego de que el Consejo de Seguridad aprobara la resolución 2136 (2014) el 30 de enero, el Secretario General nombró a seis personas para integrar el Grupo de Expertos hasta el 1 de febrero de 2015, especializadas en armas, grupos armados, aduanas/aviación, financiación, recursos naturales y cuestiones regionales (véase S/2014/183).	1
El pago de varios jugosos rescates a Al-Qaida y sus entidades afiliadas en los últimos años han hecho que el secuestro se convierta en una de las tácticas básicas de Al-Qaida.	0
En la región de Hiraan, en el centro de Somalia, los duros combates que tuvieron lugar los días 7 y 8 de julio entre los subclanes galje'el y jajele del clan hawiye por el control de la tierra y el agua en la parte occidental de Beletweyne provocaron 36 muertos y 70 heridos.	0
Resulta significativo que algunos Estados hayan comenzado hace poco a examinar sus estados de emergencia o les hayan puesto fin.	1
La comisión ha formulado una serie de recomendaciones para que se adopten medidas inmediatas al objeto de poner fin a las violaciones de los derechos humanos y atender las preocupaciones planteadas por la comisión en lo que respecta a los derechos humanos, incluidas recomendaciones específicamente dirigidas al Consejo de Seguridad, que merecen la atención y consideración del Consejo.	1
6. Insta a los Estados y a todas las demás partes en los conflictos armados a que hagan todo lo posible por impedir que se cometan violaciones del derecho internacional humanitario contra civiles, incluidos los periodistas, los profesionales de los medios de comunicación y su personal asociado;	0
Se informó de conversaciones entre las personas que se proponían acudir a la manifestación y las fuerzas de seguridad, en algunos casos cara a cara.	1
Aumento de la representación de la mujer en los órganos relacionados con los programas. D.3 Capacitación sistemática sobre cuestiones de género para el personal humanitario de todas las categorías. Aumento de la conciencia y fomento de la capacidad del personal humanitario y los asociados que ejecutan programas y proyectos de emergencia y rehabilitación en relación con el análisis de género y los instrumentos participativos.	1
La situación de las minorías sigue siendo motivo de preocupación, especialmente en cuanto a la libertad de circulación y el acceso a la justicia.	0
Aunque se sabe que hay células locales que intervienen en operaciones delictivas de poca monta, por ejemplo fraudes con tarjetas de crédito o tráfico de drogas, y la Oficina de las Naciones Unidas contra la Droga y el Delito ha informado de que grupos que operan a ambos lados de la frontera entre el Afganistán y el Pakistán, la República Islámica del Irán y Uzbekistán cobran tributos de tránsito a quienes transportan drogas, en beneficio de los talibanes, son pocas todavía las pruebas convincentes de que haya una participación en gran escala de grupos terroristas en el tráfico de drogas u otros delitos organizados.	0
En Libia, Ansar al-Sharia ha reforzado su presencia en el este del país, en particular en Derna y Benghazi, y ha perpetrado numerosos asesinatos de miembros de las fuerzas de seguridad nacionales y otras instituciones del Estado.	0
Cuanto más numerosas sean las bajas o más espectaculares sean sus atentados, mayor será la difusión que les den los medios de información.	0
b) Facilitar el establecimiento de los mecanismos regionales necesarios para la cooperación internacional en los procesos penales;	1
Observa que los civiles constituyen la gran mayoría de los desplazados internos y otros grupos vulnerables en las situaciones de conflicto armado, por lo cual tienen derecho a la protección que debe brindarse a los civiles con arreglo al derecho internacional humanitario vigente.	0
Por tanto, instó al Consejo a que pasara del enfoque de "según sea necesario" a un criterio "más activo", para aumentar el interés de los no miembros por su labor.	0
La Organización Internacional de Policía Criminal (INTERPOL) llevó a cabo programas de creación de capacidad en materia de lucha contra el terrorismo en la región del Sahel y el Cuerno de África dirigidos a mejorar el intercambio de información entre los organismos, fortalecer su respuesta operacional integrada en la región y ampliar el uso de su red de comunicación segura, bases de datos y servicios.	1
Las actividades periódicas de adiestramiento se realizan atendiendo a un plan anual. El 11 de agosto se llevaron a cabo en Mitrovica las actividades de capacitación en materia de primeros auxilios a cargo de bomberos franceses de la brigada multinacional (nordeste). El 30 de agosto, la brigada multinacional (este) organizó un seminario en Tradoc para los comandantes de las zonas de recogida. El objetivo era presentar detalladamente el programa de capacitación de oficiales para asegurarse de que los comandantes entendieran sus responsabilidades y prestaran apoyo al programa. Conclusión La situación general en Kosovo permanece relativamente en calma, con tensiones latentes que se mantendrán en el futuro previsible.	1
La planificación integrada para orientar la colaboración y las operaciones de las Naciones Unidas en apoyo del cumplimiento del mandato antes y después del período del referendo se finalizó en julio, y tanto la UNMIS como el equipo de las Naciones Unidas en el país establecieron las estructuras para coordinar las prioridades definidas.	1
Habiendo determinado que la situación imperante en Somalia sigue constituyendo una amenaza para la paz y la seguridad internacionales en la región,	0
Abdelrahman Mouhamad Zafir al Dabidi al Jahani está asociado con Al-Qaida o una célula, entidad afiliada, grupo escindido o derivado de ella por "participar en la financiación, planificación, facilitación, preparación o comisión de actos o actividades ejecutados" por Jabhet al-Nusra, alias del Frente Al-Nusra para los Pueblos del Levante (QE.A.137.14), "o realizados en o bajo su nombre, junto con él o en su apoyo" y "reclutar para él".	0
También sentarán las bases de un mecanismo efectivo de control de las armas de fuego que sirva a las autoridades de ayuda para controlar la posesión de armas.	1
La aplicación de medidas de autoprotección, en particular el despliegue de personal privado de protección armada a bordo de buques y los destacamentos de protección de buques, junto con un mayor conocimiento de la situación, la capacitación y las maniobras evasivas y el empleo de rutas marítimas seguras por los buques comerciales también pueden haber desalentado los ataques de los piratas contra los barcos.	1
La Comisión recibió pruebas en las que se demostraba que los jefes del campamento habían secuestrado a civiles y los habían retenido en el campamento, donde habían sido sometidos a torturas y forzados a trabajar.	0
12. Exhorta a los Estados Miembros a que actúen enérgicamente y con decisión para interrumpir las corrientes de fondos y otros activos financieros y recursos económicos a las personas y entidades incluidas en la Lista relativa a las sanciones contra Al-Qaida, según lo dispuesto en el párrafo 1 a), y teniendo en cuenta las recomendaciones del Grupo de Acción Financiera y las normas internacionales pertinentes cuyo objetivo es evitar el uso indebido de las organizaciones sin fines de lucro y los sistemas de envíos de remesas no oficiales o alternativos y la circulación transfronteriza de divisas en efectivo, y al mismo tiempo procuren mitigar los efectos sobre las actividades legítimas realizadas por esos medios;	0
Con la ayuda de los donantes, en lo que va de año se han reconstruido unas 20.000 casas de familias vulnerables cuyos hogares resultaron destruidos o sufrieron graves daños durante el conflicto.	1
Parece faltar, sin embargo, el elemento determinante de la intención genocida, al menos en lo que atañe a las autoridades del Gobierno central.	0
El grupo de política de la Misión encargado de examinar la explotación y el abuso sexuales está completando la elaboración de un código de conducta de la ONUCI a este respecto y participa en la red del país que se ocupa de estas cuestiones.	1
Por nuestra parte, consideramos que la cuestión de la legitimidad está directamente relacionada con la celebración de las elecciones, cuyos preparativos están en marcha en el Órgano Conjunto de Gestión Electoral.	0
No obstante, estimamos que una retirada abrupta sería contraproducente y crearía un vacío sin precedente, especialmente teniendo en cuenta el hecho de que no existen las condiciones propicias para la tan esperada inversión en gran escala y para un desarrollo sostenible.	0
Los principales aspectos de la declaración del Encargado de Negocios, así como el intercambio de opiniones entre los miembros del Grupo de Trabajo, se reflejan en el resumen que figura en las conclusiones pertinentes (S/AC.51/2014/2).	0
:: Se mantenga una coordinaciуn sistemбtica entre los componentes civiles y militares de la misiуn y con los agentes humanitarios con el fin de consolidar los conocimientos adquiridos en materia de protecciуn de la poblaciуn civil.	1
La lucha por el poder se manifiesta de diversas formas y tiene por objeto granjearse el apoyo de las distintas fuerzas sociales que coexisten en la sociedad civil y la opinión pública a fin de obtener más apoyo popular o influencia.	1
La participación de la industria y el sector privado es fundamental para aplicar marcos reguladores basados en la resolución 1540 (2004). El riesgo de que las armas de destrucción en masa lleguen a manos de los agentes no estatales solo podrá abordarse de manera eficaz si el sector privado coopera con la industria.	1
La víctima quedó embarazada como consecuencia de la violación y había dado a luz.	0
Apoyo a los grupos temáticos sobre el género en situaciones posteriores a conflictos, en colaboración con los asesores en cuestiones de género de las misiones de mantenimiento de la paz y otros equipos en los países, organismos, fondos y programas de las Naciones Unidas.	1
A todas luces es esencial que los Estados aseguren que sus regímenes de control, tanto de los explosivos militares como de los civiles, sean lo más estrictos posible.	0
:: Respeto del derecho de los refugiados y desplazados internos a regresar en forma voluntaria y en condiciones de seguridad y dignidad a sus lugares de origen.	1
Su falta de voluntad para implantar el Estado de derecho y velar por que se respete la soberanía y la integridad territorial de un Estado Miembro de las Naciones Unidas ha menoscabado su credibilidad, así como su autoridad jurídica y moral.	0
Pocos Estados de los que han presentado informes han facilitado información sobre las medidas en vigor para impedir que se abuse de las obras de beneficencia u otras organizaciones sin fines de lucro, si bien 63 Estados les exigen que obtengan una autorización o se inscriban.	1
Las principales facciones palestinas en el Líbano han manifestado su preocupación por los incidentes y se han desvinculado de Fatah al-Islam.	0
Una vez implementadas, las medidas contribuirían considerablemente a aumentar la capacidad de Somalia para llevar a cabo operaciones de lucha contra la piratería frente a sus costas.	0
La Comisión, si bien tuvo en cuenta todos los acontecimientos relacionados con el actual conflicto en Darfur, se centró en particular en los que tuvieron lugar entre febrero de 2003, mes en que la magnitud, intensidad y periodicidad de los incidentes aumentaron notablemente, y mediados de enero del 2005, justo antes de la fecha en que la Comisión tenía que presentar su informe. 3. Métodos de trabajo	1
o) Elaborar y aplicar, en estrecha consulta con las autoridades [nacionales] ... un programa multianual conjunto de las Naciones Unidas de apoyo a la justicia a fin de desarrollar la cadena de justicia penal, la policía, el poder judicial y el sistema penitenciario en las zonas afectadas por el conflicto y prestar apoyo programático estratégico a nivel central ...;	1
:: Pedir a las misiones que presten apoyo a los gobiernos anfitriones para hacer frente a la violencia sexual de forma explícita en los procesos de desarme, desmovilización y reintegración, los procesos de reforma del sector de la seguridad y las iniciativas de reforma del sector de la justicia, así como para elaborar y aplicar planes de acción concretos y con plazos determinados para luchar contra la violencia sexual relacionada con los conflictos.	0
Está claro que el Ministro Ramos-Horta planteó la cuestión general de la distribución de las armas.	0
La Misión de Determinación de los Hechos que investiga las denuncias de empleo de sustancias químicas tóxicas como armas en la República Árabe Siria prosigue su trabajo.	1
En el programa se examinan cuestiones relativas a los derechos humanos que suelen plantearse en las diversas etapas del proceso de justicia penal en casos de terrorismo.	1
En cumplimiento de esas resoluciones este órgano debe exigir al Gobierno de los Estados Unidos juzgar de inmediato a Luis Posada Carriles por sus actos terroristas o extraditarlo a la República Bolivariana de Venezuela, cuya justicia lo reclama desde hace años.	0
Aun así, en Puerto Príncipe, el acusado aumento de la violencia y la delincuencia, incluidos los secuestros, generó grave preocupación entre la población durante mayo y junio.	0
D. Escuchar con mayor atención a las víctimas El creciente reconocimiento de la importancia de escuchar a las víctimas del terrorismo a la hora de elaborar estrategias eficaces de lucha contra la incitación está estrechamente vinculado con el concepto de argumento opuesto.	1
:: Aprovechar la presencia de civiles u otras personas protegidas para que queden inmunes frente a las operaciones militares determinados puntos, zonas o fuerzas militares;	0
En ese período el equipo realizó investigaciones en lugares concretos acordados previamente, como campamentos de personas desplazadas dentro del país y aldeas destruidas, y mantuvo contactos con el SLA y con funcionarios gubernamentales.	1
El oficial a cargo del lugar del crimen, General Naji Mulaeb, de las Fuerzas de Seguridad Interna, llegó al lugar a las 13.05 horas del 14 de febrero de 2005. Ha dado a conocer un informe de fecha 3 de marzo de 2005 sobre el examen realizado por las autoridades del Líbano [Dirección General de las Fuerzas de Seguridad Interna, Unidad de Policía de Beirut, referencia No. 95] en la que expone lo siguiente:	1
La prisión se ha construido para proporcionar condiciones de detención humanas y seguras en consonancia con las normas internacionales de derechos humanos.	1
Me sigue preocupando que la desconfianza entre las partes, sumada a la continua presencia de las milicias, pueda provocar tensiones, y posiblemente inseguridad e inestabilidad dentro y fuera del Líbano.	0
Los movimientos, reconociendo el papel constructivo y fidedigno de Argelia en la promoción y búsqueda de una salida definitiva de la crisis, expresaron su confianza plena en la prosecución de los esfuerzos y el aumento de la participación de ese país en la búsqueda de la anhelada solución definitiva del conflicto.	0
El Gobierno del Líbano me comunicó que en las últimas semanas había adoptado medidas significativas para restringir esa corriente de armas y personas y la libre circulación de armas y elementos armados de y hacia los campamentos de refugiados palestinos en el Líbano, en particular desde fines de septiembre de 2005.	1
Toda la evidencia concreta que se encontró en el lugar se entregó más tarde a las Fuerzas de Seguridad Interna (General Hisham Aouar) y, por lo que sabía el General Azar, había algunos fragmentos de metal y un revólver.	1
Informaron a la UNMIK de que se presentaría cuanto antes al Parlamento de la República Federativa de Yugoslavia un proyecto de ley de amnistía que abarcaba a los prisioneros políticos detenidos en Serbia.	1
No obstante, es evidente también que el mando de las F-FDTL adoptó medidas limitadas para verificar el alcance de la amenaza planteada o para utilizar medios no militares de resolver la amenaza percibida. El 25 de mayo el Alto Mando de las F-FDTL no intentó ponerse en contacto con los responsables del mando operacional de la PNTL ni pedir la intervención del Primer Ministro o del Presidente para resolver la situación.	0
Partiendo de la base del examen completo de todas las personas y entidades incluidas en la Lista que se llevó a cabo en 2010, con arreglo al párrafo 25 de la resolución 1822 (2008), el Comité ha instituido numerosos mecanismos para asegurarse de que la Lista refleje el peligro que significa Al-Qaida y de revisar periódicamente cada una de las entradas a fin de determinar si procede mantenerla.	1
Estoy profundamente agradecido a mi Representante Especial en ejercicio para Malí, Sr. David Gressly, y a mi Representante Especial Adjunto, Sr. Arnauld Akodjénou, así como a todo el personal civil y uniformado de las Naciones Unidas en Malí, por la constante y ardua labor que desempeñan en condiciones muy difíciles para restablecer una paz y estabilidad duraderas en el país.	0
La Comisión ha tenido acceso a una enorme cantidad de informes procedentes de diversas fuentes que documentan que en todo Darfur, desde principios de 2003 hasta la fecha de publicación del presente informe, se ha cometido un gran número de asesinatos de civiles.	0
El Consejo de Seguridad insta al Gobierno de la República Democrática del Congo a que acelere la investigación de la violación masiva cometida en noviembre de 2012 por elementos de las FARDC en Minova y lleve a los responsables ante la justicia.	0
Tayikistán estableció el Departamento de Supervisión Financiera (su unidad de inteligencia financiera) en octubre de 2009 y preparó un nuevo proyecto de ley contra el blanqueo de dinero y la financiación del terrorismo en noviembre de 2010.	1
Desarrollo de un conjunto de políticas, directrices y procedimientos para la planificación, la ejecución y el seguimiento de los programas de desarme, desmovilización y reintegración, conocido como normas integradas para los programas de desarme, desmovilización y reintegración, e integración de perspectivas de género.	1
Los fondos restantes se utilizarán para financiar la aplicación de medidas adicionales de mitigación, entre ellas la capacitación antes del despliegue y el establecimiento de sistemas de alerta y vigilancia, incluso con equipos caninos, en los campamentos de la MINUSMA.	1
El Gobierno de la República Árabe Siria subraya que es su deber proteger a los ciudadanos, desarmar a los terroristas y hacer que los responsables rindan cuentas de sus actos. El Gobierno reitera que está haciendo todo lo posible por encontrar una solución política a la crisis que vive la República Árabe Siria, en cooperación con el Enviado Especial, Kofi Annan, para lo cual está reforzando las medidas democratizadoras que puso en marcha en marzo del año pasado en diversos sectores. Cabe citar, entre otras, el levantamiento del estado de excepción; la promulgación de leyes sobre el multipartidismo; las elecciones a los gobiernos locales y la libertad de los medios de comunicación; las medidas relativas a la situación económica de los ciudadanos; la promulgación de la nueva constitución; y otras medidas para revitalizar la participación política y fomentar el pluralismo y la democracia con miras a la aprobación de un proceso de reforma general.	1
La Dirección Ejecutiva del Comité contra el Terrorismo se estableció por un período inicial que terminaría el 31 de diciembre de 2007 y con sujeción a un examen completo que el Consejo de Seguridad realizaría a más tardar el 31 de diciembre de 2005.	1
En ocasiones, estas medidas se inscriben en el contexto de la acción preventiva, cuando los actos terroristas están supuestamente en su fase preparatoria.	0
Además, el grupo asignado a Darfur occidental visitó campos de refugiados en el Chad y el grupo asignado a Darfur meridional visitó el Centro de Detención de la Seguridad Nacional en Nyala.	0
Como Fiscal, me ocuparé de cualquier impugnación judicial del Presidente Al-Bashir y de otros sospechosos en el tribunal.	0
La estrategia también procura ampliar el círculo de donantes mediante la inclusión de países en los que se hayan elaborado enfoques o sistemas de lucha contra el terrorismo particularmente efectivos.	1
Entretanto, la actitud poco cooperativa de las autoridades locales, la inexistencia de un plan general de reforma de las Fuerzas de Defensa y de Seguridad de Côte d'Ivoire y la falta de acuerdo entre las parte de Côte d'Ivoire con respecto al despliegue de los agentes de la policía y la gendarmería de Côte d'Ivoire en las regiones septentrionales obstaculizaron el asesoramiento del componente de policía de la ONUCI al Gobierno de Reconciliación Nacional acerca de la reestructuración de las Fuerzas de Defensa y de Seguridad de Côte d'Ivoire y la asistencia para el restablecimiento de una presencia de la policía civil en todo el país.	0
Los miembros del Consejo dijeron que las Naciones Unidas debían liderar la respuesta internacional a las necesidades de Libia posteriores al conflicto.	1
El Consejo de Seguridad acoge con beneplácito, a este respecto, la reunión inaugural del equipo de tareas conjunto de las Naciones Unidas y la Unión Africana sobre paz y seguridad que se celebró el 25 de septiembre de 2010 y alienta al equipo de tareas a centrarse en cuestiones estratégicas y específicas de los países del continente que interesen a ambas organizaciones.	0
Estrategia de lucha contra el terrorismo: coordinación de los organismos encargados de hacer cumplir la ley	1
