es	MatCoop
La OTAN ha suministrado fuerzas adicionales para garantizar que exista un ambiente seguro para la celebración de las elecciones para la Asamblea Nacional y los Consejos Provinciales, previstas para el 18 de septiembre (véase el párrafo 15).	1
Bajo la dirección de mi Representante Especial, la UNOMIG continuó su labor dirigida a promover la estabilidad en la zona de conflicto y hacer avanzar el diálogo entre las partes de Georgia y Abjasia sobre cuestiones políticas y de seguridad, el regreso de los refugiados y desplazados internos y la cooperación económica, objetivos que recibieron el apoyo de la reunión de alto nivel del Grupo de Amigos celebrada en Ginebra bajo la presidencia de las Naciones Unidas (véase S/2003/412, párr. 3).	1
Exhorta a todos los Estados Miembros, en particular a los Estados de la región, a que, actuando a título nacional o por conducto de organizaciones o acuerdos nacionales, y a fin de garantizar la estricta aplicación del embargo de armas establecido en [las disposiciones de la resolución pertinente], inspeccionen en su territorio, incluidos los puertos y aeropuertos, y en alta mar, los buques y las aeronaves con origen o destino en [el Estado afectado], si el Estado en cuestión tiene información que ofrezca motivos razonables para creer que la carga contiene artículos cuyo suministro, venta, transferencia o exportación estén prohibidos en virtud de [el párrafo de la resolución pertinente] ..., incluido el suministro de personal mercenario armado, exhorta a todos los Estados del pabellón de esos buques y aeronaves a cooperar con esas inspecciones, y autoriza a los Estados Miembros a aplicar toda medida acorde con las circunstancias concretas para realizar esas inspecciones	0
34. Destaca la importancia que tienen las consultas y la cooperación entre las Naciones Unidas, el Comité Internacional de la Cruz Roja y otras organizaciones pertinentes, incluidas las organizaciones regionales, para mejorar la protección de los civiles en los conflictos armados;	0
El Representante Especial Adjunto del Secretario General indicó que desde el estallido del conflicto en diciembre de 2013 se había recibido por conducto del mecanismo de supervisión y presentación de informes, información que indicaba que ambas partes en el conflicto eran responsables de violaciones y abusos contra los niños, que incluían asesinatos y mutilaciones, reclutamiento y utilización y violencia sexual.	0
7. Pide al Representante Ejecutivo del Secretario General que facilite y promueva el diálogo entre los interesados nacionales e internacionales, en particular en el contexto de las próximas elecciones, y que continúe apoyando sus esfuerzos por mantener la paz y la estabilidad;	0
Un Grupo de Expertos creado en virtud de la resolución 1929 (2010) actúa bajo la dirección del Comité, al que ayuda a cumplir su mandato.	1
El Grupo de las Naciones Unidas para el Desarrollo colabora con los Comités Ejecutivos en aras del objetivo general de lograr la consolidación de la paz y formula políticas, directrices y procedimientos para mejorar la labor de la red de equipos de las Naciones Unidas en los países.	1
Aplicación de la política de la Oficina sobre la igualdad entre los géneros y de su plan de acción para incorporar las cuestiones en género en cuatro ámbitos de actividad: coordinación, gestión de la información, promoción y políticas.	1
:: Algunos miembros de Consejo de Seguridad instaron a los Estados Miembros que todavía no lo hubieran hecho a que pasaran a ser parte de los convenios, convenciones y protocolos relacionados con la lucha contra el terrorismo negociados bajo los auspicios de las Naciones Unidas.	0
25. Solicita a todos los Estados Miembros, pero especialmente al Gobierno del Afganistán, que informen al Comité si tienen conocimiento de cualquier información que indique que una persona, grupo, empresa o entidad que se haya suprimido de la Lista debería ser designado con arreglo al párrafo 1 de la presente resolución, y solicita además que el Gobierno del Afganistán presente al Comité un informe anual sobre la situación de las personas de cuya reconciliación se haya informado y que el Comité haya suprimido de la Lista el año anterior;	0
Reafirmando la declaración de su Presidencia aprobada en la sesión del Consejo que se celebró a nivel de Jefes de Estado y de Gobierno el 31 de enero de 1992 (S/23500), inclusive la necesidad de que todos los Estados Miembros cumplan sus obligaciones en relación con el control de armamentos y el desarme y eviten la proliferación en todos sus aspectos de todas las armas de destrucción en masa,	0
Los enfoques de la rehabilitación difieren entre Estados, pero cada vez se presta más atención al intercambio de experiencias y la determinación de mejores prácticas en esta esfera.	1
En primer lugar, el terrorismo se debe entender como un delito, injustificable en cualquier circunstancia. Sin embargo, también es una manifestación de reivindicaciones, expresada de una forma inhumana, detestable e inaceptable.	0
Para concluir, deseo dar las gracias a mi Representante Especial, Ameerah Haq, por su liderazgo, y a todo el personal de la UNMIT y del equipo de las Naciones Unidas en el país por su empeño en apoyar al pueblo de Timor-Leste para promover la causa de la paz, la estabilidad y el desarrollo.	1
También aumentan los centros regionales de lucha contra el terrorismo, en los que se pueden determinar las prácticas más adecuadas con respecto a la aplicación de las sanciones, conforme a las condiciones particulares correspondientes.	1
Los nacidos antes del 25 de mayo de 1988 o reclutados después del 25 de mayo de 2006 debían licenciarse de inmediato, como lo establece el Acuerdo General de Paz.	1
Instamos a la Autoridad Palestina a que haga todo lo posible para poner fin a esos ataques.	0
Mauricio introdujo en 2009 un nuevo sistema de control fronterizo que registra en una base los datos de los pasajeros a su entrada o salida del aeropuerto internacional.	1
Algunos Estados y organizaciones regionales también han puesto en marcha otras iniciativas relacionadas con el control fronterizo, como sistemas de notificación o autorización que requieren que los viajeros faciliten información de identidad antes de su viaje, o han establecido nuevos sistemas de identificación de visados o bases de datos compartidas.	1
Como indicó en una declaración política dada a conocer en marzo de 2003, "el Movimiento y Ejército de Liberación del Sudán es un movimiento nacional que tiene por objetivo, junto con otros grupos políticos afines, abordar y resolver los problemas fundamentales de todo el Sudán.	1
Por consiguiente, exhorto a todas las partes y agentes a acatar plenamente las resoluciones 1559 (2004), 1680 (2006) y 1701 (2006), y continuaré trabajando para lograr la plena aplicación de estas y todas las demás resoluciones del Consejo de Seguridad relativas al Líbano.	0
En 2006 se registraron 136 incidentes de secuestros colectivos, de los que fueron víctimas un total de 324 niños, 210 de ellos en noviembre de 2006 y el resto entre mayo y diciembre de ese mismo año.	0
Exhorta a los Estados que todavía no lo hayan hecho a que consideren la posibilidad de ratificar los principales instrumentos del derecho internacional humanitario y el derecho relativo a los derechos humanos y los refugiados y a que adopten las medidas legislativas, judiciales y administrativas necesarias para la aplicación de esos instrumentos en el plano nacional, solicitando la asistencia técnica, cuando proceda, de las organizaciones internacionales pertinentes, incluidos el Comité Internacional de la Cruz Roja y los órganos de las Naciones Unidas.	0
La cooperación en la subregión mejora constantemente, pero se debe intensificar aún más, especialmente en las zonas fronterizas, a fin de reforzar los controles contra posibles incursiones terroristas y la proliferación de la delincuencia transnacional.	1
De conformidad con lo establecido en el artículo 3, que es común a los cuatro Convenios de Ginebra, el derecho internacional humanitario es aplicable también en los conflictos armados que no son de índole internacional.	1
Reconociendo la importancia de la justicia de transición para promover la reconciliación duradera entre todo el pueblo [del Estado afectado] y acogiendo con beneplácito el proceso de consultas nacionales sobre el establecimiento de mecanismos de justicia de transición ...	0
Más allá del ámbito de aplicación inmediata de las sanciones, las delegaciones mostraron especial interés en intercambiar sus experiencias en el ámbito de la reinserción de los terroristas en la sociedad.	0
Mucho se ha hablado sobre la financiación del terrorismo mediante la droga, entre otros lugares en convenciones y convenios internacionales y en resoluciones del Consejo de Seguridad.	0
Tomamos nota de que, en su informe (S/2008/728), el Secretario General expresa preocupación por la situación de seguridad en la región oriental de la República Democrática del Congo.	0
Se está ajustando el despliegue del personal de policía de la MINUSTAH para asignar el mayor número de recursos posible al proceso electoral.	0
1. Condena el extremismo violento, que puede conducir al terrorismo, la violencia sectaria, y la comisión de actos terroristas por combatientes terroristas extranjeros, y exige que todos los combatientes terroristas extranjeros depongan las armas, pongan fin a todos los actos terroristas y dejen de participar en los conflictos armados;	0
Además, el Equipo de Vigilancia viajó dos veces a Bélgica, una para asistir al simposio de la Organización de Aviación Civil Internacional y otra para reunirse con representantes de la Organización Mundial de Aduanas, y a Francia para asistir a una reunión de expertos sobre sanciones financieras selectivas organizada por el Grupo de Acción Financiera y a la tercera sesión plenaria de ese Grupo.	0
Este mecanismo asegurará que la parte incluida en la lista no controle el patrimonio de la empresa y no pueda desviar ingresos en apoyo del terrorismo.	1
Recordando sus resoluciones sobre el reclutamiento y la utilización de niños y los conflictos armados,	0
e) Permita el establecimiento de periódicos y otros medios de comunicación independientes; permita a los ciudadanos libre acceso a Internet, los medios de comunicación social, las comunicaciones internacionales, las emisiones y publicaciones extranjeras, incluida la cultura popular de otros países y ponga fin a la participación obligatoria en organizaciones de masas y sesiones de adoctrinamiento.	1
La Comisión desea subrayar que, si se demuestra que el Gobierno utilizó las milicias como "táctica de guerra", incluso en casos en que los Janjaweed puedan haber actuado sin el apoyo demostrado del Gobierno, los oficiales del Gobierno pueden incurrir en responsabilidad penal por su participación en una empresa criminal conjunta para perpetrar ataques indiscriminados contra civiles y asesinatos de civiles.	0
a) Promover la adopción de marcos jurídicos nacionales de lucha contra el terrorismo que sean a la vez amplios e integrados, acordes con el estado de derecho y las obligaciones en materia de derechos humanos, y reforzar la capacidad nacional de investigar y enjuiciar los actos terroristas y decidir sobre ellos, incluso mediante la solicitud de asistencia para desarrollar esa capacidad, según sea necesario;	1
Cursos de capacitación sobre la cuestión de la explotación y el abuso sexuales; formulación de políticas y procedimientos sobre los aspectos de organización de la asistencia a las víctimas.	1
- Destaca la importancia que tiene un nivel apropiado de conocimientos militares para las decisiones del Consejo de Seguridad;	0
Decide establecer un tribunal internacional con la finalidad exclusiva de enjuiciar a los presuntos responsables de graves violaciones del derecho internacional humanitario cometidas en el territorio de [Estado afectado] entre [fechas].	1
Reconoce la política de cooperación demostrada por los Estados vecinos, incluidos [lista de Estados pertinentes], al mantener sus fronteras abiertas a los refugiados ... , y alienta a esos Estados a que mantengan dicha política y contribuyan a la estabilización de la situación siempre que sea posible;	1
Los 18 Estados que han presentado información sobre la importación y exportación de armas han adoptado algunas medidas para reglamentar la producción, la venta y la transferencia de armas y explosivos.	1
La mayoría de los Estados tienen capacidad limitada de congelar sin demora fondos y activos y ninguno de ellos ha puesto en vigor medidas adecuadas para proteger a las organizaciones sin fines de lucro de ser utilizadas para la financiación del terrorismo.	0
Los archivos de la PNTL muestran que el Comandante General de la PNTL firmó la entrega de una ametralladora automática F2000 y 2.000 cartuchos al Ministro del Interior.	1
Se están examinando arreglos para que el PNUD y el ACNUR establezcan y administren un fondo fiduciario sucesor para el DIS, en caso de que el Gobierno y los posibles donantes así lo deseen, hasta que se asegure que existen las estructuras y la capacidad nacionales necesarias.	1
En 5 de los 12 regímenes de sanciones del Consejo de Seguridad se incorporan criterios de inclusión relacionados con violaciones de las normas internacionales de derechos humanos y el derecho internacional humanitario, y en particular con la participación en violaciones de los derechos de los niños y las mujeres en situaciones de conflicto.	1
Recordando la declaración de su Presidente de 8 de julio de 1999 (S/PRST/1999/21) e insistiendo en su llamamiento para que se incluyan, cuando proceda, en determinados acuerdos de paz y, según el caso, en los mandatos de las operaciones de las Naciones Unidas para el mantenimiento de la paz disposiciones claras relativas al desarme, la desmovilización y la reintegración de los ex combatientes, en particular la eliminación en condiciones de seguridad y oportuna de armas y municiones,	0
El sábado 27 de diciembre de 2003, en la localidad de Domai Tamait, en Darfur meridional: "Nos atacaron temprano por la mañana, sobre las 5.30, que es la hora del rezo matinal. [El testigo muestra una herida de bala que tiene en la pierna.] Los atacantes iban a caballo y en camellos y algunos iban de uniforme.	0
En respuesta a esa ola de violencia, la MINUSTAH y la Policía Nacional de Haití organizaron con feliz resultado varias operaciones para rescatar a los secuestrados y detuvieron a un número considerable de presuntos secuestradores.	1
Su innovación fue trasladar los objetivos de los países musulmanes a Occidente, en particular los Estados Unidos de América y, definiendo su terrorismo como una lucha entre el Islam y sus enemigos, pudo reunir bajo una sola bandera a varios grupos dispares que a menudo competían entre sí.	0
El grupo atacó y asesinó a 54 personas, hirió a otras 24 e incendió viviendas antes de retirarse con un botín de ganado y artículos domésticos.	0
Del mismo modo, se han promulgado leyes de lucha contra el terrorismo, que proporcionan a las autoridades judiciales y fiscales los poderes jurídicos necesarios para llevar a los terroristas ante la justicia.	1
Además, el Consejo decidió examinar dentro de tres y seis meses si las condiciones sobre el terreno podrían permitir una reducción del personal militar de mantenimiento de la paz a una dotación de 6.000 efectivos.	1
En los debates con la Comisión acerca de la metodología de los comités sobre violaciones, se hizo mucho hincapié en la gran publicidad que se había dado al mandato de éstos.	0
Desarrollo de la capacidad de los Estados para prevenir la proliferación de armas de destrucción en masa y responder a los ataques perpetrados con ellas	1
El régimen abjasio no ha escatimado esfuerzos para legalizar la imposición de un cambio demográfico como consecuencia de la depuración étnica y ha creado unas condiciones de vida insostenibles para los ciudadanos georgianos que han regresado al distrito de Gali.	0
A unos 50 kilómetros de Daloa, el mismo día en que la Misión se hallaba en la región, hubo enfrentamientos entre las fuerzas rebeldes y las fuerzas francesas que vigilaban la cesación del fuego.	0
En enero de 2006, los efectivos ascendían a 1.435, pero se redujeron a 715 a raíz de los acontecimientos que se produjeron en el primer semestre de ese año.	0
En total, 12 Estados han adoptado disposiciones para reglamentar la producción, la venta y la transferencia de armas y explosivos, aunque sólo dos han aplicado plenamente esas medidas.	1
En ese sentido, queremos ir más allá y decir que creemos que el único modo de mejorar la seguridad y la estabilidad en Somalia es habilitar a las fuerzas de seguridad somalíes para que controlen a los insurgentes más violentos y para que el Gobierno pueda ampliar sus áreas de autoridad todo lo posible si fracasan las negociaciones de paz.	0
Por ejemplo, la Misión de Investigación de las Naciones Unidas sobre el Conflicto de Gaza fue la única que utilizó las audiencias públicas como parte de su metodología de investigación para asegurar un proceso inclusivo, y para dar voz a las víctimas que no habían sido escuchadas y defender sus derechos a la verdad y la justicia.	1
La tasa de ratificación de los instrumentos internacionales contra el terrorismo varía ampliamente: 12 Estados han ratificado al menos 10 de los instrumentos, en tanto que cuatro Estados han ratificado cinco o menos.	1
Otros han sido identificados por su posible participación en los actos de planificar u ordenar la comisión de crímenes internacionales o por su complicidad en la comisión de esos crímenes.	0
El primer grupo de 2.000 miembros de las milicias fue registrado en Guiglo en junio de 2006 y posteriormente 981 de ellos fueron desarmados y recibieron una prestación de supervivencia en efectivo.	1
Se impartió capacitación a agentes de las fuerzas de seguridad nacionales (50 en Adré y 42 en Abéché).	1
Se consideró que aumentar la cooperación con la Comisión de Consolidación de la Paz revestía también gran importancia para el programa de trabajo del Consejo. En particular, los participantes se mostraron partidarios de que se adoptara una actitud más estratégica en cuanto a aumentar la cooperación con la Comisión de manera de hacer hincapié en una transición sin contratiempos de responsabilidades operacionales del mantenimiento a la consolidación de la paz y de incrementar la rendición de cuentas en uno y otro caso.	1
El Consejo reafirma, recuerda o reitera periódicamente su exigencia de que los Estados apliquen los embargos de armas vigentes, porque la aplicación sigue planteando problemas considerables.	0
En un intento de hacer frente al aumento de los delitos cometidos en el mar, la Organización Marítima para África Occidental y Central, con la ayuda de la OMI, está intensificando la cooperación entre los organismos encargados de hacer cumplir la ley estableciendo una red de unidades de guardacostas.	1
Concebidos como un mecanismo interno para mejorar los conocimientos expertos y la coherencia y contribuir a las actividades relacionadas con la labor principal de la Dirección Ejecutiva, estos grupos se crearán inicialmente en las siguientes esferas funcionales:	1
4. Insta a la Dirección Ejecutiva a que siga reforzando su función de facilitar la asistencia técnica para la aplicación de la resolución 1373 (2001) a fin de aumentar la capacidad de los Estados Miembros y de las regiones para luchar contra el terrorismo atendiendo a sus necesidades en este ámbito, en estrecha cooperación con el Equipo Especial sobre la Ejecución de la Lucha contra el Terrorismo, así como con las entidades que proporcionan asistencia bilateral y multilateral, y acoge con beneplácito el enfoque temático y regional que aplica a su labor la Dirección Ejecutiva;	1
La Misión visitó algunas de esas zonas y quedó consternada ante la visión de casas demolidas, automóviles quemados y personas que habían quedado en la indigencia.	0
Este método se utilizó para reducir las posibles pérdidas de armas ante las actividades de las fuerzas navales.	1
d) El Comité velará por que las medidas que tomen los Estados Miembros para combatir el terrorismo estén en consonancia con las obligaciones que les incumben con arreglo al derecho internacional, en particular las normas relativas a los derechos humanos y a los refugiados y el derecho humanitario;	1
La apertura del centro mixto de análisis de la MINUSTAH ha permitido a la Misión aumentar considerablemente su capacidad de análisis e intercambio interno de información. Sin embargo, la MINUSTAH siguió sin tener acceso a información táctica fidedigna.	1
La Comisión recibió información fidedigna de que esas personas habían sido torturadas y sometidas a tratos crueles, inhumanos y degradantes.	0
La Comisión, sobre la base de un minucioso análisis de la información reunida en el curso de sus investigaciones, determinó que el Gobierno del Sudán y los Janjaweed eran responsables de graves transgresiones de las normas internacionales de derechos humanos y el derecho internacional humanitario que equivalían a crímenes con arreglo al derecho internacional.	0
El capítulo III de la Ley No. 535/2004 se dedica a las medidas para prevenir la financiación de los actos de terrorismo.	1
:: Las relaciones con otras partes de las Naciones Unidas, en particular el Secretario General y su Oficina, y los demás órganos subsidiarios del Consejo de Seguridad que desarrollan su actividad en el ámbito de la lucha contra el terrorismo.	1
Las víctimas de la trata de personas que están sujetas a ordenes de deportación siguen recibiendo asistencia por conducto del programa de albergues del componente de creación de instituciones.	1
A fines de septiembre, la MINURCAT terminó de acondicionar la cárcel de Iriba, gracias a lo cual mejoraron las condiciones de detención de los presos y la seguridad de la cárcel.	1
El acceso del socorro humanitario a Darfur ha mejorado espectacularmente gracias al levantamiento gradual de las restricciones desde el verano último.	1
En su resolución 2122 (2013), el Consejo se comprometió a prestar mayor atención a las cuestiones relativas a las mujeres, la paz y la seguridad en todas las esferas temáticas pertinentes de que se ocupa, en particular la protección de los civiles en los conflictos armados, la consolidación de la paz después de los conflictos, la promoción y el fortalecimiento del estado de derecho en el mantenimiento de la paz y la seguridad internacionales, la paz y la seguridad en África, las amenazas a la paz y la seguridad internacionales causadas por actos terroristas, y el mantenimiento de la paz y la seguridad internacionales.	1
c) Alentar a los Estados a adoptar medidas para impedir que las redes informales de envío de remesas de los trabajadores se utilicen indebidamente para los fines de la financiación del terrorismo.	0
En una nota, Theo Van Boven calificó esta disposición de más compleja y específica sobre el derecho de las víctimas a obtener reparación que cualquier otro tratado internacional precedente en materia de derechos humanos.	1
Este ha sido el tercer cohete lanzado desde Gaza hacia Israel desde el verano.	0
En otras palabras, la lucha contra el terrorismo ha de ser un esfuerzo conjunto con un enfoque integral y una dedicación a largo plazo.	1
En diciembre, la Oficina de Lucha contra la Explotación y los Abusos Sexuales será sustituida por la Unidad Deontológica y Disciplinaria que se ocupa de la explotación y abusos sexuales y otras formas de conducta improcedente.	1
En cuatro Estados rigen leyes amplias de lucha contra el terrorismo.	1
La finalidad de esas visitas era vigilar la aplicación, incluida la recopilación de ejemplos de las mejores prácticas, para difundir la labor del Comité del Consejo de Seguridad, afirmar el consenso internacional que es fundamental para el éxito del régimen de sanciones, y vigilar la propagación y el alcance de Al-Qaida y los talibanes para estar en mejores condiciones de hacer sugerencias al Comité para su labor futura.	0
Afirmando su apoyo a los tratados multilaterales que tienen por objeto eliminar o prevenir la proliferación de armas nucleares, químicas o biológicas y la importancia de que todos los Estados partes en esos tratados los apliquen integralmente a fin de promover la estabilidad internacional,	0
En momentos en que continúan las conversaciones de paz en Argel, facilitadas por el equipo de mediación dirigido por Argelia, exhorto a todas las partes a negociar de buena fe para llegar a un acuerdo de paz amplio, viable y sostenible, que permita encarar las causas profundas del conflicto.	0
Con ese fin, el Departamento determinó varios objetivos cruciales para ese proceso. Uno era el establecimiento obligatorio de tres comités de política y finanzas, asuntos de las comunidades y mediación.	1
