es	MatCoop
La policía dijo que buscaban a "Enza" y preguntaron a los hombres si habían participado en la marcha.	0
También se refirió a importantes precedentes que sentó el Consejo, en particular el establecimiento de las comisiones de investigación sobre Bosnia, Rwanda y Darfur, que allanaron el camino para el Tribunal Penal Internacional para la ex-Yugoslavia y el Tribunal Penal Internacional para Rwanda y la remisión por el Consejo de la situación en Darfur a la Corte Penal Internacional.	1
13. Insta a la comunidad internacional a proporcionar apoyo y asistencia para que los Estados puedan cumplir sus responsabilidades respecto de la protección de los refugiados y otras personas amparadas por el derecho internacional humanitario;	0
- Encomendar el establecimiento de mecanismos apropiados y adaptados en el plano local para la verdad y reconciliación (por ejemplo, de asistencia técnica, financiación y reintegración de civiles en las comunidades).	1
El Consejo de Seguridad insta a los Estados, a las organizaciones internacionales y al sector privado a que compartan pruebas, información e inteligencia, según proceda, a efectos de las actividades policiales de lucha contra la piratería, incluidos el enjuiciamiento efectivo de los presuntos piratas y el encarcelamiento de los convictos, y alienta las iniciativas existentes y futuras a este respecto.	0
La comunidad internacional debe estar preparada para actuar ahora con la misma determinación a fin de proteger los intereses de los serbios de Kosovo y de otras comunidades minoritarias.	0
En general, las donaciones caritativas constituyen un recurso financiero indispensable, sobre todo en muchos Estados en desarrollo y en aquellos que han sufrido grandes catástrofes.	1
En el ataque se utilizaron dos helicópteros artillados y un avión Antonov, posiblemente para fines de reconocimiento.	0
La nota propone que el Consejo de Seguridad inicie un proceso formal de "examen estratégico" para estudiar la forma en que la intersección de la delincuencia transfronteriza y el terrorismo puede afectar a su labor de prevención y solución de conflictos, en particular en África, y examinar los instrumentos a su disposición para reducir el espacio estratégico que la delincuencia transfronteriza brinda a los grupos terroristas.	0
Insta a los Estados Miembros a que velen por que aumente la representación de la mujer en todos los niveles de adopción de decisiones de las instituciones y mecanismos nacionales, regionales e internacionales de prevención, gestión y solución de conflictos.	0
El Centro Jurídico, instituto independiente establecido por el componente de creación de instituciones, continúa también su programa de becas.	1
27. Decide que cuando el Estado proponente presente una solicitud de supresión, la obligación de los Estados de adoptar las medidas descritas en el párrafo 1 de la presente resolución quede sin efecto respecto de la persona, grupo, empresa o entidad de que se trate después de 60 días, salvo que el Comité decida por consenso, antes del fin de ese período de 60 días, que las medidas sigan en vigor respecto de esa persona, grupo, empresa o entidad, entendiéndose que, en los casos en que no haya consenso, el Presidente, a solicitud de un miembro del Comité, someterá la cuestión de si procede suprimir de la Lista el nombre de esa persona, grupo, empresa o entidad al Consejo de Seguridad para que este adopte una decisión al respecto en un plazo de 60 días, y entendiéndose también que, en caso de que exista tal solicitud, la obligación de que los Estados adopten las medidas descritas en el párrafo 1 de la presente resolución se mantendrá durante ese período en relación con esa persona, grupo, empresa o entidad hasta que el Consejo de Seguridad adopte una decisión sobre la cuestión;	1
Todos los Estados han adoptado leyes y medidas para reglamentar y vigilar la producción, la venta y la transferencia de armas y explosivos. Sin embargo, la información suministrada no es suficiente para evaluar la eficacia de la aplicación de esas medidas.	0
c) Ayudar a los Estados a crear capacidad, en colaboración con el Grupo de Lucha contra el Blanqueo de Dinero en África Oriental y Meridional, para constituir o reforzar las unidades de inteligencia financiera de la subregión y desarrollar las capacidades legislativas y operacionales de los Estados para congelar fondos sin demora.	1
Los Estados de la subregión han ido bastante más allá de los enfoques orientados meramente a la aplicación de las leyes y han asumido el desafío que plantean los grupos terroristas.	1
Habida cuenta de la jurisdicción limitada de la Dependencia de Crímenes Graves y del fracaso del proceso del Tribunal Especial de Indonesia, sería necesario tomar medidas correctivas adicionales para que se haga justicia.	0
Se creó un sitio web independiente para la Oficina de la Ombudsman (www.un.org/en/sc/ombudsperson). En el sitio hay información esencial sobre las operaciones de la Oficina, incluidas una descripción del procedimiento seguido para examinar las solicitudes de supresión de nombres de la Lista e indicaciones generales sobre el contenido de las solicitudes que se presentan a la Ombudsman.	1
Pero las mujeres y los niños también habían sido víctimas de matanzas durante muchos ataques.	0
a) Aprobar marcos jurídicos nacionales para la lucha contra el terrorismo que sean globales y coherentes e incluyan todos los delitos de terrorismo tipificados en los instrumentos internacionales de lucha contra el terrorismo y aplicar de manera eficaz las leyes y normativas para combatir el blanqueo de dinero y la financiación del terrorismo, cumpliendo también las normas internacionales de derechos humanos;	1
:: El 3 de noviembre de 2014, unos aviones de combate del régimen atacaron la mezquita del orfanato islámico de Al Waer en Homs, y causaron grandes daños.	0
A medida que el Comité y la Interpol determinan el mejor modo de avanzar, el Equipo espera que la base de datos de la Interpol pueda proporcionar información identificatoria adicional sobre las personas que figuran en la lista consolidada.	1
Los combatientes del MPCI informaron a la Misión de que en las zonas de combate había otras fosas comunes, en total cinco fosas nuevas, tres de ellas en Man y dos en Danané (a 72 kilómetros de Man).	0
Como indica la situación en la zona de Beni, los esfuerzos para neutralizar a los grupos armados que están dispersos y cuentan con el apoyo de redes delictivas locales y elementos de las FARDC necesitan algún tiempo para traducirse en resultados visibles.	1
El 7 de octubre, la Asesora Especial del Secretario General, Sigrid Kaag, presentó información al Consejo de Seguridad sobre la aplicación de la resolución 2118 (2013), en consultas privadas. La Asesora Especial centró su intervención en cuatro temas: el cierre de la Misión Conjunta de la Organización para la Prohibición de las Armas Químicas y de las Naciones Unidas el 30 de septiembre; los progresos realizados en la aplicación de los planes para la destrucción de las 12 instalaciones restantes de producción de armas químicas; la cuestión de las discrepancias en la declaración original formulada por la República Árabe Siria; y las denuncias de utilización de cloro gaseoso en la República Árabe Siria.	0
Aqeel Al-Aquil inició juicio el 11 de mayo de 2005 en un tribunal federal del Distrito de Columbia contra funcionarios de los Departamentos de Justicia, Estado y del Tesoro de los Estados Unidos, alegando que su designación como terrorista por el Gobierno de los Estados Unidos el 2 de junio de 2004 violaba sus derechos en virtud de la Constitución de los Estados Unidos. Al-Aquil, un residente y ciudadano de Arabia Saudita, era el presidente de Al-Haramain Islamic Foundation, que estaba basada en Arabia Saudita hasta que fue clausurada por las autoridades de ese país en 2004. El 6 de julio de 2004, las Naciones Unidas lo incluyeron en la lista con su apellido, Al-Aquil, junto con diversas oficinas de Al-Haramain en Afganistán, Albania, Bangladesh, Etiopía y los Países Bajos (las Naciones Unidas habían incluido en la lista a otras oficinas de Al-Haramain antes de esa inclusión e hicieron lo mismo con otras oficinas posteriormente).	0
Los organismos estatales de policía y seguridad de Bosnia y Herzegovina han procurado aplicar medidas para mejorar la cooperación, y el grupo de trabajo sobre el Tribunal establecido conjuntamente por el Gabinete del Primer Ministro y el Representante Especial de la Unión Europea y la Oficina del Alto Representante sigue supervisando la aplicación de esas medidas. El 8 de agosto se detuvo en la Argentina a Milan Lukic, el 25 de agosto se capturó en Siberia occidental a Dragan Zelenovic y el 13 de septiembre Sredoje Lukic se entregó en Banja Luka a las autoridades de la República Srpska.	0
Los frecuentes enfrentamientos entre tropas de la FARDC y grupos armados que operan en la zona han provocado numerosas bajas entre la población civil.	0
Además, el punto focal encargado de las solicitudes de supresión de nombres de la Lista, establecido en virtud de la resolución 1730 (2006) del Consejo de Seguridad, puede aceptar la solicitud de supresión de un nombre presentada por la familia de una persona listada fallecida, o por su representante, y gracias a ello ha resultado más fácil para los herederos legítimos (no listados) de una persona fallecida conseguir que se tramite su solicitud cuando ningún Estado está dispuesto a actuar en su nombre.	0
Los frecuentes ataques llevados a cabo en el Afganistán por los talibanes y por terroristas vinculados con Al-Qaida demuestran la persistencia de las violaciones del embargo de armas pese al programa de desarme del Gobierno.	0
Es necesario mejorar el intercambio de información y también fomentar la cooperación con los Estados de otras regiones.	0
Además, la Comisión halló pruebas suficientes de que las mujeres siguieron siendo víctimas de violaciones y violencia sexual durante su desplazamiento, de forma que se había perpetuado en ellas el temor a salir de los campamentos de desplazados.	0
Acogiendo con beneplácito y apoyando las medidas adoptadas para concertar tratados sobre zonas libres de armas nucleares y reafirmando la convicción de que la creación de zonas libres de armas nucleares reconocidas internacionalmente en base a acuerdos convenidos libremente entre los Estados de cada región afectada, y de conformidad con las directrices de 1999 de la Comisión de Desarme de las Naciones Unidas, promueve la paz y la seguridad mundial y regional, fortalece el régimen de no proliferación nuclear y contribuye a la consecución de los objetivos del desarme nuclear,	0
Sin embargo, sigo preocupado porque continúan las restricciones impuestas a la libertad de circulación de los observadores militares de las Naciones Unidas que intentan visitar las unidades, los cuarteles y los bastiones de las partes con fines de verificación.	0
En estas mismas consultas oficiosas dos representantes de la Misión de Estabilización de las Naciones Unidas en la República Democrática del Congo informaron al Comité por videoconferencia sobre el mandato encomendado a la Misión de vigilar la aplicación de las sanciones y, en particular, sobre el rastreo y el marcado de armas, en respuesta a una petición del Comité.	1
Promoción del conocimiento y la concienciación sobre las cuestiones de género en los planos nacional y local por conducto de la red de coordinadores de cuestiones de género en las oficinas regionales y nacionales.	1
Recuerda la prohibición del desplazamiento forzado de civiles en situaciones de conflicto armado que viola las obligaciones que tienen las partes en virtud del derecho internacional humanitario.	0
a) Revisar su derecho penal a fin de asegurar que el reclutamiento para llevar a cabo actos terroristas y la integración de grupos terroristas están suficientemente tipificados como delito;	1
Por lo que respecta a las F-FDTL, un decreto ley dispone la estructura militar, pero las leyes que rigen la disciplina y la carrera militares son las leyes aprobadas por la UNTAET.	1
La mayoría de los Estados han promulgado leyes por las que se establecen autoridades nacionales de seguridad de la aviación, pero pocos han proporcionado información sobre su aplicación de los anexos pertinentes del Convenio sobre Aviación Civil Internacional.	1
La Secretaria General Adjunta señaló que 69 trabajadores humanitarios habían perdido la vida desde el inicio del conflicto, y que la violencia sexual se había utilizado como una forma de tortura, para causar lesiones, para degradar e intimidar y como forma de castigo.	0
Los progresos alcanzados en esta esfera permitirán que el año próximo los centros de seguridad pública de la República Srpska y la administración de policía de la Federación de Bosnia y Herzegovina funcionen con una metodología fiscal mejorada.	1
Desde que se presentó el último informe sobre esta cuestión (S/2012/971), el número total de combatientes extranjeros y líderes y facilitadores de Al-Qaida asesinados o capturados ha disminuido.	0
El Coordinador Especial informó de que se mantenía la calma general en el sur del Líbano, aunque se habían producido algunos incidentes de seguridad durante el período de que se informa, entre ellos el lanzamiento de cohetes contra Israel desde el sur del Líbano durante el conflicto relacionado con Gaza que había tenido lugar en julio y agosto y dos incidentes graves de seguridad en la zona de las granjas de Shab'a (Sector Oriental).	0
a) Asegurar la protección de los civiles, incluido el personal de asistencia humanitaria, que se encuentren en peligro inminente de sufrir violencia física;	1
Algunos reiteraron la necesidad de una coordinación más estrecha entre las entidades de las Naciones Unidas de lucha contra el terrorismo.	0
Además, la restricción de Eritrea afecta dramáticamente a la seguridad de las fuerzas de mantenimiento de la paz de las Naciones Unidas y de sus operaciones, hasta el punto de que se ha hecho insostenible seguir ocupando los puestos pequeños en los lugares aislados -- que constituyen 18 localidades de un total de 40 -- y ha dejado de ser operacionalmente viable.	0
Además, el Equipo ha intercambiado información con expertos del Comité 1540, expertos de los Comités de Sanciones contra Somalia y Liberia, y con organizaciones no gubernamentales y académicas pertinentes.	1
Entre tanto, se han conseguido grandes progresos en la capacitación de la policía nacional congoleña, que se encargará de garantizar la seguridad de las elecciones.	1
Antecedentes Las Naciones Unidas desempeñan un papel fundamental en la lucha contra el terrorismo mundial.	1
Reiterando su llamamiento a las partes y a los Estados de la región para que cooperen más plenamente con las Naciones Unidas y entre sí y refuercen su implicación para poner fin a la actual situación de estancamiento y avanzar hacia una solución política,	1
Un análisis de las declaraciones de los líderes de Al-Qaida demuestra que sus objetivos inmediatos son, mediante el recurso al terrorismo, conseguir que los países occidentales se retiren del Oriente Medio y de otros Estados islámicos y convencer a los musulmanes de que se quiere atacar a su civilización.	0
En opinión del Coordinador, que comparten sus interlocutores, esta modalidad podría llegar a ser el centro de un mecanismo operativo eficaz que establecería claros parámetros para lograr avances en la búsqueda de los desaparecidos, según se indicaba en mi informe completo (S/2009/190, párr. 16).	0
a) Alentar la elaboración de objetivos mensurables para reducir la violencia armada;	1
En varias ocasiones, he expresado mi firme convicción de que la mejor manera de lograr el desarme de Hizbullah y otras milicias es mediante un proceso político dirigido por los propios libaneses, que conduzca al objetivo final de poner fin a la existencia de armas o fuerzas armadas en el Líbano que no sean las del Estado libanés.	1
6. Confirma además que las disposiciones del párrafo 1 a) serán aplicables también al pago de rescates a personas, grupos, empresas o entidades que figuren en la Lista;	1
Acudieron también a las comisarías de policía y a la fiscalía del distrito para obtener información sobre los casos de violación ya denunciados.	1
Con respecto a la prohibición de viajar, en el párrafo 10 de la resolución 1807 (2008), el Consejo estableció la exención de los viajes por motivos humanitarios, incluidas las obligaciones religiosas, para promover la paz y la reconciliación nacional y la estabilidad en la región, y el tránsito de las personas que regresaran al territorio del Estado de su nacionalidad o participen en intentos de someter a la acción de la justicia a quienes hayan perpetrado graves violaciones de los derechos humanos o del derecho internacional humanitario.	1
En cuanto al desarme, la ONUCI seguirá apoyando el rápido acantonamiento de fuerzas, con arreglo al Acuerdo Suplementario No. 3.	1
Además de informar la labor de los mecanismos de información sobre los derechos humanos y de servir de archivo seguro de la información proporcionada por los interesados pertinentes, la labor de esa estructura facilitaría los esfuerzos de las Naciones Unidas por enjuiciar o exigir responsabilidades a los principales responsables de los crímenes de lesa humanidad.	1
La Ley Uniforme contra la Financiación del Terrorismo de la Unión Económica y Monetaria del África Occidental dispone la congelación administrativa de los activos de los terroristas.	1
Preocupado por las actividades armadas y el bandidaje en [los países afectados], que suponen una amenaza para la seguridad de la población civil, la realización de las operaciones humanitarias en esas zonas y la estabilidad de dichos países, y que dan lugar a graves violaciones de los derechos humanos y el derecho internacional humanitario.	0
En el futuro, estas organizaciones regionales, y en particular la Unión Europea, deberán desempeñar el papel más destacado en Kosovo.	0
En el informe se exponen también tres enfoques específicos que permitirían mejorar la aplicación de las sanciones: en primer lugar, disuadir del pago de rescates a Al-Qaida y sus entidades afiliadas para favorecer la congelación de activos. En segundo lugar, utilizar técnicas biométricas e introducir cambios en los criterios nacionales de definición de viajeros no admisibles para reforzar la prohibición de viajar impuesta contra las personas incluidas en la Lista. En tercer lugar, mejorar el análisis y la adopción de medidas para limitar la disponibilidad de componentes empleados en la elaboración de los dispositivos explosivos improvisados que utilizan Al-Qaida y sus entidades afiliadas. II. Perspectiva general A. Al-Qaida	0
Expresa su más sentido pésame y sus condolencias a las víctimas de este atroz acto de terrorismo y a sus familiares, así como al pueblo y al Gobierno del Pakistán.	0
Los acontecimientos que tuvieron lugar en Abidján en relación con la marcha prevista para el 25 de marzo dieron como resultado graves violaciones de los derechos humanos.	0
Es evidente que la situación de Darfur no reúne las condiciones necesarias para que se apliquen esas disposiciones.	0
Hemos expresado nuestra seria preocupación por el sufrimiento de los palestinos en la Franja de Gaza.	0
En todas esas conversaciones, me alentó encontrar una convergencia de opiniones: todos quedamos maravillados ante los numerosos progresos que ha logrado Liberia desde que terminaron los combates en 2003, pero todos nos percatamos plenamente de cuán abrumadores son los retos que Liberia aún enfrenta y de que, en última instancia, no podemos dar nada por sentado.	0
Si bien la Iniciativa se concibió en respuesta al aumento del tráfico de drogas y la delincuencia organizada transnacional en África occidental, las unidades de lucha contra la delincuencia transnacional funcionarán como centros de coordinación nacional y regional para apoyar la capacidad analítica y técnica de respuesta a amenazas transnacionales.	1
La Oficina de Asuntos de Desarme ha tratado de sensibilizar a los posibles donantes para movilizar su apoyo con destino a los seminarios y talleres regionales que organiza.	1
La dependencia comparte información con sus contrapartes de otros países, tanto directamente como por conducto de organismos de represión.	1
En los últimos tres meses, la Brigada Conjunta de Investigaciones Especiales de la MINUSTAH investigó por lo menos cuatro casos de presuntas ejecuciones sumarias.	1
Aunque la Comisión descarta que en la reunión del 8 de mayo el ex Primer Ministro diera instrucciones a Rai Los para "eliminar" a sus opositores políticos, está convencida, sobre la base de toda la información que tiene ante sí, de que existe una sospecha razonable de que el ex Primer Ministro al menos tenía conocimiento de la distribución de armas de la PNTL a civiles.	0
Además, la Organización de Aviación Civil Internacional y la Organización Marítima Internacional, lo mismo que asociaciones sectoriales no gubernamentales, como la Asociación de Transporte Aéreo Internacional, han establecido y actualizado periódicamente normas para la conducta de sus miembros y para el transporte de cargas peligrosas, incluidas las remesas de municiones y explosivos.	1
Por último, tenemos que incorporar la participación y la indemnización de las víctimas en la labor de estos tribunales en el futuro.	0
Además, tras su recuperación por las fuerzas del Gobierno, la ciudad había acogido a más de 11.000 personas desplazadas, a las que se había intentado asistir lo mejor posible.	1
Hablemos francamente: estos relatos de la prensa, de grupos de derechos humanos y de civiles que se encuentran sobre el terreno generan una gran preocupación acerca del carácter y la magnitud del conflicto.	0
En estrecha cooperación con los comités establecidos en virtud de las resoluciones 1267 (1999) y 1540 (2004) y de conformidad con su mandato, el Comité prestará especial atención a los Estados que estén atrasados en la presentación de la información pertinente y estudiará la mejor manera de resolver ese problema.	1
El Comité seguirá organizando reuniones y eventos especiales sobre temas y cuestiones de preocupación e interés común para los Estados Miembros, con miras a aprovechar al máximo los efectos de las resoluciones y mantener el compromiso de la comunidad internacional de luchar contra el terrorismo.	1
Prácticamente todos los Estados tipifican el uso de sus territorios para cometer o preparar atentados terroristas contra los ciudadanos, las instalaciones o los representantes diplomáticos de otros Estados.	1
No se puede permitir que los terroristas y sus cómplices aprovechen las lagunas jurídicas existentes para eludir la responsabilidad de sus actos.	0
Durante ese período la Comisión seguirá investigando el crimen y ayudará a las autoridades libanesas a profundizar la investigación.	1
La Dirección Ejecutiva del Comité contra el Terrorismo seguirá fortaleciendo su función de facilitación de la asistencia técnica para aplicar la resolución 1373 (2001) con el fin de aumentar la capacidad de los Estados Miembros y las regiones para luchar contra el terrorismo atendiendo sus necesidades al respecto, en estrecha cooperación con el Equipo Especial sobre la Ejecución de la Lucha contra el Terrorismo, los demás órganos de las Naciones Unidas y los proveedores de asistencia bilateral y multilateral, y seguirá aplicando el enfoque delimitado y regional a su labor.	1
Para terminar, el Teniente General Singha explicó que, desde marzo de 2012, la FNUOS había padecido combates entre grupos de la oposición y el ejército sirio en la zona de separación, lo cual constituía una clara violación del mandato.	0
En esos lugares se informó al Grupo de que últimamente no había habido reclutamiento alguno, pero que si estallaba nuevamente un conflicto en Côte d'Ivoire ello podría cambiar.	1
El equipo forense holandés recibió asistencia de numerosas personas mientras llevaba a cabo la investigación en el lugar del crimen, por ejemplo, técnicos forenses de las Fuerzas de Seguridad Interna, un equipo británico de buceadores, un equipo francés de expertos en explosivos, un científico forense de Irlanda del Norte, un ingeniero eléctrico alemán especializado en dispositivos de interferencia, un equipo japonés de investigadores del lugar del crimen, un experto alemán en automóviles, un experto holandés en automóviles y varios especialistas libaneses.	1
En ambas resoluciones se insiste en que los Estados tienen la responsabilidad de investigar y procesar a las personas responsables de genocidio, crímenes de lesa humanidad, crímenes de guerra u otras infracciones graves del derecho internacional humanitario.	1
La Oficina Conjunta de Derechos Humanos de las Naciones Unidas sigue investigando las presuntas infracciones de esos derechos y del derecho internacional humanitario cometidas tanto por los grupos armados como por las fuerzas de seguridad nacionales.	1
b) Exhortar a las partes en los conflictos armados a cumplir las obligaciones que les incumben en virtud del derecho internacional humanitario de respetar y proteger al personal humanitario y los artículos utilizados en las operaciones de socorro;	1
