ar_en_DEEP	VerConf
He called for special attention to be paid to the large number of elections scheduled to be held in the regional region until 2013, which, although a good development, has the potential to raise tensions leading to renewed violence and instability.	0
From 25 November to 10 December, my Special Representative joined participants in my annual âUnited to End Violence against Womenâ campaign, with a special focus on countries in conflict.	0
40 - I also call on the leadership of Hezbollah to cease all efforts to acquire weapons and build paramilitary capabilities outside the authority of the state.	1
As a result, the security threats to many countries in Africa and beyond, including member states of this Council, have been crossed, exposing their vulnerabilities.	1
The Security Council encourages Member States to develop comprehensive and integrated strategies to combat terrorism.	0
One delegation expressed concern that, despite the Council's listing of the Marine Ocean Management Company, its ships continued to operate, including calling at foreign ports, and suggested that the Committee remind Member States of their obligation to enforce the listing, including by detaining the company's ships and freezing Its origins.	1
Moreover, what is clearly evident from all this is that Eritrea is trying to gain the support of the Security Council by taking the staff of the United Nations Mission in Ethiopia and Eritrea hostage.	1
It is therefore largely concerned with aspects of social contexts that may lead to the spread of terrorism.	1
Determining that the situation in Afghanistan constitutes a threat to international peace and security in the region,	1
More than two million people were killed during the conflict, and more than 4.5 million people were forced to leave their homes.	0
Africans have clearly expressed their concerns about the situation in Zimbabwe.	1
Expressing its dissatisfaction with the continued obstructions imposed by the Government of Sudan on the work of the Group of Experts during its mandate, including restrictions imposed on the freedom of movement of the Group of Experts and the African Union-United Nations Hybrid Operation in Darfur, and restrictions imposed on the Group of Expertsâ access to areas of armed conflict and areas where There have been reports of violations of human rights and international humanitarian law, while noting the improved interaction between the Government of Sudan and the Group of Experts,	1
In May, all aspects of police education were consolidated under a separate programme, and an agreement was concluded on the establishment of a broad training system for Bosnia and Herzegovina.	0
37. The Committee encourages its Executive Directorate to remain focused on the implementation of resolution 1624 (2005), including by giving due attention to relevant issues, such as the role of new information and communications technologies, and promoting dialogue, including at the national level, in order to promote tolerance, diversity and inclusion, Establishing strategic partnerships between governments and non-governmental actors, defining roles for victims of terrorism, and preventing the sabotage of institutions by terrorists and their supporters.	0
In particular, I welcome the development of a regional counter-terrorism strategy by the Member States of the Lake Chad Basin Commission and Benin, and urge the continuation of joint efforts aimed at countering the Boko Haram threat in a manner consistent with international human rights standards.	0
45. Recognizing the need to maintain contact with relevant Security Council committees, international organizations and expert groups, including the Committee established pursuant to resolution 1267 (1999), the Counter-Terrorism Committee, the United Nations Office on Drugs and Crime and the Executive Directorate of the Counter-Terrorism Committee, The Committee established pursuant to resolution 1540 (2004) and the Financial Action Task Force, particularly in view of the continued presence of Al-Qaida and any associated, splinter or offshoot cell or group in the region and the negative impact this is having on the Afghan conflict;	0
He rejected both declarations of independence at the moment of his birth.	1
In some cases, national measures taken to respond to the virus have been accompanied by excessive use of force or the imposition of medical quarantine on communities by means that fall short of standards of human dignity.	0
The threat posed by terrorists, criminals and those involved in the drug trade to the security and stability of Afghanistan is a real phenomenon that must be constantly addressed.	1
Steps need to be taken to adequately suppress terrorist financing.	1
International law also prohibits indiscriminate attacks on civilians, meaning any attack on areas or places where both civilians and combatants may be present, and which is not directed at a specific military target, or an attack in which methods or means of combat are used that cannot be directed at a specific military target.	0
This State indicated that it had used the media and targeted programs to promote tolerance and dialogue among all beliefs and ethnic nationalities, and that a number of its constituent states had established interfaith committees or groups composed of various religious leaders in order to promote understanding and tolerance.	0
The Mission and the United Nations country team are providing coordinated support to the law's implementation process in all its aspects, including to the Minister of State for the Promotion of Equality, who is leading efforts to develop the implementation plan, and to civil society to raise awareness of the law.	0
In October 2009, Tajikistan established the Financial Monitoring Department (Financial Intelligence Unit) and, in November 2010, prepared a new draft law on combating money-laundering and combating the financing of terrorism.	0
40 - Welcomes the periodic briefings provided by the Government of Afghanistan on the content of the List, as well as on the impact of targeted sanctions in deterring threats to peace, stability and security in Afghanistan, as well as on support for the Afghan-led reconciliation process;	0
The recent rulings by an Indonesian Court of Appeal, overturning four convictions by the ad hoc Human Rights Court, while outside the mandate of the Mission, have a direct impact on the larger issue of accountability for crimes.	1
On the other hand, the Claims Commission for Eritrea and Ethiopia shows that the mechanisms for paying and enforcing compensation as a result of collective claims adjudicated by a third party may pose a significant problem.	1
Individuals and cells associated with Al-Qaeda and its affiliated organizations continue to be creative in their goals, methods, and technology.	1
In May 2000, Turabi led a split from the National Congress that resulted in the creation of a new party called the Popular Congress.	0
40 - Over the past month and a half, the Haitian authorities have made some initial attempts to address issues of administration of justice and detention.	1
221 - States of the subregion cooperate well with regional and international partners to reduce the threat of terrorism and their vulnerabilities to it. It exchanges intelligence on threats and warnings, exchanges operational information, and conducts joint exercises and maneuvers within bilateral and multilateral contexts.	0
Calls upon all parties to armed conflicts to immediately take appropriate measures to protect civilians, including women and children, from all forms of sexual violence, including measures such as the enforcement of appropriate military disciplinary measures, adherence to the principle of command responsibility, and training of forces to prohibit all forms of sexual violence committed against An absolute ban on civilians, exposing false ideas that fuel sexual violence, and screening candidates to join the national military and security forces to ensure the exclusion of those linked to serious violations of international humanitarian law and international human rights law, including sexual violence.	0
However, it should be noted that helicopters, along with other units such as the navy, were reportedly widely distributed, while the army was officially supposed to remain the âthird lineâ playing a mainly defensive role, after the police and gendarmerie.	0
The extent of cluster munitions is becoming increasingly evident as the work of the Landmine Action Organization progresses.	0
We therefore urge the members of the Council and the Group of Friends of Haiti to view positively these recommendations made by the Secretary-General.	1
4 - Notes with concern the close connection between international terrorism, transnational organized crime, illicit drug trafficking, money laundering, illegal arms trafficking and the illegal transfer of nuclear, chemical, biological and other materials that can have lethal effects, and stresses in this regard the need to strengthen coordination of efforts At the national, subregional and international levels in support of the global response in the face of the serious challenge and threat to international security;	1
On November 30, 2014, regime warplanes targeted the Tema market in Al-Hasakah, wounding two people and destroying seven stores. Medical centers	0
Therefore, the international community must take the necessary action to prevent Israel from continuing the reprehensible process of destruction it has initiated in Gaza, and affirm its rejection of all these Israeli practices that constitute a violation of international law and international humanitarian law.	1
In addition, President Kostanica's victory appears to Kosovo Albanian leaders as a threat to their aspirations for independence for the province.	1
Furthermore, measures exempting from the Covenant must not discriminate on grounds of race, colour, sex, religion or social origin.	0
19 - Emphasizes in this regard the importance of the efforts made by Member States to develop non-violent alternative methods for preventing and resolving conflicts so that affected individuals and local communities can adopt them in order to reduce the risks of spreading extremist ideology that leads to terrorism, and the importance of spreading peaceful alternatives to discourse. violence espoused by foreign terrorist fighters, and emphasizes the role that education can play in countering terrorist rhetoric;	0
The European Union is deeply concerned about the continuing cycle of retaliatory violence in Israel and the occupied territories.	1
:: Consider, as appropriate, the feasibility of establishing rosters and networks of experts within and outside the United Nations system and using them to work	0
27. In addition, several States have taken temporary measures to allow their officials to implement sanctions imposed under a list issued by the Security Council even before national verification processes are completed.	0
However, this requires an American will that places Middle East peace at the top of its priorities, overcoming the neglect and exclusion that has continued for about seven years and led to the aggravation of the situation in the region.	1
âThe Security Council welcomes the establishment of a national oversight mechanism by the President of the Democratic Republic of the Congo, Joseph Kabila, as requested under the Peace, Security and Cooperation Framework and resolution 2098 (2013), and calls on the President of the Democratic Republic of the Congo to ensure the transparency and inclusiveness of this mechanism.	0
Others have been identified for potentially being involved in planning and/or ordering the commission of international crimes, or for potentially assisting in the commission of such crimes.	0
- As much as possible, collect, evaluate, monitor, report and make recommendations on the implementation of measures; Conduct case studies, as appropriate; Conduct in-depth investigation of any other relevant matters as directed by the Committee;	0
We call on the Palestinian Authority to do everything in its power to stop these attacks.	1
Some threats were directed at program staff.	1
However, failure to intervene effectively to restore stability in that country truly threatens the effectiveness of the international community, in addition to costing it enormous resources.	1
:: Prosecute those who finance, plan, support or facilitate terrorist acts, with particular reference to the principle of âhand over or face trialâ, in accordance with international law, including human rights law	1
Commending the progress made to date by the Counter-Terrorism Committee, established by the Security Council, pursuant to paragraph 6 of resolution 1373 (2001) and acting under Chapter VII of the Charter, in carrying out its important responsibility of monitoring the implementation of that resolution,	1
We note that in his report (S/2008/728), the Secretary-General expresses concern about the security situation in the eastern Democratic Republic of the Congo.	1
Most people in the region rightly reject a return to the status quo ante, as any truce based on such limited results cannot be expected to last.	1
It is difficult to determine measures of its success, and the ability of the groups it targets to withstand and recover raises questions about its impact and highlights its weaknesses.	1
Condemn acts of incitement to violence against civilians in situations of armed conflict and call for an immediate halt to these acts.	1
The Prosecutor expressed concern about the unresolved issues regarding individuals detained in Libya and the mass displacement of the Tawergha people.	1
259. Preventing the cross-border movement of terrorists also requires the use of technology and equipment, such as machine readers and scanners, at border checkpoints to obtain real-time traveler data and verify it against national and international notifications and criminal databases.	0
He added that these discussions are still ongoing. The Personal Envoy reported that the Moroccan Government had on a number of occasions expressed its disappointment with the content of the latest report and with the Personal Envoy's recent briefing to the Council during the informal consultations held in April 2014.	1
Not doing anything about such an evil group under the ill-advised pretext that it poses no threat to the government is an abdication of any state's basic responsibility, which is to ensure the safety of its citizens.	1
It is also indisputable that Armenia, as the occupying power, bears direct responsibility for the commission of these crimes.	1
The Council stresses the importance and urgency of restoring justice and the rule of law in post-conflict societies, not only to overcome past injustices, but also to promote national reconciliation and help prevent future conflicts.	0
âThe Security Council highlights the importance of the recommendations of the Financial Action Task Force in supporting the implementation of resolutions 2170 (2014) and 2178 (2014), including its recommendation for States to implement declaration/disclosure systems for both inbound and outbound currency transfers , and other measures to address the threat posed by certain foreign terrorist fighters and their supporters who act as cash couriers for terrorist organizations.	0
Reaffirming the need to combat by all means, in accordance with the Charter of the United Nations and international law, threats to international peace and security resulting from terrorist acts,	1
UNIFIL soldiers must fully implement their mandate with the aim of eliminating threats emanating from Afghanistan.	1
Welcoming the efforts of the Burundian authorities to combat impunity, in particular the prosecution and conviction of some of the perpetrators of the Muyinga massacre,	1
Unresolved ethnic and border disputes have resulted in conflicts that undermine efforts to develop a coherent regional approach to combating terrorism.	1
However, detection and prevention mechanisms are often not implemented at borders due to insufficient application of risk indicators and targeting criteria; Lack of information exchange and lack of cooperation between officials in customs, law enforcement, immigration and financial intelligence units; The lack of human and material resources dedicated to this purpose.	1
However, we also oppose and condemn extrajudicial executions.	1
2 - A diagram showing the Bay of La Union and the Island of Conejo, which is an annex to the GoascorÃ¡n Strip, which was confirmed as being under Honduras' sovereignty by the International Court of Justice's ruling of 11 September 1992, which was again confirmed by the ruling of 18 December 2003, which ruled that the petition for reconsideration submitted by El Salvador regarding the GoascorÃ¡n Strip was inadmissible.	1
However, the situation remains a source of concern, given the long border between our two countries, which is difficult to control.	1
110- Some observers remain unconvinced of the importance of this threat, while others criticize the prioritization of chemical, biological, radiological or nuclear terrorism over other aspects of terrorism or other types of threat.	1
These measures are being taken despite the clear negative position taken by the Special Representative of the Secretary-General and are considered a challenge to the United Nations and the Security Council.	1
E. Arbitrary detention, torture, executions and concentration camps	0
32. To date, the Council has not requested the Secretary-General to report on his efforts, as called for in presidential statements issued in 2009 and 2010, to mainstream drug trafficking as a factor in drug prevention strategies. Conflicts, conflict analysis, integrated mission evaluation and planning, and peacebuilding support.	0
I urge all Somali leaders to take the necessary steps to resolve their differences.	0
Urges appropriate regional and subregional bodies to give particular consideration to the development and implementation of policies, activities and information campaigns on behalf of women and girls affected by sexual violence in armed conflict.	0
3 - The complexities facing conflict prevention and settlement	0
As noted above, there are repeated and reliable reports that these raids increased significantly on the night of 23 March, and then to a greater extent during the nights that followed.	0
Expresses concern that the illicit transfer, destabilizing stockpiling and misuse of small arms and light weapons continues to threaten the safety and security of United Nations peacekeepers and undermine the effectiveness of their implementation of peacekeeping mandates...	1
46. ââThe Counter-Terrorism Committee and its Executive Directorate should: (a) Work more vigorously with the relevant regional organizations (the African Union, the East African Community, the East African Police Chiefs Cooperation Organization, the East and Southern African Community to Combat Money Laundering and the Capacity Strengthening Program in Counter-Terrorism (Intergovernmental Authority on Development) and focus on activities aimed at improving the implementation of the resolution and redressing its shortcomings;	0
Calls upon all parties to cooperate fully with the Independent International Commission of Inquiry established by the Human Rights Council on [date] to investigate the facts and circumstances surrounding allegations of serious human rights violations and violations committed in [the country concerned]... and requests the Secretary-General to transmit this report to Security Council and other relevant international bodies	0
While UNAMA and the Independent Electoral Commission have so far relied on civilian observers to resolve conflicts, this mechanism may not be sufficient to address the most serious threats.	1
The Court of First Instance’s push to issue an arrest warrant against a head of state on March 4, 2009, sparked massive popular reactions and dealt a new setback to hopes for peace and stability.	1
Unfortunately, the Sudanese justice system has proven that it does not have the capacity or desire to investigate and prosecute the perpetrators of war crimes and crimes against humanity in Darfur.	1
We condemn the excessive use of force by the Israeli army in densely populated areas, which inflicts widespread suffering and losses on large numbers of Palestinian civilians, including children.	1
Brigadier General Taur Matan Ruak refused President Gusmao's request to attend the march and sent instead the Chief of Staff of the Timorese Armed Forces, Colonel Leri Anan Timor.	1
It is concerned about armed activities and acts of banditry in [affected countries], which pose a threat to the security of the civilian population, the conduct of humanitarian operations in those areas and the stability of those countries, and result in serious violations of human rights and international humanitarian law.	1
Although the Committee did not accept information indicating that the former Prime Minister gave instructions to Ray Luce to "get rid of" his political opponents during a meeting on 8 May, it is satisfied, on the basis of all the information available to it, that there are reasonable suspicions that the Prime Minister The former was at least aware of the distribution of police weapons to civilians.	1
We challenge anyone to say that there is now a single battle taking place in any corner of Sudan.	1
148 - The international community is increasingly aware of the problems raised by terrorist use of the Internet, and discussion has begun about the possibility of taking measures to confront them.	0
30. Potential dangers arising from the process of bringing non-signatory parties to the negotiating table include the parties' insistence on unrealistic preconditions for the conduct of negotiations. Another danger is the parties' intransigence towards and during negotiations. These dangers can be mitigated by unifying the positions of the international community regarding the peace process and maintaining close dialogue with the parties. Another danger is the establishment of initiatives related to parallel peace processes by regional and/or international partners, which would undermine this element of the framework.	1
On November 3, 2014, regime warplanes bombed the Islamic Orphanage Mosque in the Al-Waer neighborhood in Homs, causing severe damage.	0
Sometimes, in order to cover up these facts, they wear military uniforms to send false messages that the official armed forces are the ones practicing this violence.	1
For example, the ruling in the case known as the âJakir al-Hadi al-Maqbool and othersâ case describes how a joint group of police and armed popular forces, numbering 39 people, left the residents of al-Thabit at the mercy of a large group of Knights attackers.	1
The humanitarian consequences of continuing violence in Iraq are a source of grave concern to my delegation.	1
My delegation strongly condemns these acts of violence and extends its condolences to the family of the deceased pediatrician.	1
Equally worrying is information about increasing tension between government and opposition parties on issues critical to the future of Kosovo, as well as the continued emergence of elements willing to resort to violence.	1
In the letter, the Committee drew attention to the principle of command and superior responsibility stipulated in international criminal law, and urged the Supreme Commander to prevent and suppress crimes against humanity, and to ensure that perpetrators are prosecuted and brought to justice.	1
Resolution 1267, which reflects the international community's determination to restrict the activities of Al-Qaeda, played a prominent role in keeping the focus on the need to prevent the flow of funds to terrorist groups and restrict the movement of their members.	0
The government acknowledged the attack and offered compensation to the victims.	0
562 - There is another, more specific reason why the political and military leadership of the Sudan Liberation Movement and the Justice and Equality Movement cannot refuse to bear responsibility for every crime committed by its soldiers in the field, if that leadership refrains from preventing or suppressing those crimes.	1
3. On 27 December 2007, supporters accused Sergeant Ibrahim Coulibaly, known as IB, who had previously been a member of the Forces Nouvelles, of attacking members of the Forces Nouvelles in Bouake. The attack resulted in many deaths, as well as the arrest of a number of individuals.	0
The concepts of planning, ordering, instigating, aiding, and abetting a crime are discussed below.	0
144 - States are responsible under international human rights law to ensure that human rights and fundamental freedoms are protected and preserved at all times, both in times of war and in times of peace.	0
Although it may not be practical to authorize all units to conduct targeted offensive operations to incapacitate armed groups, urgent measures are needed in order to ensure a more effective contribution of the framework brigades to activities undertaken in the context of incapacitating armed groups and protecting civilians.	0
This is the essence of the humanitarian tradition of CÃ´te d'Ivoire, which is a society with a strong democratic spirit that yearns for the rule of law and respect for human rights for all, without discrimination as to nationality or origin.	0
The Committee continues to monitor and assess the changing nature of the threat posed by Al-Qaida and its associates to international peace and security, and to adapt its operational approach accordingly in order to ensure an effective and efficient response to these threats.	0
