ar_en_DEEP	MatCoop
To expedite the approval process, States may be encouraged to provide the Committee with any available evidence or supporting documents, such as arrest warrants, existing Interpol bulletins, indictments or judicial rulings or copies thereof.	1
The Operation will also cooperate with the Facilitator to encourage the parties to agree on an effective arrangement to control the weapons in storage, consistent with the supervisory role assigned to UNOCI and UNFICYP under the Ouagadougou Agreement.	0
Some Council members expressed their concern that circumstances have not yet allowed the start of investigations into crimes committed by the revolutionaries.	0
13. This situation has complicated efforts aimed at peace and reconciliation.	0
[Calls] in this regard on the parties to the armed conflict to take all possible precautions to protect the civilian population, including children, from the effects of mines and explosive remnants of war, and in this regard encourages the international community to support national efforts aimed at clearing mines and other remnants of war from Explosives and providing assistance to care for victims, including people with disabilities, rehabilitate them and reintegrate them economically and socially.	1
(c) Working with relevant international and regional organizations to raise awareness of and comply with the measures;	1
A number of regions have also concluded specific agreements to control the export, import and transit of these weapons.	1
Thousands were killed, women were raped, villages were burned, homes were destroyed, and property was looted.	0
The Monitoring Group noted in its analysis that at least 31 countries have established national committees or other mechanisms in order to bring all relevant agencies together to discuss issues related to counter-terrorism.	1
To ensure that potential applicants have a clear understanding of this process and are aware of the steps to be taken and to ensure consistency in implementation, practices and procedures to further operationalize this process have been developed and information has been disseminated.	0
It seems that real change is more likely to come from popular protests, rather than from secretly planned violence.	0
The operations of these groups also supported the efforts of the Afghan Taliban to destabilize Afghanistan.	0
(a) The Chief of the Branch in the Office for Disarmament Affairs shall conduct a technical review of the project to determine its consistency;	1
For banking institutions, this obligation is also imposed by Decree No. 1 of the Czech National Bank of 8 September 2003.	1
Critical work is undertaken by organizations such as UNESCO, UNDP and the United Nations Alliance of Civilizations, which focus on preventing conflicts, building a culture of peace, eradicating poverty and promoting sustainable development and social inclusion through education, culture and communications in Africa.	1
In conclusion, the challenges facing Afghanistan are enormous, but we are making progress.	0
The team reports on the progress made by the international community in restricting the movement of terrorists and their supporters, including the recent joint initiative between the International Criminal Police Organization (INTERPOL) and the Security Council that resulted in an international bulletin, with the identity, description, photographs and fingerprints of persons on the Consolidated List.	1
Providing prompt assistance was valuable as it allowed investigators to quickly analyze specific telephone calls made by subscribers to this service and enable them to identify the pattern of calls made by a particular group of subscribers.	1
64. Despite recent improvements in the security situation and the successes achieved in large-scale joint security operations, more needs to be done to maintain pressure on illegal armed groups.	1
Biological risk management and Security Council resolution 1540 (2004)	1
(iii) Improved capacity of [national] authorities in [the violence-affected area], including national law enforcement agencies, the judiciary, and the prison system, to provide necessary security to refugees, internally displaced persons, civilians and humanitarian personnel while respecting international human rights standards.	1
One delegation expressed concern that, despite the Council's listing of the Marine Ocean Management Company, its ships continued to operate, including calling at foreign ports, and suggested that the Committee remind Member States of their obligation to enforce the listing, including by detaining the company's ships and freezing Its origins.	0
231. In addition, UNHCR reported that, as of 15 November 2004, 203,051 people from the Darfur region were residing in 11 camps and other sites as refugees in eastern Chad, along the border with Sudan.	0
For this reason, the insurgents directed their attacks against government facilities and deliberately avoided attacks on Arab tribes.	0
At the 74th General Assembly of the International Criminal Police Organization in September 2005, the Organization adopted Resolution AG-2005-RES-05 on cooperation between the United Nations and the International Criminal Police Organization (INTERPOL), which establishes a special notification regarding individuals on the Consolidated List, which can The Organization may issue it upon the request of the Committee, to alert States that UN sanctions target specific individuals.	1
13 - Reports of children abducted during recent attacks on the civilian population demonstrate the terrible price that Darfur's children are paying in this civil war.	0
The Council and troop- and police-contributing countries heard briefings by Edmund Millet, Assistant Secretary-General for Peacekeeping Operations, Abhijit Guha, Deputy Military Adviser, and Andrew Carpenter, Acting Police Adviser.	0
Mali and Niger have joined the newly established Subregional Joint Intelligence Center in Tamanrasset, Algeria.	1
General Gueye, the former head of the junta, and seven people close to him were executed.	0
International and regional cooperation in preventing illicit trade in small arms and light weapons requires all Member States, in particular States of the region, acting at the national level or through regional organizations or arrangements, to ensure strict implementation of the arms embargo imposed under relevant resolution], to inspect within its territory, including at ports and airports, and on the high seas, ships and aircraft heading to or coming from [the State concerned], if the State concerned has information that provides a reasonable basis for believing that the cargo contains prohibited items. supply, sale, transfer or export pursuant to [paragraph of the relevant resolution]â¦, including the provision of armed mercenary personnel, and requests all States whose flags such ships and aircraft fly to cooperate with such inspections and authorizes Member States to take all measures proportionate to the specific circumstances for carrying out such inspections	0
11 - The criteria for inclusion in the list is âparticipation with the Taliban in threatening peace, stability and security in Afghanistan,â as set out in paragraphs 2 and 3 of resolution 2160 (2014).	0
Requests [the Mission] to strengthen its conflict management capacity by completing as quickly as possible the development of its integrated strategy aimed at supporting conflict resolution mechanisms among local tribes in order to provide the maximum possible protection for civilians; Welcomes the development of a comprehensive strategy for the protection of civilians and encourages [the Mission] to continue and complete its work on developing the strategy in a timely manner; It once again requests [the Mission] to effectively patrol high-risk areas of local conflict, consistent with its current mandate and capabilities.	0
The Security Council reiterates the need for all parties concerned, including Governments and donors, to focus stronger on the long-term effects of armed conflict on children, and on the obstacles to their rehabilitation and full integration into their families and communities, by, inter alia, addressing The need to provide adequate health care, encourage the exchange of information on programs and best practices, and ensure the availability of adequate resources, financing and technical assistance to support national strategies or action plans for child protection and well-being, as well as local programmes, taking into account the âParis Principles for the Protection of Children from Unlawful Recruitment.â legitimate by armed forces or groups, with a view to ensuring the long-term sustainability of their response through the implementation and success of programs for the release and reintegration of all children associated with armed forces or groups.	0
Also, the issue of the full deployment of the civilian police component of the Mission, in accordance with the mandate issued by the Security Council, remains unresolved.	1
With regard to the Timorese Defense Forces, a decree-law stipulates the structure of the army, but the laws governing military discipline and career path in the army are those of the United Nations Transitional Administration in East Timor.	1
26. Furthermore, the comprehensive review acknowledged the large number of measures taken by States to implement the obligations arising from resolution 1540 (2004), but identified some areas in which States had adopted less measures, such as biological weapons, their means of delivery, national control lists, and access to Related equipment, and financing of prohibited or illegal proliferation activities.	1
Commending the progress made to date by the Counter-Terrorism Committee, established by the Security Council, pursuant to paragraph 6 of resolution 1373 (2001) and acting under Chapter VII of the Charter, in carrying out its important responsibility of monitoring the implementation of that resolution,	0
The Lebanese state's ability to fully extend its authority over all of its territory remains limited, however, a series of security incidents have once again highlighted the threats posed by armed groups outside the state's control and the proliferation of weapons to Lebanon's security.	0
Four countries have sufficient legal provisions to suppress terrorist recruitment.	1
177. The courts and structures constituted under the Constitution are still nascent and the system still relies to a large extent on international staff to carry out its core functions.	1
It appears that the United Nations Operation in CÃ´te d'Ivoire granted the Air Force of CÃ´te d'Ivoire permission to move its intact Mi-24 and BAC 167 Strikemaster aircraft from Yamoussoukro to Abidjan Air Base on 24 January 2005, after they had undergone weapons inspection by the United Nations Military Observer Group In Yamoussoukro.	1
In late September, the Mission completed the renovation of Iriba Prison, improving both prisoner detention conditions and prison security.	1
However, Iraq still faces terrorist forces that include foreign elements carrying out horrific terrorist attacks and acts in an attempt to obstruct Iraq's political and economic development.	0
As requested in resolutions 2170 (2014) and 2178 (2014), the Council also received two briefings from the Chairs of the Security Council Committee established pursuant to resolutions 1267 (1999) and 1989 (2011) on Al-Qaida and associated individuals and entities and the Security Council Committee established pursuant to resolutions 2170 (2014) and 2178 (2014). Resolution 1373 (2001) on combating terrorism.	1
It is his duty, at least, to alleviate their suffering by obligating the State of Sudan to compensate them for the harm they have suffered.	1
19 - Emphasizes in this regard the importance of the efforts made by Member States to develop non-violent alternative methods for preventing and resolving conflicts so that affected individuals and local communities can adopt them in order to reduce the risks of spreading extremist ideology that leads to terrorism, and the importance of spreading peaceful alternatives to discourse. violence espoused by foreign terrorist fighters, and emphasizes the role that education can play in countering terrorist rhetoric;	1
11 - The entity's armed forces carried out regular training activities during the reporting period, in compliance with the provisions of the Dayton Peace Agreement relating to military aspects.	1
This will include refining the concept of operations so that the force becomes more flexible and mobile, and can anticipate or respond to crises quickly, while eliminating redundancies.	0
44. The Joint Human Rights Office continued to investigate alleged violations of human rights and international humanitarian law committed by armed groups and national security forces.	1
On 18 July 2011, the Council held a special session with troop- and police-contributing countries to the African Union-United Nations hybrid operation in Darfur.	1
:: Providing information to Member States and international organizations, upon their request, to assist them in making more effective offers of assistance or, as appropriate, requests for assistance, in order to implement their obligations under resolutions 1540 (2004), 1673 (2006) and 1810 (2008). ), using the matrix as a reference tool to facilitate technical assistance	1
We are also concerned about the resurgence of cholera cases, although the mortality rate appears to be slowly declining.	0
Three States have established legal provisions enabling them to extradite wanted persons, exchange information and provide legal assistance, and have concluded bilateral treaties or entered into other arrangements with other States in this regard.	1
(n) Coordination and cooperation with national counter-terrorism focal points or similar coordination bodies in the country visited, as appropriate;	1
We call on all armed groups that signed the Ouagadougou Agreement to disassociate themselves from terrorist groups.	0
This academy will be an important institution to implement the new training curriculum and support the implementation of the roadmap for rebuilding the civilian police force.	0
86. States of the subregion should: (a) review their criminal laws so that they adequately criminalize recruitment for the purpose of committing terrorist acts or joining terrorist groups;	1
344- An eyewitness described the horror of detention in the area designated by the detainees for women and young girls in Kaylek as follows:	0
Regarding the human rights situation in the Democratic Republic of the Congo, he stressed the importance of justice, respect, accountability, good governance and respect for human rights to address the root causes of the conflict, and said that the Democratic Republic of the Congo had made some progress on those issues in recent years.	0
Council members agreed that the root causes of the conflict must be addressed and that there is a need for coordinated responses involving all relevant United Nations bodies.	0
Reaffirming that terrorism in all its forms and manifestations represents one of the gravest threats to peace and security and that any act of terrorism is criminal and cannot be justified, regardless of its motives, regardless of its timing or the identity of its perpetrator; Reiterating its unequivocal condemnation of Al-Qaeda and all associated individuals, groups, institutions and entities, for the ongoing and multiple criminal terrorist acts they commit that aim to kill innocent civilians and other victims, destroy property, and greatly undermine the foundations of stability,	0
H. Prevent and address sexual exploitation and abuse by United Nations personnel, relevant personnel and United Nations partners;	1
However, the children remain linked to the Maoist army, and no progress has been made to secure their formal release; Children remain vulnerable to death and injury during political demonstrations and from explosive devices left behind during the conflict.	0
For example, countries in the Sahara region have found it difficult to deal with mobile terrorist training camps run by Al-Qaeda in the Islamic Maghreb (QE.T.14.01).	0
(e) Authorizing the establishment of independent newspapers and other media; allowing citizens to freely use the Internet and social networks, international communications, radio and television broadcasts and foreign publications, such as the popular culture of other countries; and abolishing compulsory participation in mass organizations and ideological indoctrination courses;	1
Recalling the Security Council presidential statement of 9 May 2011 (S/PRST/2011/9), in which the Council notes that Osama bin Laden will no longer be able to commit acts of terrorism,	0
The Lebanese security teams (police and army) worked hand in hand with the security team of the Commission of Inquiry to ensure the safety and security of the Commissionâs personnel and its workplace.	1
B - Preserving the crime scene	1
16. Expresses its deep solidarity with the victims of terrorism and their families, and encourages the Executive Directorate to take into account the important role that victim and survivor networks can play in countering terrorism, in close cooperation with the Counter-Terrorism Implementation Task Force and its relevant working groups;	0
Although there is evidence of strengthening internal disciplinary mechanisms in the National Police Force of Timor-Leste, progress has been slow in bringing security service personnel responsible for violations to justice through the courts.	1
âThe Security Council attaches great importance to the role played by the Organization of African Unity and welcomes its decision to establish an international team of eminent persons to investigate the genocide in Rwanda and the events surrounding it (S/1998/461).	1
65. The road map for the exit of MONUC should be accompanied by intensified efforts by the international community to strengthen regional cooperation with a view to minimizing external threats and risks to the peace consolidation process in the Democratic Republic of the Congo. Eighth - Notes	1
Eritrea's decision to restrict all types of UNMEE helicopter flights within Eritrean airspace, as emphasized in these briefings, seriously hampers the Mission's ability to implement its monitoring mandate, as requested by the parties in the Agreement The cessation of hostilities was dated 18 June 2000 and was authorized by the Security Council in its resolutions 1312 (2000) and 1320 (2000).	0
The Royal Moroccan Army also reported that its efforts have been hampered by limited resources and a lack of available information regarding areas where mines are prevalent.	0
The Security Council also calls on the three committees to continue their cooperation with the working group established pursuant to resolution 1566 (2004).	0
The Committee members were of the view that the current contents and format of the Checklist should be reviewed with a view to redesigning it, if necessary, and examining its effectiveness on a pilot basis at a later date.	0
140. During some of the visits carried out by the Team, particularly to some of the least developed States, the Team found that national agencies working in the field of counter-terrorism do not receive adequate funding, especially in the area of ââborder security, to the extent that relatively high-ranking officials in them do not receive adequate funding. They have access to computers and other relevant technology, while others do not have enough or no staff to carry out basic tasks.	1
First and foremost, security concerns remain paramount.	0
19 - Requests the Group of Experts to continue to coordinate its activities, as appropriate, with those of the African Union-United Nations Hybrid Operation in Darfur and with international efforts aimed at strengthening the political process in Darfur, and to provide in its interim and final reports an assessment of the progress achieved towards reducing violations by all parties For the measures imposed under paragraphs 7 and 8 of resolution 1556 (2005), paragraph 7 of resolution 1591 (2005) and paragraph 10 of resolution 1945 (2010), and for the progress made towards removing obstacles to the political process and threats to stability in Darfur and in the region violations of international humanitarian law or human rights violations or abuses, including attacks against the civilian population, sexual and gender-based violence, other grave violations and abuses committed against children, and other violations of the above-mentioned resolutions, and to provide the Committee with information on entities and individuals who meet Criteria for inclusion in the List contained in paragraph 3 (c) of Resolution 1591;	1
âThe Security Council stresses the need to continue taking measures to prevent and suppress the financing of terrorism and terrorist organizations, reiterates the obligations of Member States in this regard, including the effective implementation of those measures, and recognizes the importance of the work undertaken by United Nations entities and other multilateral organizations, in particular the Financial Action Task Force.	1
:: Consider how more effective implementation of the Women, Peace and Security Program can contribute to improving security for all and achieving lasting peace	1
They noted that Somalia will still need significant capacity-building assistance to ensure that pirate gangs cannot return to their peak levels.	1
During this period, the Commission will continue its investigation into the crime and assist the Lebanese authorities in continuing the investigation.	1
Several peace operations have recently included cross-border crime analysis in their mission planning and in their joint mission analysis structures â in particular MINUSMA.	0
Citizens are rewarded for informing others who are suspected of committing these âcrimes.â	0
It is recommended that United Nations contributions to the stabilization agenda be harmonized and coordinated within the framework of the next revision of the United Nations Development Assistance Framework.	1
57. The reality remains, however, that the financing of terrorist acts does not follow any clear pattern, especially with regard to local cells that raise funds to support their own activities.	0
3- The political tensions surrounding the 2012 elections increased during the reporting period. On 9 September 2011, a convoy carrying Brigadier General Julius Maada Bio (retired), the presidential candidate of the Sierra Leone People's Party, was attacked by All People's Congress supporters in Bo in the Southern Region, leaving him injured.	0
''The Security Council supports the six-party talks, and calls for their accelerated resumption in order to achieve the verifiable and peaceful denuclearization of the Korean Peninsula, and to maintain peace and stability on the Korean Peninsula and in the Northeast Asian region.	0
In reality, most of the transfers of these weapons to CÃ´te d'Ivoire are unannounced.	0
12 - The Committee will continue to organize meetings and special events on topics and issues of common interest and concern to Member States, with the aim of maximizing the impact of the decisions taken in this regard and maintaining the international communityâs commitment to combating terrorism.	1
Almost all States have introduced early warning systems and made arrangements for information exchange. Almost all of these States also have arrangements for mutual legal assistance in criminal and extradition matters.	1
The United States urges the United Nations and the Haitian National Police to redouble their efforts to examine students' personal records.	0
Recalling the adoption of resolution 2122, and reaffirming its intention to intensify its attention to issues relating to women, peace and security in all relevant thematic areas of work on its agenda, including in the context of threats to international peace and security posed by terrorist acts,	0
66. Through the United Nations Rule of Law and Security Programme, technical and financial support has been provided to a law enforcement seminar and training workshop for the Somali Police Force in Kampala, since August 2005.	1
In an investigation conducted in Morni camp, West Darfur, medical teams treated about 20 victims of sexual violence from April to June 2004.	1
193 - In order to effectively address the asymmetric nature of the terrorist threat, it is necessary to strengthen cooperation by establishing a continuous exchange of information between law enforcement, border security and intelligence agencies.	1
I recognize Pakistan's determination and endeavors to search for the truth and bring to justice all the financiers, perpetrators, organizers, sponsors and conspirators of this terrorist act, so that they can be held accountable for their action.	0
Bearing in mind its primary responsibility under the Charter of the United Nations for the maintenance of international peace and security, and stressing the importance of taking measures aimed at preventing and settling conflicts,	1
(a) Working to adopt comprehensive and integrated national legal frameworks to combat terrorism in line with the rule of law and its obligations in the field of human rights, and strengthening national capabilities in the areas of investigation and prosecution of terrorist acts and in the area of ââadjudicating this type of cases, through means Including requesting assistance to build capacity if needed;	1
Ivorian security forces arrested several national and international journalists (who were soon released as a result of external pressure) and threatened them while carrying out their duties.	0
