ar_en_DEEP	VerConf
I urge donors to examine options available to support Sudan's demobilization, disarmament and reintegration efforts in the post-referendum period.	0
23. The Committee would like to express its appreciation to the Monitoring Team for its high-level report and the recommendations contained therein, as well as for the highly professional support and assistance provided to the Committee, and looks forward to receiving the seventh report to be submitted by the Team, in accordance with annex II of resolution 1735 (2006). , on September 30, 2007.	0
123 - When militias participate with the armed forces in an attack, they can be said to be operating under the effective control of the government, in full accordance with the concept of control (established in 1999 in the Tadic case (Appeal), paras. 98-145).	0
In that regard, we would like to go further to say that we believe that the only way to improve security and stability in Somalia is to enable the Somali security forces to subdue the most powerful insurgents and enable the Government to expand its areas of authority as much as possible if peace negotiations fail.	1
Emphasizes that all parties and armed groups in [the affected country] have the responsibility to take appropriate steps to protect the civilian population of the country, consistent with international humanitarian law and international laws relating to human rights and international refugees, in particular, by avoiding indiscriminate attacks on populated areas or excessive use For strength in it.	1
As a result, some Committee members who do not have information about a name, and who were not party to the consultations, may feel marginalized in the decision-making process; But although there might have been a more open exchange of views at Committee meetings, all members had the option, which they frequently exercised, of requesting further details that they considered important.	0
This is despite the repeated condemnation of these inhumane acts by Security Council Resolutions 1820 (2008), 1888 (2009) and 1960 (2010), which have become a source of hope for millions of women and girls victims around the world.	1
Reaffirming the necessity of using all means, consistent with the Charter of the United Nations, in order to combat the dangers posed by terrorist acts to international peace and security,	1
As Prosecutor, I will face any legal challenge brought by President Al-Bashir and other defendants in court.	1
All of these Janjaweed individuals identified by the Commission as perpetrators are suspected of launching indiscriminate attacks on civilians, which constitute a war crime.	0
All the houses of the village were burned. The bodies of the victims were buried in mass graves near the village.	0
29. Meanwhile, the efforts of the UNOCI police component to advise the Government of National Reconciliation on the restructuring of the Defense and Security Forces of CÃ´te d'Ivoire and to assist in the restoration of civilian policing throughout the country were hampered by the uncooperative attitude of local authorities and the lack of a plan A comprehensive reform of the Defense and Security Forces of CÃ´te d'Ivoire, and the lack of agreement between the Ivorian parties regarding the deployment of CÃ´te d'Ivoire police and gendarmerie personnel in the north.	1
Mr. Le Luong Minh (Viet Nam): Terrorism is a concern shared by all Member States of the United Nations and the international community as a whole.	1
However, some countries' definitions of terrorism appear vague or overly broad, and should be brought into line with international rules.	1
Council members expressed their deep concern about the crimes continuously committed in Libya.	1
(c) Strengthening programs for judicial oversight of police activities and encouraging continued dialogue with international and regional mechanisms with the aim of ensuring compliance with international human rights obligations in the context of combating terrorism.	0
:: Launching any attack that is expected to cause incidental loss of civilian life or injury, or damage to civilian sites, or a combination of such loss and damage, and such risks are excessive in relation to the concrete and direct military advantage expected;	0
The Ombudsman may engage in dialogue with these countries to find out the following:	0
463 - A Parliamentary Committee for the Promotion of Peace, Security and Development in the Darfur States was established, in accordance with National Assembly Resolution 38 of December 2003, with a membership of approximately 59 persons.	0
Last Sunday, on the occasion of the twenty-first anniversary of the Hamas movement, Hamas leader Haniyeh refused to allow President Abbas to remain in office until the internal division was resolved.	1
C. Cooperation with the Counter-Terrorism Committee and the Committee established pursuant to resolution 1540 (2004)	0
On November 16, 2014, regime warplanes targeted the city of Maarat Misrin with a missile, killing five people, including a child and a woman, in addition to destroying residential buildings.	0
In most cases of ground attacks, men were the direct targets of killing, and in some cases there was evidence of efforts by the perpetrators to spare the lives of women.	0
43. Reiterates the need to enhance ongoing cooperation between the Committee, the Counter-Terrorism Committee and the Committee established pursuant to resolution 1540 (2004), as well as their respective expert groups, including, as appropriate, through enhanced information exchange and coordination on country visits under their respective mandates, facilitation and monitoring of technical assistance, relations with international and regional organizations and agencies, and on other matters of interest to all three Committees, expresses its intention to provide guidance to the Committees on areas of common interest with a view to better coordinating their efforts and facilitating such cooperation, and requests the Secretary-General to make all necessary arrangements for the groups to work as soon as possible in a common location;	0
She announced that the Secretary-General had received a request from East Timor to become a member of the United Nations, and looked forward to the Council considering this request.	0
The men in these vehicles and the soldiers in the street opened fire on the police vehicles, wounding a police force soldier in the leg.	0
Deeply concerned about the threat posed by terrorism and the risks of capture by non-State actors**, such as parties identified on the United Nations list established and monitored by the Committee established under Security Council resolution 1267 (1999), and parties to which resolution 1373 (2001) applies, Nuclear, chemical and biological weapons and their means of delivery, or the development, trade or use of such weapons and means,	1
Unfortunately, these warnings were not heeded.	1
Several delegations called on the Government of Mali to investigate human rights violations, expressing concern about the release of perpetrators of serious crimes against human rights.	0
13 - Encourages the Member States of the United Nations to cooperate to resolve all outstanding issues until they adopt by consensus the draft Comprehensive Convention on International Terrorism and the draft International Convention for the Suppression of Acts of Nuclear Terrorism;	0
139 - While this two-pronged approach â which uses restrictions applicable across the Schengen Area to keep out listed persons who are not Schengen States â maintains national restrictions to limit the movement of listed aliens within the area, it can serve as an example for other States in existing or being created areas operating on the basis of freedom of movement and visa exemption.	0
Noting that some parties to the armed conflict have responded to his call to prepare and implement concrete, time-bound plans of action to stop the recruitment and use of children in contravention of the provisions of applicable international law;	0
Based on a careful analysis of the information collected during the Commissionâs investigations, the Commission found that the Government of Sudan and the Janjaweed militias are responsible for serious violations of international human rights law and international humanitarian law that constitute crimes under international law.	1
Reaffirming that acts of terrorism must not be allowed to disrupt the political and economic transition process taking place in Iraq, and reaffirming further the obligations of Member States under resolution 1618 (2005) of 4 August 2005 and other relevant international resolutions and agreements with regard to issues of Including terrorist activities committed in or from Iraq or against its citizens,	1
Accordingly, depending on the circumstances of each individual case, and within the framework of the principle of joint criminal enterprise, these persons may be suspected of having committed a crime against humanity by killing civilians; They commit forced displacement and war crimes by carrying out indiscriminate attacks on civilians and destroying civilian targets.	1
It encourages communities to self-monitor and counter polarizing views without government intervention as a more sustainable way to prevent extremism within communities.	0
The non-profit sector is perhaps the most vulnerable to terrorist financing and the most difficult to regulate and monitor.	1
The request of the Government of Kuwait regarding the claim related to the real estate ownership of a deceased prisoner should not be accepted, given that this matter actually constitutes a request to submit a claim regarding the part related to the real estate ownership after the expiration of the deadline for accepting claims, and that the Secretariat be requested to inform the Government of Kuwait of this.	1
Expressing its dissatisfaction that the Taliban continues to provide safe haven for Osama bin Laden and for allowing him and others associated with him to operate a network of terrorist training camps in territory controlled by the Taliban, and for using Afghanistan as a base for sponsoring international terrorist operations,	0
After the expected elections, consultations will be required with the newly elected government to determine the nature and level of support that the Ivorian authorities will require from UNOCI in order to hold the legislative and local elections before the process can begin to wind down its work.	0
I urge Lebanese leaders to resume and accelerate their discussions on developing a national defense strategy, and to achieve tangible progress therein. The end result of this process must be that there are no weapons without the consent of the Government of Lebanon and no authority other than the authority of the Government of Lebanon.	1
âThe Security Council condemns the deaths of innocent civilians and human rights violations in the eastern Democratic Republic of the Congo, and calls for a full investigation into these incidents.	1
At the same time, all Somali stakeholders, especially the transitional federal institutions, must act on their promises to address the enormous political, economic and security challenges facing them.	1
From our previous discussions, Belgium shared the Secretary-General's concern about the danger that the violence in Iraq poses to a society, institutions and political process that is still fragile.	1
Some delegations stressed the importance of the six-party talks in finding a solution to the nuclear issue on the Korean Peninsula, and called for working to create favorable conditions for the resumption of those talks.	0
âThe Security Council encourages national Governments, the United Nations and regional and subregional organizations to expand and deepen civilian expertise in peacebuilding in the immediate aftermath of conflicts, including experience gained in countries with experience in peacebuilding or democratic transition in the post-conflict period.â With special attention to mobilizing the capabilities of developing countries and women, as this is of great importance to the success of the United Nations in its peacebuilding endeavors.	0
However, we are concerned by recent developments, including increased tensions between members of local communities and ISAF forces.	1
Reaffirming the need for all parties to armed conflict to respect the humanitarian principles of humanitarian considerations, neutrality, impartiality and independence in order to ensure the provision of humanitarian assistance and to ensure the safety of civilians receiving such assistance and the security of humanitarian personnel and United Nations and associated personnel,	0
The Republic of South Sudan is deeply concerned about the deteriorating security situation in the border areas of both the Republic of Sudan and the Republic of South Sudan.	1
Eritrea's decision to restrict all types of UNMEE helicopter flights within Eritrean airspace, as emphasized in these briefings, seriously hampers the Mission's ability to implement its monitoring mandate, as requested by the parties in the Agreement The cessation of hostilities was dated 18 June 2000 and was authorized by the Security Council in its resolutions 1312 (2000) and 1320 (2000).	1
The Office of Information and Administration will oversee the preparation of end-of-course evaluations via the electronic Performance Appraisal System (e-PAS) for all staff of the Directorate, and will help all staff participating in the new voluntary networking initiative to enhance career mobility by increasing horizontal mobility of staff into networked groups, as is the case For the professional network in the fields of political affairs, peace and security.	0
This disturbing pattern of activities is a serious concern that threatens to undermine the credibility of United Nations operations.	1
These recommendations, on which both parties and troop-contributing countries were consulted, aim to strengthen the capacity of the military component to monitor ceasefires and military agreements, within existing resources.	0
In its resolution 2122 (2013), the Council expressed its intention to give greater attention to issues related to women, peace and security in all the relevant thematic areas of work on its agenda, including, in particular, the protection of civilians in armed conflicts and peacebuilding in the post- Conflict, achieving and strengthening the rule of law in the context of maintaining international peace and security, peace and security in Africa, threats to international peace and security resulting from terrorist acts, and maintaining international peace and security.	0
Uganda's only concern and categorical demand remains that the LRA terrorists be immediately disarmed, arrested and brought to justice.	1
''The Security Council expresses its concern about the threat posed by unsecured weapons and ammunition in Libya and their proliferation, as they pose a threat to stability, including the risk of their transfer to terrorist and extremist groups, and calls on the Libyan government to take concrete measures to tighten its control over weapons and ammunition stockpiles in Libya. This is by ensuring the proper management of weapons and related materiel, their safe storage, and their effective disposal when necessary, as well as by enhancing border security, and urges neighboring countries to cooperate in this regard with the Libyan authorities in their efforts to ensure the security of their borders.	0
(g) Persons or entities who support illegal armed groups in the eastern part of the Democratic Republic of the Congo through illicit trade in natural resources;	0
One State gave the example of people who had been denied entry over the past decade due to suspicion of involvement in international terrorist activities.	1
The assessment mission report indicates growing concern about the humanitarian and economic impacts of the crisis on the Sahel region.	1
In his report, the Secretary-General notes some improvement measures in all of these areas except for the central issue of local government reform, in particular, decentralization, where progress is lacking.	1
During the meetings held by the Committee with President Gbagbo and the Ministers of Defence and Internal Security, the Committee was informed that the decision to mobilise the national armed forces was intended to frustrate the demonstration and prevent it from taking place.	0
The Special Representative of the Secretary-General stressed that women live in deplorable conditions without access to health and legal services, and she believed that it would be very difficult to address this situation, especially given the culture of silence and the lack of institutions for investigation and prosecution.	1
We condemn all acts and crimes committed in Kosovo with ethnic motives.	1
But we note that without a strong justice and security sector, developing peace and stability can be threatened.	1
The High Commissioner expressed concern about the continued spread of violations and the prevailing culture of impunity across the country, particularly in the Trust Zone, and the erosion of the rule of law in areas under the control of the Government and the Forces Nouvelles.	1
In this regard, we are particularly concerned about the continued lack of progress in the areas of freedom of movement of minorities, sustainable returns and relevant representation of minorities in government structures and in the public sector at large.	1
In this regard, I received a letter dated 6 December 2007 from the Permanent Representative of Morocco to the United Nations (S/2007/714) and another letter dated 12 December 2007 from the Minister of Foreign Affairs and Cooperation of Morocco (S/2007/731), Both contained allegations of violations of the provisions of military agreements reached in 1991.	1
âThe Security Council calls on the authorities of Burundi and the Democratic Republic of the Congo to cooperate effectively in bringing the perpetrators and those responsible for these crimes to justice without delay.	0
In some recent cases, such as those in CÃ´te d'Ivoire and Libya, the Council welcomed the commissions of inquiry established by the Human Rights Council. This demonstrated the close connection between concrete actions aimed at promoting peace and security and the protection of human rights.	0
A brief exchange of views took place, during which a Council member expressed his views on the force, and a troop-contributing country posed some questions to the Department of Peacekeeping Operations.	0
The impunity of these high-ranking officers is unacceptable and prevents post-conflict societies from recovering sustainably.	1
Terrorists and their associates must not be given the opportunity to exploit legal loopholes to escape the consequences of their actions.	1
As a result of the security forces' firing of tear gas bombs and fire, the crowds erupted in panic and chaos.	0
One of the police officers was killed by a soldier thirty minutes later.	0
We can only express concern about the deteriorating security situation in areas that were previously relatively calm.	1
158. Almost half of States apply customs controls on illicit trade in small arms, light weapons, ammunition and explosives, but customs controls and training of customs officers must be strengthened.	0
44. With regard to the reunification of the two forces, the Chiefs of Staff of the Defense and Security Forces and the Forces Nouvelles informed the assessment mission that they had prepared a proposal to form a unified transitional army consisting of units that would be responsible for providing security for the electoral process.	0
33 - In accordance with Presidential Decree No. 2004-236 mobilizing the national armed forces and the instructions issued during the meeting held between the President, the Prime Minister, the Ministers of Defence and Internal Security and the relevant heads of the National Police, the Gendarmerie and the National Armed Forces of CÃ´te d'Ivoire on 24 March, security forces were deployed in several areas on the outskirts of the city, particularly in places where rallies and demonstrations were planned.	0
When the situation in Haiti is addressed within the framework of the United Nations, all attention is almost always focused on so-called security issues, which in practice reduces the urgent attention needed to the country's serious structural, economic and social problems.	1
In a session held by the full court in the presence of the nine first instance judges and five appeal judges, the court discussed in detail the issue of paying compensation to the victims of the tragic events that occurred in Rwanda.	0
8. The Committee will commence its activities on a date determined by the Secretary-General, which will be formally communicated to the Government of Pakistan.	0
I have the honour to transmit herewith the report of the Security Council Committee established pursuant to resolution 2048 (2012) concerning Guinea-Bissau, which contains an account of the activities undertaken by the Committee during the period from 1 January to 31 December 2014.	0
24. The mid-term review of the Common Vision Strategy was completed in September 2011, following consultations with the Government. The review highlighted the contribution of the United Nations family to the implementation of the Government's agenda for change, and provided direction towards a programmatic approach that would allow greater synergy and flexibility in United Nations activities.	0
As a result, the security situation in Mitrovica has improved significantly, as have judicial and detention services, but little or no progress has been made in the return of displaced Kosovo Serbs and Kosovo Albanians to their homes on the banks of the Ibar River.	0
Despite these challenges, we cannot fail to acknowledge that approximately 50 percent of the Afghan people live in areas where responsibility for security has been transferred to the Afghan security forces.	1
States should ensure full respect for human rights in implementing counter-terrorism legislation.	0
There was likewise no evidence that the Government arrested perpetrators of attacks directed against civilians, as stated in the Joint Statement and Resolution 1556 (2004).	0
8 - While Al-Qaeda as an organization has not evolved, and its key leaders have not been able to rally their supporters behind key operational issues or direct them toward specific action, Al-Qaeda as a movement continues to flourish and draws its strength from a general message of resistance to real or perceived injustice.	0
10. Given the inability of any country in the subregion to implement these recommendations alone, the United Nations Peacebuilding Support Office in the Central African Republic will facilitate cooperation between these countries, upon their request and in partnership with subregional and regional organizations, with the aim of Putting a final end to insecurity in the border areas resulting from the actions of armed groups and bandits.	0
Abdul Rahman Muhammad Dhafer Al-Dubaidi Al-Juhani is linked to Al-Qaeda or any cell affiliated with it or a group associated with it, splintered from it, or affiliated with it due to âparticipation in financing the actions or activities of [the Al-Nusra Front for the People of the Levant, also known as the Al-Nusra Front (QE.A.137.14)] Or planning, facilitating, preparing for, or committing it, or participating in it with, in its name, on behalf of, or in support of, and ârecruiting for it.â	1
He added that one of the Chairman's main tasks is also to act as a consensus builder and foster a climate of cooperation within his committee in order to enable it to move forward.	0
They are the ones who do all these things, and then they ask for protection and guarantees and use them as a mask in order to blackmail and obtain more concessions.	1
However, little information is available about the level of implementation of these implementing rules.	1
Ms. Tagliavini reported that much of the fighting has stopped since the signing of the Minsk documents, but fighting is still continuing in some strategic locations, including the outskirts of the city in the port of Mariupol on the Black Sea, and around Donetsk airport, without taking into account the ceasefire and the Minsk agreements.	0
The Democratic People's Republic of Korea categorically rejects the human rights resolution fabricated against the Republic based on machinations, lies and disinformation and taken under the coercion of the United States and other hostile countries in a tyrannical and arbitrary manner.	1
Based on that hypothesis, the largest number of victims belongs to Abobo: 63 percent of those killed, 35 percent of those injured or tortured, and 40 percent of those who disappeared. The second highest number of casualties belonged to Anyama, with 10 percent of those killed; Kumasi accounted for 13 percent of those injured or tortured, while 35 percent of the disappeared belonged to Anyama.	0
âThe Security Council, recalling its resolutions 2042 (2012) and 2043 (2012), welcomes the appointment of the Joint Special Representative of the United Nations and the League of Arab States for Syria as an important step forward in the path of cooperation between the two organizations, and expresses its support for the efforts made by the Special Representative to continue The good offices of the Secretary-General in this regard.	0
âThe Security Council recognizes the importance of a comprehensive, coherent, action-oriented approach, including during the early planning phase, to protect civilians in situations of armed conflict.	0
