ar_en_TRANSFORMERS	VerCoop
For example, States in the Sahara region have found it difficult to deal with mobile terrorist training camps run by Al-Qaida in the Islamic Maghreb (listed as QE.T.14.01).	0
Some reports, while a few confirmed that the elements of genocide were present in the patterns and nature of violations committed by the Government and its militias.	0
:: 2 June 2005, journalist Samir Kassir was killed by a car explosion in eastern Beirut.	0
In this regard, the Security Council commends the support provided by neighbouring States to refugees from the Democratic Republic of the Congo.	1
Those meetings will include periodic briefings by the working groups responsible for tracking progress on national monitoring and implementation; assistance; cooperation with international organizations, including the Security Council Committee established pursuant to resolution 1267 (1999) and the Security Council Committee established pursuant to resolution 1373 (2001); and transparency and media outreach.	1
The Council also deplored the adoption of the resolution by the Assembly of Kosovo and agreed with the Special Representative that those resolutions adopted by the Assembly, on matters not within its competence, were null and void.	0
Recognizing that most States have undertaken binding legal obligations under treaties to which they are parties, or other obligations with a view to preventing the proliferation of nuclear, chemical or biological weapons, and have taken effective measures to account for, secure and physically protect sensitive materials, such as those required by the Convention on the Physical Protection of Nuclear Material and the measures recommended in the Code of Conduct on the Safety and Security of Radioactive Sources of the International Atomic Energy Agency,	1
(c) The Commission shall have the authority to determine the location and methods of interviewing Syrian officials and persons whom the Commission deems relevant to the inquiry;	1
Recalls the prohibition of the forced displacement of civilians in situations of armed conflict under circumstances that violate the obligations of the parties under international humanitarian law.	0
The phenomenon of foreign terrorist fighters cannot be addressed by security means alone.	0
The meeting took the form of a very ad hoc question-and-answer session, during which the tripartite group responded to questions from the members of the Working Group.	1
Despite those challenges, we cannot fail to acknowledge that nearly 50 per cent of the Afghan people live in areas for which responsibility for security has been transferred to the Afghan security forces.	0
They noted that Somalia would continue to require substantial capacity-building assistance to ensure that pirate gangs could not return to peak levels.	0
One soldier grabbed the baby and threw it away on the side of the road.	0
Urge relevant regional and/or subregional bodies to develop and implement policies and activities in favour of civilians affected by armed conflict, and advocate for this.	1
At the 5303rd meeting of the Security Council, held on 10 November 2005, in connection with the Council's consideration of the item entitled "Threats to international peace and security caused by terrorist acts," the President of the Security Council made the following statement on behalf of the Council:	1
:: The prohibition of arbitrary deprivation of liberty; corporal punishment; collective punishment; and the imposition and execution of death sentences without prior trial by an ordinary court constituted in accordance with the law which guarantees all legal safeguards generally recognized as non-derogable.	0
32. Welcomes the periodic briefings by the Government of Afghanistan on the content of the List and the impact of targeted sanctions on deterring threats to peace, stability and security in Afghanistan, as well as supporting the Afghan-led reconciliation process;	1
:: Request UNMISS to support the host Government in addressing sexual violence explicitly, in disarmament, demobilization and reintegration processes, security sector reform processes and justice sector reform initiatives, and in developing and implementing concrete and time-bound action plans to combat conflict-related sexual violence.	1
"The Security Council reiterates its support for the establishment of a major group with the task of continuously mobilizing the international community, increasing consultation among key stakeholders to enhance the coordination and effectiveness of assistance to Haiti and contributing to the definition of a long-term development strategy aimed at promoting lasting peace and stability in that country.	1
The shelling damaged the mosque and nearby houses.	0
The 2008 report of the Financial Action Task Force on patterns of money-laundering and the financing of terrorism through the real estate sector indicates that there may be terrorist financing schemes related to the real estate sector.	0
No major change in the overall security situation is expected, although a slow and steady increase in crime-related incidents is expected.	0
The inhabitants of those neighbourhoods were subjected to violence and beatings by the security forces.	0
The gender perspective has been mainstreamed into coordinated responses to the prevention of armed conflict and emergencies.	0
Reaffirming the need to use all means, in conformity with the Charter of the United Nations, to combat threats to international peace and security caused by terrorist acts,	0
The exclusion of other forms of sexual abuse from the scope of the investigation has left a large number of allegations unattended.	0
I am deeply concerned that sexual violence against children will weaken the prospects for peaceful coexistence in Darfur for years to come.	0
Although threats from illegal militias in the west will remain low, for most areas of Afghanistan, these forces will continue to pose the second greatest threat to regional security, following threats related to drugs and crimes.	0
Most States do not have domestic refugee legislation and only three have ratified the 1951 Refugee Convention.	0
The Directorate will facilitate the provision of required training to customs officers, border police and financial intelligence units in the first quarter of 2014.	0
Decides hereby to establish an international tribunal solely for the purpose of prosecuting persons responsible for serious violations of international humanitarian law committed in the territory of [the State concerned] between [two dates]...	1
43. Reiterates the need to strengthen the ongoing cooperation between the Committee, the Counter-Terrorism Committee and the Committee established pursuant to resolution 1540 (2004), as well as their respective expert groups, including, as appropriate, by enhancing the exchange of information and coordination on country visits in accordance with their respective mandates, facilitating and monitoring technical assistance and relations with international and regional organizations and agencies, as well as on other issues of concern to all three Committees, expresses its intention to provide guidance to the Committees on areas of common interest with a view to better coordinating their efforts and facilitating such cooperation, and requests the Secretary-General to make all necessary arrangements so that the groups can work as soon as possible in a common place;	0
450. There are a number of serious errors that prevent the judicial system in the Sudan from working quickly and correctly to address the attacks.	0
These positions are an indirect participation in the blinding of the positions of the Syrian Government on its territory and an irresponsible incitement to violence in all its forms, which would provide international cover for terrorist acts by armed groups against the interests of Syria and its people and Government.	0
Recalling the presidential statement of the Security Council (S/PRST/2012/17) of 4 May 2012 on threats to international peace and security caused by terrorist acts,	0
Stress the responsibility of parties to armed conflict to respect, protect and meet the basic needs of the civilian population under their effective control.	1
Within the framework of the Office of the United Nations High Commissioner for Refugees (UNHCR), the parties will further study family visits by road.	0
"The Security Council invites the Secretary-General to redouble his efforts to ensure that the monitoring and reporting mechanism is strengthened to implement resolution 1882 (2009) in order to allow for the acceleration of awareness-raising activities and the operationalization of measures to address all violations and abuses against children, inter alia, by ensuring that all relevant United Nations agencies effectively assist in the collection of accurate, objective, reliable and verifiable information on rape and other forms of sexual violence committed against children, as well as by ensuring synergies between relevant United Nations entities, both at Headquarters and at the country level, and avoiding overlapping of functions as required by resolutions 1882 (2009) and 1888 (2009).	1
The current strength of the Centre consists of 544 Forces nouvelles and national defence and security personnel, with a maximum authorized strength of 568, including mixed police units.	0
Expressing their desire to unite and promote harmony among communities in the Azawad region, with all its components;	0
Secondly, Mr. Covic expressed his concern about the quality of democracy in a place where the minority - Kosovo Serbs - risk losing to the mechanical majority vote, and I would like to say that I believe that the most important aspect of democracy that can be expected is one &apos; s participation, exercise of democratic rights and vote.	0
On 30 August 2010, SPLA established a child protection unit in Belfam, Central Equatoria State, in support of the implementation of the United Nations and SPLA action plan.	0
23. On the other hand, the Commission reaffirms its determination to continue to combat the adverse effects of climate change.	1
The Council also imposed on individuals and entities designated by the Committee an embargo on the supply, sale or transfer of arms and military equipment and related training, financial assistance and other forms of assistance.	1
(c) Facilitate capacity-building of the States of the subregion, in cooperation with the Eastern and Southern African Group against Money Laundering, to establish/strengthen financial intelligence units and develop their legislative and executive capacity to freeze funds without delay.	0
220. The Committee recommends that special measures be taken to ensure the dignity of victims and to avoid re-traumatic stress in any proceedings, whether judicial or non-judicial.	1
During my visit to Lebanon in January, I told Lebanese interlocutors, both during private and public meetings, of the serious risks that the continued presence of these militias in the country poses to the stability of the country and to internal peace.	0
The Treaty establishing the Court, the Rome Statute, entered into force on 1 July 2002.	0
Capacity-building and longer-term stabilization activities should be transferred to the country team to the extent possible in areas where it has a comparative advantage.	1
18. In Beni, both local authorities and civil society called for more effective participation of the UNOMIL force in military operations against the coalition, including through unilateral operations.	1
Ocean Without Piracy, a non-governmental organization, estimated that $3.2 billion had been spent in 2013 on combating piracy and that the international community had spent some $139 million on each attack.	0
"The Security Council recognizes that women continue to be underrepresented in formal peace processes and is deeply concerned about the continuing obstacles and challenges posed by situations such as violence against women, dilapidated economies and social structures, the absence of the rule of law, poverty, limited access to education and other resources, and various forms of discrimination and stereotyping.	0
The Group also continued to play an active role in developing measures to combat the financing of terrorism through its participation in the Financial Action Task Force on Money Laundering (FATF) plenary meetings and meetings of FATF-style regional bodies.	0
35. Decides, with a view to assisting the Committee in fulfilling its mandate, that the Monitoring Team of the 1267 Committee established pursuant to paragraph 7 of resolution 1526 (2004) shall also support the Committee for a period of 36 months, the mandate of which is contained in annex A to the present resolution, and requests the Secretary-General to make all necessary arrangements to that end;	1
Calling upon States to work together urgently to prevent and suppress acts of nuclear terrorism, including by promoting cooperation and the full implementation of relevant international conventions, and by taking appropriate measures to strengthen the existing legal framework with a view to ensuring effective accountability of those who commit crimes of nuclear terrorism;	1
"The Security Council invites the Secretary-General to continue to transmit to it relevant information and analysis whenever he considers that such information or analysis would contribute to improving his work on the protection of civilians in armed conflict and to include, on an ongoing basis and as appropriate, in his written reports to the Council on matters before it, observations relating to the protection of civilians in armed conflict.	1
82. In follow-up to Security Council resolutions on children affected by armed conflict, in particular resolution 1612 (2005), a strong partnership has been established between the United Nations and the Netherlands Organization for International Development Cooperation -- Somalia, a non-governmental organization, to initiate community-level reporting and monitoring of violations of child rights and child protection.	0
A number of detainees held by the Moroccan authorities were on hunger strike during the period from the beginning of August to 29 September.	0
Any deprivation of liberty must be carried out in accordance with article 9: deprivation of liberty must not be arbitrary; it must be in accordance with the law and the procedure established therein; information must be provided on the reasons for arrest; and a court must be allowed to decide on the detention, as well as compensation in the event of a violation.	1
(b) Prevent the entry into or transit through their territories of such individuals, provided that nothing in this paragraph shall oblige any State to deny entry into or require the departure from its territory of its nationals; and this paragraph shall not apply where entry or transit is necessary for the conduct of judicial proceedings or where the Committee established pursuant to resolution 1267 (1999) ('the Committee') determines, in a case-by-case situation-by-case situation, that entry or transit is justified;	1
The Organization for Security and Cooperation in Europe (OSCE) had not yet observed any withdrawal of heavy weapons from the line of control.	0
20. Since my report (see S/2007/619, para. 25), the Royal Moroccan Army has continued to report a large number of alleged violations of military agreement No. 1 by the Frente POLISARIO concerning the presence of persons and vehicles in the buffer strip.	0
Calls upon parties to armed conflict to undertake and implement specific commitments to combat sexual violence with specific time frames, including, inter alia, clear chain of command orders prohibiting sexual violence and the prohibition of sexual violence in codes of conduct and manuals of military operations in the field or their equivalent, and calls upon those parties to undertake and implement specific commitments to investigate alleged abuses in a timely manner to hold perpetrators accountable;	1
In its resolution 2154 (2014), adopted on 8 May 2014, the Security Council noted with deep appreciation that Captain Mbaye Diang (Senegal), who had been working in UNAMIR, had saved the lives of hundreds and perhaps thousands of Rwandans, without any weapons and in the face of serious danger, during the 1994 genocide.	1
45. The Committee reaffirms its responsibility to include the implementation of Council resolution 1624 (2005) in its dialogue with Member States and to assist in capacity-building in this regard, including through the dissemination of best legal practices and the promotion of information exchange.	1
We urgently appeal to them to increase their support for the collective initiatives that our States will take, within the framework of the Nouakchott process, to address the threat that terrorism, violent extremism and transnational organized crime pose to international peace and security.	0
Reiterating the obligation of Member States to prevent the movement of terrorists or terrorist groups, in accordance with applicable international law, including through effective border controls,	0
119. Significant resources have been invested worldwide in initiatives to promote dialogue and understanding among civilizations and to counter incitement motivated by extremism and intolerance.	0
Urge humanitarian and development organizations to take appropriate action to prevent sexual exploitation and abuse by their personnel, including conducting predeployment and field awareness training, in the case of United Nations actors, and to promote and ensure compliance with the Secretary-General &apos; s bulletin on special measures for protection from sexual exploitation and abuse (ST/SGB/2003/13), including by civilian personnel of United Nations peacekeeping operations and other relevant missions.	1
Since October 2013, Atlanta has foiled two pirate attacks and transported five suspected pirates to trial in Seychelles.	0
27. The members of the Committee noted on several occasions the complementarity of the functions of the Al-Qaida Sanctions Committee, the Committee established pursuant to resolution 1373 (2001) concerning counter-terrorism and the Committee established pursuant to resolution 1540 (2004) with regard to combating international terrorism, and the need for coordination of activities and exchange of information among the three Committees.	1
Two of the meetings attended by the Group resulted in a specific request to the United Nations Office on Drugs and Crime (UNODC) to organize reporting workshops for States from Africa and the Caribbean/Latin America, which are required to report to one or more of the three Security Council committees dealing with counter-terrorism).	1
Taken together, these challenges constitute political pressures on Governments and have a direct and serious impact on peace, security and stability in the countries concerned.	0
A senior government official who participated in the recruitment process led the Commission to the effect that tribal leaders were receiving gifts and gifts for their recruitment efforts and depending on the number of persons they were able to recruit.	0
The terrorist networks formed in the conflicts that are now taking place can pose a threat for decades to come.	0
10. Encourages all Member States to submit to the Committee established by paragraph 30 below (the "Committee") for the purpose of listing the names of individuals, groups, undertakings and entities participating, by any means, in the financing or support of the actions or activities described in paragraph 3 above;	1
Urge States, United Nations entities, regional and subregional organizations and other relevant parties to take appropriate measures to combat any illegal activities affecting children across borders and at the subregional level and any other violations or abuses committed against children in situations of armed conflict in violation of applicable international law.	0
129. Beyond the immediate scope of the sanctions measures, delegations expressed particular interest in sharing their expertise on the return of terrorists to society.	1
Takes note of the development of the human rights due diligence policy, encourages [the mission] to implement it fully, and requests the Secretary-General to include progress in the implementation of that policy in his reports to the Council;	1
22. On 9 April 2013, the Committee met with representatives of the Department of Political Affairs, the Department of Peacekeeping Operations, the Monitoring Team, the Executive Directorate of the Committee established pursuant to resolution 1373 (2001) and the Counter-Terrorism Implementation Task Force.	1
As a result of the Ebola outbreak, Guinean security institutions have shifted their efforts towards containing the outbreak.	0
2. Decides also that all States, in accordance with their national procedures, shall adopt and enforce appropriate effective laws which prohibit any non-State actor to manufacture, acquire, possess, develop, transport, transfer or use nuclear, chemical or biological weapons and their means of delivery, in particular for terrorist purposes, as well as attempts to engage in any of the foregoing activities, participate in them as an accomplice, assist or finance them;	1
Syria calls upon the United Nations and its relevant bodies to combat terrorism and prevent its financing, including the Security Council and its relevant Committee, as well as the Human Rights Council, to deny terrorists and their supporters any cover for their destructive practices in order to preserve the sovereignty and independence of States and to preserve security, peace and stability.	1
Reiterates its demand that all parties to the conflict cease all acts of sexual violence fully and immediately, and also reiterates its call upon those parties to undertake specific time-bound commitments to combat sexual violence, including, inter alia, clear orders through their chain of command prohibiting sexual violence, accountability for breaches of such orders, provision for the prohibition of sexual violence in codes of conduct and manuals of military operations on the ground or the like, and specific commitments to investigate and fulfil alleged abuses in a timely manner; further calls upon all relevant parties to armed conflict to cooperate within these obligations with the personnel of United Nations missions involved in monitoring their implementation, and calls upon the parties to appoint, as appropriate, a high-level representative responsible for ensuring the implementation of these undertakings;	0
13. The Committee reaffirms that States must ensure that any measures taken to combat terrorism comply with all their obligations under international law and adopt such measures in accordance with that law, in particular human rights law, refugee law and humanitarian law.	1
"The Security Council recognizes the support of bilateral and multilateral actors, including the African Union, the European Union, the Organization of Islamic Cooperation, the League of Arab States and subregional organizations such as the Economic Community of West African States, the Community of Sahelo-Saharan States, the Intergovernmental Authority on Development and the Arab Maghreb Union, in their efforts to combat terrorism in Africa, and calls upon the international community and the United Nations system to strengthen their cooperation with subregional counter-terrorism bodies, such as the African Centre for Studies and Research on Terrorism.	1
Opposition forces - affiliated with Mohamed Ibrahim Habsade - were able to take control of Baidoa on 26 or 27 March, or so, by defeating the militias of President Yusuf and Sheikh Madobe.	0
The Committee strongly recommends that Member States establish such national bodies to coordinate and discuss counter-terrorism issues.	1
23. East Africa had been a victim of terrorism in the past and continued to face a high level of terrorist threats owing to its continuing political instability.	0
173. The Committee notes, however, that the Office &apos; s approach and preparedness for such intervention have been deficient.	0
With regard to Burundi, the mission called on the armed groups to cease all hostilities and start ceasefire negotiations without delay.	1
In addition, the Mission is currently examining the need for a specialized reconnaissance aircraft to carry out observation and patrolling operations in border areas and coastal areas that are generally inaccessible.	0
Following its meeting on 8 September 2010, the Working Group adopted its conclusions on children and armed conflict in Colombia (see S/AC.51/2010/3).	1
"The Security Council condemns the deaths of innocent civilians and human rights violations in the eastern Democratic Republic of the Congo and calls for a full investigation into these incidents.	0
:: Highlighting the importance of the women, peace and security agenda in addressing discrimination, human rights violations and obstacles to the protection and justice of refugees, internally displaced persons and stateless women and girls at all stages of the displacement cycle	1
"The Security Council reaffirms its commitment to the protection of civilians in armed conflict and to the continued full implementation of all its previous relevant resolutions, including resolutions 1265 (1999), 1296 (2000), 1674 (2006), 1738 (2006) and 1894 (2009), as well as all its resolutions on women, peace and security, children and armed conflict, peacekeeping and all relevant statements of its President.	1
