ar_en_TRANSFORMERS	VerCoop
'The Security Council urges Member States to improve bilateral, international, regional and subregional cooperation and to prevent the travel of foreign terrorist fighters from or through their territories, including by increasing the exchange of information with a view to identifying foreign terrorist fighters, understanding their travel patterns, sharing practices in evidence-based passenger risk assessment and border testing, and noting the need to address the challenges posed by elusive travel routes of foreign terrorist fighters.	1
These meetings will also be used to review general issues important to the Committee &apos; s work with a view to promoting a more innovative and dynamic approach to the work of the Executive Directorate and to develop new ideas on how the Organization can respond more effectively to the growing terrorist threat.	1
Takes note of the development of the human rights due diligence policy, encourages [the mission] to implement it fully, and requests the Secretary-General to include progress in the implementation of that policy in his reports to the Council;	1
Calls for effective international action to curb the illegal flow of small arms into conflict areas.	1
This includes those detained by the National Security and Intelligence Service in a secret place of detention in Khartoum, which was discovered and inspected by the Commission.	0
17. More than 8,000 people were killed in Afghanistan in rebel incidents during 2007 (A/62/722-S/2008/159, para. 17), compared with 6,000 killed by all kinds of violence in 2006.	0
Once the revised plan is approved by the Committee, the priority activity of the Directorate will be to initiate the new cluster and unit structure and to proceed with the development of criteria for the full scope of the Directorate &apos; s work and the harmonization of judgements in this framework.	0
Within one week of the Committee &apos; s adoption of policy guidance in a particular area, the Executive Directorate should develop a plan for the implementation of the guidance and submit it to the Committee for approval.	1
24. The Committee, with the assistance of its Executive Directorate, arranged special events with Member States and international and regional organizations on a number of topical issues of common concern, including counter-terrorism through the use of new communications and information technologies.	0
31. Both States and many international actors welcomed the openness of the comprehensive review process and urged the 1540 Committee to continue this approach and to increase its already useful efforts towards transparency and inclusiveness.	1
Seventeen States said that they did not consider themselves threatened, while three expressed the belief that there was no risk at the regional level.	1
The Committee duly completed its review before the new deadline.	0
Decides to remove those individuals, groups, undertakings and entities previously designated as the Taliban, and other individuals, groups, undertakings and entities associated with them, who as at the date of adoption of this resolution were registered in section A ("individuals associated with the Taliban") and section B ("Entities, groups and other institutions associated with the Taliban") of the Consolidated List maintained by the Security Council Committee established pursuant to resolution 1267 (1999) concerning Al-Qaida and the Taliban and associated individuals and entities, and to include such names in the list referred to in paragraph 1, and further decides that all States shall take the measures provided for in paragraph 1 against such listed individuals, groups, undertakings and entities;	0
44. It is equally clear that many of the killings on these two days did not take place in the streets, but in the homes of those who intended to demonstrate or even innocent civilians targeted by the security forces solely because of their names, origin or group.	0
11. Requests the Secretary-General to include in his next report a comprehensive assessment of the disarmament, demobilization and reintegration and disarmament, demobilization, repatriation, resettlement and reintegration programmes of the Mission and, in close coordination with his Special Envoy for the Great Lakes Region, to make recommendations on adjustments that may be needed to increase their effectiveness and resources and to coordinate with the military component of the Mission;	1
Urging [the affected State], in coordination with the international community, to undertake comprehensive police, judicial and prison reform, to protect and promote human rights and fundamental freedoms and to end impunity.	1
The authorities agreed that ethnic Albanians were victims of social and institutional discrimination and recognized that confidence-building measures, such as integration of ethnic Albanians into the local police force and increased representation in political institutions, would go a long way towards easing tensions and stabilizing the region over a longer period.	1
The decision of the European Union to start negotiations on a stabilization and association agreement serves as a point of reference in this regard.	1
The Trust Fund also supports other activities relevant to the implementation of the objectives of the Contact Group in addressing piracy in all its aspects.	0
266. Clearly, the issue of proportionality was not raised when there were no armed groups in the village, where civilian attacks were targeted alone.	0
In August 2005, the Group, accompanied by UNOCI officials, visited the Autonomous Port of Abidjan, Grand Lahoe, Frisco, Sassandra, Munugaga, Grand Birbi, San Pedro Autonomous Port and Tabou. At all these locations, the Group examined ports and docks and discussed the implementation of the embargo with the responsible authorities, businesses and UNOCI.	1
- The Group of Experts should have particularly unimpeded access to persons, documents and sites to enable it to carry out its mandate;	0
Suspects are deliberately starved and subjected to other inhumane conditions of detention to increase pressure and force them to confess and to criminalize others.	0
The international community remains committed to combating terrorism in all its forms and manifestations, but should strengthen its efforts to achieve full implementation of relevant resolutions and international counter-terrorism instruments.	1
258. Under resolution 1373 (2001), States are required to prevent the cross-border movement of terrorists and terrorist groups through controls on the issuance of safe and proper identity and travel documents.	1
63. Significant concerns remain regarding restrictions on freedom of expression.	0
"The Security Council reaffirms the need to combat all forms of terrorism and that no terrorist act can reverse the path towards peace, democracy and reconstruction in Iraq, which is supported by the Government and people of Iraq and the international community.	1
The report should also identify the contributions that the Council could make to the effective implementation of existing humanitarian law and should examine whether there were any significant gaps in existing legal norms, by reviewing recent reports on the matter.	1
The Mission trained more than 20 human rights organizations on monitoring techniques and, with the financial support of OHCHR and the Embassy of Canada, facilitated the production and dissemination of awareness-raising materials for more than 30,000 people and civil society organizations.	0
37. In July 2007, the Government submitted a draft law for the establishment of a truth and reconciliation commission, which is currently being consulted with a number of stakeholders.	1
Reaffirming the need for all parties to armed conflict to respect the humanitarian principles of humanity, neutrality, impartiality and independence in order to ensure the provision of humanitarian assistance and the safety of civilians receiving such assistance and the security of humanitarian personnel and United Nations and associated personnel,	1
6. Demands that all States and parties to armed conflict fully implement all relevant Security Council resolutions and, in this regard, cooperate fully with United Nations peacekeeping missions and country teams in the follow-up to and implementation of these resolutions;	1
97. In conclusion, I would like to express my appreciation for the dedicated service of my Special Representative for the Sudan, Haile Menkerios, as well as all military, police and civilian personnel serving in UNMIS.	1
However, the Commission found no evidence that they were so widespread and systematic as to constitute a crime against humanity.	0
14. The Executive Directorate will strengthen its engagement with international, regional and subregional organizations around the world to assist them in developing and/or implementing appropriate action plans in the context of counter-terrorism and to involve them more directly in meeting the capacity-building needs of States identified by the Committee through initial implementation assessments and country visits.	1
While this recommendation is primarily aimed at future listings, the Committee may wish to provide specific and targeted guidance to States where such transfers have been known to have already taken place.	1
However, these soldiers are equipped with light weapons and have poor ground mobility, no air assets and minimum logistical and financial support.	0
Cells, branches or associated groups are now obliged to operate independently and to finance their activities on their own.	0
Some Council members noted the importance of coordination - between the Council &apos; s sanctions committees and its expert groups and Member States, as well as between United Nations entities, field missions and force commanders - for the effective implementation of the Council &apos; s sanctions.	1
I am aware of Pakistan &apos; s determination and endeavours to seek the truth and bring to justice all the financiers, perpetrators, organizers, sponsors and conspirators of this terrorist act to be held accountable.	1
Moreover, mobile armed groups that rely on banditry tend to be more brutal in their tactics, as they are less motivated to establish local public support bases.	0
I am deeply concerned about the recent escalation between Gaza and Israel.	0
Law enforcement agencies: establishment of counter-terrorism units	0
154. Although the Commission received information from a source that one of Hariri &apos; s trusted associates tampered with the jamming devices prior to the explosion, the Commission was unable to substantiate this information.	0
:: Relations with other United Nations entities, including the Secretary-General and his Office, and other subsidiary bodies of the Security Council working in the area of counter-terrorism.	0
Condemn and call for the immediate cessation of all acts of violence or violations against civilians in violation of applicable international humanitarian and human rights law.	0
(h) Develop methodologies to improve the effectiveness of cooperation with individual States, subregional organizations, regional organizations, international organizations and multilateral arrangements dealing with export controls and relevant entities within the United Nations system, assess the level of cooperation between the committees established pursuant to Security Council resolutions 1540 (2004), 1267 (1999) and 1373 (2001), assess in particular the level of information exchange and coordination with regard to country visits, and make specific recommendations, as appropriate, for enhanced cooperation.	0
As stated in Security Council resolution 1535 (2004) and the report of the Counter-Terrorism Committee on its revitalization (S/2004/124), the Counter-Terrorism Committee looks forward to establishing a close and cooperative relationship with the Executive Director and his staff with a view to strengthening the Committee's capacity to effectively monitor the implementation of resolution 1373 (2001).	1
8. More than six years after the adoption of resolution 1624 (2005), there are still serious risks and threats in most parts of the world to incite the commission of terrorist acts, but there are disparities in the level of such threats and threats, including among States from the same region or region.	0
However, he felt - and another speaker agreed - that the Council &apos; s initiatives should be more than consistent in its subsidiary bodies and aimed at system-wide coherence within the United Nations when important issues, such as counter-terrorism, were at stake.	1
The Commission also received credible reports of the killing of another police officer by the crowd in the same area.	0
The parties to the peace process have yet to make arrangements for the release of children and reintegration programmes that would have enabled children in those forces to benefit from recovery and reintegration measures.	1
A military adviser from the Department of Peacekeeping Operations responded to questions posed by Council members.	1
Stressing that safe havens for terrorists remain a serious concern and that all Member States must cooperate fully in the fight against terrorism in order to find and bring to justice any person who supports or facilitates the financing, planning, preparation or commission of terrorist acts or the provision of safe havens, participates or attempts to participate, and not to grant safe haven to that person, based on the principle of aut dedere aut judicare,	1
Reaffirming its call upon all States to become parties as soon as possible to the international conventions and protocols against terrorism, whether or not they are parties to regional conventions on this issue, and to implement fully their obligations under the conventions to which they are party,	1
46. MONUC continued to coordinate support for the implementation of the national strategy on sexual and gender-based violence, under which five programmes are being implemented in the areas of prevention and protection, combating impunity, multisectoral assistance, security sector reform, data collection and mapping in the Ituri and South Kivu provinces.	0
(a) The distinction between combatants and civilians, and the protection of civilians against violence, in particular attacks on life and physical integrity, in particular murder (this rule has been reaffirmed in some agreements concluded by the Government of the Sudan with the rebels);	1
At the same time, other key elements of this institution-building process are strengthening the rule of law by increasing the effectiveness, integrity and overall functioning of the judiciary, strengthening law enforcement institutions to reduce organized crime and ethnic violence and bringing all criminals to justice.	0
As pointed out by a third speaker, the Council will find itself constantly at an impasse, without a commitment to cooperation between the permanent members and the elected members, since resolutions require nine votes for adoption.	1
According to these sources, the rape of individual victims was often multiple, i.e. by more than one man, and was accompanied by other severe forms of violence, including beatings and flogging.	0
However, little information is available on the level of implementation of those operational rules.	0
UNOCI will also cooperate with the Facilitator to encourage the parties to agree on an effective arrangement for the control of weapons in storage, consistent with the oversight role of UNOCI and the Licorne force under the Ouagadougou Agreement.	1
464. The Commission made recommendations in the areas of security, humanitarian aid, the strengthening of social infrastructure, services and development, the opening of police stations with adequate supplies for rapid crisis response and the seizure of weapons in the hands of suspects.	1
While the Government of Iraq affirms its respect for its obligations under the resolutions of the United Nations Security Council and its pursuit of peaceful policies and peaceful living with its neighbours in a manner that contributes to the security and stability of the region, the Government of Iraq looks forward to the recognition by the Security Council of the significant and positive developments that have taken place in Iraq. The situation in Iraq is fundamentally different from that which existed when the Security Council adopted resolution 661 (1990) and the time has come for Iraq to regain its legal and international status, which prevailed prior to the adoption by the Security Council of the said resolution and the subsequent sanctions imposed on it under Chapter VII of the Charter of the United Nations.	1
35. In mid-March, Brigadier General Ruak announced the demobilization of 594 troops with retroactive effect from 1 March.	0
In particular, States are encouraged to strengthen physical security, improve stockpile management and the destruction of surplus and obsolete small arms and light weapons, ensure the marking of all small arms and light weapons at the time of manufacture and import, strengthen export and border controls and control brokering activities.	1
In addition, Syrian security forces continue to operate along the Syrian-Lebanese border, part of which has been mined in recent months.	0
57. The purpose of the visit was: to review the progress made in the implementation of the action plan signed between the Government and the United Nations country team on monitoring and reporting on 4 October 2012; to discuss the conclusions adopted on 19 September 2014 on children and armed conflict in the Democratic Republic of the Congo; to liaise with relevant ministries, other Government officials, child protection actors, non-governmental organizations and children formerly associated with armed groups and to determine first-hand the situation of children affected by the armed conflict in the Democratic Republic of the Congo, paying particular attention to the efforts of FARDC to comply with its obligations and remaining challenges, including those relating to non-State actors included in the annual report of the Secretary-General; and to assess the challenges and opportunities for the reintegration of children associated with armed forces and groups in the Democratic Republic of the Congo.	1
34. The Commission expresses its appreciation to the African Union and the United Nations for their support in various forms to the efforts of the region to find a peaceful solution.	1
Officials presented the Government &apos; s view and policies on the conflict in Darfur.	1
The amendment to Act No. 61/1996 (Act No. 284/2004 of 8 April 2004, in force from 1 September 2004 - the new Money Laundering Act) provides that the Financial Analysis Unit may exchange information with foreign authorities with the same powers, within the scope of international treaties or on the basis of reciprocity.	1
Drug trafficking and transnational organized crime	0
In that context, we believe that it is important that the Security Council pay the utmost attention to the threats posed by fundamentalist and extremist religious organizations such as the Liberation Party and urge the Council to impose severe sanctions on terrorist organizations.	0
Recent reports of the deaths of sick and hungry ex-combatants in the Cotacully camp underscore the need for the Government to provide the necessary resources to improve the poor conditions in the pre-disarmament, demobilization and reintegration sites, including by making available the $10 million pledged to the new plan.	0
Meanwhile, resources are being mobilized, with the support of UNOCI, UNICEF and WFP, for the rehabilitation and reintegration of a total of 511 child soldiers, including 204 girls released and handed over to UNICEF by the Forces nouvelles leadership.	0
The prison provides better infrastructure and sanitation facilities, medical support for prisoners and staff, education programmes for prisoners and vocational training programmes in areas such as construction, sewing, carpentry and brick industry.	0
To increase awareness of and support for refugee women &apos; s rights and legal options.	1
274. Extradition of terrorists continues to face many obstacles, and is neither smooth nor simple.	0
Call upon all parties concerned to create favourable conditions for the voluntary, safe, dignified and sustainable return of refugees and displaced persons to their homes and their local reintegration or resettlement.	1
465. In the joint communiquÃ© issued by the Government and the United Nations during the Secretary-General &apos; s visit of 3 July 2004 on the situation in Darfur, the Government of the Sudan committed itself to taking concrete measures to put an end to impunity for human rights violations in the region.	1
2. In its resolution 1575 (2004) of 22 November 2004, the Security Council requested Member States acting through or in cooperation with the European Union to report to the Council, at least every three months and through appropriate channels, on the activities of the European Union military mission in Bosnia and Herzegovina.	1
66. Technical and financial support for a law enforcement seminar and training workshop for the Somali Police Force has been provided through the United Nations Rule of Law and Security Programme in Kampala since August 2005.	0
18. In its fourteenth report, the Panel discussed the threat of attacks by Al-Shabaab (S/2013/467, para. 10), the associated entity of Al-Qaida in East Africa based in Somalia.	0
24. Urges the International Working Group, which will receive periodic reports from the Mediation Group and the Sanctions Committee established by resolution 1572 (2004) of 15 November 2004, to assess progress on the issues mentioned in paragraphs 14 to 18 above and to monitor and closely follow up that progress;	0
29. Pursuant to paragraph 37 of resolution 1822 (2008), the President undertook two visits in 2009, first on 9 June 2009, at the invitation of the Russian Federation, where he attended a meeting of the Special Intelligence Service, security agencies and law enforcement organizations in Irkutsk, Russian Federation. 8 and 9 October 2009, the President travelled to Brussels, Belgium, for discussions with officials of European Union institutions on the implementation of the sanctions measures by the European Union and its 27 member States.	1
In addition, a mobile team visits remote communities, in particular minority groups, who may not have access to the centres.	1
The Council reaffirms the importance of addressing the needs of women in peacebuilding and their participation in the development and implementation of post-conflict strategies.	1
Finally, the question of the conditions under which a peacekeeping operation is authorized to use force, ranging from self-defence to enforcement and deterrent peacekeeping, needs to be addressed, and how this issue is integrated into the implementation of the Operation &apos; s protection of civilians mandate.	1
During the discussions, in the light of the change of leadership on both sides over the past two years, the parties agreed on the need to reaffirm their commitment not to resume hostilities and to return internally displaced persons and refugees in safety and dignity, in the first phase to the Gali region within its old borders, as emphasized in the Yalta Declaration on the Georgian and Abkhaz sides (see S/2001/242, annex, and S/2001/401, para. 6).	1
23. Scope of the arms embargo: The Committee requested the Coordination Group to work towards the preparation of a document containing the experience of States in dealing with the threat of civilian and improvised explosives.	0
All aspects of police education were consolidated under an independent programme in May, and agreement was reached on the establishment of a large-scale training system for Bosnia and Herzegovina.	1
"The Security Council stresses that safe havens for terrorists remain an important concern, and recalls that all Member States must cooperate fully in the fight against terrorism in order to find and bring to justice any person who supports or facilitates the financing, planning, preparation or perpetration of terrorist acts or the provision of safe havens, or participates or attempts to participate in such acts, and not to grant safe haven to that person, based on the principle of extradite or prosecute.	1
The Executive Directorate has adopted a multimedia approach to reaching out to its target audiences, using tools and channels of communication such as the Committee &apos; s website, a Twitter account and an e-newsletter, and the information services provided by the Department of Public Information.	1
The Council considers activities aimed at strengthening the rule of law to be critical in peacebuilding strategies in post-conflict societies and underlines the role of the Peacebuilding Commission in this regard.	1
Request troop- and police-contributing countries to ensure that appropriate training is provided to increase the awareness of protection concerns and responsiveness of their personnel participating in United Nations peacekeeping and other relevant missions authorized by the Security Council for the protection of civilians.	1
317. The Commission found no information or evidence that could show that the rebel groups were responsible for mass destruction.	0
Recalling its previous resolutions on international terrorism and the threat it poses to Afghanistan, in particular resolutions 1267 (1999), 1333 (2000), 1363 (2001), 1373 (2001), 1390 (2002), 1452 (2002), 1455 (2003), 1526 (2004), 1566 (2004), 1617 (2005), 1624 (2005), 1699 (2006), 1730 (2006), 1735 (2006), 1822 (2008), 1904 (2009), 1988 (2011) and 1989 (2011) and the relevant statements of its President,	1
