ar_en_DEEP	MatCoop
The political debate is likely to be heated, as several election-related court challenges have already been filed.	0
(o) To cooperate closely with relevant United Nations counter-terrorism bodies to provide information on measures taken by Member States regarding kidnappings and hostage-taking for ransom by Al-Qaida and other associated individuals, groups, undertakings and entities, and on related trends and developments in this area;	1
Security Council resolution 1373 (2001) already imposes obligations on States to take certain measures to suppress terrorism, end the recruitment of members of terrorist groups, prevent terrorist movements, and bring terrorists to justice.	1
The involvement of Boko Haram and Ansaru in the kidnapping of a French priest in Cameroon in November 2013 indicates the ability of these two groups to operate outside Nigerian borders.	0
Both Jordan and the United Arab Emirates have made a number of important improvements to programs and policies related to aviation security and to the way security controls are implemented at airports.	1
(d) The Committee will ensure that any measures taken by Member States to combat terrorism comply with all their obligations under international law, in particular international human rights law, refugee law and humanitarian law;	1
The Security Council met at ministerial level on 22 September to consider civilian aspects of conflict management and peacebuilding.	0
The Committee removed five names from the list in January 2010 and another five names in July 2010, two of which were names of deceased individuals and the rest of which were names of individuals considered to have reconciled with the Afghan government.	1
Decides to strengthen and amend the mandate of the [Mission] as follows: Promotion and protection of human rights: - Assist in strengthening the capacities of the judicial system, including transitional justice mechanisms, strengthening national human rights institutions, and assisting in national reconciliation efforts;	1
14. The Executive Directorate will strengthen its engagement with international, regional and subregional organizations around the world to assist them in developing and/or implementing appropriate action plans in the context of counter-terrorism and to engage them more directly in addressing the capacity-building needs of States identified by the Committee through initial implementation assessments and country visits.	0
The use of home-made explosives demonstrates the adaptability of Al-Qaeda-linked terrorists in countries that effectively enforce arms embargoes.	0
At the same time, Cuba condemns suicide bomb attacks and other acts against Israeli civilians, who are innocent victims of the cycle of violence driven by their government's policy. We also reject the use of these scattered actions to cast doubt on the legitimate exercise of self-defense by the Palestinian people, and to justify activities, which are widely or selectively committed against the Palestinian population.	0
The report mentions a number of incidents, especially in the security sector, that cause serious concern.	0
Training of peacekeeping personnel Requests the Secretary-General to ensure the provision of technical support, pre-deployment and in the field, to troop- and police-contributing countries to the [Mission], to include the guidance and training of military and police personnel in protecting civilians from dangers and taking appropriate measures , including in the field of human rights, sexual violence and gender issues.	0
Porous borders remain a challenge for effective border control, and regional approaches and best practices (eg community policing) need to be developed to address those challenges.	1
The commissions were established in response to allegations of violations of international human rights law and international humanitarian law in the context of conflicts, as well as in situations of high levels of violence that were often, but not exclusively, linked to electoral or political processes and involved serious violations of human rights law. ().	0
3. I indicated in paragraph 7 of the annex to my letter of 8 August 2005 that the cash guarantee funds supporting the 249 letters of credit expiring on 31 December 2004 would continue to be held in the United Nations account for Iraq until 30 November. /November 2005, in order to pay the sellers upon receipt of the proof documents confirming the delivery of the goods within the validity period of the letters of credit in question. However, during recent consultations with its competent authorities, the Iraqi government requested an extension of the deadline for receiving the proof documents until 31 December 2005. To give it more time to process it.	0
Resolution 1267, which reflects the international community's determination to restrict the activities of Al-Qaeda, played a prominent role in keeping the focus on the need to prevent the flow of funds to terrorist groups and restrict the movement of their members.	0
73. The Civil Security and Emergency Preparedness Department was formally established on 9 November under AMISOM organizational rule 2000/61.	1
This struggle for power manifests itself in various forms and aims to attract various national forces within civil society and public opinion in order to obtain additional popular support or influence.	1
Viet Nam is deeply concerned about the alarming deterioration of the security and humanitarian situation in the eastern part of the Democratic Republic of the Congo.	0
He expresses his deepest sympathy and sincere condolences to the victims of this heinous terrorist act and their family members, and to the government and people of Pakistan.	0
:: Innovative ways should be considered to develop comprehensive, mutually reinforcing systems linking the ICC and any possible future hybrid court to national bodies, as well as criminal prosecutions and redress programmes.	0
8 - We are also deeply concerned about the worsening scourge of terrorism and violent extremism in the Sahel-Sahara region, and about the close links between armed terrorist groups and transnational organized crime, in particular drug and human trafficking networks, money laundering and illicit arms trafficking.	0
They also reiterated their call on all Afghan parties to work together for peace and to establish a broad-based, multi-ethnic and representative government.	0
Most countries criminalize the use of their territory to commit or plan terrorist acts against citizens, facilities and diplomatic representatives of other countries.	1
On 15 December 2010, the Center hosted a meeting of experts from member states of the African Union to study a draft model law to combat the phenomenon of terrorism, with the aim of harmonizing national legislation and giving UN resolutions against terrorism binding force.	0
Building confidence and enhancing stability by consolidating truth-finding and reconciliation mechanisms	1
During the period from 20 October to 10 December 2014, regime helicopters dropped a total of 1,125 barrel bombs, killing 603 civilians, including 129 children and 112 women.	0
The network also aims to encourage contributions to policy at national and European levels, including the implementation of the 2005 EU Strategy to Combat Radicalisation and Terrorist Recruitment.	0
The use of lethal force in such cases must respect the principles of distinction and proportionality, and violations must be subject to accountability.	0
21 - In light of the concerns mentioned above, and the continued presence and activities of militias in Lebanon, improving the management and control of Lebanonâs land borders is crucial to preventing the illicit flow of weapons to armed groups.	1
Some reports hinted, while a few confirmed, that the elements of the crime of genocide exist in the patterns and nature of violations committed by the government and its affiliated militias.	0
- Emphasizes the need for the General Secretariat to submit, at least one month before the renewal of mandates, precise and clear recommendations regarding the content of the mandate and any necessary amendments to it, taking into account developments on the ground and the views of the host country, relevant troop- and police-contributing countries and other parties, as appropriate;	0
The prisoners were transferred based on credible reports that an attempt had been made to free them from prison in Bukavu.	0
With fuel smugglers making profits exceeding 100 percent, these smuggling networks have a vested interest in prolonging the conflict.	0
The concepts of planning, ordering, instigating, aiding, and abetting a crime are discussed below.	0
7. The Executive Directorate will continue to enhance its cooperation with relevant United Nations bodies, including the Analytical Support and Sanctions Monitoring Team established pursuant to Security Council resolution 1526 (2004) and the Group of Experts assisting the Security Council Committee established pursuant to resolution 1540 (2004), as well as with numerous international, regional and subregional organizations, including in the context of the Committeeâs visits to Member States.	1
The intentional killing of detained fighters constitutes a war crime.	0
(k) In light of past expenditures by the Command, the Army and the security services, re-prioritize and allocate available resources, where appropriate, to ensure freedom from hunger and the fulfillment of other basic minimum standards for citizens, including citizens serving in the armed forces;	1
The information we have received indicates that the Special Envoy has already begun searching for new arrangements to accommodate and appease Ethiopia regarding its non-compliance with the provisions of the Algiers Agreement and its rejection of the Boundary Commissionâs decision.	0
As for the requirement that the attack be âsystematic,â it ârequires that the acts be of an organized nature and that such acts are not likely to occur randomly.â(	0
Sufficient capacities should be developed in key areas of civilian crisis containment, such as police, justice, rule of law, preparation of electoral processes, electoral observation, civil protection, and public administration.	1
324. The Commission and its team reviewed extensive evidence of displacement and conducted a large number of interviews with internally displaced persons in Darfur and refugees in Chad.	1
408 - With regard to international humanitarian law, Common Article 3 of the Geneva Conventions prohibits acts of aggression against life and physical integrity, including cruel treatment, torture, the taking of hostages, and outrages upon personal dignity, in particular humiliating or degrading treatment.	0
Improvised explosives and homemade explosives, such as ammonium nitrate and urea nitrate: car bombs.	0
Consider applying targeted and graduated measures against parties to armed conflict that commit grave violations against children in situations of armed conflict.	0
He also held additional meetings with the Monitoring Group established pursuant to resolution 1519 (2003) regarding Somalia regarding the arms market in Mogadishu and regional financial flows, and met with the Group of Experts established pursuant to resolution 1579 (2004) regarding Liberia to discuss the transfer of valuable commodities.	1
Given the urgency of the investigation, we sent a telegram bearing the number 2056 and dated 14 February 2005 to the leadership of the district police unit and to the commanders of the police units, requesting that all necessary investigations be carried out within the jurisdiction of each unit regarding the bodies taken to hospitals. In each area, in order to enable their families to identify them, and to inform me of the conduct of the investigation in accordance with established procedures, in a way that enables me to obtain the approval of the relevant authorities to return those bodies to their families.	1
In addition, as noted below, this destruction appears to have been consistently accompanied by the looting of valuable personal property, cash and, most important of all, livestock.	0
âThe Security Council stresses the urgent need to demobilize and disarm all illegal armed groups.	0
In accordance with the terms of reference of the Committee, the report establishes the facts and circumstances relating to the incidents that occurred on 28 and 29 April and from 23 to 25 May and other related events or matters that contributed to the outbreak of the crisis; The report clarifies responsibilities for the incidents and recommends accountability measures.	1
22. On 25 August, a statement attributed to General Laurent Nkunda, one of the main perpetrators of the Bukavu crisis of May 2004, in which he threatened to bring down the transitional Government, was published in Goma.	0
âThe Security Council remains deeply concerned about the threat posed by acts of piracy and armed robbery at sea to international navigation, the safety of commercial sea routes, and the security and economic development of States in the regions concerned, as well as the safety and well-being of seafarers and others, including their exposure to being taken hostage.â In view of the increase in violence used by pirates and persons engaged in acts of piracy and armed robbery at sea, the Security Council condemns in the strongest terms the taking of hostages and the use of violence against them, and calls upon States to also cooperate, as appropriate, to ensure the early release of hostages, including through Exchange of information and intelligence.	0
Red Cross vehicles and personnel were reported to be seen at the scene, occasionally assisting the injured.	1
Finally, the widespread institutional, cultural, ethnic and spiritual diversity in societies currently experiencing profound historical change may give rise to particular tensions and security concerns.	0
Reaffirming its resolutions 1265 (1999) and 1296 (2000) on the protection of civilians in armed conflicts, and its various resolutions on children and armed conflicts and on women, peace and security, as well as its resolution 1631 (2005) on cooperation between the United Nations and regional organizations in the maintenance of peace and security international organizations, and further reaffirming its determination to ensure respect for and follow-up of those resolutions,	1
The Council also adopted a presidential statement (S/PRST/2011/17) in which it stressed the need to improve communication between the Security Council, troop- and police-contributing countries, the United Nations Secretariat and other stakeholders in order to enhance the spirit of partnership, trust, cooperation and mutual trust, and to ensure that the Council Security from the perspectives of those working in the field when making decisions on peacekeeping mandates.	1
405 - Even in cases where a State has legitimately derogated from certain provisions of the Covenant, the prohibition of unacknowledged detention, hostage-taking or kidnapping is absolute.	1
During the reporting period, the mission's police component focused on training the South Sudan Police Service in referendum security and assisting the Service in developing its plans for referendum security.	1
Since the categories of international crimes have been included in another part of the report, it is sufficient here to briefly mention the various ways of participating in the commission of international crimes that give rise to individual criminal responsibility.	0
We must reject any attempts to undermine the sovereignty and territorial integrity of Somalia.	0
Despite this progress, numerous visits by the Committee and workshops held in the region demonstrated that regional cooperation on counter-terrorism matters needs to be further strengthened. 184 - States of the subregion should:	1
The Mission and the United Nations country team are providing coordinated support to the law's implementation process in all its aspects, including to the Minister of State for the Promotion of Equality, who is leading efforts to develop the implementation plan, and to civil society to raise awareness of the law.	1
In addition, four countries have introduced legislation that criminalizes providing safe haven to terrorists and those who support them, whether individuals or organizations.	1
They were all armed and were all pointing their rifles at us.	0
But how can this be achieved when the two agreements and the authority of the law continue to be disdained? When our land remains occupied by force and our people are displaced from their cities and villages? In fact, how can all possible arrangements of mutual benefit and normalization begin when sovereign territories are neither respected nor demarcated?	0
Prominent journalists have been detained for expressing their opinions on issues of human rights, the constitution and the rule of law.	0
This forest is now under the surveillance of the national army.	0
Thanks to the establishment of the Joint Mission Analysis Cell, the Mission has been able to significantly increase its capacity to analyze and exchange information throughout the Mission. However, the mission continued to lack access to reliable tactical information.	1
By its resolution 1425 (2002), the Council established a group of experts on Somalia and then established a successor monitoring group in its resolution 1519 (2003).	1
Accordingly, transactions suspected of financing terrorist acts will be subject to the same reporting and arrest system used for transactions suspected of being linked to money laundering.	1
This guide is designed to be a source of information on counter-terrorism best practices, model laws, and available assistance programs.	0
Despite the continued pressure on the leadership of the two groups, the situation in Iraq and other conflict areas has placed terrorism at the forefront of global attention, and there has been no decrease in the recruitment of new individuals.	0
However, many of these countries have barely begun to develop dedicated counter-terrorism capabilities.	1
They can train recruits and innovate in planning and executing attacks. Lashkar-e-Taiba (Lashkar-e-Taiba, QE.L.118.05) continues to provide advanced terrorist training, including on improvised explosive devices. Al-Qaeda in the Arabian Peninsula (QE.A.129.10) remains a major source of technological innovation.	0
Non-EU member states work independently to develop legislative frameworks to combat terrorism and to integrate the crimes stipulated in international counter-terrorism instruments into their domestic laws.	1
Mr. Malik wanted to send UN police officers accompanied by Colonel Rees to meet Brigadier Ruak. Colonel Rees refused, believing that more police officers in blue shirts would aggravate the situation.	0
They informed the mission that a draft amnesty law covering political prisoners detained in Serbia would be submitted to the Parliament of the Federal Republic of Yugoslavia as soon as possible.	1
In Nyakundi, well over 2,000 people were reported killed; Residents fled into the forest.	0
On the other hand, death squads and militias composed of independent elements spread terror and commit acts of execution and kidnapping.	0
A senior government official who participated in the recruitment process told the Commission that tribal leaders were receiving donations and gifts for their recruitment efforts and according to the number of people they were able to recruit.	0
The program had begun to note interconnections and develop pencil drawings that might be of interest to other countries, and the team commended the way in which findings were being shared at the international level.	1
The military component of the operation will continue to implement its new concept of operations, cooperate with the Licorne force to help the parties implement the facilitator's proposals for the reintegration of Forces Nouvelles personnel into the national police and the army and prepare contingency plans for possible stabilization interventions in order to prevent acts of violence aimed at disrupting the operation. peace.	0
The group will create and maintain an online data repository to collect unedited documents submitted by contact group participants, which reflect their views on international efforts since 2008 to combat piracy off the coast of Somalia, and make those documents available to researchers, analysts and policy makers.	1
For example, in a unique move, the United Nations Fact-Finding Mission on the Gaza Conflict () used public hearings as part of its investigative methodology to ensure an inclusive process, allow victims to have their voices heard where they had not previously been able to do so, and uphold their rights to truth and access to justice.	1
The state has imposed blatantly discriminatory restrictions on women with the aim of perpetuating the gender stereotype of Korean women as pure and innocent beings.	0
Within the framework of this scheme, great efforts were made to cover eligible minorities.	1
2. This report covers the period from 1 July to 31 December 2014. It gives an overview of developments and trends of events in the West African region, and presents the activities undertaken by the Office in the areas of good offices and capacity-building at the subregional level to address cross-border and multi-faceted threats to peace and security, good governance, and respect for the rule of law and human rights. Taking into account gender considerations.	1
Initial measures 39. Solving a crime of this magnitude requires strong administrative capacity, clearly defined roles, strong coordination and access to sufficient competencies, manpower, equipment and means of assistance.	0
However, after a number of years of war and as a result of strong international pressure, the government and the main rebel movement in the south, the Sudan People's Liberation Movement/Army, entered into peace talks in 2002.	1
4. The Committee is also concerned with classifying, from the point of view of international criminal law, the violations of international human rights law and international humanitarian law that it may establish. This legal classification is implicitly required for the other tasks he has set for the Security Council Committee, namely (a) to determine whether such violations amount to genocide, and (b) to identify the perpetrators of those violations.	1
The following is a brief overview of those reports, illustrating the framework of the fact-finding mission and investigations undertaken by the Committee. In the sections that follow this overview, individual incidents will be presented according to the type of violation or international crime identified.	1
- Allowing a number of Yugoslav and Serb military and police personnel to return to Kosovo and Metohija (paragraphs 4, 6 and 10 of Annex 2 and paragraph 4 of the Military Technical Agreement).	1
For example, Europe has the European Union and the Schengen Agreement; The Economic Community of West African States (ECOWAS); the Southern African Development Community, in Africa; The Association of Southeast Asian Nations() as well as the Commonwealth of Independent States(); The North American Free Trade Agreement in North America (); Central American Integration System, in Central America(); The Andean Community and MERCOSUR, in South America, are moving towards merging to create the Community of South American States.	1
Call on all relevant parties to ensure that issues relating to the protection, rights and well-being of women and girls affected by conflict, specifically, are included in all peace processes, peace agreements and post-conflict recovery and reconstruction plans and programmes.	0
:: Assessing progress in the peacebuilding process before considering decisions on the United Nations withdrawal and/or transition from one form of engagement to another, which could include: (a) the level of support and commitment of the international community; (b) ways to strengthen the capacity of United Nations country teams to enable them to continue supporting long-term peacebuilding efforts in countries on the agenda; and (c) the opportunities and risks that peace consolidation presents to specific countries.	1
In all of these locations, the team was informed that there had been no recent recruitment attempts, but that the situation could change if conflict erupted again in CÃ´te d'Ivoire.	1
While most Ivorian stakeholders, including President Gbagbo and Prime Minister Soro, made positive comments about the operations of the mobile courts, the opposition Rally of Republicans complained that many Ivorians were unable to access the mobile courts, particularly in the Western Region, due to The presence of militias, even if they are inactive.	0
The police fired tear gas to disperse supporters of both parties who were throwing stones in the streets.	0
53 - INTERPOL is also in the process of establishing its own electronic weapons tracing system to assist national law enforcement agencies in tracking the illicit transfer and use of firearms.	1
âThe Security Council requests the Secretary-General to strengthen cooperation between the United Nations and the member States of the Economic and Monetary Community of Central Africa with a view to facilitating and strengthening initiatives to address cross-border insecurity in the subregion and to put an end to violations by armed groups of the territorial integrity of the Central African Republic.	1
They are widely used in inter-state conflicts and are the weapons of choice in civil wars, acts of terrorism, organized crime and guerrilla warfare.	0
