ar_en_TRANSFORMERS	VerCoop
The Executive Directorate will also continue its constructive dialogue with Member States through meetings at United Nations Headquarters, visits, workshops and videoconferences with officials in the capitals concerned, with a view to informing the Committee on the implementation by Member States of relevant elements of resolutions on counter-terrorism, including updates of preliminary implementation assessments, new steps taken to combat terrorism and new developments related to facilitating the provision of technical assistance.	1
The Council calls upon [the affected State] to immediately apply appropriate procedures to the issue of property rights and to cease all forms of discrimination against [minority population] when providing social benefits and reconstruction assistance.	1
On 8 November 2014, the regime &apos; s warplanes targeted areas around the Shahid Wasim Husseino hospital in Idlib, causing considerable damage.	0
It is therefore not surprising that many Member States see the Internet as a key issue in the fight against the spread and threat of Al-Qaida-related terrorism.	0
Urges Member States to ensure increased representation of women at all levels of decision-making in national, regional and international institutions and mechanisms for conflict prevention, management and resolution.	1
He also referred to the attack on the United Nations Multidimensional Integrated Stabilization Mission in Mali (MINUSMA) base in Kidal on 7 October.	0
While areas of freedom of movement, such as the Economic Community of West African States (ECOWAS), pave the way for growth and economic opportunities, listed individuals can move within these areas with little or no restrictions, owing to the absence of regular checkpoints.	0
The Group considers that Al-Qaida continues to be a threat to Al-Qaida, as a group of affiliated elements with Al-Qaida have developed weak links, and individuals and independent extremist cells guided by Al-Qaida ideology have emerged.	0
It is also surprising that no members of the parallel forces have been arrested or prosecuted for these crimes.	0
Except in cases where an individual is arrested in flagrante delicto, law enforcement officials must make a warrant for the arrest or detention of the person.	0
Much of this intensive effort to enable AMISOM contingents to respond effectively to the threat of mines and improvised explosive devices has been funded through the AFISMA Trust Fund.	0
The Council expresses its deep concern that civilians continue to account for the majority of victims of violence committed by parties to armed conflict, including the consequences of deliberate targeting, indiscriminate and excessive use of force and sexual and gender-based violence.	0
Undertake research to explore the causes of gender disparity in early warning mechanisms and develop indicators that take into account the outcome of such research.	0
In particular, they explained that the amended law on the Independent Electoral Commission did not provide for the representation of the Forces nouvelles in its subsidiary organs and did not confirm the primacy of the Independent Electoral Commission over the National Institute of Statistics in the electoral process.	0
(a) The violence at the Government Palace around midday on 28 April, which resulted in two deaths, at least four gunshot wounds and two other serious injuries;	0
16. On 1 December, in accordance with paragraph (p) of the annex to resolution 2160 (2014), the Monitoring Group submitted to the Committee a special written report, in consultation with the Government of Afghanistan, the United Nations Office on Drugs and Crime and United Nations sanctions expert groups, as appropriate, on specific cases of cooperation between organized crime syndicates, in particular hostage-taking groups for ransom, producing and trading drugs, as well as groups that illegally exploit natural resources in Afghanistan, including precious and semi-critical stones, and individuals, groups, undertakings and entities that meet the criteria for listing under paragraph 1 of resolution 2160 (2014).	1
After the expected elections, consultations with the new elected Government will be required in order to determine the nature and level of support that the Ivorian authorities will require from UNOCI for the holding of legislative and local elections before the process begins to wind up.	1
Calling upon all parties to armed conflict to cease immediately and fully all acts of sexual violence against civilians, in accordance with resolutions 1325 (2000), 1820 (2008), 1888 (2009) and 1889 (2009); the recruitment and use of children, in accordance with resolutions 1612 (2005) and 1882 (2009); and indiscriminate attacks against civilians, in accordance with resolution 1894 (2009),	0
Many international leaders, including heads of State, representatives of the United Nations and the majority of the members of the Security Council, have denounced those fleets that have gone to Gaza over the past year and have stressed the need only to transport humanitarian supplies to the region through existing channels.	1
In that battle, the wounded soldiers were transferred to Burm to receive medical care.	0
"'The Security Council expresses its concern at the threat posed by the weapons and ammunition not insured in Libya and their proliferation, which pose a threat to stability, including for reasons of their transfer to terrorist and extremist groups, calls upon the Libyan Government to take concrete measures to tighten its control over arms and ammunition stockpiles in Libya by ensuring the proper management and safe storage of arms and related materiel and, where appropriate, their effective disposal, as well as by enhancing border security, and urges neighbouring States to cooperate with the Libyan authorities in their efforts to ensure the security of their borders in this regard.	1
President Al-Bashir took diplomatic reprisals against the Kenyan decision and threatened to impose economic and commercial sanctions.	0
On 24 November, the Council received a 90-day report from the Chairperson of the Committee established pursuant to resolution 1591 (2005) concerning the Sudan, Ambassador Maria Cristina Perceval (Argentina), who updated the Council on the Committee &apos; s activities during the reporting period, including her engagement with Member States in the region to identify information gaps and report on capacity-building needs to enhance the implementation of the sanctions measures.	1
Acknowledges the policy of cooperation pursued by neighbouring States, including [names of the States concerned], by maintaining their borders open to refugees... and encourages them to continue this policy and to contribute to the stabilization of the situation whenever possible;	0
- Stresses the need to provide the appropriate level of military expertise for Security Council resolutions;	1
In this regard, the Security Council encourages all States in the region to sign and implement the Code of Conduct as soon as possible and calls upon them to take further effective measures at the national level to combat piracy and armed robbery at sea in the Gulf of Guinea.	1
23. Requests the Committee to circulate to the Council a list of States that have not submitted their reports by 31 March 2004 pursuant to paragraph 6 of resolution 1455 (2003), including an analytical summary of the reasons provided by States for their failure to submit reports;	1
MINUSMA will initiate a revision of the Mission concept early in 2015 that will guide the review of the complementary concepts of the military, police and support components detailing and supporting the implementation of the Mission concept.	1
No State applies adequate measures to protect non-profit organizations from the financing of terrorism.	0
These activities are part of an ongoing dialogue between the United Nations Rule of Law and Security Programme and the Transitional Federal Government on mine-related issues and support for the operations that will ensure that the Government is aware of the existence of the relevant international legal instruments and considers possible participation in them.	1
UNDP and its implementing partners have made arrangements to provide reintegration services to an additional 7,219 ex-combatants upon demobilization.	0
It is recognized that the Committee should take into account all international codes, standards and best practices relevant to the implementation of resolution 1373 (2001), while monitoring implementation by States.	1
The Group recognizes that there are national and international laws that place restrictions on the exchange of information between States, but international cooperation is essential for the effective implementation of the assets freeze.	1
49. The Committee encourages the Executive Directorate to continue to work with other United Nations entities to explore the best possible approaches and means of coordinating United Nations activities, in particular with regard to the harmonization of working methods and the programming of counter-terrorism projects.	1
I commend the introduction to the annual report for 2007-2008 prepared by the delegation of Viet Nam for providing a summary and substantive analysis of the Council &apos; s activities in all regions and on issues ranging from the proliferation of weapons of mass destruction to the role of regional and subregional organizations in contributing to the maintenance of international peace and security.	0
At this stage, it suffices to say that the crime of genocide, whether under the 1948 Convention or the corresponding rules of customary law, includes any of the following acts committed with the intention of destroying, in whole or in part, a national, ethnical, racial or religious group as such; killing members of the group; causing serious bodily or mental harm to members of the group; deliberately subjecting the group to conditions of life intended to destroy it in whole or in part; imposing measures aimed at preventing reproduction within the group; forcibly transferring children of the group to another group.	0
1. Expresses its strong condemnation of all forms of violence, including murder, rape, sexual assault, intimidation, armed robbery, abduction, hostage-taking, kidnapping for the purpose of extortion and harassment, illegal arrest and detention of those involved in humanitarian operations, as well as attacks on humanitarian convoys and the destruction and looting of their property;	0
Recalling the statement of its President of 8 July 1999 (S/PRST/1999/21), and stressing its call for the inclusion, as appropriate, within specific peace agreements and on a case-by-case basis within United Nations peacekeeping mandates, of explicit provisions for the disarmament, demobilization and reintegration of former combatants, including the safe and timely disposal of weapons and ammunition,	1
Many of them further examined the root causes of violence and violations, which provided a starting point for transitional justice mechanisms dealing with the right to the truth, the administration of justice, the provision of remedies and redress and guarantees of non-repetition, thus providing guidance for more sustainable peacebuilding and reconciliation efforts and helping to achieve a political settlement of disputes.	0
:: 14 February 2005, Rafik Hariri and 22 others were killed in a massive explosion off the seafront in central Beirut.	0
A risk element of shifting attention from these criteria to focus on the issue of territorial status will arise.	0
At that meeting, the parties agreed to continue to cooperate on matters related to the conduct of a railway survey and the return of refugees and internally displaced persons.	1
In that regard, it considered it important to complete the deployment of the additional UNMISS force.	0
"The Security Council stresses that stability and security remain key factors in the political and economic reconstruction efforts of the Transitional Government and the international community.	1
36. During the reporting period, the Mission continued efforts to raise awareness of HIV/AIDS.	0
64. The concern of States and the Committee to maintain lists of ideologies despite the lack of impact appears to be evidence of a broader trend in the fight against terrorism to harmonize efforts to arrest and detain terrorists, in an effort to prevent others from becoming terrorists in the first place.	0
In a meeting with the United Nations Office on Drugs and Crime on 5 August, the new Minister of Justice outlined the efforts of the new Government to renew unity to align it with the objectives of the West African Coast Initiative. On 27 October, more than 100 parliamentarians and Government representatives adopted a political declaration reaffirming Guinea-Bissau &apos; s commitment to supporting initiatives to combat transnational organized crime, including drug trafficking, corruption, money-laundering and terrorism, and called for continued United Nations support to strengthen national institutions in this area.	1
The Security Council reaffirms the principle of non-refoulement of refugees as enshrined in the relevant instruments of international law, welcomes recent efforts by countries neighbouring [the affected State] to support the voluntary, safe and dignified return of refugees and urges host States to continue to provide international protection to [those] refugees in need.	1
"The Security Council stresses the need to continue to take measures aimed at preventing and suppressing the financing of terrorism and terrorist organizations, reiterates the obligations of Member States in this regard, including the effective implementation of those measures, and recognizes the importance of the work of other United Nations entities and multilateral organizations, in particular the Financial Action Task Force.	0
Stresses that all those responsible for human rights violations and abuses must be held accountable, and stresses the need for a comprehensive, independent, impartial and internationally compliant investigation into alleged human rights violations and abuses to prevent and ensure full accountability for impunity;	0
In addition, he was received in Nouakchott on 14 February by the President of the Republic of Mauritania, Sidi Mohamed Ould Sheikh Abdullah, and met with the Minister for Foreign Affairs and Cooperation, Mohamed Salek Ould Mohamed El Amin, and other senior government officials.	1
It is understood from the battle to control Baidoa that opposition elements are coordinating their efforts to overcome Transitional Federal Government forces.	0
A stronger link between security sector reform and the lifting of the arms embargo, where appropriate, may provide a viable incentive for such reform to succeed, as well as an important factor in preventing the recurrence of conflicts in fragile post-conflict situations.	1
10. Invites the Secretary-General to report to the Security Council on opportunities and challenges for cooperation between the United Nations and regional and subregional organizations in the maintenance of international peace and security, and encourages the Secretary-General to explore with international organizations the possibility of concluding agreements to establish a framework for the cooperation of regional organizations with and contributions to United Nations-led peacekeeping operations, taking due account of previously identified guidelines for cooperation between the United Nations and certain regional organizations;	1
The protection of civilians is a duty that has long been ignored in Somalia.	0
7. Requests the Executive Representative of the Secretary-General to facilitate and encourage dialogue among national and international stakeholders, in particular in the context of the forthcoming elections, while continuing to support their efforts to maintain peace and stability;	1
12. Invites the Committee, working in cooperation with the Committee established pursuant to resolution 1373 (&quot; the Counter-Terrorism Committee &quot;) to inform the Council of further action that States may take to implement the measures set out in paragraph 1 above;	1
The Security Council notes with appreciation the urgent initial steps taken by the Government of Rwanda to address this situation and encourages the Government of Rwanda to continue its cooperation with the United Nations and relevant international organizations to ensure that these combatants are permanently demobilized and dealt with in accordance with relevant international law, with particular attention to children and women among them.	1
At the end of the fourth round of negotiations in late November, the positions of the parties on key issues remained unchanged.	1
The repeated attacks on international diplomats in Benghazi and Tripoli are indicative of this presence.	0
Noting that some parties to armed conflict have responded to its call for the preparation and implementation of concrete time-bound action plans to halt the recruitment and use of children in contravention of applicable international law,	0
66. Several regional cooperation mechanisms have been established to strengthen the capacity of States to prevent mass incitement and safe haven for terrorists in Latin America and the Caribbean.	0
The declaration of independence was rejected both at the time of its birth.	0
We urge Israel to abide by its obligations with regard to the population in the occupied territories.	0
35. The Executive Directorate proposes three minor modifications to its organization and operational practice to better reflect the change in its proposed new priorities and activities.	1
Paragraph 4 of resolution 1624 (2005) emphasized that "States, when taking any measures to implement paragraphs 1, 2 and 3 of the resolution, must ensure compliance with all their obligations under international law, in particular international human rights law, refugee law and humanitarian law."	1
Condemn and call for the immediate cessation of acts of sexual violence committed in the context of and associated with armed conflict.	0
(a) The act mentioned in paragraph 1 above results in the death of a person or serious bodily harm to more than one person;	0
There is no doubt that the crimes alleged to have been committed in Darfur meet the requirements of the Rome Statute in articles 7 (1), 8 (1) and 8 (2) (f).	0
Urges States and all other parties to the armed conflict to make every effort to prevent violations of international humanitarian law against civilians, including journalists, media personnel and associated personnel.	0
The second reason is once again to call upon the Security Council to take urgent and necessary action to stop the bloodshed in Syria.	0
In general, the Team has found a high level of commitment to the work of the 1267 Committee and a generally encouraging awareness of the List and the measures.	0
Al-Qaida has to some extent succeeded in recovering from the loss of Afghanistan as a training base for terrorism by exploiting the situation in Iraq.	0
Call upon parties to armed conflict to strictly abide by applicable international humanitarian law, including the prohibition of:	0
Supporting the Democratic Republic of the Congo in its decision to promote revenue transparency in the extractive industries,	1
The Commission also found that the restrictions imposed on internally displaced persons in the camps, particularly women, by terrorizing them by rape, murder or violent threat to their lives or to their persons by the Janjaweed militia, constituted a severe deprivation of physical liberty in violation of the rules of international law.	0
"The Security Council expresses its deep concern at the tense situation prevailing in Blue Nile and Southern Kordofan States.	0
In its resolution 1977 (2011), the Security Council explicitly encouraged the Committee established pursuant to resolution 1540 (2004) to draw, among other sources, on relevant private sector expertise.	1
In particular, four States have introduced measures to suppress terrorist recruitment.	1
We are convinced that the early conclusion of these talks, with the signing of a comprehensive and final peace agreement, will greatly facilitate efforts to combat terrorism and transnational organized crime in our region.	1
It now further recommends that the Team make every effort, in cooperation with the States concerned, immediately upon receipt of a communication from the Committee concerning the death of a listed person, to establish the facts and transmit its findings to the Committee as soon as possible.	1
In the United Arab Emirates, the Central Customs Intelligence Unit feeds the risk estimates included in the electronic customs clearance system.	0
The programme collects information at the national level on all persons arrested or suspected of involvement in low-level crimes such as forgery of bank/credit cards or travel documents.	0
28. In view of the prevailing situation, I believe that the Mission continues to play an important role in stabilizing and monitoring the ceasefire on the ground, and I would like to recommend an extension of its mandate for an additional six months, ending on 30 April 2006.	1
They also noted that enhanced coordination and interoperability among those organizations, as well as the development and sharing of common strategies, operational policies and best practices, in civilian crisis management endeavours, would increase the effectiveness and coherence of crisis management.	1
Calls for full respect for human rights, fundamental freedoms and international humanitarian law throughout (the affected country) and notes with concern restrictions on the freedom of the media and attacks on media professionals.	1
6. On 14 April 2011, the Coordinator met with the Under-Secretary of the Ministry of Foreign Affairs of Kuwait, Khaled Al-Jarallah, who noted that the task of finding the remains of the Kuwaiti victims should not be confused with developments in political relations between Iraq and Kuwait.	1
The degree of damage caused to the metal fragments offered by the police (it was said to originate from a Mitsubishi Canter) is consistent with the fragments that we would expect would have occurred had the car been at the centre of the explosion.	0
The Security Council reaffirms the principle of non-refoulement of refugees as enshrined in the relevant instruments of international law, welcomes recent efforts by neighbouring countries [the affected State] to support the voluntary, safe and dignified return of refugees, urges host countries to continue to provide international protection to refugees [who] need it and encourages the international community to provide the necessary assistance.	1
Welcoming the continued progress made by Burundi in achieving peace, stability and development, and stressing the need for the United Nations system and the international community, including the international financial institutions and development partners of Burundi, to continue to support the peace consolidation process and the long-term development of Burundi,	0
The Commission has worked for over two years, during which it has identified more than 800 places of detention, some 50,000 cases of torture, 200,000 deaths and some 2 million persons displaced as a result of ethnic cleansing, and conducted a large-scale investigation into cases of systematic rape, including over 500 written confessions from victims who have identified their rapists.b	0
42. With regard to the argument of international law, the Monitoring Team considers that one of the reasons for the establishment of a review panel or other review mechanism is merely a pre-emption of law in this area, in order to establish it rather than leaving it to national and regional courts or the practice of Member States.	1
We also agreed that the parties should re-establish a genuine dialogue that was needed and should proceed, without delay, to the dismantling of militias and the disarmament, demobilization and reintegration of combatants, and to the holding of free, fair and credible elections.	1
All these conditions create grievances and create fertile conditions for the exploitation of individuals from different backgrounds, religions and beliefs who are determined to incite the commission of terrorist acts.	0
In his briefing to the Council in December 2005 and June 2006, Under-Secretary-General Gambari described the serious human rights and humanitarian conditions in Burma, including the detention of more than 1,100 political prisoners, as well as the influx of refugees, drugs, HIV/AIDS and other diseases from Burma.	0
It was not clear at the current time when an agreement on police restructuring would be reached to allow those negotiations to begin, but the European Union was always ready to assist in further negotiations once an agreement had been reached that met the requirements of the European Commission.	1
37. The Committee encourages its Executive Directorate to continue to focus on the implementation of resolution 1624 (2005), including by paying due attention to relevant issues, such as the role of new information and communication technologies, promoting dialogue, including at the national level, in order to promote tolerance, diversity and inclusiveness, developing strategic partnerships between Governments and non-State actors, defining roles for victims of terrorism and preventing institutional vandalism by terrorists and their supporters.	1
The Secretary-General cautions unequivocally that none of the eight standards have yet been fully met.	0
