ar_en_TRANSFORMERS	VerCoop
Colonel Leary sent the messengers to deliver the order to the soldiers who were not in sight.	0
77. This section is briefly addressed to various groups that are active in the armed conflict in Darfur.	1
92. The Commission of Inquiry recommends that both States and civil society organizations promote opportunities for dialogue and communication between the two peoples in the areas of culture, work, sport, good governance and economic development that provide opportunities for citizens of the Democratic People &apos; s Republic of Korea to exchange information and learn about the experiences of other countries.	1
On 21 December, at a public meeting, the Council heard a briefing by the Chair of the Committee established pursuant to resolution 1737 (2006) and the Permanent Representative of Colombia, NÃ©stor Osorio, on the work of the Committee from 1 September to 18 December 2011.	1
"The Security Council encourages Member States to continue to cooperate with each other in combating piracy and armed robbery at sea off the coast of Somalia, underlines the primary responsibility of Somali authorities in combating piracy and armed robbery at sea off the coast of Somalia, and requests Somali authorities, with the assistance of the Secretary-General and relevant United Nations entities, to adopt without further delay a full range of anti-piracy laws and declare an exclusive economic zone in accordance with the United Nations Convention on the Law of the Sea.	1
134. The Group discussed areas of cooperation with the Counter-Terrorism Action Unit of the Organization for Security and Cooperation in Europe (OSCE), the Central Asian Regional Office of the Commonwealth of Independent States (CIS) and the Shanghai Cooperation Organization (SCO) Regional Counter-Terrorism Structure and initiated contacts with other regional organizations such as the Organization of American States (OAS), which established the Inter-American Committee against Terrorism (CICTE) and the African Union (AU), which established a counter-terrorism centre in Algeria.	0
The situation among the various ethnic groups in Kosovo remains relatively calm, but unstable.	0
UNOCI closely monitors incitement to hatred and violence in the Ivorian media and submits monthly reports to the Security Council and will continue to strengthen media monitoring and analysis capacity in the run-up to the elections.	0
I welcome the steps taken by the African Union and the affected LRA countries to define a coordinated strategy in dealing with armed groups and to improve the protection of civilians.	1
The risks are undoubtedly high because failure to meet the deadline set in the Comprehensive Peace Agreement for the holding of the referendums could have serious consequences.	0
Request States and regional and subregional organizations to take measures that would restrict and reduce the illicit trade in small arms and light weapons, such as voluntary collection and destruction; effective stockpile management; arms embargoes; sanctions; and appropriate legal measures against corporate actors, individuals and entities involved in such activities.	1
28. On the basis of a proposal by the Executive Directorate, the Committee will consider a communication strategy aimed at enhancing the clarity of the role and activities of the Committee and the Executive Directorate in the area of counter-terrorism.	1
In his view, "the village is a small area, which is difficult to divide into parts, and the entire village becomes a military target."	0
Welcoming the establishment of the Office of the Ombudsman pursuant to resolution 1904 (2009) and the strengthening of the mandate of the Ombudsman in resolutions 1989 (2011) and 2083 (2012), noting the essential contribution of the Office of the Ombudsman to providing additional integrity and transparency, and recalling the strong commitment of the Security Council to ensuring that the Office of the Ombudsman is able to continue to play its role effectively in accordance with its mandate,	1
22. The Council is determined to increase pressure on foreign armed groups in the eastern part of the Congo by participating in initiatives under the tripartite process.	0
Call upon all parties concerned to ensure that issues relating to the protection, rights and well-being of women and girls affected by conflict are specifically included in all peace processes, peace agreements and post-conflict recovery and reconstruction plans and programmes.	1
At the same time, Germany and the European Union have repeatedly condemned the terrorist crimes that resulted in the deaths of hundreds of Israelis in the past.	0
Timor-Leste continues to face important challenges in reducing poverty and creating employment opportunities, particularly for its young population.	0
In this regard, the Security Council welcomes the inaugural meeting of the United Nations-African Union Task Force on Peace and Security, held on 25 September 2010, and encourages the Task Force to focus on strategic and country-specific issues on the continent of concern to both organizations.	1
The potential logistical support to the electoral process will have significant support implications, particularly in non-conflict-affected areas where the Mission has reduced its presence.	0
This approach follows the pledge made by the Asia-Pacific Economic Cooperation Ministers in November 2005 to undertake an assessment of the vulnerability of airports to attack such systems before the end of 2006.	0
Despite these achievements, however, challenges to the Government &apos; s effective authority and control over its national territory still need to be overcome.	0
The Counter-Terrorism Committee Executive Directorate has facilitated workshops on border control management in a number of regions and intends to continue this practice in the future.268. Member States should: (a) implement more effective prevention, inspection and detection procedures, reliance on risk assessments, exchange and analysis of intelligence and international cooperation at official border crossings and along open or porous borders;	0
The Ombudsman may engage in dialogue with these States in order to:	1
"The Security Council calls upon the international community to provide, where appropriate, financial and technical support, as well as appropriate training, for the implementation of resolution 1325 (2000) at the national level, and calls upon the United Nations system, civil society and other relevant stakeholders to cooperate and assist Member States in accordance with national priorities, in particular those affected by armed conflict, to develop national action plans expeditiously and to work closely with national bodies responsible for the implementation of the resolution, including, where appropriate, through United Nations country teams.	1
One State cited a broad plan to combat extremism, adopted in 2006, aimed at combating extremism while also protecting democratic values.	1
Frequent calls from groups for contributions and allegations that they are unable to launch attacks because they lack money have encouraged the continued focus on adding funders to the list.	0
Recognizing that development, security and human rights are mutually reinforcing elements that are vital to the effectiveness and comprehensiveness of the approach to counter-terrorism, and stressing that counter-terrorism strategies should pursue sustainable peace and security as a particular objective,	1
Strengthening the protection of civilians in armed conflict is at the core of the work of the United Nations Security Council on the maintenance of peace and security.	1
30. The potential dangers arising from the process of bringing non-signatory parties to the negotiating table include the insistence of the parties on unrealistic preconditions for negotiations; another risk is the intransigence of the parties towards and during the negotiations; these risks can be mitigated by consolidating the positions of the international community on the peace process and maintaining close dialogue with the parties; and other risks include the establishment of initiatives for parallel peace processes by regional and/or international partners, which could undermine this element of the framework.	0
In this context, the Security Council looks forward to the International Summit on the Great Lakes Region, to be held in Luanda on 31 July, to review further the latest developments in the region, including progress in the implementation of the Peace, Security and Cooperation Framework.	1
On 29 November 2014, two barrel bombs were dropped by regime helicopters at the Bakfar prison clinic in Idlib, parts of which were destroyed.	0
11. Directs the Committee to cooperate with other relevant Security Council sanctions committees, in particular the Committee established pursuant to resolution 1988 (2011); listing	1
Requests the Secretary-General to entrust the Monitoring Group established pursuant to paragraph 4 (a) of resolution 1363 (2001), whose mandate expires on 19 January 2002, to monitor the implementation of the measures referred to in paragraph 2 of the present resolution for a period of 12 months;	0
Even when there is a legal basis for cooperation on counter-terrorism matters among States, practical cooperation remains a challenge, and the underlying causes are of a technical and political nature.	1
Furthermore, the exchange of information on inter-agency cooperation, enforcement activities, voluntary implementation planning and schedule data were among other proposed measures to improve the Committee's understanding of national implementation measures in accordance with resolution 1540 (2004).	1
Moreover, more than 1,000 houses had been burned down, while numerous cases of destruction, looting and inhuman treatment had been reported.	0
After pointing out that the transition process was time-consuming, he stressed the need for joint political action against armed opposition groups that threatened any peace process.	1
In addition, it is considered that the international obligation has been fulfilled at any time when the responsible State, after the conclusion of a peace treaty, agrees to pay war damages or sanctions to the other State or States for damage to the nationals of the adversary, regardless of whether the payment was actually made at any time.	0
(c) Further calls upon all parties listed in the annexes to the report of the Secretary-General on children and armed conflict to address all other violations and abuses committed against children, and to undertake specific commitments and measures in this regard;	1
The Mission &apos; s interim health policy has been amended to take into account the recommendations made by the task force of local and international health professionals.	0
Apart from sporadic confrontations between demonstrators and the police, no acts of violence were reported.	0
The Georgian leadership is firmly committed to the peaceful settlement of the conflict on its territory, recognizing the importance of the integration and integration of ethnic groups and of the protection of human rights and freedom.	1
In the former Yugoslavia, Rwanda and Darfur, following some futile steps to stop large-scale killings, the international community was alarmed by the extent and nature of the violence.	0
Sadly, the current Palestinian leadership has proved unable to be a partner in peace as it is unable to pursue the reform and democratic governance of its people.	0
"The Security Council calls upon the authorities of Burundi and the Democratic Republic of the Congo to cooperate effectively in bringing the perpetrators and those responsible to justice without delay.	1
According to article 3 common to the four Geneva Conventions, international humanitarian law also applies in armed conflicts not of an international character.	0
Almost half of the States apply customs controls to the illicit trade in small arms and light weapons, ammunition and explosives, but customs controls and training of customs officers must be strengthened.	1
The network was unable to collect information on deaths in the isolated areas of the system.	0
"The Security Council strongly condemns the continuing violence and human rights violations committed by all armed groups, including summary executions, sexual and gender-based violence and the widespread recruitment and use of children, demands that all armed groups immediately cease all forms of violence and destabilizing activities and that their personnel be immediately and permanently demobilized, that their weapons be laid down and that children be demobilized from their ranks, and reiterates that those responsible for human rights violations and violations of international humanitarian law will be held accountable for their actions and must not be eligible for integration into the armed forces or other elements of the State security forces.	0
In Zoran, KupreÅ¡kiÄ et al., the Trial Chamber of the International Criminal Tribunal for the Former Yugoslavia defines persecution as "a gross or flagrant deprivation, for discriminatory reasons, of a fundamental right established in international customary or treaty law, up to the same level of gravity as other acts prohibited in article 5."	0
2. Reiterates that it is the primary responsibility of the authorities in Bosnia and Herzegovina to achieve greater success in the implementation of the peace process and that the continued willingness of the international community and major donors to assume the political, military and economic burden of implementation and reconstruction efforts will be determined by the compliance and active participation of all authorities in Bosnia and Herzegovina in the implementation of the Peace Agreement and the rebuilding of a civil society, in particular in full cooperation with the International Criminal Tribunal for the Former Yugoslavia in strengthening joint institutions and facilitating the return of refugees and displaced persons;	1
For example, residents of the Naktoka district of the Nietebe subdistrict reported that on 29 May, some 20 Indonesian soldiers had dismantled two structures that had been partially dismantled by the Government of Timor-Leste in this undecided area.	0
18. During the reporting period, attacks by extremist groups in northern Mali and the escalation of violence in north-eastern Nigeria affected security and stability in the region. The impact of Boko Haram-related violence in the southern part of the Niger and in the far north of Cameroon was of particular concern.	0
To that end, it was pointed out that Lebanese leaders had resumed the national dialogue, whose main mandate was to develop a national defence strategy that would address the important issue of weapons outside the control of the State, following the events of May 2008.	1
30. In its resolution 1963 (2010), the Security Council encouraged the Executive Directorate to work with Member States to develop comprehensive and integrated national counter-terrorism strategies and mechanisms for their implementation.	1
4. Requests the Executive Director, within 30 days of assuming office, to submit, after consultation with the Secretary-General and through him, an organizational plan to the plenary for approval, consistent with the report of the Commission (S/2004/124) and with the rules and regulations of the United Nations, including its structure and staffing requirements, budgetary requirements, management guidelines and recruitment procedures, recognizing in particular the need for an effective and cooperative management structure for the new body, as well as staff with appropriate qualifications and expertise, to be international civil servants subject to Article 100 of the Charter, ensuring the highest standards of efficiency, eligibility and integrity, and giving due consideration to the importance of recruiting staff on as wide a geographical basis as possible;	1
As noted above, a new decision was taken during this session regarding the payment of compensation.	1
The Committee also conducts periodic reviews of the names of individuals reported dead and entities reported to have ceased to exist.	0
Interactions with civil society showed that the mandate and capacity of the Mission were not clearly understood by the population, and there was a perception among the local population that only the intervention brigade could take strong action to protect civilians, which was not true.	0
(h) To provide a midterm briefing to the Council, through the Committee, within 90 days of its establishment;	1
(i) To take immediate measures to achieve gender equality in practice, such as by women &apos; s equal participation in public life and access to employment; to eliminate discriminatory laws, regulations and practices harmful to women; to take measures to end all forms of violence against women, including domestic violence, and sexual and gender-based violence by State agents and/or within its institutions; to address promptly and effectively trafficking in women and to eradicate the structural causes that make women vulnerable to such violations;	0
33. Accordingly, with the support of the international community and the parties to the conflict, the implementation and completion of the ceasefire agreement will be seriously pursued.	1
Mandate the establishment and local adaptation of appropriate truth and reconciliation mechanisms (e.g. technical assistance, funding and reintegration of civilians into local communities).	0
Deeply concerned about the activities of armed groups and acts of banditry in [the region] that threaten the security of the civilian population, the conduct of humanitarian operations in those areas and the stability of those countries, resulting in grave violations of human rights and international humanitarian law.	0
The Team coordinates its travel plans on a regular basis with the Counter-Terrorism Committee Executive Directorate and has organized briefings on visits to Member States, international organizations of the Executive Directorate and experts providing support to the 1540 Committee. The Team looks forward to its first joint visit with the Executive Directorate to a Member State in February 2006 and expects that joint visits will become increasingly frequent.	1
This could mean strengthening competencies in specific areas such as the police, the judiciary, education, culture, the media and the economy, and could allow for horizontal linkages between municipalities where Kosovo Serbs constitute the majority of the population.	1
The Council authorized the deployment of ONUB, which would consist of a maximum of 5,650 military personnel, including 200 observers, 125 staff officers and up to 120 civilian police, as well as an appropriate number of civilian personnel, and, for the initial period of six months, for the deployment of ONUB, effective June 2004, would initially consist of the current troops of the African Mission in Burundi (AMIB).	0
(a) To promote the adoption of international counter-terrorism instruments and the enactment of legislation to fully implement international counter-terrorism instruments throughout the subregion;	1
Three States had developed legal texts enabling extradition, exchange of information and legal assistance and had concluded bilateral treaties or entered into other arrangements with other States in that regard.	0
Five States have established in their legislation sufficient jurisdiction to prosecute related offences under their legislation.	0
The Reserve also supports formed police units deployed in the area.	0
Calls upon all parties to the armed conflict in [the country concerned], including elements of [a particular armed group], to issue clear orders prohibiting sexual violence, and also calls upon those parties to make and implement specific commitments to investigate in a timely manner alleged abuses in order to hold perpetrators accountable, consistent with Council resolution 1960 (2010), and to facilitate immediate access to available services for victims of sexual violence;	1
The transfer of technical skills and techniques between Al-Qaida affiliates is increasing, supporting a degree of innovation that exacerbates the threat.	0
1. Condemns violent extremism, which can lead to terrorism, sectarian violence and terrorist acts by foreign terrorist fighters, and demands that all foreign terrorist fighters give up their weapons and stop completely committing terrorist acts and participating in armed conflicts;	0
Overall, in the context of attacks on villages, the Commission has collected very substantial material and testimony that tends to confirm the killing of thousands of civilians.	0
"The Security Council reaffirms the vital role of women in the prevention and resolution of conflicts, in peace negotiations, peacebuilding, peacekeeping, humanitarian response and post-conflict reconstruction, further reaffirms the importance of preventing and protecting against sexual violence in armed conflict and post-conflict situations, and stresses the need for the United Nations and regional and subregional organizations to ensure the full participation of women and the full integration of gender perspectives in all efforts of the United Nations and regional and subregional organizations for peace and security, including through the necessary capacity-building.	1
564. Taking into account the above comment on the structure of the rebel groups, the Commission has gathered sufficient reliable documentation indicating that four individuals holding important positions within the various rebel groups may be suspected of being responsible for knowingly failing to prevent or suppress the commission of crimes committed by the rebels.	0
It is recommended that United Nations contributions to the stabilization plan be harmonized and coordinated in the context of the next revision of the United Nations Development Assistance Framework.	0
125. The implementation of resolution 1373 (2001) in Central Asia has been hampered by several factors: proximity to the conflict in Afghanistan (drug production fuelled terrorist activities and contributed to the popularization of arms trade with drugs); illegal cross-border cash couriers (a potential source of terrorist financing); the circulation of surplus arms (as a result of political unrest and the region); the remoteness and inadequate protection of borders, coupled with the lack of human and material resources to ensure effective border control; and the large number of migrant workers (which in turn leads to increased recourse to informal remittance systems, also a potential source of terrorist financing).	0
As the Prosecutor, I will face any judicial appeal by President Al-Bashir and other accused in court.	0
"The Security Council expresses its strong solidarity with all victims of terrorism and their families, stresses the importance of assisting victims of terrorism and providing support to them and their families to help them endure their suffering and pain, recognizes and encourages the important role played by networks of victims and survivors in the fight against terrorism, including by sharing experiences and speaking out publicly and with courage against violent and extremist ideologies, and in this regard welcomes and encourages the efforts and activities of Member States and the United Nations system, including the Counter-Terrorism Implementation Task Force.	1
The decision of the European Union to commence negotiations with Serbia and Montenegro on the Stabilization and Association Agreement is an important step in this regard.	1
At the same time, the Council recognizes the key role that the Special Representative of the Secretary-General and the civilian advisers assisting him can play in coordinating humanitarian assistance and re-establishing public order, the functioning of public institutions, as well as rehabilitation, reconstruction and peacebuilding for long-term sustainable development.	1
The victim was pregnant as a result of the rape and subsequently placed a child.	0
(e) To submit a comprehensive programme of work to the Committee for review and approval, as appropriate, in which the Monitoring Team details the activities envisaged to fulfil its responsibilities, including the proposed travel, in close coordination with the Counter-Terrorism Committee Executive Directorate and the 1540 Committee Group of Experts, in order to avoid duplication and enhance synergies;	1
I condemn in the strongest terms the heinous attacks against people who are supporting the Somali people in the fight against organized crime that impedes their country &apos; s development.	0
64. Despite recent improvements in the security situation and the success of large-scale joint security operations, more needs to be done to maintain pressure on illegal armed groups.	0
29. UNMIK police have focused on activities aimed at ensuring that all UNMIK police and Kosovo Police Service trainees have practical knowledge of international human rights standards in law enforcement.	0
5. Affirms that the requirements of paragraph 1 (a) above apply to financial and economic resources in all their forms, including, but not limited to, resources used to provide Internet publishing or related services to support those on this list, as well as other individuals, groups, undertakings and entities associated with the Taliban in threatening peace, stability and security in Afghanistan;	1
Recognizing the importance of transitional justice in promoting lasting reconciliation among all the people of [the affected country], and welcoming the process of national consultations on the establishment of transitional justice mechanisms...	1
