ar_en_DEEPL	MatCoop
54. Following the withdrawal of the Syrian Arab Republic from Lebanon, the time has also come to begin the process of redefining the relationship between these two historically close neighbors.	1
:: Consider how more effective implementation of the WPS program can contribute to improved security for all: Consider how more effective implementation of the WPS program can contribute to improved security for all and lasting peace	1
The involvement of government forces in some of the attacks is a very negative development.	0
With regard to the killing of detained soldiers by the rebels, the Commission has received reports, particularly from the government, of rebels executing detained soldiers.	0
For example, most states have yet to criminalize terrorist financing and combine it with money laundering as a predicate offense.	0
19. From an analysis of statements made by al-Qaeda leaders, it is clear that their immediate goal is to terrorize the West to drive it out of the Middle East and other Muslim countries, and to convince Muslims that their world is under attack.	0
The purpose of these visits was to monitor implementation, including collecting examples of best practices, raising awareness of the Committee's work, building the international consensus that is vital to the success of the sanctions regime, and monitoring the spread and reach of Al-Qaida and the Taliban in order to be better able to make suggestions to the Committee to strengthen its work.	0
10. In accordance with its mandate and in close cooperation with the Security Council Committees established pursuant to resolutions 1267 (1999) and 1540 (2004), the Committee will pay particular attention to States for which information on their implementation of resolution 1373 (2001) is not available and will discuss how best to address this issue.	1
118. Terrorism is a driving factor in an increasing number of conflict situations, particularly in the Sahel and Maghreb regions.	0
3. Directs the Committee to forward to the Committee established pursuant to resolution 1988 (2011) all listing and delisting requests and proposed updates to existing information pertaining to section A (âIndividuals associated with the Talibanâ) and section B (âEntities and other groups and undertakings associated with the Talibanâ) of the Consolidated List that were under consideration by the Committee as of the date of adoption of this resolution, so that the Committee established pursuant to resolution 1988 (2011) can consider those matters in accordance with resolution 1988 (2011).	1
Only 14 of the 238 regime strikes in Aleppo targeted the Islamic State.	0
The Declaration reminds the world that victims of crime should be treated with compassion and respect for their dignity, and are entitled to access justice mechanisms and obtain immediate redress in the form of restitution, compensation for harm suffered, or assistance.	1
92. The commission of inquiry recommends that the two States and civil society organizations encourage opportunities for people-to-people dialogue and communication in the areas of culture, labour, sports, good governance and economic development that provide opportunities for citizens of the Democratic People's Republic of Korea to exchange information and learn about the experiences of other countries.	0
134. The Team has discussed areas of cooperation with the OSCE Counter-Terrorism Action Unit, the CIS Regional Office for Central Asia and the Regional Anti-Terrorist Structure of the Shanghai Cooperation Organization, and has initiated contacts with other regional organizations such as the Organization of American States, which has established the Inter-American Committee against Terrorism, and the African Union, which has established a counter-terrorism centre in Algeria.	1
None of the eyewitnesses reported the distribution of leaflets or warnings over the radio or by tribal sheikhs, or low-altitude airplane flights over villages to warn civilians of an impending attack.	0
Mr. Bralo, indicted for war crimes by the International Criminal Tribunal for the Former Yugoslavia (ICTY), surrendered on November 10 and was transferred to The Hague on November 11, 2004.	1
The information received so far tends to confirm the Group's view that providing examples of the financing of terrorist activities may have more disadvantages than simply allowing seasoned bankers to rely on their knowledge and instincts to detect suspicious transactions.	1
Counter-terrorism strategy: Coordination among law enforcement agencies	1
Takes note of the Department of Peacekeeping Operations' deployment of a fact-finding mission to Chad and the Central African Republic to assess how the United Nations can assist these countries in addressing the current instability.	1
(b) supplying, selling or transferring arms and related materiel to or for the benefit of Al-Qaida, Osama bin Laden or the Taliban; or (c) recruiting for Al-Qaida, Osama bin Laden or the Taliban; or	0
In the UAE, the Central Customs Intelligence Unit feeds risk assessments into the electronic customs clearance system.	1
Attacks against civilians, including sexual violence, by foreign and Congolese armed groups and FARDC elements continue.	0
OCHA, âTo stay and deliver: good practice for humanitarians in complex security environmentsâ: OCHA report, âTo stay and deliver: good practice for humanitarians in complex security environmentsâ (2011). This report outlines the increasingly difficult working conditions for humanitarian workers, makes recommendations for policy responses, and provides references to relevant legal documents.	1
148. The implementation of border control measures is essential to the practical application of States' counter-terrorism strategies.	1
The Council recalls the importance it attaches to ending impunity and bringing those responsible for crimes committed in Darfur to justice.	0
78. Seven countries have institutionalized structures to implement counter-terrorism strategies.	1
âThe Security Council stresses the need to bring to justice the perpetrators, organizers, financiers and architects of this abhorrent terrorist act and urges all States, in accordance with their obligations under international law and resolution 1373 (2001) and consistent with resolution 1624 (2005), to cooperate actively with the Algerian authorities in this regard.	0
In response to this wave of violence, MINUSTAH and the Haitian National Police organized several successful kidnapping rescue operations, and a large number of suspected kidnappers were arrested.	1
24. The Committee will consider information provided by the Executive Directorate regarding its continued close attention to resolution 1624 (2005) in the context of its dialogue with Member States; its work with Member States, in accordance with their obligations under international law, to develop strategies, including to counter incitement to commit terrorist acts motivated by violent extremism and intolerance; and its facilitation of technical assistance for the implementation of resolution 1624 (2005).	0
Many countries have introduced measures to combat illegal migration and smuggling of arms and explosives, but broader and more consistent implementation is needed in most regions.	1
64. Despite recent improvements in the security situation and the success of large-scale joint security operations, more needs to be done to maintain pressure on illegal armed groups.	1
The main security concerns relate to criminal activity and factional fighting.	0
The perspective of the National Police, as explained to the Committee, was to arrest the petitioners and hand them over to the National Police if they were moving from one place to another, and that no arrests were authorized.	0
5. Requests the Monitoring Team to report to the Committee established pursuant to resolution 1267 (1999), including through briefings by Monitoring Mechanism experts, on the work of the Monitoring Mechanism specified in paragraph 3 above, and also requests the Sanctions Enforcement Support Team to provide at least one report per month to the Monitoring Team.	0
169. The evidence obtained by the Commission establishes that Prime Minister Alkatiri was informed of the alleged transfer of weapons to civilians no later than May 21.	0
57. FAO is also providing technical and legal support to the Federal Government of Somalia to facilitate the adoption of a robust legal framework for fisheries, including the establishment of a Somali Federal Fisheries Authority, under the Ministry of Fisheries and Marine Resources.	1
113. Despite those initiatives, regional counter-terrorism efforts continue to face significant challenges.	1
The degree of damage to the metal fragments shown to us by the police (said to have originated from a Mitsubishi Canter) is consistent with the fragments we would expect if the car had been at the center of the explosion.	0
âThe Security Council recalls its resolutions 1265 (1999) of 17 September 1999 and 1296 (2000) of 19 April 2000 on the protection of civilians in armed conflict, and the statements of its President of 12 February 1999 (S/1999/6), 15 March 2002 (S/2002/6) and 20 December 2002 (S/2002/41), and reaffirms the need to protect civilians in armed conflict as an important item on the Council's agenda.	0
40. Few reporting States provided information on their measures to prevent the misuse of charities or other non-profit organizations, but 63 States require such organizations to be licensed or registered.	1
58 - Every day, the New Forces equip warriors to secure the area around the diamond pits.	1
75. Only one of the eight States in this subregion has sufficient legislation to cover all relevant terrorist offenses. Four States have introduced legislation covering only some terrorist offenses.	1
(b) Prevent the entry into or transit through their territories of such individuals, provided that nothing in this paragraph shall oblige any State to refuse entry into or require the departure from its territory of its own nationals; provided that this paragraph shall not apply where entry or transit is necessary for the conduct of judicial proceedings or where the Committee determines on a case-by-case basis only that entry or transit is justified, including where directly related to supporting the efforts of the Government of Afghanistan to promote reconciliation.	0
The Council requests UNSMIL to continue to monitor reports of reported extrajudicial violence and to report to the Council.	0
However, the Caribbean states have adopted the Caribbean Treaty on Mutual Legal Assistance in Serious Criminal Matters (including offenses related to terrorism, financing of terrorism, money laundering and drug trafficking).	1
(c) Encourage strong internal controls on weapons and explosives.	0
Eyewitnesses were unable to determine who actually fired at them: Parallel forces, police or gendarmes.	0
19. Requests the Panel of Experts to continue to coordinate its activities, as appropriate, with those of the African Union-United Nations Hybrid Operation in Darfur and with international efforts to promote the political process in Darfur, and to provide in its interim and final reports an assessment progress towards reducing violations by all parties of the measures imposed by paragraphs 7 and 8 of resolution 1556 (2005), paragraph 7 of resolution 1591 (2005) and paragraph 10 of resolution 1945 (2010), progress towards removing obstacles to the political process, and threats to stability in Darfur and in the region threats to stability in Darfur and the region, violations of international humanitarian law or violations or abuses of human rights, including attacks on the civilian population, sexual and gender-based violence, and other grave violations and abuses committed against children and other grave violations committed against children and other means of violations of the above-mentioned resolutions, and to provide the of individuals and entities that meet the listing criteria set out in paragraph 3(c) of resolution 1591.	1
While free movement zones, such as the Economic Community of West African States (ECOWAS), pave the way for economic growth and opportunity, individuals on the list can move within these spaces with little or no restrictions, due to the lack of regular checkpoints.	1
We are concerned that the success of the presidential election may risk being eroded by the lack of progress in forming a government.	0
295. In addition, given the politically motivated discriminatory nature of the systematic and widespread killing of civilians, such acts may very well constitute the crime of persecution as a crime against humanity.	0
However, many of these countries have barely begun to develop dedicated counterterrorism capabilities.	1
In this regard, she said it was important to finalize the deployment of the additional UNMISS force.	1
20. With regard to Lebanon's border with the Syrian Arab Republic, reports of alleged illegal arms transfers continue to be received and are now allegedly occurring in both directions. Many Member States continued to express deep concern about the illegal transfer of arms across the land border.	0
5. Emphasizes that the crisis in CÃ´te d'Ivoire can only be resolved through dialogue and consultation, with the support of the international community. Council urges the parties to show maximum restraint and refrain from the use of force and unilateral actions, which only complicate the search for a solution.	0
âThe Security Council attaches great importance to the role played by the Organization of African Unity (OAU) and welcomes its decision to establish an international panel of eminent persons to investigate the genocide in Rwanda and surrounding events (S/1998/461).	1
On the eve of the demonstration, PNTL General Commander Martins issued a written order regarding PNTL deployment and use of force. This included the use of the Dili District Police for foot patrols, the Close Protection Unit to protect senior state officials, and the Police Reserve Unit for patrolling âcritical areasâ.	1
The UN Security Council encourages the UN, AU, ICGLR, SADC and other relevant international and regional organizations to continue to work together, with the continued commitment and support of the international community, to implement the PSC Framework.	0
The High Commissioner expressed her concern about the continued prevalence of violations and the prevailing culture of impunity throughout the country, particularly in the zone of confidence, and the erosion of the rule of law in areas under the control of the government and the Forces Nouvelles.	0
12. With regard to border and export controls, Malaysia's Strategic Trade Act 2010 entered into force on January 1, 2011, and Finland adopted a new export control law.	1
âThe Security Council requests the Secretary-General to support efforts to mobilize the necessary resources for the implementation of the YaoundÃ© Summit Outcome and to strengthen national and regional capacities, in close consultation with the Gulf of Guinea States, relevant regional organizations and other United Nations entities.	0
She also referred to important precedents set by the Council, notably the establishment of commissions of inquiry for Bosnia and Herzegovina, Rwanda and Darfur, which paved the way for the establishment of the International Tribunal for the Former Yugoslavia and the International Criminal Tribunal for Rwanda, and the Council's referral of the situation in Darfur to the International Criminal Court (ICC).	1
24. With the assistance of its Executive Directorate, the Committee arranged special events with Member States and international and regional organizations on a number of topical issues of common interest, including combating terrorism through the use of new communication and information technologies.	1
193. In order to effectively address the asymmetric nature of the terrorist threat, it is necessary to enhance cooperation through the establishment of a continuous exchange of information between law enforcement, border security and intelligence agencies.	1
18. The joint communiquÃ© placed an obligation on the Government to freeze restrictions on all humanitarian activities in Darfur and remove any other obstacles to humanitarian action.	1
The International Investigative Department's Training Assistance Program and the European Community's Reconstruction, Development and Stabilization Assistance Program have agreed to provide mentoring to police trainers to enable them to teach both specialists and senior managers.	1
12. The Committee will continue to organize meetings and special events on topics and issues of common interest and concern to Member States with a view to maximizing the impact of the resolutions adopted in this regard and maintaining the commitment of the international community to the fight against terrorism.	1
Red Cross vehicles and personnel were reportedly seen at the scene, sometimes assisting the injured.	1
Encourages troop- and police-contributing countries, in consultation with the Secretary-General, to consider what measures they can take to enhance the awareness and responsiveness of their personnel participating in United Nations peacekeeping operations to protect civilians, including women and children, and to prevent sexual violence against women and girls in conflict and post-conflict situations, including, to the extent possible, deploying a greater proportion of women peacekeepers or police.	0
40. UNODC continued to provide counter-terrorism technical assistance to countries in East Africa; for example, in close consultation with national authorities in Djibouti, Ethiopia, Kenya, Somalia and Somalia, UNODC developed country-specific long-term assistance programs to strengthen their criminal justice response to terrorism in accordance with the rule of law and with due respect for human rights.	1
In informal consultations following the meeting, the Under-Secretary-General and several MINUSMA staff emphasized that the threat is significant, real and complex and that it is therefore imperative to take all necessary steps to protect MINUSMA personnel in the face of growing asymmetric threats and to strengthen the Mission's operational capacity to match its mandate.	1
Once the future status is determined, the international presence - both military and civilian - will need the necessary resources to manage the implementation of the settlement in a balanced and orderly manner.	1
The December 12 agreement also provides for the release and repatriation of prisoners of war without delay, as well as all other persons detained as a result of the armed conflict.	1
More efforts must be made by the Haitian government and international humanitarian organizations in preventive activities, such as the provision of sanitation and clean water.	0
In addition, four countries have introduced legislation criminalizing the provision of safe haven to terrorists and their supporters, both individuals and organizations.	1
Furthermore, it should be noted that the Commission has collected extensive material on various influential individuals, institutions, groups or committees that have played a significant role in the conflict in Darfur, including in planning, ordering, authorizing and encouraging attacks.	1
The issue of the full deployment of the Mission's civilian police component, as mandated by the Security Council, also remains unresolved.	1
17. I believe that the task of uncovering the fate of missing Kuwaiti and third-country nationals is urgent and should not be subject to political factors and considerations.	0
76. States of the subregion should: (a) Adopt comprehensive and harmonized national counter-terrorism legal frameworks that incorporate all terrorist offences set out in the international counter-terrorism instruments, and effectively implement anti-money-laundering and counter-financing of terrorism laws and regulations, while also complying with international human rights standards.	1
Reaffirming its resolution 1373 (2001) of September 28, 2001, and reiterating its support for international efforts to eliminate terrorism, in accordance with the Charter of the United Nations.	0
The initiative, open to all member states, aims to promote a measurable reduction in global armed violence and a measurable improvement in human security by 2015.	1
- With regard to paragraphs 46, 48 and 49 on the arms embargo and border control, the truth is that arms smuggling is from Lebanon to Syria. Everyone knows that certain groups in Lebanon are involved in attempts to destabilize Syria by supplying armed terrorist groups in Syria with weapons and funds to undermine Syria's stability.	0
On 10 November, the Council was briefed in closed consultations by the Deputy Permanent Representative of Luxembourg to the United Nations, Olivier Maes, on behalf of the Chairman of the Security Council Committee established pursuant to resolution 1718 (2006) concerning the Democratic People's Republic of Korea, on the work of the Committee during the period from 5 August to 9 November. The briefing was provided in accordance with paragraph 12 (g) of resolution 1718 (2006).	0
âThe Security Council calls on the Somali parties to build on the progress made and expedite the National Reconciliation Conference to reach a lasting and inclusive solution to the conflict in Somalia through the establishment of a viable transitional government.	0
The Government also shares a number of the concerns expressed in the report regarding, inter alia, human rights and the situation of women and children.	0
This legal character of the prohibition of torture in customary international law has been upheld by the International Criminal Tribunal for the Former Yugoslavia in the Furundzija case (paras. 144 and 153-157), by the House of Lords in the Pinochet case, and by the United Nations Special Rapporteur on Torture.	1
All seven countries are only partially implementing measures to prevent the smuggling of arms and explosives.	1
These measures will include further work to increase the Committee's capacity, including through increased cooperation with the Taliban/Al-Qaida Sanctions Committee established pursuant to resolution 1267 (1999) and the Committee established pursuant to resolution 1540 (2004).	1
6. The application of self-protection measures, including the use of privately contracted armed security personnel on board ships and the deployment of ship protection detachments, together with increased situational awareness, training and evasive manoeuvres, and the use of safe sea lanes by merchant ships, may also play a role in discouraging pirates from attacking ships.	1
Thirty graduates of the first four-week medium-term training program for senior municipal officials received training in law, economics, public finance, human resource management, and conflict resolution.	1
In resolution 2122 (2013), the Council expressed its concern at the increased vulnerability of women in armed conflict and post-conflict situations, in particular in relation to forced displacement as a result of unequal citizenship rights, sexist application of asylum laws and obstacles that often prevent them from registering their data and obtaining identity documents.	0
The measure of success for a hybrid court must be the legacy it leaves with the people most affected by the crimes committed, in this case in Sierra Leone.	1
Another bomber failed to detonate her bomb and was arrested a few days later.	0
The Council stressed that reform of the defense and security sectors, the fight against impunity, and the fight against illicit drug trafficking remain peacebuilding priorities in Guinea-Bissau, and urged the armed forces of Guinea-Bissau to respect civilian governance and oversight.	0
âThe Security Council calls on the Government of National Unity and Transition to begin working immediately with the International Committee in Support of the Transition (CIAT) and the United Nations Organization Mission in the Democratic Republic of the Congo (MONUC) to develop mechanisms to enhance coordination, with a view to accelerating security sector reform, the adoption of basic laws and preparations for elections.	1
Lt. Col. Valor ordered the soldiers to return fire.	0
77. As part of its efforts to promote regional cooperation, UNODC and the Global Counterterrorism Forum jointly organized a conference on regional cooperation in criminal matters in the Maghreb and Sahel region in Casablanca, Morocco, from 16 to 18 April 2013.	1
A total of 146 States, including some that have not yet reported, reported circulating the List (and any changes to it) to banks and, to some extent, financial institutions, as well as to ports of entry and other relevant authorities, but visits indicated that in many States the circulation of updates to the List is slow, particularly at border points.	1
15. As at 8 September, the total strength of UNOCI stood at 6,430 personnel, against the authorized strength of 7,090, including 200 military observers.	1
66. The strengthening of rule of law institutions in Haiti, including the reform of the Haitian National Police, is essential for the effective maintenance of internal stability and the extension of State authority.	1
On August 23, the Vice-Chairman of the Security Council Committee established pursuant to resolution 1718 (2006) presented to the Council his 90-day report to the Council on the work of the Committee.	1
