ar_en_DEEP	VerConf
âThe Security Council welcomes the significant progress achieved by Timor-Leste in strengthening the institutional and human resource capacities of State institutions, including in the security, justice and governance sectors, which play vital roles in maintaining stability and advancing democracy.	0
It strongly condemns all acts of sexual and other forms of violence against civilians in armed conflict, in particular against women and children, and pledges to ensure that all peace support operations apply all possible measures to prevent such acts of violence and address their impact wherever they occur.	1
“The Security Council notes with deep concern the postponement of the first round of the presidential elections, which were scheduled to take place on 29 November 2009 in accordance with the communication of the Permanent Advisory Framework of the Ouagadougou Political Agreement of 18 May 2009, endorsed by all Ivorian political actors.	1
The resolution reiterates the importance of fulfilling those obligations and stresses that neither party should undertake any activity that conflicts with those obligations under the roadmap or prejudges final status negotiations.	1
However, despite increased interest and recent positive developments in this area, many challenges remain in the field with regard to implementation, in particular challenges related to the continued lack of clarity regarding the concept and operationalization of the protection of civilians, internal and external coordination mechanisms, and early warning and rapid response. , providing support to host government security forces, force capabilities, and providing resources.	1
However, terrorism will still have supporters, especially in places where overt political protests are unsuccessful, and although Al Qaeda will never gain widespread acceptance, attacks will continue.	0
10 - Decides that the travel ban imposed under paragraph 1 (b) does not apply to individuals identified pursuant to paragraph 9 bis above, when the Committee determines, on a case-by-case basis, that such entry or transit is justified, and further determines that any such exception is approved The Committee shall grant only the period required for any travel to that specific location or locations, and directs the Committee to decide on all such exception requests, as well as requests to amend or renew previously granted exceptions, or on a request submitted by a Member State to cancel previously granted exceptions, within ten days. From receipt of such requests; Confirms that the individuals included on the list remain, regardless of any exception to the travel ban, subject to the other measures set out in paragraph 1 of this decision;	0
This is particularly the case with regard to persons who have obtained weapons from the Defense Forces and subsequently returned them.	0
He presents a new message accompanied by video recordings in which Mustafa Abu Al-Yazid, known as Sheikh Saeed, the head of Al-Qaeda in Afghanistan, appears, accompanied by leaders from the Taliban movement. and excerpts from bin Ladenâs letters; And on television news topics; With audio clips of distinguished heads of state and government, including many from Arab countries; and to officials from the CIA; and officials from NATO; counter-terrorism experts; Muslim clerics; And scientists; And journalists; And lawyers; And Western supporters of Al-Qaeda.	1
âThe Security Council welcomes the steps taken by national, international and âhybridâ criminal courts and tribunals against persons alleged to have committed grave violations against children in situations of armed conflict, in violation of applicable international law.	0
First, the effective implementation of a sanctions regime is directly linked to the quality of information available about its objectives.	0
The parties committed to the preliminary agreement for the presidential elections and the inclusive peace talks in Mali, signed on 18 June 2013 in Ouagadougou, are the Arab Movement of Azawad, the Coordination of Movements and National Forces of Resistance and the Coalition of the People for Azawad;	0
Repeated clashes between FARDC soldiers and armed groups active in this region have led to numerous civilian casualties.	0
âThe Security Council also reaffirms the need to work by all means, in accordance with the Charter of the United Nations, to combat risks to international peace and security resulting from terrorist acts. The Council reminds States that they must ensure that any measures they take to combat terrorism comply with all obligations under It was decided under international law, in particular international human rights law, international refugee law and international humanitarian law.	0
(b) Recommendations on possible actions to strengthen the response to the threat posed by these foreign terrorist fighters;	0
Condemns the use of [the national radio and television station] and other media to incite discrimination, hostility, hatred and violence, including against the [relevant United Nations mission], as well as acts of intimidation and violence against journalists and calls for the lifting of all restrictions on the exercise of the right to freedom of expression in [ country in question];	1
âThe Security Council is deeply concerned about the deteriorating security situation in the Central African Republic, in particular following the attacks on Birao, Ouanda-Djali and Sam Ouandja.	0
However, the remainder of the movement's ability to undermine tangible progress in stabilizing the situation in Ituri remains a source of concern, especially given the inability of the transitional government so far to bring leaders of armed groups to justice and prevent their movement to and from Uganda.	0
As long as we are discussing the development challenges facing Afghanistan, the recent incident justifies the bleak picture regarding the security situation.	1
The total information collected by the team was information related to attacks on 51 towns or villages and 11 cases of rape, by interrogating 116 eyewitnesses and 12 indirect witnesses.	0
Emphasizing that terrorism can only be overcome by adopting a sustained and comprehensive approach that involves the effective participation and cooperation of all States and international and regional organizations to prevent, weaken, isolate and incapacitate terrorist threats,	0
The terrorist threats threatening the region are somewhat different in terms of their origin and nature, but they are similar to the aforementioned dangers in terms of their effects.	1
According to these decisions, this body must demand that the United States government immediately sentence Luis Posada Carriles for committing acts of terrorism or extradite him to the Bolivarian Republic of Venezuela, whose judicial system has been pursuing him for years.	1
The main Palestinian factions in Lebanon expressed concern about the incidents and distanced themselves from Fatah al-Islam.	1
It will also require the assistance of bilateral donors to meaningfully address the security threats posed by drug and arms flows.	0
12 - Given the deep lack of confidence that prevailed among the Lebanese people towards their security and judicial authorities, the International Commission of Inquiry has become a source of great expectations and hopes for change, and has also become a âlinkâ between the Lebanese people and their authorities.	0
During the discussions, and in light of the change in leadership on both sides over the past two years, the two parties agreed on the need to reaffirm their commitment not to resume hostilities and to the return of internally displaced persons and refugees in safety and dignity, provided that this is done in the first phase to the Gali region within its old borders, as was confirmed It was stated in the Yalta Declaration for the Georgian and Abkhaz sides (see S/2001/242, annex, and S/2001/401, para. 6).	0
Noting with concern the continued threat to international peace and security posed by Al-Qaeda, Osama bin Laden, the Taliban and all associated individuals, groups, institutions and entities, and reaffirming its determination to confront all aspects of that threat,	1
- It has become easier, in an increasingly globalized world, for terrorists to exploit advanced technology, communications and resources to achieve their criminal goals.	1
United Nations human rights mechanisms have expressed concern, for example, about measures taken by some States to restrict the activities of some religious groups or their members, or in some cases to criminalize them.	1
The Committee strongly recommends that Member States establish such national bodies in order to coordinate and discuss counter-terrorism issues. Third - failure to submit reports	0
In this climate of insecurity, the freedom of political parties to express opinions has become threatened or even restricted.	1
However, the crucial element of genocidal intent appears to be missing, at least as far as central government authorities are concerned.	1
During that period, there has been a significant change in the threat posed by Al-Qaida, the Taliban and those associated with them, and in the aforementioned sanctions regime.	1
69. Mr. Soro told the mission that they were surprised that the international community had not foreseen the impending conflict in CÃ´te d'Ivoire, which had been clearly visible since the death of President FÃ©lix Houphoulier-Boigny.	1
We are confident that these groups will not be able to undermine the electoral process at the national level.	1
That night, an eastern police officer broadcast a statement on the radio blaming Commander-in-Chief Martins and his deputy, Babu, for the death of the Rapid Response Unit officer.	1
Security Council resolution 1318 (2000), operative paragraph 6, stresses the importance for all Member States, in particular those involved in the manufacture or marketing of arms, to restrict the transfer of arms that could provoke or prolong armed conflicts or exacerbate existing tensions or conflicts...	0
OSCE observers observed ongoing fighting in many locations in the Donetsk and Lugansk regions, where artillery and mortar shelling often hit residential areas, causing casualties among the civilian population.	0
Improvised explosives and homemade explosives, such as ammonium nitrate and urea nitrate: car bombs.	0
56- The police and security forces in the Democratic People's Republic of Korea systematically resort to violence and impose sanctions, which constitute a gross violation of human rights, in order to create a climate of fear that suppresses any opposition to the current regime and the ideology on which it is based.	0
In this regard, another participant pointed to the high costs of peacekeeping operations and expressed his regret at the Council's lack of military expertise.	1
However, without greater transparency â which would undermine one of the main advantages of the mechanism â it is unlikely to meet the requirements for an effective and independent judicial review.	1
The Council regularly reaffirms, reminds and reiterates its call on states to implement the applicable arms embargo, as implementing the embargo still poses major challenges.	1
The mission met with a wide range of international and Ivorian stakeholders, including President Gbagbo, Prime Minister Soro, the Chief of Staff of the Defense and Security Forces of CÃ´te d'Ivoire, the Chief of Staff of the Forces Nouvelles, representatives of political parties and the heads of national institutions responsible for implementing key operations under the Ouagadougou Agreement.	0
Noting with concern the continued threat posed by Al-Qaeda, Osama bin Laden, the Taliban and other groups, institutions, entities and individuals associated with them to international peace and security, ten years after the adoption of resolution 1267 (1999), and reaffirming its determination to address all aspects of that danger,	1
56 - Encourages Member States, when reversing a decision to freeze the assets of a deceased individual or an entity that has been notified or determined to no longer exist after being delisted, to take into account the obligations set out in resolution 1373 (2001), and, in particular, to prevent the exploitation of assets The decision to freeze it was cancelled, in order to achieve terrorist objectives.	0
The Security Council's current attempts to shift blame onto Eritrea are unjustified, neither legally nor politically.	1
The Government also shares a number of concerns expressed in the report regarding, inter alia, human rights and the situation of women and children.	1
However, to ensure the continuation of this comprehensive mine action programme, additional funding from donors is required for 2008.	0
The Acting Assistant Secretary-General briefed on political developments in Ukraine, including the holding of parliamentary elections on 26 October, and the elections held by rebels in Donetsk and Lugansk on 2 November, which were denounced by the Secretary-General and many in the international community.	1
I urge the Congolese authorities and others concerned to take the necessary steps to put an end to these actions, which may undermine the credibility of the elections and increase the risk of violence.	1
I expressed my condemnation of the terrorist attack that occurred on the Indian Embassy in Kabul.	1
49 - Many challenges remain in combating impunity, particularly due to the limited capacity of civilian and military judicial authorities to conduct independent and comprehensive investigations and provide protection to victims and witnesses.	1
It is not unlikely that criminal activities are interconnected and feed into each other, thus fueling terrorism in Africa and criminal acts that plague other regions of the world.	1
At the same time, the Council recognizes the key role that the Special Representative of the Secretary-General and the civilian advisers who assist him can play in coordinating humanitarian assistance, re-establishing public order and the functioning of public institutions, as well as reform, reconstruction and peace-building to achieve long-term sustainable development. .	0
12 - Refers to its resolution 2161 (2014) and its requirement that all States must ensure that no funds, financial assets or economic resources are made available, directly or indirectly, for the benefit of the Islamic State in Iraq and the Levant, the Al-Nusra Front, or other individuals, groups, institutions and entities. associated with Al-Qaeda, through its nationals or any persons present in its territories, and reaffirms the requirement of its resolution 1373 (2001) that all States prohibit their nationals or any persons or entities within their territories from making available any funds, financial assets, economic, financial or other resources of relevant services, directly or indirectly, for the benefit of persons who commit, attempt, facilitate or participate in terrorist acts, or for the benefit of entities owned or controlled, directly or indirectly, by such persons, or by persons and entities that operate In the name of or at the direction of such persons;	1
Noting with concern that the threat of terrorism has become more widespread, with various regions of the world witnessing an increase in terrorist acts, including acts motivated by fanaticism or extremism, and expressing its determination to combat this threat,	1
57- So far, about 20,000 homes have been rebuilt this year, with support from donors, for affected families whose homes were severely damaged or destroyed during the conflict.	0
The recent fatwa issued by the Ulema Council condemning drug and other related activities could be very helpful in thwarting opium poppy production.	1
Since the categories of international crimes have been included in another part of the report, it is sufficient here to briefly mention the various ways of participating in the commission of international crimes that give rise to individual criminal responsibility.	0
The European Union condemns such acts of violence committed by the Maoists, which have caused enormous suffering and hardship to the Nepalese people.	1
At the same time, the issue of ensuring that counter-terrorism measures comply with human rights obligations remains a major topic of discussion in this subregion.	1
Condemning in particular sexual violence committed by [militias and armed groups as well as elements of the armed forces and the national police] and other security and intelligence services, and stressing the urgent need for [the State concerned], in cooperation with the [peacekeeping mission] and other relevant actors, to put an end to of this violence and prosecute its perpetrators and the senior leaders under whose command these criminals work, and calling on Member States to provide assistance in this area and to continue providing medical, humanitarian and other forms of assistance to the victims,	1
15. Al-Qaida in Iraq (QE.J.115.04) recently replaced its name with the Islamic State in Iraq and the Levant, in order to legitimize its operations in the Syrian Arab Republic and break away from the name Al-Qaida.	1
8 - In Somalia, since early 2007, Al-Shabaab, which is not listed, has claimed responsibility for numerous suicide bombings and attacks that followed the practices of Al-Qaeda and its associated groups in Iraq or Afghanistan.	0
28. Uganda remains committed to the Lusaka Peace Agreement and subsequent agreements, because the framework of the Lusaka Agreement adequately accommodates the two dimensions of the conflict, namely the internal issue and the security concerns of neighbours.	0
105. The Government has the mandate to formulate and implement the country's general policy.	0
She heard voices crying for help from other girls and believes they were also being raped.	0
8 - The continued efforts of Ansar al-Sharia in eastern Libya are of particular concern (it is a group not included on the list and differs from Ansar al-Sharia, which is affiliated with Al-Qaeda in the Arabian Peninsula). There are communications in the field of operations between Ansar al-Sharia and organizations affiliated with Al-Qaeda in the Sahel region, the Maghreb, the Middle East, and South Asia. Many foreign fighters continue to travel to training camps in Libya before heading elsewhere to fight.	0
We urge Israel to take further action to remove outposts in accordance with the Roadmap, and to address the growing threat posed by settler extremism.	1
3 - The perpetrator of these acts shall be punished by imprisonment for a period of up to fifteen years, with confiscation of his property, if the court deems so, or by an exceptional ruling,	1
No single country can combat terrorism. The transnational nature of the terrorist threat requires cooperation and coordination with other countries.	0
The areas besieged by the regime are still subjected to daily bombardment, resulting in the slaughter of civilians without any attention or media coverage.	0
However, transparency measures relating to small arms systems are the least developed of all transparency measures relating to weapons systems.	1
Since then, the government has repeatedly expressed its preference to receive direct bilateral support to build the capabilities of its security forces.	0
Elsewhere, along the Blue Line, violations threaten to destabilize fragile stability.	1
Its work with regional and subregional organizations should focus on facilitating the interaction of regional and national institutions to address national implementation challenges, such as aligning priorities, harmonizing approaches, facilitating advisory and drafting services, and matching requests and offers for assistance.	0
I am deeply concerned about the recent escalation between Gaza and Israel.	1
The declaration obliges participating countries to support programs to reduce armed violence from a development and human rights perspective.	0
Likewise, the Security Council Committee established pursuant to resolution 1518 (2003) maintains a non-binding and non-exclusive list of âmoney and financial assetsâ and âeconomic resourcesâ, noting that the latter phrase includes âassets of any kind, whether physical or intangible, movable or immovable property, which is not moneyâ().	0
In the statement, President Abbas also expressed his full support for the measures taken by the Government of Lebanon in recent weeks to ban the carrying of weapons outside Palestinian refugee camps, to stop the illegal transfer of weapons and personnel, and to assert its exclusive right to use force and extend its authority over all of the countryâs territory.	0
In addition, there have also been concerns about the occupation of minority property, with reports from a Croat community in the municipality of Vitina and from Roma living in the town of Gnilane that Kosovar Albanians are inspecting vacant homes and, in some cases, intimidating community members.	1
The Group also considers the growing international concern regarding terrorist use of the Internet, and provides views on this issue and all its monitoring activities.	1
âThe Security Council considers sanctions to be an important tool in the fight against terrorism, and stresses the importance of the immediate and effective implementation of relevant resolutions, in particular Security Council resolutions 1267 (1999) and 1989 (2011), as a key tool in the fight against terrorism.	1
Regarding the discussion of procedural amendment, the Group agrees that any reform must strengthen the legal nature of the system that the Council has sought to establish in recent years, by adding more clauses containing the phrase ârelating toâ in resolution 1617 (2006), and introducing a system of summaries Narrative justifications for listing, and review of the mechanisms of resolution 1822 (2008), for example.	0
Meetings will also be organized with the Analytical Support and Sanctions Monitoring Team and experts of the Security Council Committee established pursuant to resolution 1540 (2004) in order to discuss issues of common concern and ensure appropriate coordination in our work.	0
22. Calls upon the Government of the Democratic Republic of the Congo, with the support of the international community and MONUC, to urgently develop and implement a comprehensive national strategy for security sector reform, based, inter alia, on the outcomes of the round table on the security sector held in February 2008, with a view to establishing professional security organizations in the areas of defence, police and justice that protect civilians and are well-managed and operate in accordance with the Constitution and with respect for the rule of law, human rights and international humanitarian law, urges the Congolese Government to ensure the sustainability of support from its partners in this area, in particular by giving priority to the reform of the management and command structures of the FARDC and other security forces, and reiterates its appeal to the Congolese authorities to establish a screening mechanism that, when selecting candidates for official positions, including key positions in the armed forces, the national police and other security services, takes into account the candidatesâ previous conduct with respect for international humanitarian law and human rights;	0
Strongly condemns the recruitment and use of child soldiers by parties to armed conflict, in violation of the international obligations applicable to them, and other violations and acts of abuse committed against children in situations of armed conflict.	0
Al-Qaeda in the Islamic Maghreb (QE.T.14.01) has developed significant expertise in kidnapping for ransom.	0
The challenges facing the country require a united, common will from Haiti's leaders.	1
106 - All States except one State met the deadline set by the International Civil Aviation Organization for the issuance of machine-readable travel documents.	0
These measures are sometimes applied in the context of preventive measures when terrorist acts are allegedly still in the preparatory stage.	1
As the representative of Algeria pointed out a moment ago, the draft resolution that was not adopted clearly contained a condemnation of all terrorist attacks against civilians in addition to all acts of violence and destruction.	1
In all these discussions, I was heartened to discover a convergence of views: we all marvel at how much Liberia has achieved since the fighting ended in 2003, but everyone is fully aware of the magnitude of the challenges that still face Liberia, and that we take nothing for granted. Of him in the end.	1
In 1993, that vision was vague at best, and at the time, it was impossible to define an ultimate goal that would come close to meeting the concerns of both peoples.	1
2 - Reiterates the need to fully respect the military agreements reached with the Mission regarding the ceasefire, and calls on both parties to fully adhere to those agreements;	0
61. The extent of the presence and functioning of state institutions, the police and the national army in these areas varies greatly.	0
My delegation believes that to prevent new outbreaks of violence and to stabilize northern Kosovo, it remains essential that the reconciliation process be accompanied by policies aimed at ensuring social and economic stability among the communities in a non-discriminatory manner.	1
The remains of the victims were transferred to the Hilversum military base, where identification operations are underway.	0
114. The violence that occurred in Rai Koto on the afternoon of 28 April resulted in the death of one civilian, as described in paragraphs 50 and 51 above.	0
