ar_en_DEEPL	MatCoop
1. In the statement by its President on September 4, 2008 (PRST/2008/33S/), the Security Council requested the Secretary-General to identify and approach States that could contribute the necessary financial resources, personnel, equipment and services for the establishment of a multinational force for Somalia.	0
The Organization of Islamic Cooperation calls for an end to the Israeli military occupation of the Palestinian Territory, including East Jerusalem, and to the illegal actions of the occupying Power, which have claimed thousands of civilian lives, caused widespread destruction and exacerbated the social, economic and humanitarian suffering of the Palestinian people in violation of international law, including international humanitarian and human rights law.	0
Many countries are also investing in social programs to better understand and prevent radicalization and potential terrorist recruitment, and almost all have engaged, to some extent, in counterterrorism dialogue.	0
42. UNOCI has enhanced its efforts to sensitize the Ivorian public to the Mission's mandate and objectives in an effort to counter the ongoing campaign to discredit the Mission.	1
71. Member States should be invited, in their tracing efforts, to utilize, as appropriate, the INTERPOL Global Police Communications System âI-24/7â and the INTERPOL Electronic Weapons Tracing System.	0
As I explained, I am confident that your esteemed council will not pay attention to these false accusations, which are not true and do not meet the minimum standards of professionalism.	0
An eighth formed police unit from Nigeria is expected to be deployed in October.	1
24. The UNTAET period has been characterized by significant changes.	1
(a) Encourage the development of measurable goals in the area of armed violence reduction.	1
The Committee will endeavour to ensure that both committees and expert groups fully exchange national reports, visit reports and other relevant information, including on organized visits to States and other official travel and technical assistance.	0
In particular, the Commission found that government forces and militias carried out indiscriminate attacks, including killing civilians, torture, enforced disappearances, destruction of villages, rape and other forms of sexual violence, looting, and forced displacement, throughout Darfur.	0
Security Council Committee established pursuant to resolution 1718 (2006) Sanctions List	0
36. Encourages all Member States, in particular designating States and States of residence or citizenship, to submit to the Committee additional identifying and other information, with supporting documentation, on listed individuals, groups, undertakings and entities and other information, including updates on the operational status of listed entities, groups and undertakings, the movement, incarceration or death of listed individuals and other relevant facts, as such information becomes available.	0
The violence that erupted in the Gali region is a logical consequence of the escalating situation of gross violations of the rights of peaceful citizens by the Abkhaz regime, which encourages the smuggling of weapons and drugs.	0
68. I am appalled by the killings of hundreds of innocent civilians and the resulting displacement of the population in Beni and deplore the serious violations of human rights and international humanitarian law occurring in other parts of the country, which are also unacceptable.	0
These changes, in addition to bringing renewed hope to the people of the Republic, have provided a new opportunity for MINURSO to improve its consultations with the federal authorities and engage in constructive dialog on matters of mutual concern.	0
UNOCI will also provide logistical support for the redeployment of the national police to the northern part of the country in support of an agreed comprehensive security plan for the electoral process developed by the Ivorian authorities, with the assistance of UNOCI and the Licorne force.	1
It was recommended that the Committee strengthen and, where appropriate, institutionalize its cooperation with international non-proliferation mechanisms, other United Nations bodies, the Group of Eight, regional and subregional organizations and nuclear-weapon-free zones, which could add value to the implementation of resolution 1540 (2004) by expanding formal and informal working relationships.	1
âThe Security Council calls on the parties to refrain from the use of force, settle their differences by peaceful means, normalize their relations, promote stability between them, and lay the foundations for lasting peace in the region.	0
Emphasizing its support for multilateral treaties aimed at eliminating or preventing the proliferation of nuclear, chemical or biological weapons, and the importance of their full implementation by all States parties to such treaties in order to promote international stability.	0
However, my delegation notes with regret that the security situation remains of concern.	0
CTED has facilitated workshops on border control management in a number of regions and intends to continue this practice in the future. 268. Member States should (a) Implement more effective prevention, inspection and detection procedures, relying on risk assessments, intelligence sharing and analysis and international cooperation at official border crossings and along open or porous borders.	1
43. In pursuit of these objectives, the mission documented widespread cases of unlawful arrests, ill-treatment and prolonged pre-trial detention.	0
Second, the lack of information causes frustration and exasperation among those responsible for verifying the list on which effective implementation most relies, increasing the risk that listed names will go undetected and measures may be applied to unintended targets.	0
Conduct research to discover the causes of gender disparity in early warning mechanisms, and develop indicators that take into account the results of that research.	1
53. Integrated plans are being implemented to support the planned withdrawal of the Mission's military and civilian components between 15 October and 31 December 2010.	1
544. The Commission has identified 14 Janjaweed suspected of having committed an international crime under the principle of joint criminal enterprise.	0
Determining that the situation in the region continues to constitute a threat to international peace and security.	0
All but one of the East Asian states are members of several regional organizations or mechanisms for international counterterrorism cooperation, with little information provided, and are seeking to strengthen those relationships.	1
The Council supports the idea of establishing a unit within the Secretariat to assist in establishing the rule of law, and looks forward to receiving the Secretariat's proposals on the implementation of the recommendations contained in paragraph 65 of the report of the Secretary-General on the rule of law and transitional justice in conflict and post-conflict societies (S/2004/616).	0
The Register has therefore become a tool of direct relevance to the work of the Security Council and the General Assembly on small arms and light weapons.	1
In all of these locations, the team was informed that there have been no recent recruitment attempts, but the situation could change if the conflict erupts again in CÃ´te d'Ivoire.	1
Decides to strengthen and amend the mandate of [the mission] as follows: To promote and protect human rights: - To assist in strengthening the capacity of the judicial system, including transitional justice mechanisms, to strengthen national human rights institutions, and to assist in national reconciliation efforts.	1
32. Requests the Secretary-General to include in his country-specific reports to the Council more comprehensive and detailed information on the protection of civilians in armed conflict, including on protection incidents and actions taken by parties to conflict to implement their obligations to respect and protect the civilian population, and to include information specific to the protection needs of refugees, internally displaced persons, women, children and other vulnerable groups.	1
âThe Security Council expresses its growing concern about the serious threats posed by drug trafficking and related transnational organized crime activities to international peace and stability in West Africa and the Sahel region as referred to in the United Nations Integrated Strategy for the Sahel.	0
Government forces reportedly often committed unwarranted acts of destruction beyond any military necessity.	0
The mechanism, funded by the United Kingdom, through its three working groups on maritime strategy, legal framework and fisheries, provides support to anti-piracy focal points in the federal government and in each region.	1
This situation depicts not only the killing of civilians in large numbers, but also unlawful detentions accompanied by summary executions, rape and other abuses.	0
All countries in the subregion are members of the International Criminal Police Organization (INTERPOL) and have established INTERPOL National Central Bureaus.	1
âThe Security Council reiterates that the growing threat posed by foreign terrorist fighters is part of the emerging issues, trends and developments relevant to resolutions 1373 (2001) and 1624 (2005), and encourages the CTC to hold special meetings in 2015 with the participation of Member States and relevant international and regional organizations to discuss ways to stem the flow of foreign terrorist fighters and prevent terrorists from using the Internet and social media to recruit and incite terrorist acts, while respecting human rights and fundamental freedoms and in compliance with other obligations under international law.	0
24. Requests the Counter-Terrorism Committee, within its existing mandate and with the support of CTED, to identify key gaps in the ability of Member States to implement Security Council resolutions 1373 (2001) and 1624 (2005) that may impede the ability of States to stem the flow of foreign terrorist fighters, identify good practices in stemming the flow of foreign terrorist fighters in implementation of resolutions 1373 (2001) and 1624 (2005), and facilitate technical assistance, in particular by encouraging networking between providers and recipients of capacity-building assistance, in particular those in the most affected regions, including by developing, upon request, holistic counter-terrorism strategies that include countering the spread of violent extremist ideology by encouraging networking between providers and recipients of capacity-building assistance, particularly those in the most affected regions, including through the development, upon request, of inclusive counter-terrorism strategies that include countering the spread of violent extremist ideology and the flow of FTFs, noting the roles played by other actors, including the Global Counterterrorism Forum (GCTF).	0
The Executive Directorate has also developed strong relationships with some regional and subregional organizations, notably the Caribbean Community and the Inter-American Committee against Terrorism of the Organization of American States in the Americas; the African Centre for the Study and Research on Terrorism, the African Union, the Economic Community of West African States, the IGAD Capacity Building Programme for Counter-Terrorism and the Southern African Development Community in Africa; the Council of Europe, the European Union and the Organization for Security and Cooperation in Europe; the Pacific Islands Forum, in the	1
But despite these achievements, challenges to the government's authority and effective control over its national territory still need to be overcome.	0
56. Encourages Member States, when unfreezing the assets of a deceased individual or entity that has been reported or determined to have ceased to exist after delisting, to take into account the obligations set out in resolution 1373 (2001) and, in particular, to prevent unfrozen assets from being used for terrorist purposes.	0
The Security Council must now seek to reassure the courts that the sanctions regime established pursuant to resolution 1267 (1999) (the 1267 sanctions regime) is impartial and, with increasing support from Member States, reaffirm the original purpose of the regime: to rid the world of the threat of terrorism posed by Al-Qaida, the Taliban and their listed associates.	1
6. In the second phase of the registration process, conducted from June 2007 to December 2007, United Nations teams verified the age and date of recruitment of all individuals at the cantonment sites.	1
In late September, UNMIL completed the renovation of Iriba prison, improving both detention conditions for prisoners and prison security.	1
Determining that the situation in the Democratic Republic of the Congo continues to constitute a threat to international peace and security in the region.	0
However, the Commission found no evidence that they were so widespread and systematic as to constitute a crime against humanity.	1
While the threat posed by al-Qaeda as a global terrorist organization has diminished, the threat of al-Qaeda affiliates and infectious ideas remains.	0
The prison provides better infrastructure and sanitation, medical support for inmates and staff, educational programs for inmates, and vocational training programs in areas such as masonry, sewing, carpentry, and brick-making.	1
Such assistance should be aimed at establishing a tripartite national authority that could assume responsibility for monitoring the implementation of any agreed rules and regulations established for the well-being of the more than one million people gathered in the Gulf and for the economic development of the three coastal States in order to facilitate international maritime trade.	1
38. Owing to the rainy season, mine action activities were largely disrupted until late September, when implementation of the mine risk education strategy began. The project is funded by the Australian Agency for International Development.	1
47. In addition to the marked increase in arms flows into Somalia, both sides are also very actively distributing arms and ammunition to their respective militias, equipping militiamen with individual combat equipment, securing and stockpiling food, medicine, fuel and other necessities for sustained fighting, organizing themselves into military-style structures, escalating militia recruitment and training and developing strategies and plans to militarily defeat the other side.	0
Mandate the establishment and localization of appropriate truth and reconciliation mechanisms (e.g., technical assistance, funding, reintegration of civilians into local communities).	1
In their comments, Council members expressed deep concern about recent developments, stressed the need to establish border security mechanisms, and called on both parties to take steps to normalize their relations.	0
Their number has since increased to 16 observers, in addition to their special adviser, and more observers and UN volunteers are currently being recruited.	1
KFOR and UNMIK police collaborated to manage security for major public events, address political violence, and provide special security services to threatened minority communities.	1
Law enforcement expertise will be centralized within a dedicated and independent task force.	1
From the standpoint of international criminal law, these violations of international humanitarian law undoubtedly constitute large-scale war crimes.	0
Meanwhile, the United Nations Development Program (UNDP) is implementing a short-term reintegration program targeting 5,200 ex-combatants and their resettled communities.	1
Requests the Secretary-General to provide Member States with guidelines and training materials on the protection, rights and special needs of women, as well as on the importance of including women in all peacekeeping and peacebuilding measures, invites Member States to include these elements and HIV/AIDS awareness training in their national predeployment training programs for civilian military and police personnel; and also requests the Secretary-General to ensure that civilian personnel serving in peacekeeping operations receive similar training.	0
(b) Enhancing the facilitation of technical assistance aimed at increasing the counter-terrorism capacity of Member States and ensuring that its provisions are adapted to the needs of countries.	1
(b) Monitoring and reporting on the human rights situation, in cooperation with the Office of the United Nations High Commissioner for Human Rights, including on the situation of returned refugees and displaced persons.	1
As outlined above, this approach benefits from its growing understanding of the ongoing challenges of counter-terrorism, gained from its active dialogue with States, including within the framework of country assessment visits. The Executive Directorate continues to make specific referrals for technical assistance to address specific needs in the States it has visited. It does so on a targeted basis, targeting donors who have been deemed responsive, either because they are involved in ongoing programs in a specific State or because they have a keen interest and strong capacity in the relevant technical area.	1
161. Moreover, in 1995, the Appeals Chamber of the International Criminal Tribunal for the Former Yugoslavia, in its judgment in the TadiÄ case (interlocutory appeal), held that the main body of international humanitarian law also applies to internal conflicts as a matter of customary law and, moreover, that serious violations of these rules constitute war crimes.	1
:: :: Play a full role in regional seminars and activities that contribute to raising awareness and promoting the implementation of resolution 1540 (2004) and increase efforts to raise the awareness of parliamentarians and other high-level decision makers	0
The Council emphasizes the importance and urgency of re-establishing justice and the rule of law in post-conflict societies, not only to overcome past injustices, but also to promote national reconciliation and help prevent future conflicts.	0
On July 26, the Council issued a statement to the press condemning the terrorist attack on the United Nations Interim Force in Lebanon, in which six United Nations peacekeepers from France were injured. Thematic and other matters	0
Another State held an international seminar in 2009 on enhancing counter-terrorism cooperation and dialogue among government agencies, the media and civil society.	0
In May 2000, Turabi led a split from the National Congress that resulted in the creation of a new party called the Popular Congress.	1
After visiting Angola and the Democratic Republic of Congo, Margot WallstrÃ¶m, my Special Representative on Sexual Violence in Conflict, issued a statement on March 16 calling on both countries to investigate allegations of abuses of sexual violence that occurred in the context of expulsions and take concrete action to prevent such crimes.	0
2. Directs the sanctions committees established by the Security Council, including those established pursuant to resolutions 1718 (2006), 1636 (2005), 1591 (2005), 1572 (2004), 1533 (2004), 1521 (2005), 1518 (2003), 1267 (1999), 1132 (1997), 918 (1994) and 751 (1992) by revising its guidelines accordingly.	0
The Committee will continue to focus on promoting consensus in the international community on the importance of combating terrorism; taking practical measures aimed at increasing the capacity of States to combat terrorism; helping to identify and address the problems faced by States in implementing Council resolution 1373 (2001); and contributing to the process of increasing the number of States parties to the relevant international counter-terrorism conventions and protocols.	0
Kinshasa and other areas in the west of the country have seen relatively low threat levels, although crime rates remain a concern.	0
51. Three States have developed effective legal frameworks to ensure mutual legal assistance and extradition, as well as adequate mechanisms for the prompt and effective exchange of information with other States.	1
(a) Ensure that customs officers have the necessary operational measures and resources to be able to detect and prevent attempts to transfer currency, negotiable instruments, bearer payments and arms smuggling.	1
While some have been slow to respond, more and more people are eager to participate in the Committee's work, whether by submitting names or promoting views on identifying new areas where Security Council sanctions or other actions can help stem the flow of recruits and reduce the likelihood of further attacks by terrorists associated with Al-Qaida and the Taliban.	1
2. Decides that all States shall take the following measures with respect to Usama bin Laden, members of the Al-Qaida organization, the Taliban and other individuals, groups, undertakings and entities associated with them, as reflected in the list established pursuant to resolution 1267 (1999) and resolution 1333 (2000), to be regularly updated by the Committee established pursuant to resolution 1267 (1999), hereinafter referred to as âthe Committeeâ:	1
I urge the parties to the Comprehensive Peace Agreement and the international community to cooperate fully with the independent panel I have established at the request of the parties.	1
When the weapons collection began, six additional UN vehicles arrived carrying UN police officers, including Mr. Malik.	1
The addition of these names also demonstrates the Committee's continued attention to the threat to international peace and security posed by the Taliban.	0
56. The UNOCI Policy Group on Sexual Exploitation and Abuse finalizes the UNOCI code of conduct on sexual exploitation and abuse and participates in the country network on sexual exploitation and abuse.	1
In conclusion, I would like to make a number of recommendations for any fact-finding mechanism that is established:	0
According to a report by an ad hoc committee set up to assess losses and damage during the popular uprising, some 29 people were killed and 625 injured in the protests.	0
In other words, the fight against terrorism should be a joint, comprehensive and long-term effort.	1
463. In accordance with National Assembly Resolution 38 of December 2003, a Parliamentary Committee for the Promotion of Peace, Security and Development in the Darfur States was established, with a membership of approximately 59 persons.	1
States have developed regional mechanisms to ensure consistent legal and institutional capacity-building in the areas of financial system oversight, law enforcement, border control, cooperation, attention to human rights, and non-duplication of activities.	1
At around 17:00 on the same day, witnesses from Anka village saw between 300 and 400 Janjaweed on foot, and another 100 Janjaweed on camels and horseback, advancing towards Anka village from the direction of Bari village.	0
Sometimes, in order to camouflage these realities, they dress up in military garb to send the false message that it is the official armed forces that are practicing this violence.	0
Arrangements are being considered for UNDP and UNHCR to establish and manage a successor trust fund for DIS, if desired by the Government and potential donors, until the necessary national structures and capacities are firmly in place.	1
However, terrorism will still have its supporters, especially in places where overt political protests don't work, and although al-Qaeda will never gain widespread acceptance, the attacks will continue.	0
That night, an eastern police officer broadcast a statement on the radio blaming General Commander Martins and his deputy Babu for the death of the QRU officer.	0
10. Emphasizes the urgent need for the full and immediate implementation of this resolution with respect to foreign terrorist fighters, stresses the particular and urgent need for the implementation of this resolution with respect to foreign terrorist fighters associated with ISIL, ANF and other cells, affiliates, splinter groups or derivatives of AlQaida designated by the Committee, and expresses its readiness to consider listing, under resolution 2161 (2014), individuals associated with AlQaida who commit the acts specified in paragraph 6 above.	1
(n) Coordinate and cooperate with national counter-terrorism focal points or similar focal points in the country visited, as appropriate.	1
17. For the purposes of task four, the Commission considered it necessary to conduct a preliminary assessment to determine the extent to which the Sudanese criminal justice system was able and willing to prosecute and bring to justice those responsible for international crimes committed in Darfur, and then to consider the various international mechanisms available.	1
âThe Security Council notes the detrimental impact of the proliferation of weapons, particularly small arms, on the security of civilians, including refugees and other vulnerable groups.	0
Law enforcement agencies are well organized and have established special counter-terrorism agencies, committees, and units.	1
It is important to formally prosecute cases of domestic violence and sexual assault in accordance with the new penal code.	0
Our analysis and research on the size and shape of the crater caused by the explosion does not give a clear indication of whether the explosion occurred above or below the surface of the earth.	1
As outlined above, there are repeated and credible reports showing that these raids increased dramatically on the night of March 23, and then even more dramatically during the nights that followed.	0
