ar_en_DEEPL	MatCoop
While there is justifiable concern about weakening sanctions or appearing 'soft' on terrorism, improving de-listing procedures will strengthen sanctions while making them fairer.	0
Welcoming and expressing support for the steps taken to conclude nuclear-weapon-free zone treaties, and reaffirming its conviction that the establishment of internationally recognized nuclear-weapon-free zones on the basis of arrangements freely arrived at among the States of the region concerned on a voluntary basis among the States of the region concerned, in accordance with the guidelines established by the United Nations Disarmament Commission in 1999, is supportive of global and regional peace and security, strengthens the non-proliferation regime, and contributes to the realization of nuclear disarmament objectives.	0
The pattern of destruction indicates that what was detonated was a charge of high explosives.	1
At the conclusion of the meeting, the Committee adopted a forward-looking outcome document in which it urged all Member States to ensure zero tolerance for terrorism and to take urgent action to prevent and combat terrorism in all its forms and manifestations through the full and effective implementation of the said resolution.	1
(d) Prevent those who finance, plan, facilitate or commit terrorist acts from using their territories for such purposes against other States or their citizens.	0
On an exceptional basis, Executive Directors discuss issues related to the situation of women in various conflict-affected areas, including gender-based violence and sexual exploitation and abuse.	1
Taking note of the request of the Government of Afghanistan to the Security Council to support national reconciliation, including by removing from the United Nations sanctions lists those Afghans who enter into reconciliation and who therefore cease to participate in or support activities that threaten the peace, stability and security of Afghanistan.	1
Since its inception in January 2003, the Kimberley Process has aimed to stop the trade in conflict diamonds by ensuring that all rough diamonds traded between its participants (42 states and the European Community) are accompanied by a valid Kimberley Process certificate.	0
Encourage and support accurate management of conflict-related information	1
Urges Member States to ensure increased representation of women at all levels of decision-making in national, regional and international institutions and mechanisms for conflict prevention, management and resolution.	0
154. Although the Commission received information from a source that one of Hariri's trusted associates had tampered with the jammers prior to the explosion, the Commission was unable to substantiate this information.	1
The team investigated the supply of these vehicles to northern CÃ´te d'Ivoire, but was hampered by not being able to examine the Forces nouvelles vehicles up close, but the team did take photographs of a number of these vehicles that were part of a military convoy in BouakÃ©.	1
Many of the reports relate to the abduction of women.	0
:: Take measures to ensure the protection of and respect for the human rights of women and girls, especially as they relate to the Constitution, the electoral system, the police and the judiciary Take measures to ensure that the human rights of women and girls are protected and respected, especially in relation to the constitution, the electoral system, the police and the judiciary.	1
C. Cooperation with the Counter-Terrorism Committee and the Committee established pursuant to resolution 1540 (2004)	0
The Security Council adopted resolution 1894 (2009) on the protection of civilians in armed conflict, in which it called for the prioritization of mandated protection of civilians activities in resolutions on the allocation of resources and capacities and requested the development of a concept of operations, comprehensive mission planning and training on the protection of civilians.	0
In Wadi Hajam, they stole weapons from the police.	0
57. The Mission should continue to prioritize its work in monitoring and reporting on violations of international humanitarian and human rights law, in particular killings, sexual violence and grave violations against children, while at the same time supporting the Government in its efforts to address the consequences of past widespread violations through transitional justice mechanisms and strengthening efforts to combat impunity.	1
The Office for Disarmament Affairs has undertaken outreach efforts to potential donors in support of the regional seminars and workshops organized by the Office.	1
Despite these efforts, security in Mogadishu remains a concern due to the presence of several militia factions as well as militias acting on their own behalf or linked to businessmen or sharia courts.	0
He rejected the arrest of Ali Kushayb and Ahmad Harun.	0
On November 29, 2014, regime warplanes dropped two barrel bombs on Wahid al-Yousef School in Kafr Sajna village in Idlib, completely destroying the school. Places of worship	0
The establishment of the Joint Mission Analysis Cell has significantly increased the Mission's ability to analyze and share information throughout the Mission. However, the Mission continued to lack access to reliable tactical information.	1
The commission's forensic experts were able to verify that some members of the military forces were buried in the trenches surrounding the military camp, while the civilians were all buried in multiple graves in the town's cemeteries.	0
As the situation in Beni clearly demonstrates, efforts to deactivate dispersed armed groups supported by local criminal networks and FARDC elements take time to materialize into tangible results.	1
While there are reports of armed groups along the border between Western Bahr el Ghazal State and South Darfur, UNMISS was unable to assess these areas due to the lack of security guarantees from the SPLA.	0
According to reports, the UN arms embargo continues to be violated, and arms flows into the country have increased.	0
According to many accounts, this support for the parallel forces comes from within the presidential palace.	1
Nothing is more urgent in Sierra Leone than maintaining peace, security and stability in the country.	0
The trial is ongoing in the case of the murder of human rights activist Floribert Chebeya Bizer and his driver, Fidel Bazana, on June 2, 2010.	1
52. The state has also used deliberate starvation as a means of control and punishment in detention facilities.	0
Such a mechanism is necessary to fully investigate the fate of the missing.	1
However, the influx of migrants and refugees throughout the region from conflict zones in the Middle East and Africa continues to challenge immigration authorities.	0
4. The mission will emphasize that lasting peace, security and stability must be achieved for all countries in the region.	0
By committing itself to interacting and sharing information with other members of the expanded membership as part of its core responsibilities, the Council can hope to improve entrenched attitudes towards it on the part of the general membership.	1
110. Special attention should also be given to providing specialized training for investigators, prosecutors and judges, in areas such as combating the use of the Internet for terrorist purposes; providing support and assistance to victims of terrorist acts; combating chemical, biological, radiological and nuclear terrorism; combating transport-related terrorist crimes; and combating the financing of terrorism.	1
The Operation's police component also provides technical support and advice to the Integrated Command Center on security sector reform.	1
They welcomed the statement by the President of the Security Council of July 14, 2005, and expressed support for the initiative of my Special Representative, but also took the opportunity to express their concern that President Yusuf and Prime Minister Gedi might resort to armed confrontation with them.	0
States in the subregion are aware of their vulnerabilities to arms trafficking and have put in place the necessary legislative frameworks to criminalize illicit trafficking and control the production, sale, and transfer of arms and explosives.	1
Encourage United Nations peacekeeping and other relevant missions authorized by the Security Council, as appropriate and on a case-by-case basis, to prevent the illegal seizure and confiscation of land and property belonging to refugees and internally displaced persons, and to ensure the protection of returning refugees and internally displaced persons.	1
Mali and Niger are members of the newly established sub-regional Joint Intelligence Center in Tamanrasset, Algeria.	1
4. The recent high-level exchange of visits between Iraq and Kuwait has contributed to the creation of an atmosphere conducive to the Coordinator's contacts with representatives of Iraq and Kuwait, as well as with other members of the Tripartite Commission and its Technical Subcommittee, which remains the main body on the issue of persons unaccounted for in the 1990-1991 Gulf War.	1
(q) The prohibition of ill-treatment of enemy combatants outside combat and the obligation to treat detained enemy combatants humanely.	0
Condemns the continued illicit flow of arms into and out of [the affected State] in violation of the resolutions [providing for sanctions], and declares its determination to continue to monitor directly the implementation of the arms embargo and other measures established by its resolutions concerning [the affected State].	0
Improved relations between Chad and Sudan, and the vigilance of the joint national and border security forces, were also cited as important contributing factors.	1
The Council further called on Croatia and the Federal Republic of Yugoslavia to cooperate fully with the Mission and to ensure the safety and full and unrestricted freedom of movement of the observers.	1
Guidance materials are available to assist in the implementation of effective practices. Of note in this regard are the FATF paper on best practices in detecting and preventing the illicit cross-border movement of cash, negotiable instruments and bearer payments and the World Customs Organization guidelines on the enforcement of measures to combat money-laundering and the financing of terrorism.	1
However, detection and interdiction mechanisms are often not applied at the border due to insufficient application of risk indicators and targeting criteria; lack of information sharing and cooperation between customs, law enforcement, immigration, and financial intelligence units; and lack of dedicated human and material resources.	0
Furthermore, the Group of Experts on the Democratic Republic of the Congo recommended that the Security Council Committee established pursuant to resolution 1533 (2004) immediately inform the Group and the United Nations Organization Mission in the Democratic Republic of the Congo (MONUC) of notifications received from States supplying arms to the Democratic Republic of the Congo under exceptions to the arms embargo (S/2008/43), and that the Government of the Democratic Republic of the Congo inform MONUC of such arms shipments.	1
In addition, Israeli air violations of the Blue Line have continued on a regular basis, in direct violation of resolution 1701 (2006).	0
The initial investigation showed a general atmosphere in which everyone claimed to have no idea that something was going on around Hariri that would threaten his life.	1
13. The members of the Commission decided that in order to ârecommend measures to ensure accountability for the crimes and serious human rights violations allegedly committed during the above-mentioned period, bearing in mind that the Government of Timor-Leste considers that the domestic judicial system, involving a pool of international judges, prosecutors and defense lawyers, should be the main framework for accountability for these alleged crimes and violationsâ, they had to make a preliminary assessment of the existing domestic judicial system in Timor-Leste.	0
This finding of Iraq's state responsibility, as noted below, is based on its violation of the jus ad bellum (prevention of the threat or use of force in Article 2(4) of the Charter), rather than the breaches of the law of war (violations of international humanitarian law), which are the main focus of the Eritrea-Ethiopia Claims Commission's decisions.	0
In addition, members of both rebel movements came mainly from local village defense groups and specific tribes, and were formed in response to increasing attacks from other tribes.	0
The MDC candidate has little or no access to the media in Zimbabwe; he is barred from campaigning freely; and campaign buses and cars have reportedly been seized by the state, allegedly due to illegal registration.	0
I encourage the Government of Iraq to expedite further practical steps towards fulfilling its obligations under paragraph 14 of Security Council resolution 1284 (1999).	0
According to Afghan officials, the annual number of deaths caused by insurgent activity in 2010 exceeded the previous year by 50 percent, and civilian casualties rose by a third.	0
However, I regret the cancellation of the seminar in Madeira, Portugal, and urge the parties to continue to explore ways to expand the CBM program.	0
The Mission's police strength began to be gradually reduced in April and was reduced in May, for a total of 22 officers.	1
States must make their legislation and guidance flexible and robust enough to cover emerging threats and still fulfill their preventive role.	1
7. KFOR continues operations to prevent ethnic violence, protect heritage sites and remain vigilant to deter potential threats against international organizations and military bases.	1
44. The Committee welcomes the Executive Directorate's continued close cooperation with the experts of the Security Council Committee established pursuant to resolution 1540 (2004) and its Committee pursuant to resolutions 1267 (1999) and 1989 (2011), including through regular information-sharing, the exchange of mission reports and the preparation of joint documents and statements by the Chairs of the Committees to the Council.	1
4. While both the Comprehensive Peace Agreement and the Arms and Armies Management Monitoring Agreement contain provisions for the disbandment of militias associated with the Maoist army, neither contains detailed plans in this regard.	1
However, in 2007, after the arrest warrants for Harun and Kushayb were issued, President al-Bashir publicly refused to execute them, defying the authority of the Security Council and saying that Harun had done what he was ordered to do.	0
It refers in particular to the obligation to distinguish between the civilian population and combatants, the prohibition of indiscriminate attacks and attacks against civilians and civilian objects, as well as the prohibition of the use of chemical weapons and the use of weapons, projectiles, materials and methods of warfare that by their nature cause superfluous injury or unnecessary suffering.	1
Specific operations are carried out to collect weapons and ammunition voluntarily surrendered under the terms of the amnesty, or, if necessary, to collect weapons and ammunition in dedicated operations.	1
In order to achieve lasting regional peace, all destructive forces must be comprehensively dealt with and forcibly disarmed.	1
The Council can play an important role in ensuring that reparations programs are established to meet the needs of victims.	1
The resolution outlined a number of measures that member states are required to develop and implement, and established the Counter-Terrorism Committee (CTC) to monitor the implementation of these measures.	1
The National Commission also found evidence that the armed forces bombed some of the areas where some members of the opposition were seeking refuge. Some civilians were killed as a result.	0
Five of the countries have adequate measures in place to suppress terrorist recruitment, while four do not.	1
The decision to expel humanitarian workers, silence others with threats of expulsion, or attempts to restrict UNAMID's freedom of movement are part of this policy of limiting the international community's ability to monitor.	0
I have the honour to transmit herewith the report of the Security Council Committee established pursuant to resolution 1267 (1999) concerning Al-Qaida and the Taliban and associated individuals and entities containing the Committee's position on the recommendations contained in the sixth report of the Analytical Support and Sanctions Monitoring Team (S/2007/132, enclosure) (see annex).	1
One country cited a wide-ranging counter-radicalization plan, adopted in 2006, that aims to combat radicalization while also protecting democratic values.	0
The Ministry of Justice has established a specialized cell on the redeployment of justice and prison authorities with technical assistance from UNOCI to facilitate the redeployment of police, justice and prison authorities.	1
To help ensure the financial viability and sustainability of the local police, the Mission has made progress in developing local capacity on payroll, budget planning for organizational units, revision of premises maintenance costs, rationalizing the use of police equipment, inventory control and payroll, and general budget implementation and management.	1
Despite this, Russian military forces are still known as peacekeepers or âblue helmets,â as the overall conflict resolution process in the region takes the form of a UN-led peace process.	1
6. The Committee is also of the view that if it is confirmed that an individual is deceased, that the individual does not have any assets and that none of the beneficiaries of the assets have been listed, the Committee should proceed with de-listing (para. 19).	1
4. Urges CTED to continue to strengthen its role in facilitating technical assistance in the implementation of resolution 1373 (2001) with a view to increasing the capabilities of Member States to combat terrorism by addressing their needs in this area.	1
102. The Commission was informed that when the rebellion, initiated by two rebel movements, broke out in Darfur in early 2003, the Government asked a number of Arab tribes to help it fight.	0
During the meeting, both parties endorsed, in principle, UNHCR's approach to the return of refugees and IDPs and the activities it plans to undertake over the next two years.	0
140. During some of its visits, particularly to some of the least developed States, the Team found that national agencies working in the field of counter-terrorism are so underfunded, particularly in the area of border security, that even relatively high-ranking officials do not have access to computers and other relevant technology, and others have insufficient or no staff at all to carry out essential tasks.	1
132. While the Committee and INTERPOL decide how best to proceed, the Team hopes that the INTERPOL database will provide additional information on the identity of individuals on the Consolidated List.	1
Belarus, the Russian Federation and Ukraine have fully operational financial intelligence units. In 2010, Belarus and Ukraine adopted amendments to anti-money-laundering and counter-terrorist financing laws on customer identification, customer due diligence, record-keeping, beneficial owner verification and suspicious transactions, and also extended control standards to the transfer of funds through the State postal system.	1
This approach addresses human rights issues that typically arise at various stages of the criminal justice process in terrorism cases.	1
The Commission's conclusions in its report have serious implications for the accountability of government officials, and the Security Council should carefully consider its recommendations when deciding what approach to take in order to finally put an end to abuses and impunity in Darfur.	1
The Commission was informed that an administrative investigation is being conducted by a committee established by the governor of South Darfur State in view of the gravity of the accusation and its consequences, which necessitates expediting the required measures.	1
24. Urges the International Working Group, which will receive periodic reports from the Mediation Group and the Sanctions Committee established by resolution 1572 (2004) of 15 November 2004, to assess, monitor and closely follow progress on the issues mentioned in paragraphs 14 to 18 above.	1
Southern Africa's natural resources, transnational crime, and the availability of small arms in the context of past conflicts can make the region a magnet for money launderers, international criminal organizations, drug traffickers, and terrorist groups.	0
Seven states have some measures in place to monitor, regulate and control the production, sale and transfer of weapons and explosives.	1
Regarding the human rights situation in the Democratic Republic of the Congo, he emphasized the importance of justice, respect, accountability, good governance and respect for human rights to address the root causes of the conflict, and said that the Democratic Republic of the Congo had made some progress on those issues in recent years.	0
The method of attack (placing a toxic bacterial agent in letters sent via the Federal Postal Service) was largely effective in terms of publicity, but a large-scale attack targeting as many victims as possible (e.g. spreading anthrax via aerosols) requires a much higher degree of technology.	0
In some cases where the Committee concludes that the available information is insufficient to make a decision as to whether a listing remains appropriate, it requests the Team to seek further information. This is particularly true in cases where an individual is believed to be deceased but there is no death certificate or equivalent official document to prove it.	0
An advance group of this battalion, and a special forces company, have already been deployed to Yamoussoukro and Abidjan.	1
He also stated that the Verification Mechanism canceled several missions due to resistance from South Sudanese forces.	0
During the reporting period, the composition of the joint monitoring and verification team in Gao was adjusted to include all armed groups that are members of the Coordination Council and the Preliminary Plan Coalition, as well as representatives from Algeria, Chad, Mauritania and Niger. From November 19 to 22, the Gao team conducted a fact-finding mission to Didi on both sides of the Niger River.	1
Recent developments in several countries in the region have been accompanied by changes in security structures.	1
- To the extent possible, compile, assess, monitor, report and make recommendations on the implementation of the measures; conduct case studies, as appropriate; and conduct in-depth consideration of any other relevant issues as directed by the Committee.	1
Condemning also in the strongest terms incitement to terrorist acts and deploring attempts to justify or glorify (excuse) terrorist acts that may incite further terrorist acts.	0
In most cases, through vigilance, situational awareness and decisive response in accordance with best management practices to protect against piracy from Somalia, the ships succeeded in preventing the attackers from boarding the ship.	1
â1. It is support provided to the elected legitimate government. It is internationally supported and at its request. â2. The aim of this assistance is to strengthen the capabilities of the police and security forces so that the President can move to the capital, Mogadishu, to carry out his official duties, which is only possible if the armed gangs are disarmed in favor of the legitimate government. â3 - Disarming these armed gangs and taking control of the situation in the hands of the legitimate authority is one of the most important moves to fight the armed terrorist hotbeds lurking in Somalia, and therefore this matter is consistent with the policy of all countries of the world in the fight against terrorism to prevent the emergence of another âTalibanâ in Somalia.	1
Building Trust and Stability by Strengthening Truth and Reconciliation Mechanisms	1
17. MINURSO continues to enjoy good relations with both the Royal Moroccan Army and the armed forces of the Frente Polisario.	0
âThe Security Council expresses its concern about the threat posed by unsecured weapons and ammunition in Libya and their proliferation, which pose a threat to stability, including through the risk of transfer to terrorist and extremist groups, and calls on the Libyan government to take concrete measures to tighten its control over stockpiles of weapons and ammunition in Libya by ensuring the proper management, safe storage, and effective disposal of weapons and related materiel where appropriate, as well as by strengthening border security and ammunition in Libya, by ensuring the proper management, safe storage and, where appropriate, effective disposal of weapons and related materiel, as well as by enhancing border security, and urges neighboring States to cooperate in this regard with the Libyan authorities in their efforts to ensure the security of their borders.	0
I am deeply concerned about the recent escalation between Gaza and Israel.	0
(a) A monitoring group in New York consisting of up to five experts, including the Chairman, to monitor the implementation of all measures imposed by resolutions 1267 (1999) and 1333 (2000), in all fields, including those related to the arms embargo, counter-terrorism and related legislation, money-laundering, financial transactions and drug trafficking, given the link between arms purchases and the financing of terrorism.	1
