ar_en_DEEP	MatCoop
However, the government, as the public authority responsible for policy making, also bears responsibility for dealing with problems of critical importance that arise within or between institutions.	1
13 - From 13 to 17 September, WFP, in cooperation with UNHCR, conducted a mid-term review of its food programme in the Tindouf camps, in which the Government of the United States and the European Commission Humanitarian Aid Office participated as observers.	1
There were reports that during attacks, members of the Janjaweed and government forces routinely raped, burned, beat and stripped women, and verbally abused and humiliated civilians.	0
It is equally important that the Mission's work with United Nations and other humanitarian actors does not undermine the independence and impartiality of these actors, as well as their perceived image.	1
Despite these challenges, we cannot fail to acknowledge that approximately 50 percent of the Afghan people live in areas where responsibility for security has been transferred to the Afghan security forces.	0
Requesting States and regional and subregional organizations to take measures that would restrict and reduce the illicit trade in small arms and light weapons, such as voluntary collection and destruction; Effective management of its inventories; Imposing arms embargoes; imposing sanctions; And take appropriate legal measures against corporate actors, individuals and entities involved in such activities.	0
(h) Continue to strengthen efforts to raise awareness among parliamentarians and other high-level decision-makers;	0
First, it should be understood that terrorism is a crime that cannot be justified under any circumstances, but it is also a manifestation of grievance that is embodied in an inhuman, hateful and disgusting way.	0
A system will be established to ensure that victims of sexual exploitation and abuse are referred on a case-by-case basis to a non-governmental organization that will provide the necessary support.	1
Regional and bilateral mechanisms for law enforcement cooperation have been put in place, such as early warning mechanisms and intelligence cooperation.	1
For example, in 2009, Tunisia amended Law No. 2003-75 to criminalize incitement to commit terrorist acts, thus separating âincitement to hatredâ and âreligious fanaticismâ from terrorist crimes.	1
(a) Continue to remind Member States of their obligation to extradite or prosecute criminals in accordance with applicable international counter-terrorism instruments to which they are party and to remind States of their obligation to ensure that allegations of political motives are not treated as grounds for rejecting requests for the extradition of suspected terrorists;	0
Despite the progress made by the Government in accordance with the action plan, specifically in deploying police forces, it has not implemented its commitment not to enter areas under the control of armed movements.	0
(c) Strengthening programs for judicial oversight of police activities and encouraging continued dialogue with international and regional mechanisms with the aim of ensuring compliance with international human rights obligations in the context of combating terrorism.	1
Consequently, observers have pointed out the need to train lawyers, judicial and law enforcement officials, and the importance of establishing credible guarantees to ensure freedom from pressure and acts of intimidation that may be exercised by members of clans and ethnic sects.	1
Militant groups may refocus their efforts on their own countries or on other countries if Afghanistan becomes less attractive in terms of their goals.	0
All 18 countries that reported arms exports and imports have taken steps to regulate the production, sale and transfer of weapons and explosives.	1
The committee will allow youth to express their issues as it provides a forum that ensures policy consistency and promotes youth interest in government policies.	1
In practice, both committees reached their conclusions regarding real property rights for the purposes of restitution and not to provide compensation, in accordance with the political will that favors the return of those displaced by ethnic discrimination and sectarian fighting to their places of origin rather than adopting other durable solutions.	1
I welcome the efforts made by States to ensure that suspects receive a fair trial and humane and safe prison conditions, in line with international human rights standards.	1
He also stressed the risk of the conflict intensifying with the resumption of the migration season, elections, and the lack of dialogue.	0
Both resolutions stress the responsibility of states to investigate and prosecute persons suspected of committing genocide, crimes against humanity, war crimes or other serious violations of international humanitarian law.	1
Furthermore, the Group of Experts on the Democratic Republic of the Congo recommended that the Security Council Committee established pursuant to resolution 1533 (2004) immediately inform the Group and MONUC of notifications received from States supplying arms to the Democratic Republic of the Congo under exemptions to the arms embargo (S/2008/43), and that the Government of the Democratic Republic of the Congo inform MONUC of such arms shipments received.	1
7 - Requests the Secretary-General to appoint, in accordance with the rules and procedures of the United Nations, once this decision has been taken and after consultation with the Committee, not more than eight persons, including the coordinator of the Monitoring Group, who meet one or more qualifications in the following areas of expertise related to regulatory activities: Al-Qaeda and/or the Taliban including: counter-terrorism legislation and other relevant legislation; Terrorist financing and international financial transactions including banking expertise, alternative money transfer systems, charitable donations and the use of parcel couriers; strengthening borders, including port security, arms embargoes and export controls; drug trafficking;	0
Recent reports of former combatants dying from disease and starvation in Kutakuli camp underscore the need for the Government to provide the necessary resources to improve poor conditions in pre-disarmament, demobilization and reintegration sites, including by making available the pledged contribution of $10 million to the new plan.	1
Council members are concerned by reports of a Congolese armed forces attack on Equator Province, and have called for an immediate end to the fighting and for all parties to exercise restraint.	0
In response to this wave of violence, the Mission and the Haitian National Police organized several successful operations to rescue kidnappers, and a large number of suspected kidnappers were arrested.	1
241 - The Commission has found, based on its analysis of other sources and its own investigative work, that there were attacks on villages in Darfur by Sudanese Government armed forces and the Janjaweed throughout the conflict, with certain periods when such attacks reached their peak in intensity.	0
Three countries have introduced measures prohibiting the extradition of individuals who may be subjected to torture or persecution.	1
This symposium, which was held at the United Nations Headquarters in New York, allowed participating prosecutors to learn about common challenges in prosecuting those accused of committing terrorist acts and to share success stories in effectively bringing terrorists to justice while ensuring respect for the rule of law and human rights.	1
125 - Several factors have hampered the implementation of resolution 1373 (2001) in Central Asia, namely: proximity to the conflict in Afghanistan (where drug production fuels terrorist activities, which has contributed to the popularity of arms-for-drug swaps); illicit activities by cross-border cash holders (a potential source of terrorist financing); the circulation of surplus weapons (as a result of political and regional unrest); The remoteness of the borders and the lack of adequate protection, combined with the lack of human and material resources to ensure effective border control; The large number of migrant workers (which in turn leads to an increase in the use of informal transfer systems, which is also a potential source of terrorist financing).	0
Statements such as “The Palestinian people do not love their children” or “The Palestinian people are sending their children to death because of their hatred for Israel” are statements that smack of racism and reflect the kind of approach that should be rejected outright - and I am trying to do that now.	0
In addition, in 2007, the International Monetary Fund provided direct budget support in the amount of $60 million as part of its emergency post-conflict assistance, and will provide the same amount of support in 2008, including support for elections and social rehabilitation.	1
States cannot ignore this basic obligation without any consequences for their illegal behavior.	0
Nine of the States have some measures in place to prevent the smuggling of weapons and explosives, but it is not known how effectively these measures are implemented.	1
The Committee continued to consider three other exemption requests, the first relating to a proposal by a specialized United Nations agency to provide technical assistance to the Islamic Republic of Iran; The second relates to a request received by a State from the Islamic Republic of Iran Mine Action Center, in which it was proposed to cooperate with that State in the field of mine action; The third request relates to a request received by a member state from the Islamic Republic of Iran to train its armed forces.	1
:: Requesting the Mission, in cooperation with relevant entities in the United Nations country team, to establish and implement a country-level monitoring and reporting mechanism on serious violations committed against children, pursuant to resolution 1612 (2005).	0
We are encouraged that the Government of the Democratic Republic of the Congo has taken steps to act on the Lord's Resistance Army terrorists who entered its country from Sudan.	1
We are particularly disappointed by the very low number of returnees, which is the best indicator of the assessment of the situation in the region.	0
12. During the reporting period, the Government of Chad and UNHCR continued to implement programs to raise awareness among refugees and displaced persons about the civilian nature of camps. On September 12, the Integrated Security Detachment, in the Goz Amer refugee camp near Goz Beida (Dar Sila Province), arrested 11 people suspected of having carried out recruitment activities in the camp during the past few months, for the benefit of an armed group.	1
No single country can combat terrorism. The transnational nature of the terrorist threat requires cooperation and coordination with other countries.	0
Building the capabilities of states to prevent proliferation and to respond to attacks launched using weapons of mass destruction	1
Given that many financial intelligence units in South Asia have only recently been established, priority attention is given to developing their capabilities.	1
âIn the context of the expiration of the Missionâs mandate on 31 December 2010, the Security Council commends the Missionâs contribution to the security it has provided, without prejudice to the primary responsibility of the Government of Chad, for refugees, internally displaced persons and humanitarian workers in eastern Chad, and its efforts to strengthen the capacity of Chad's Integrated Security Detachment.	0
The purpose of the extraordinary meeting was to take the first step towards deepening regional awareness of the sanctions regime and to encourage enhanced cooperation between the Committee and the countries of the Sahel and Maghreb region.	1
The allegations indicate that during these three days, four of the girls were raped and the fifth was sexually assaulted.	0
Develop multi-sectoral strategies to address gender-based violence, involving parties from the health, safety/security, law/justice and mental health sectors; Organizing local training to strengthen national skills and capacities in addressing gender-based violence.	1
In this regard, I considered it important to complete the deployment of the additional force of the United Nations Mission in South Sudan.	1
Emphasizing that terrorism can only be overcome by adopting a sustained and comprehensive approach that involves the effective participation and cooperation of all States and international and regional organizations to prevent, weaken, isolate and incapacitate terrorist threats,	1
27 - On several occasions, I have expressed my firm conviction that the disarmament of Hezbollah and other militias can best be achieved through a Lebanese-led political process that would achieve the ultimate goal of having no weapons or armed forces in Lebanon except those of To the Lebanese state.	1
However, since this crime was not the act of individuals but rather the act of a highly organized group, it is very likely that fraud, corruption and money laundering were a motive for individuals to participate in it.	0
The Security Council reiterates its call on the parties to the armed conflict [mentioned in the relevant report of the Secretary-General] to prepare, without further delay, if they have not already done so, timely and specific plans of action to stop the recruitment and use of children in violation of applicable international law, and to address for all violations and acts of abuse committed against children, in close cooperation with the [Special Representative of the Secretary-General for Children and Armed Conflict], as well as with UNICEF and the United Nations country task forces on monitoring and reporting.	1
C. Support to people affected by conflict	1
(h) During the dialogue phase, the Ombudsman shall give due consideration to the views of States proposing names for inclusion on the List, as well as other Member States submitting relevant information, in particular Member States most affected by the actions or engagements that led to the original listing.	0
âThe Security Council notes the commitment of the Government of Chad, expressed in the letter sent to the President of the Security Council dated 7 September 2010 (S/2010/470), to assume full responsibility for the security and protection of the civilian population in eastern Chad, including refugees, internally displaced persons, returnees and local communities host, with particular emphasis on women and children, United Nations staff and assets and humanitarian workers, in accordance with its obligations under international humanitarian law, human rights law and refugee law.	1
The Syrian government also believes that the problem of the so-called displaced Syrians is largely fabricated and hopes that they will return to their homeland and not exploit their presence for political purposes. The noticeable improvement in the security situation has led to the return of large groups of them to their country and to resume their work from which terrorist groups prevented them.	0
Bin Laden needs to counter-balance Zarqawi's actions and demonstrate his continued global influence by organizing horrific attacks elsewhere, allowing him to return to the strategic path he set before he lost his Afghan base in 2001.	0
During this attack and the subsequent forced confinement of the population, many people were subjected to severe torture in order to extract information about the rebels, or as punishment or terror to the population.	0
All countries in this region are members of the Organization of American States, which provides regional mechanisms for cooperation at the policy and operational levels.	1
At the 5059th session of the Security Council, on 19 October 2004, on the occasion of the Councilâs consideration of the item entitled âThreats to international peace and security resulting from terrorist actsâ, the President of the Security Council made the following statement, on behalf of the Council:	0
While piracy off the coast of Somalia remains a critical challenge, we call on the international community not to lose sight of the fact that the solution to this problem must be achieved on land, not at sea. A comprehensive solution to the Somali conflict must address all the root causes of piracy and other challenges, including the exploitation of marine resources and the dumping of toxic waste.	0
The review process resulted in the inclusion of all individuals who, although not included exclusively on this basis, were identified primarily for their role in providing ideological justifications to recent recruits or the wider public for Al-Qaida-related violence. This is despite the fact that the penal measures themselves have little, if not no, impact on their main tool: the ability to communicate and persuade via the Internet.	0
Recalling its resolution 2133 (2014) and the publication by the Global Counter-Terrorism Forum of the âAlgeria Memorandum on Best Practices for the Prevention of Abductions of Persons for Ransom and Deprivation of their Profitâ by terrorists, and strongly condemning incidents of kidnappings of persons and hostage-taking committed by terrorist groups for any purpose , including for the purpose of raising funds or extracting political concessions, Expressing its determination to prevent kidnappings and hostage-taking committed by terrorist groups, and to ensure the safe release of hostages without paying ransom or making political concessions, in accordance with applicable international law, and calling upon All States should work to prevent terrorists from benefiting directly or indirectly from ransom payments or political concessions, and to ensure the safe release of hostages, and reaffirming the need for all States to cooperate closely during incidents of kidnapping and hostage-taking committed by terrorist groups ,	0
2 - Also decides that all States, in accordance with their national procedures, shall adopt and enforce appropriate effective laws prohibiting any non-State actor from making, acquiring, possessing, developing, transferring, transferring or using nuclear, chemical or biological weapons and their means of delivery, in particular For terrorist purposes, attempts to engage in any of the above-mentioned activities, or to participate as an accomplice in them, or to assist in carrying out or financing them, are also prohibited.	0
212. During the course of the investigation conducted by the Commission, it recognized the importance of the traditional justice system in Timor-Leste as well as the modified form of traditional justice administered through the civil reconciliation process undertaken by the Reception, Truth and Reconciliation Commission for âless seriousâ criminal offences.	1
(a) Encourage the adoption of international counter-terrorism instruments and enact legislation to fully implement international counter-terrorism instruments throughout the subregion;	0
42. At the request of Working Group II of the Contact Group on Piracy off the Coast of Somalia, and with the support of the Government of Italy, the United Nations Interregional Crime and Justice Research Institute organized two informal expert working group meetings in 2013 to formulate a set of guidelines, standards and practices Best practices regarding the use of armed security personnel contracted by private companies on board commercial ships, for use by private sector companies and interested governments.	0
This practice may be considered a form of enforced disappearance, and constitutes a violation of the obligations of armed groups under customary international humanitarian law.	0
:: Continue to develop initiatives aimed at prohibiting and preventing incitement, identifying best practices and exchanging information, bearing in mind the need to ensure that all relevant measures are consistent with their international legal obligations, including human rights obligations.	1
389. In conclusion, the Commission found that, according to the majority of incidents reported by other sources, most cases of looting were the work of the Janjawid, while a small number of them were the work of government forces.	0
Desiring to continue to assist Lebanon in searching for the truth and holding the perpetrators of this terrorist act accountable for their crime,	1
The Mission decentralized its communications functions to improve coordination locally, while preparatory work prior to the arrival of the Union Force facilitated the transition process.	1
155. The Group also held its second meeting in Geneva in May 2005 of the heads and deputy heads of intelligence and security services from six Arab countries, continuing its discussions on the threat posed by Al-Qaida and the possibility of taking additional measures to confront it for consideration by the Security Council.	0
134 - Seven of the eight Central Asian and Caucasian countries have ratified 12 international legal instruments in the field of combating terrorism, and Kazakhstan is currently considering joining six instruments.	1
Among the 57 civilians killed were five children (two of whom died during torture), and 51 rebel fighters.	0
According to these decisions, this body must demand that the United States government immediately sentence Luis Posada Carriles for committing acts of terrorism or extradite him to the Bolivarian Republic of Venezuela, whose judicial system has been pursuing him for years.	0
56 - All but one State has taken some steps to create a comprehensive counter-terrorism legal framework that includes terrorism-related crimes.	1
8. The Committee, in close cooperation with the Committee established under resolution 1267 (1999) and the Committee established under resolution 1540 (2004), and in line with its mandate, will pay particular attention to States that have delayed the provision of relevant information to them, and will discuss how to best address this issue Possible way.	1
8 - Emphasizes the importance of providing safe and unhindered access for humanitarian personnel providing assistance to civilians in armed conflict, and calls on all concerned parties, including neighboring States, to fully cooperate with the United Nations Humanitarian Coordinator and United Nations agencies in providing these means, and calls on States and the Secretary-General to inform him of information relating to the deliberate deprivation of such access in violation of international law and where such deprivation may constitute a threat to international peace and security, and in this regard expresses his readiness to consider such information and to take appropriate steps where necessary;	0
At least 90 countries are affected by improvised explosive devices, and Al-Qaeda and its affiliates exchange information and advice on how best to make and use them.	0
10. NATO provided additional forces to ensure a safe and secure environment for the National and Provincial Council elections scheduled for 18 September (see paragraph 15).	1
In order to help ensure the financial viability and sustainability of local police, the Mission has made progress in developing local capacity on payroll, planning budgets for organizational units, revising space maintenance costs, rationalizing the use of police equipment, asset control and payroll, and implementing and managing the overall budget. .	1
1 - If the offender has destroyed, damaged, moved, rendered irreparable or exhausted any assets subject to confiscation under paragraphs 1 and 2 of Article 70, or in any way prevented the confiscation of those assets, the court may confiscate funds equivalent to Its value is the value of those assets, and the court may estimate the value of the assets that can be confiscated.	0
Deeply concerned about the recurrence of acts of violence in many parts of the world against journalists, media personnel and associated individuals in armed conflicts, in particular deliberate attacks against them in violation of international humanitarian law,	0
The Deputy Foreign Minister of Afghanistan said that the year was full of achievements that constitute important milestones, but the achievements did not come without a price. He stressed that terrorism still represents a strong threat.	0
49. The Government also continued its efforts to provide food assistance to vulnerable and food-insecure segments of the population with support from the World Food Program through the Maternal and Child Nutrition Program of the Ministry of Health (47,000 beneficiaries) in 2010 until 30 June and the School Feeding Program of the Ministry of Health. Education (241,000 beneficiaries) and Food for Work program (600 beneficiaries) targeting communities in need of food. On May 27, a food production factory was opened for distribution through the Maternal and Child Nutrition Programme, with technical and administrative support from the World Food Programme.	1
In 2014, in response to the provisions of resolutions 2083 (2012) and 2161 (2014), and with a view to further strengthening the implementation by national authorities of Security Council sanctions regimes, the Division standardized the format of all United Nations Security Council sanctions lists and developed a unified sanctions list imposed by the Security Council, which includes names included in all sanctions lists imposed by the Security Council sanctions committees.	1
Uganda remains concerned about the humanitarian situation in Darfur.	0
