ar_en_DEEPL	MatCoop
11. During the reporting period, the entity armed forces conducted normal training activities, in compliance with the military-related provisions of the Dayton Peace Agreement.	1
The European Union is deeply concerned by the ongoing cycle of retaliatory violence in Israel and the occupied territories.	0
UNMIS continues to share urgent reports and other vital information with UNAMID regarding the Government of Sudan's flight restrictions in South Darfur and clashes between the Justice and Equality Movement and the Sudanese Armed Forces.	0
It is therefore not surprising that many Member States see the Internet as a key issue in combating the spread and threat of Al-Qaeda-related terrorism.	0
Sudan has also ratified ILO Convention No. 182 concerning the Prohibition and Immediate Action for the Elimination of the Worst Forms of Child Labor, which prohibits the forced or compulsory recruitment of children for use in armed conflict.	1
(d) To continue dialogue and information-sharing with designated focal points or coordinators on issues related to their contributions to the implementation of resolution 1540 (2004).	0
However, the crucial element of genocidal intent appears to be lacking, at least as far as the central government authorities are concerned.	0
51. I remain firmly committed to the implementation of resolution 1559 (2004) in order to bring peace and stability to the region, at a particularly difficult and challenging time.	1
Although the three countries are aware of the sanctions regime and are taking measures to improve its implementation, they have not yet fully realized that the regime can help strengthen their national and regional response to the threat.	1
6. Building on the comprehensive review of all entries on the List completed in 2010 pursuant to paragraph 25 of resolution 1822 (2008), the Committee has since implemented a large number of mechanisms to ensure that the List provides the most accurate picture possible of the threat posed by Al-Qaida and to ensure that each entry is periodically reviewed to determine whether it is warranted to remain on the List.	1
She confirmed that a Russian helicopter had been shot down and that a UN board of inquiry, which was in the country last week, would report back in early November.	0
We also agreed that the parties should re-establish the much-needed genuine dialogue and proceed without delay with the dismantling of militias, the disarmament, demobilization and reintegration of combatants and the holding of free, fair and credible elections.	0
::: States are invited to check the fingerprints contained in the confidential versions of the bulletins against their police database to see if they match the fingerprints contained in their system (sect. VI.C, para. 80).	1
Consequently, observers have noted the need to train lawyers and judicial and law enforcement personnel, and the importance of establishing credible safeguards to ensure freedom from pressure and intimidation by members of clans and ethnic communities.	1
Of the four countries the committee visited, two have yet to adopt some of the draft counterterrorism laws that have been in the pipeline for several years.	1
19. Strongly condemns all acts of sexual and other forms of violence committed against civilians in armed conflict, in particular against women and children, and undertakes to ensure that all peace support operations apply all feasible measures to prevent such violence and address its impact wherever it occurs.	0
Reiterates the importance of compliance with the relevant provisions of international humanitarian, human rights and refugee law and of appropriate training for personnel involved in peacemaking, peacekeeping and peacebuilding activities in that legal area, including child and gender-related provisions, as well as negotiation and communication skills, cultural awareness, civil-military coordination and sensitivity in the prevention of HIV/AIDS and other communicable diseases, and requests the Secretary-General to publish appropriate guidance and to ensure that United Nations personnel receive appropriate training.	0
::: Fact-finding mechanisms should be established early enough in a crisis to enable them to contribute to the prevention of further violations.	0
In practice, information sharing is hampered by a lack of institutional and operational capacity and language challenges.	1
Concerned by the absence of key armed movements from the negotiations so far, they urged continued engagement with the government and non-signatory movements to increase the inclusiveness of the peace process.	1
With financial support from OHCHR and the Embassy of Canada, UNMISS trained more than 20 human rights organizations on monitoring methods and partnered with a national NGO to facilitate the production and dissemination of awareness-raising materials to more than 30,000 individuals and civil society organizations.	1
Common standards and procedures are being developed in six key areas: code of conduct; training materials and strategies; standardized procedures for referral of complaints within an agency; community outreach; standardized procedures for implementing partners of United Nations agencies and the United Nations Organization Mission in the Democratic Republic of the Congo (MONUC) in compliance with the Secretary-General's bulletin (ST/SGB/2003/13) on special measures for protection from sexual exploitation and sexual abuse; and referral of complaints received by one agency regarding an incident involving a staff member of another agency.	1
1. Deplores and condemns in the strongest terms the terrorist acts and violent extremist ideology of ISIL and its continued gross, systematic and widespread violations of human rights and violations of international humanitarian law.	0
In the past, it was common for authorities to send entire families to political prison camps for political offenses committed by a relative (including ancestors up to the third generation) based on the principle of guilt by association.	0
Recalling the right to freedom of expression enshrined in article 19 of the Universal Declaration of Human Rights adopted by the General Assembly in 1948 (âthe Universal Declarationâ), and recalling also the right to freedom of expression enshrined in article 19 of the International Covenant on Civil and Political Rights adopted by the General Assembly in 1966 adopted by the General Assembly in 1966, and that any restrictions imposed in this regard must not exceed those prescribed by law and must be necessary for the purposes set forth in article 19, paragraph 3, of the International Covenant on Civil and Political Rights.	0
Prominent journalists have been detained for expressing their views on issues of human rights, the constitution and the rule of law.	0
âThe Security Council recognizes the need to prevent and suppress the financing of terrorism and terrorist organizations using the proceeds of organized crime, including through the illicit production of and trafficking in narcotic drugs and their precursor chemicals, and the importance of continued international cooperation to this end.	0
29. A second battalion will be deployed to the southern town of Kamina to: protect the airport runway; provide a secure environment for the electoral process within its area of operations; monitor Mayi-Mayi militias in the south and encourage them to participate in the integration or disarmament, demobilization and reintegration process; and support and mentor FARDC, particularly in Kamina.	1
The first is that the court was established taking into account crimes that are potentially a threat to peace and security.	1
âThe Security Council notes with concern that terrorism continues to pose a serious threat to international peace and security, the enjoyment of human rights, the social and economic development of States and undermines global stability and prosperity, and that this threat has become more widespread, with an increase in terrorist acts, including those motivated by intolerance and extremism, in different regions of the world, and reaffirms its determination to combat by all means, in accordance with the Charter of the United Nations and international law, including applicable international human rights law and international law, threats to international peace and security caused by terrorist acts	0
The two press conferences, especially the first press conference, as well as the interrogation of the first suspect and the arrest of former senior security officials as suggested by the commission, all had a catalyzing effect.	0
7. Requests the Executive Representative of the Secretary-General to facilitate and encourage dialogue among national and international stakeholders, particularly in the context of the upcoming elections, while continuing to support their efforts to maintain peace and stability.	0
In addition, the Council itself has set important precedents, including the establishment of commissions of inquiry on Bosnia, Rwanda, and Darfur, which paved the way for the International Tribunals for the former Yugoslavia and Rwanda in 1993 and 1994, respectively, and the referral of the situation in Darfur to the International Criminal Court in 2005.	1
20. Decides that an Office of the Ombudsperson shall assist the Committee in its consideration of de-listing requests and shall be established for an initial period of 18 months from the date of adoption of this resolution, and requests the Secretary-General, in close cooperation with the Committee, to appoint an eminent person of high moral character, impartiality and integrity, with high qualifications and experience in relevant fields, such as law, human rights, counter-terrorism and sanctions, to serve as Ombudsperson highly qualified and experienced in relevant fields, such as law, human rights, counter-terrorism and sanctions, to serve as Ombudsperson, with the mandate set out in Annex II to this resolution, and further decides that the Ombudsperson shall perform the said functions in an independent and impartial manner and shall refrain from seeking or receiving instructions from any government.	1
Often, only victims who are represented by lawyers receive a satisfactory amount of compensation.	1
91. The Monitoring Team is mandated to examine and report on the changing nature of the threat, including through dialogue with scientists and relevant academic bodies.	0
27. On 2 November, 16 of the 20 persons arrested during an operation by the Malian defence and security forces in Bolkissi (Mopti territory), an area controlled by HCUA, reported to MINUSMA that they had been severely beaten during interrogation.	0
The Deputy Foreign Minister of Afghanistan said that the year was full of achievements that constitute important milestones, but the achievements did not come without a price. He emphasized that terrorism remains a strong threat.	0
If that person is found guilty, they have a duty to punish them and provide victims with effective remedies and redress.	1
She and Mr. Abu Adass's father, Taysir, were illegally detained for almost 10 days.	0
For example, Uzbekistan has established internal control rules and penalties for entities that fail to report, and Uzbekistan and Turkmenistan have introduced strict customer verification and record-keeping procedures.	0
The commission found that the forced displacement of the civilian population was systematic and widespread, an act that constitutes a crime against humanity.	0
The concept of preparing baseline inventories by conducting a small arms survey in the early stages of project development is now taking hold and has proven to be effective in project development and evaluation.	1
4. Throughout its mandate, the Monitoring Group continued to keep the Security Council Committee established pursuant to resolution 751 (1992) informed of its activities by submitting biweekly progress reports through the United Nations Secretariat and through a midterm briefing at United Nations Headquarters in New York in July 2005.	0
36. The Council encourages the Burundian authorities to cooperate with the Special Representative of the Secretary-General to establish a mechanism to put an end to impunity and promote reconciliation.	1
86. Seven States have developed counter-terrorism strategies and established the necessary institutions to implement them.	1
Many states, together with bilateral and multilateral partners, have established some form of early warning arrangements to help predict and prevent terrorist attacks.	1
The gradual removal of the Green Line has been based on a comprehensive threat assessment; consultations with the Integrated Command Center; and an overall improvement in the security situation, in particular the assessment that the likelihood of military confrontation between the former belligerents is low.	0
Emphasizing the importance of building the capacity of the security forces of the [Government of ...], reaffirming in this regard the importance of restructuring, training, equipping and retaining [national] security forces, which is critical to the long-term stability and security of [the country concerned], and expressing its support ... [of] ongoing [international] capacity-building programs, and emphasizing the importance of further coordinated and sustained support from the international community, in a timely manner.	0
The Committee considers that all persons, including those accused of serious crimes, should of course be presumed innocent until proven guilty in a fair trial.	1
On March 15, 2005, clandestine unloadings at the fruit loading terminal of ships registered in Greece and Panama were carried out without declaration to customs and police authorities.	0
In this regard, the Kingdom of Morocco fulfilled all its obligations in a timely manner, notably by releasing the detained individuals, including Algerian military personnel, and by providing all the clarifications requested by the International Committee of the Red Cross (ICRC) regarding the allegations of disappearance.	1
The Committee is concerned that structural issues, including laws and policies that violate the right to adequate food and freedom from hunger, remain in place, which could lead to a resurgence of mass starvation.	0
5. As the Maoists prepared to move their forces to the cantonment sites, they embarked on a recruitment campaign that culminated in November 2006.	0
Those three States have implemented the Program of Action on Small Arms, but two other States have not reported on the status of their implementation of the Program and neither appears to have developed a national program to combat arms smuggling.	1
Habsade received financial and military support from Atto, Musa Sudi, Sheikh Yusuf Indohaadde, and others.	1
It is important to establish and maintain regular information-sharing and coordination between the Counter-Terrorism Committee and the Security Council Committee on Sanctions against the Taliban, Al-Qaida and associated individuals and organizations established pursuant to Security Council resolutions 1267 (1999), 1333 (2000) and 1390 (2002).	1
15. UPDF from Laforstier and Bangoka airports were to withdraw to Bwafasende in accordance with the Implementation Order, while RPA forces at Bangoka airport and the Lubutu-Bwafasende junction were to withdraw to Lubutu.	1
100. The Special Needs Voter Program was established to help special groups of voters, including those confined to their homes due to fear, hospitalized, mentally retarded, elderly and prison inmates, to register and vote simultaneously.	1
3. Calls upon all States to continue international efforts to promote dialogue and broaden understanding among civilizations in an effort to prevent the indiscriminate targeting of different religions and cultures, and to take all necessary and appropriate measures in accordance with their obligations under international law to counter incitement of terrorist acts motivated by extremism and intolerance and to prevent the subversion of educational, cultural and religious institutions by terrorists and their supporters.	0
In addition, the EU has a supranational regime aimed at ensuring that terrorist funds and assets are frozen within all of its member states.	1
621. Whether a TRC is appropriate for Sudan and the stage at which it should be established is a matter for the Sudanese people alone to decide through a genuinely participatory process.	1
Judge Mezher approved the proposal with the following conditions: The vehicles should be photographed at the site and should be marked and numbered: They should also be photographed during transportation and upon arrival at the Helou barracks, where they should be covered and guarded around the clock to prevent tampering with evidence.	0
This power struggle manifests itself in different forms and aims to attract different national forces within civil society and public opinion in order to gain additional popular support or influence.	1
Elsewhere, deaths occur in violent circumstances and the authorities are unable or unwilling to issue an official document to prove the death.	0
(x) To consult with relevant representatives of the private sector, in cooperation, as appropriate, with national authorities, with a view to promoting awareness of and compliance with the travel ban and the arms embargo.	0
Officers from the national security forces were trained (50 in AdrÃ© and 42 in AbÃ©chÃ©).	1
(c) Decided that the Executive Directorate should continue to operate as a special political mission under the policy guidance of the Committee for the period ending 31 December 2010, and further decided to conduct an interim review by 30 June 2009 and a comprehensive consideration of the work of the Executive Directorate before the expiration of its mandate.	1
36. The Committee continued to consider a media outreach strategy, based on a non-paper prepared by Committee experts. The purpose of the strategy is to systematically and efficiently leverage the resources of the United Nations and the Committee to reach a wider and specific audience, including through the development of specialized contact lists to communicate electronically important updates by the Committee.	1
Such precautions are set out in customary international law, as follows: A belligerent should (a) do everything feasible to verify that the objects to be attacked are not of a civilian character; (b) take all feasible precautions in the choice of means and methods of combat to avoid, or at least to minimize, incidental injury to civilians or civilian objects; (c) refrain from launching attacks that may be expected to cause incidental loss of civilian life, incidental injury to civilians, or incidental injury to civilian objects that would be excessive in relation to the specific direct military advantage anticipated; (d) give effective advance warning of attacks that may affect the civilian population, except in cases of attack, as provided for in Article 26 of the Hague Regulations of 1907, or as provided for in Article 57(2)(c) which reads 'unless circumstances so permit' i.e. when the belligerent considers a surprise attack to be indispensable.	1
Soldier Francisco Amaral of the Defense Forces appeared at the intersection of the Ministry of Justice; his uniform was stained with blood.	0
The Security Council notes that UN multidisciplinary assessment teams can, with the consent of the host states, provide assistance and support in separating combatants from civilians.	1
(d) Adopt a victim-centered and human rights-based approach to human trafficking, including by giving victims the right to reside in the country and have access to legal protection and basic services, such as medical treatment, education and employment, on the same basis as their fellow citizens.	0
Let's be frank: These reports from the press, human rights groups and civilians on the ground raise serious concerns about the nature and scope of the conflict.	0
35. Following the launch of the national stabilization and reconstruction programme in areas of armed conflict in eastern Democratic Republic of the Congo, the United Nations approved the International Security and Stabilization Support Strategy in 2008. The strategy provides the framework for stabilization projects in eastern Democratic Republic of the Congo.	1
5. The Executive Directorate will continue to enhance its cooperation with relevant United Nations bodies, including the Monitoring Team of the Security Council Committee established pursuant to resolution 1267 (1999) and the Panel of Experts of the Security Council Committee established pursuant to resolution 1540 (2004), as well as with various international, regional and subregional organizations, including in the course of the Committee's visits to Member States.	1
128. Another method favored by Al-Qaida is to recruit and deploy operatives who are unknown to any law enforcement or security agency, making it easier for them to travel with little difficulty and obtain work or study visas. As a more secure method, they claim the loss of any documents containing potentially incriminating visa stamps in order to obtain a new replacement for the lost document.	0
283. On the basis of the Commission's investigations, and based on the pattern of air attacks it has established, the Commission is of the view that the military forces bear responsibility for a very large number of indiscriminate air attacks that have claimed the lives of many civilians.	0
18. Reiterates that peacekeeping and special political missions, when mandated by the Council, can provide capacity-building assistance, upon request, to host country Governments to implement their obligations under existing global and regional instruments and address the illicit trade in small arms and light weapons, including through weapons collection and disarmament, demobilization and reintegration programmes, strengthening physical security and stockpile management practices, enhancing record-keeping and tracing capacities, developing national export and import control systems, improving border security and strengthening the capacity of judicial institutions, and so on.	1
25. Calls upon all States to manage responsibly the use of highly enriched uranium for civilian purposes and to minimize its use to the extent technically and economically feasible, including through the conversion of nuclear research reactors and radioisotope production processes to low-enriched uranium fuels and targets.	0
States should develop a clear, complete, and consistent legal framework that categorizes terrorist acts as serious criminal acts, punishes them according to their seriousness, establishes jurisdiction, and assists courts in bringing terrorists to justice.	1
They called for the UN to take firmer action on factors leading to terrorism in general, such as Islamophobia.	0
There have also been warnings of al-Qaeda cells in Zambia, and both South Africa and Zambia have extradited terrorist suspects in the past.	1
54. âLike-mindedâ States have suggested that the Committee change its decision-making procedures to allow for a majority vote, rather than consensus, when considering de-listing following the review period, which they propose to reduce to two years.	0
In November, the unit began construction work to create a unit within the new Timbuktu camp.	1
The renewed authorization followed the presentation by the Under-Secretary-General for Political Affairs of the annual report of the Secretary-General on the situation with respect to piracy and armed robbery at sea off the coast of Somalia (S/2014/740) on 22 October.	1
10. Decides that the travel ban imposed by paragraph 1 (b) shall not apply to individuals designated pursuant to paragraph 9 bis above, when the Committee determines, on a case-by-case basis, that such entry or transit is justified, further decides that any such exception approved by the Committee shall be granted only for the period required for any travel to that specific location or locations, and directs the Committee to decide on all such exception requests, as well as requests to modify or renew previously granted exceptions, or a request by a Member State to revoke previously granted exceptions, within ten days of receipt of such requests all such requests for exemptions, as well as requests to modify or renew previously granted exemptions, or a request by a Member State to revoke previously granted exemptions, within ten days of receipt of such requests; and emphasizes that, notwithstanding any exemption to the travel ban, listed individuals remain subject to the other measures set forth in paragraph 1 of this resolution.	1
C. Disbanding and disarming Lebanese and non-Lebanese militias	0
The Security Council urges all parties to any armed conflict, including non-state actors, to end such practices.	0
Just last month, in a statement dated May 27, 2011, Secretary-General Ban Ki-moon expressed his belief that âaid and goods destined for Gaza should be transported through legitimate crossings and existing channels,â and explained that these flotillas âcould be a source of violent conflict.â	0
96. The Monitoring Team examined the implementation of the arms embargo by reference to the methods used by Al-Qaida and the Taliban in their attacks.	1
84. Four States have signed a letter of intent committing to implement the SAFE Framework of Standards to Secure and Facilitate Global Trade to ensure that shipments are not used for terrorist purposes, three of which are at an advanced stage of implementation.	1
âWeapons of Mass Destruction and Non-Proliferation in the framework of best business practices,â followed by a training activity	0
