en	VerConf
162. The Dutch forensic team was assisted by many people in carrying out the crime scene investigation, e.g., forensic police officers from ISF, a team of British divers, a French expert on explosives, a forensic scientist from Northern Ireland, a German electrical engineer specialized in jamming devices, a team of Japanese crime scene investigators, a German car expert, a Dutch car expert and a number of Lebanese specialists.	0
On 4 March, he urged the issuance of arrest warrants against State officials, provoking popular outrage and undermining hopes for peace and stability.	1
First, while Sierra Leone is the most advanced member of the West Africa Coast Initiative, the slow pace of progress elsewhere hinders intelligence-sharing and early warning.	1
The Team has also raised awareness of the Al-Qaida sanctions in the commercial airline sector by working closely with the International Civil Aviation Organization (ICAO), the International Air Transport Association (IATA) and private industry.	0
"The Security Council stresses that any attempt at destabilization of Chad by force is unacceptable.	1
The Security Council and the Committee have, however, made many changes to their procedures over the years which improve transparency and recognize basic standards of fairness that might apply were their decisions judicial.	0
39. Trafficking victims subject to deportation orders continued to receive assistance through the institution building pillar's shelter programme.	0
We are also concerned about the situation faced by those who are participating in the reconstruction of the country.	1
It also places emphasis on prohibiting and blocking Internet sites that contain extremist materials and on the regulation of problems in this field.	0
This traditional discrimination under the songbun system was recently complicated by increasing marketization in the Democratic People's Republic of Korea and by the influence of money, including foreign currency, on people's ability to have greater access their economic, social and cultural rights.	0
49. Many challenges remain in combating impunity, particularly in view of the limited capacity of civilian and military judicial authorities to carry out independent and thorough investigations and to provide protection to victims and witnesses.	1
However, concerns persist in relation to the 2.3 million people who remain in crisis.	1
This limited the effectiveness of the initiative in providing comprehensive justice to victims.	1
The grade of damage of the metal fragments which were shown to us by the police (said to have originated from a Mitsubishi Canter) is consistent with fragments we would expect if such a vehicle was located in the centre of the explosion.	0
Member States submitted information during the review that will lead to a total of 465 proposed amendments to the List (and changes to 217 narrative summaries of reasons for listing).	0
International partners and human rights defenders unanimously condemned the Government's decision to expel the Director of the United Nations Joint Human Rights Office following the publication of the human rights report on violations allegedly committed by the police during Operation Likofi.	1
The Committee strives to ensure that the List is dynamic and responsive to the evolving threat posed by Al-Qaida.	1
Political pressure on UNMIK has significantly increased, with attempts to challenge its role under resolution 1244 (1999) and the Constitutional Framework.	1
The Government also shares a certain number of the concerns expressed in the report on, among other issues, human rights and the situation of women and children.	1
First, they have created an ongoing humanitarian emergency that threatens the peace and stability of Haiti.	1
92. The commission of inquiry recommends that States and civil society organizations foster opportunities for people-to-people dialogue and contact in such areas as culture, science, sports, good governance and economic development that provide citizens of the Democratic People's Republic of Korea with opportunities to exchange information and be exposed to experiences outside their home country.	0
The Financial Action Task Force on Money-Laundering International Cooperation Review Group stated in June 2009 that six States of the subregion had anti-money-laundering and counter-financing of terrorism deficiencies.	1
The Council expresses its deepest concern that civilians continue to account for the majority of victims of acts of violence committed by parties to armed conflicts, including as a result of deliberate targeting, indiscriminate and excessive use of force, use of civilians as human shields and of sexual and gender based violence, as well as all other acts that violate applicable international law.	1
Since the beginning of the political impasse following the 29 March elections, the Secretary-General has expressed his concern about the process and the politically motivated violence.	1
Rape and crimes of sexual violence were committed but were not widespread or systematic enough to amount to a crime against humanity.	0
"It underlines that no attempt to destabilize Lebanon should prevent the holding, without delay, of a free and fair presidential election in conformity with Lebanese constitutional rules, without any foreign interference or influence, and with full respect for democratic institutions.	0
Despite increased attention and positive recent developments in this area, however, numerous challenges on the ground in respect of implementation remain, in particular challenges regarding a continued lack of clarity surrounding the concept and operationalization of the protection of civilians, internal and external coordination mechanisms, early warning and rapid response, support to the security forces of the host Government, troop capabilities and resourcing.	1
260. Preventing cross-border terrorist mobility also requires the use of technology and equipment, such as readers and scanners, at border checkpoints to capture traveller data in real time and to verify that data against national and international alert and criminal databases.	0
Mali and the Niger are members of the newly established subregional Joint Intelligence Centre in Tamanrasset, Algeria.	0
It is crucial that domestic violence and sexual assault cases be formally prosecuted in accordance with the new Criminal Code.	1
56. Gunfire was heard throughout the night, particularly in the western area of Dili where F-FDTL had established positions at Rai Kotu, Taci Tolu and Beduku. Rumours that F-FDTL had massacred 60 people took root on 29 April and grew rapidly thereafter, even to the extent of citing the licence plate number of the FFDTL truck said to have been used to transport the corpses, either in boxes or a shipping container, from Taci Tolu to Viqueque District on 1 May 2006.	0
Demanding an immediate and complete cessation by all parties to armed conflict of all acts of sexual violence against civilians in line with resolutions 1325 (2000), 1820 (2008), 1888 (2009), and 1889 (2009); recruitment and use of children in line with resolutions 1612 (2005) and 1882 (2009); and indiscriminate attacks on civilians in line with resolution 1894 (2009),	1
As I said earlier, the application of double standards in dealing with terrorism and terrorist groups is yet another important matter of grave concern that seriously undermines the international community's collective fight against terrorism.	1
Taking note of the Moroccan proposal presented on 11 April 2007 to the Secretary-General and welcoming serious and credible Moroccan efforts to move the process forward towards resolution; also taking note of the Polisario Front proposal presented 10 April 2007 to the Secretary-General,	0
The Council members, in their comments, expressed serious concern at the recent developments, stressed the need for establishing border security mechanisms, and called upon both sides to take steps to normalize their relations.	1
10. Reiterates the importance of all States identifying, and if necessary introducing, adequate procedures to implement fully all aspects of the measures described in paragraph 1 above, strongly urges all Member States to implement the comprehensive international standards embodied in the Financial Action Task Force's (FATF) revised Forty Recommendations on Combating Money Laundering and the Financing of Terrorism and Proliferation, particularly Recommendation 6 on targeted financial sanctions related to terrorism and terrorist financing;	1
5. My recent visit to the Sahel region reinforced my belief in the importance of considering peace, security, development and human rights in an interconnected manner.	0
Five States are not yet a party to the Firearms Protocol, but almost all have introduced OAS legislation criminalizing the illicit manufacturing, possession and trafficking of small arms and light weapons, ammunition and explosives.	1
At the 5764th meeting of the Security Council, held on 22 October 2007, in connection with the Council's consideration of the item entitled "Threats to international peace and security caused by terrorist acts", the President of the Security Council made the following statement on behalf of the Council:	0
134. Seven of the eight States of Central Asia and the Caucasus have ratified 12 of the international counter-terrorism legal instruments, with Kyrgyzstan actively considering adherence to the 6 instruments to which it is not yet a party.	0
We strongly condemn the criminal attacks that the Boko Haram terrorist group continues to perpetrate in northern Nigeria and in neighbouring countries.	1
Accordingly, the arms-trading networks were forced to exercise greater care in the movement of arms shipments from Yemen to Somalia across the Gulf of Aden.	0
In all those discussions, I was encouraged to find a convergence of opinion: we all marvelled at how Liberia has achieved so much since the end of the fighting in 2003, but all realized fully just how breathtaking the challenges confronting Liberia still are, and that, ultimately, we take nothing for granted.	1
The only issue upon which the participants agree is that there was no discussion about weapons.	0
I urge all Somali leaders to undertake the necessary steps towards reconciling their differences.	0
Israel is obligated under international law and as the occupying power to protect Palestinian civilians, especially children, and to safeguard civilian property.	1
The Council demands that the Government of the Sudan withdraw immediately from the Abyei area.	1
19. Based on an analysis of the statements by Al-Qaida leaders, their immediate objectives are to terrorize the West into disengagement from the Middle East and other Muslim States and to persuade Muslims that their world is under attack.	0
On 7 October, the Special Adviser of the Secretary-General, Sigrid Kaag, briefed the Security Council in closed consultations on the implementation of resolution 2118 (2013). The Special Adviser focused her intervention on four topics: the closure of the Joint Mission of the Organization for the Prohibition of Chemical Weapons and the United Nations on 30 September; the progress on the implementation of the plans for the destruction of the remaining 12 chemical weapons production facilities; the issue of discrepancies in the original declaration made by the Syrian Arab Republic; and the allegations concerning the use of chlorine gas in the Syrian Arab Republic.	0
Moreover, there are concerns that the active arms-for-drugs trafficking emanating from Afghanistan may lead to terrorist financing in neighbouring Central Asian States, through the activities of cash couriers.	1
In particular, we would like to express our profound concern over the stagnation of Haiti's socio-economic development and food security.	1
Transformation of the MONUSCO Force alone will not result in the changes necessary to more effectively implement the Mission's mandate. It must involve a change in the behaviour of certain troop-contributing countries.	1
483. The committees rejected too many cases for the reason that their interrogation of the victims revealed that the crime complained of did not amount to rape, as penetration had not occurred, or that the complainants had confused the Arabic term for oppression with the term for rape and had mistakenly come forward with complaints of other forms of abuse or violence, such as beatings.	1
36. In other cases, the Council's special political missions have played an important role in helping States to reduce the strategic space afforded to terrorist groups through engagement in cross-border crime.	0
We believe, however, than an abrupt withdrawal would be counterproductive and create an unprecedented vacuum, particularly given the fact that conditions conducive to the hoped-for large-scale investment and sustainable development are not yet entirely established.	1
22. The first batch of 2,000 militia members was registered in Guiglo in June 2006 and 981 of them were subsequently disarmed and received a cash safety net allowance.	0
248. Many of the ground and air attacks on villages resulted in the indiscriminate killing of civilians.	0
This is made clear by recent incidents of DIS ill-discipline, notably the alleged murder of a civilian by a DIS commander in Farchana on 22 March.	1
4. The average monthly income accruing to the Compensation Fund for the year to date is approximately $351.2 million, with quarterly payments of compensation awards continuing to average in excess of $1 billion.	0
The abduction of a French priest in Cameroon by Boko Haram and Ansaru working together in November 2013 demonstrates the ability of these two groups to act beyond Nigeria's borders.	0
65. The prosecution of individuals suspected of piracy and the punishment of convicted pirates in accordance with relevant Security Council resolutions is an essential deterrent to would-be pirates, demonstrating that they cannot act with impunity.	1
This is an important aspect because it greatly increased the level of frustration and hate on the part of the targeted population, including supporters or perceived supporters of opposition parties and community groups, with respect to the police and security forces.	1
12. Aqeel Al-Aquil filed a lawsuit on 11 May 2005 in federal district court in the District of Columbia against officials of the United States Department of Justice, State and the Treasury, claiming that his designation as a terrorist by the United States Government on 2 June 2004 violated his rights under the United States Constitution. Al-Aquil, a resident and citizen of Saudi Arabia, was chairman of AlHaramain Islamic Foundation, which was based in Saudi Arabia until it was shut down by Saudi authorities in 2004. On 6 July 2004, the United Nations listed him under the family name Al-Aquil, along with various offices of Al-Haramain in Afghanistan, Albania, Bangladesh, Ethiopia and the Netherlands (the United Nations has listed other Al-Haramain offices both before and after that listing).	1
As we are set to discuss development challenges facing Afghanistan, the recent incident underscores the grim picture related to the security situation.	1
47. Strongly urges Member States to provide all relevant information to the Ombudsperson, including any relevant confidential information, where appropriate, encourages Member States to provide relevant information in a timely manner, welcomes those national arrangements entered into by Member States with the Office of the Ombudsperson to facilitate the sharing of confidential information, encourages Member States' further cooperation in this regard, including by concluding arrangements with the Office of the Ombudsperson for the sharing of such information, and confirms that the Ombudsperson must comply with any confidentiality restrictions that are placed on such information by Member States providing it;	0
Pursuant to paragraph 18 of Security Council resolution 2100 (2013), France submitted four reports to the Security Council which outlined six combat actions undertaken in response to an "imminent and serious threat" and highlighted the work of the liaison and operational support detachments for MINUSMA, as well as the support of French forces in caring for the wounded.	1
They insist on treating the case as a minor migration crime.	1
12. Demands that all parties cooperate fully with the operations of MONUC and that they ensure the security of as well as unhindered and immediate access for United Nations and associated personnel in carrying out their mandate, throughout the territory of the Democratic Republic of the Congo, demands in particular that all parties provide full access to MONUC military observers, including in all ports, airports, airfields, military bases and border crossings, and, in addition, that MONUC human rights observers are granted access to detention centres and brassage centres, and requests the Secretary-General to report without delay any failure to comply with these demands;	1
The Abkhaz regime has not been sparing in efforts aimed at legalizing the forcibly changed demographic situation as a consequence of the ethnic cleansing, and creating unbearable living conditions for the Georgian returnees in the Gali district.	0
While both Pristina and Belgrade strongly condemned the incident and called for the arrest of the perpetrators, each side has claimed that the other is responsible for provoking the incident.	1
The Group provides below three case studies -- on air power; vehicles for military use; and mercenaries and mechanics -- for the Committee to examine and reach a timely decision on whether they violate the embargo.	0
9. With regard to military agreements No. 2 and No. 3, the parties continued to extend a high level of cooperation to MINURSO in the marking and disposal of mines and unexploded ordnance.	0
This has increased the potential for employing arms embargoes as part of an effective strategy for post-conflict peacebuilding.	0
The incident in northern Mitrovica clearly showed that, despite the Security Council's mandate concerning the reconfiguration of UNMIK, EULEX is increasingly departing from the status-neutral principle, which undermines the standing of that international presence.	1
1. The present report of the Security Council Committee established pursuant to resolution 1518 (2003) covers the period from 1 January to 31 December 2009.	0
The disarmament of the militias is a priority concern, particularly in the run-up to an electoral campaign, with its potential for politically motivated violence.	1
In this regard, in a letter dated 1 August 2008 to the President of the Security Council, the Committee conveyed its recommendations to the Security Council concerning the imposition of targeted measures against individuals and entities as designated by the Committee.	0
Other provisions of the Criminal Code, such as unauthorized arming (Section 185) or the development, production and possession of prohibited means of combat (Section 185a) might apply as well: Public endangerment	0
An international tribunal is not considered appropriate given that the crimes under consideration contravene domestic law.	0
The Programme of Action contains concrete suggestions for improved national legislation and controls and international assistance and cooperation. It calls upon States to address the special needs of children affected by armed conflict.	0
5. Reaffirms also its condemnation in the strongest terms of all acts of violence or abuses committed against civilians in situations of armed conflict in violation of applicable international obligations with respect in particular to (i) torture and other prohibited treatment, (ii) gender-based and sexual violence, (iii) violence against children, (iv) the recruitment and use of child soldiers, (v) trafficking in humans, (vi) forced displacement, and (vii) the intentional denial of humanitarian assistance, and demands that all parties put an end to such practices;	1
The two witnesses who had participated in the Inquiry, Mr. Donghyuk and Ms. Lee, spoke of their personal experiences in the Democratic People's Republic of Korea before they had escaped as refugees.	0
The members of the Security Council also condemned the continued attacks against Yemeni security forces in Hadramawt on 9 October, as well as in Bayda on 8 October, which were aimed at undermining Yemen's stability.	1
The threat to the security and stability of Afghanistan posed by terrorists, criminals and those involved in the illicit drug trade is real and needs to be continuously addressed.	1
Most of the potential witnesses residing outside the State were afraid to testify, even on a confidential basis, because they feared for the safety of family members and assumed that their conduct was still being clandestinely monitored by the authorities.	1
The review process has resulted in the confirmation of listing of all individuals who, while not listed solely on this basis, are primarily known for their role in providing ideological justification for Al-Qaida-related violence to new recruits or to a wider audience. This is despite the fact that the sanctions measures themselves have little if any impact on their key tool: the ability to communicate and persuade via the Internet.	1
In that context, we reiterate our repeated affirmation that the greatest threat to the investigation lies in the fact that certain parties in and beyond our region are exploiting it in order to politicize conclusions that are entirely unrelated to the investigation and that are not based on firm evidence.	1
Noting with concern that the terrorism threat has become more diffuse, with an increase, in various regions of the world, of terrorist acts including those motivated by intolerance or extremism, and expressing its determination to combat this threat,	1
But, although the Team does not assess that paramilitary technical advice available on the Internet presents a threat on a par with real-life training, the potential will increase as the quality of advice improves.	0
It commits both parties to the immediate release and reintegration of children associated with armed forces.	0
36. The Committee continued to consider a media outreach strategy, based on a non-paper prepared by the Committee experts. The purpose of this strategy is to utilize methodically and efficiently the United Nations and Committee resources to reach wider, targeted audiences, including through the preparation of specialized contact lists for electronic communication of important Committee updates.	0
According to Jordanian official sources, the explosive vests were made by Al-Qaida in Iraq, using explosives and grenades taken from former Iraqi Army stockpiles and smuggled into Jordan.	0
Recalling the adoption of resolution 2122, and reaffirming the intention to increase its attention to women, peace and security issues in all relevant thematic areas of work on its agenda, including in threats to international peace and security caused by terrorist acts,	0
"The Security Council calls on the international community to provide, where needed, financial and technical support, as well as adequate training, for national implementation of resolution 1325 (2000), and on the United Nations system, civil society and other relevant actors to collaborate and provide assistance in line with national priorities to Member States, particularly those affected by armed conflict, in the rapid development of national action plans, and work closely with national mechanisms responsible for the implementation of the resolution, including, where appropriate, through the United Nations country teams.	0
The government has not taken the necessary administrative and legislative action to fight and prevent corruption in the provisional institutions.	0
But there was also concern because, each time there has been a hopeful sign in the Middle East, it has been met by increasing violence and destruction.	1
The Security Council recalls the obligations of States to respect and to ensure respect for international humanitarian law, including the four Geneva Conventions, and emphasizes their responsibility to end impunity and to prosecute those responsible for genocide, crimes against humanity and serious violations of humanitarian law.	0
Takes note of the elaboration of the human rights due diligence policy, encourages [the Mission] to implement it fully, and requests the Secretary-General to include progress made in implementing the policy in his reports to the Council;	0
"The Security Council reiterates its concern regarding the increasing connection, in many cases, between terrorism and transnational organized crime, illicit drugs, money-laundering, illegal arms trafficking, and emphasizes the need to enhance coordination of efforts on national, sub-regional, regional and international levels in order to strengthen a global response to this serious challenge and threat to international peace and security, and encourages UNODC to continue its work, in this regard, in collaboration with other relevant UN entities.	1
30. Generally speaking the attitude of the Government authorities towards the Commission has been cooperative.	0
Frequent calls for donations by the groups, and their claims to be unable to launch attacks for lack of money, have encouraged further emphasis on adding financiers to the List.	1
83. The MPCI combatants provided the mission with information on the existence of other mass graves in the combat zones. The mass graves are said to be five in number, three of them at Man and two at Danan, 72 kilometres from Man.	0
An eighth formed police unit from Nigeria is expected to be deployed in October.	0
