en	VerConf
Demands an end to violence by all sides, to attacks on civilians, peacekeepers and humanitarian personnel, and to other violations of human rights and international humanitarian law...	1
The Operation will also work with the Facilitator to encourage the parties to agree on an effective arrangement for the control of the weapons placed under storage, in keeping with the supervisory role entrusted to UNOCI and the Licorne force under the Ouagadougou Agreement.	0
Thus, where no State objects or presents a delisting request or where the information submitted is insufficient or conflicting, the matter could be referred to the Office.	0
At the same time, in spite of the promises brought by the process of democratic transition, one should not forget that it is an extremely responsible stage in the history of the Middle East that demands the highest vigilance and laborious work in order to rule out miscalculations and unpredictability as to the region's future.	1
"The Security Council further reaffirms the need to combat by all means, in accordance with the Charter of the United Nations, threats to international peace and security caused by terrorist acts. The Council reminds States that they must ensure that any measures taken to combat terrorism comply with all their obligations under international law, in particular international human rights, refugee and humanitarian law.	0
Beyond its immediate consequences, the attack on Aro Sharow and nearby villages is a grave source of concern because it may signal the start of deliberate targeting of internally displaced person populations by militia and the inability, or unwillingness, of Government forces to provide effective protection for the camps and villages where the internally displaced persons reside.	1
Also, greater coordination and interoperability among those organizations, as well as developing and sharing common strategies, operational policies and best practices in civilian crisis management would enhance efficiency and coherence in crisis management.	0
Regarding the humanitarian situation, Guatemala is concerned that, according to the Office for the Coordination of Humanitarian Affairs (OCHA), 20 million people in the Sahel require humanitarian assistance, particularly in Mauritania, Niger, Burkina Faso and Chad.	1
"The Security Council expresses its strong condemnation of this attempt to destabilize Lebanese institutions, in this particular case the Lebanese Armed Forces.	1
Acknowledging the important role played by regional and subregional arrangements in the prevention of, and response to, situations that may lead to genocide, war crimes and crimes against humanity, especially noting Article 4(h) of the Constitutive Act of the African Union,	0
The victim became pregnant as a result of this rape and later gave birth to a child.	0
Promote gender issues and awareness at the national and local level through a network of gender focal points in regional and country offices.	0
It is significant to note that on 22 May 2005, approximately one week before the second battle of Baidoa, a very large arms shipment arrived from Yemen, via the arms-trading networks, at BAM.	0
Somewhere between 1315 and 1330 hours, Lieutenant Colonel Ahmed Al-Assir informed him of the blast and that Mr. Hariri's motorcade had been the target.	1
Reaffirming the obligation of the Member States to freeze without delay funds and other financial assets or economic resources of persons who commit, or attempt to commit, terrorist acts or participate in or facilitate the commission of terrorist acts; of entities owned or controlled directly or indirectly by such persons; and of persons and entities acting on behalf of, or at the direction of such persons and entities, including funds derived or generated from property owned or controlled directly or indirectly by such persons and associated persons and entities,	0
Some concerns have been expressed -- most recently by several presidential candidates -- about the fairness of registration.	1
While we are pleased to note that some 10 million Afghan voters have been registered, we remain concerned that sufficient registration has not taken place in the south and south-eastern parts of Afghanistan, mainly due to security concerns.	1
No State has reviewed its non-profit sector or conducted a risk assessment for terrorist financing.	1
Collaborate in the development and implementation of gender-sensitive HIV/AIDS policy in such areas as training, codes of conduct, HIV testing, civilian and military cooperation, resource information and best practice materials; integrate an HIV/AIDS policy within DPKO and strengthen capacities of peacekeeping operations (including future peacekeepers) to address HIV/AIDS.	0
As it may be recalled, the Government of Eritrea had urged the Security Council, through its letter of 28 February 2012 (S/2012/126), to shoulder its responsibilities and take appropriate measures against the myriad and unlawful acts of aggression and occupation.	1
The Council condemns all other violations of international law, including international humanitarian law, human rights law and refugee law, committed against children in situations of armed conflict.	1
The Security Council should recognize countering violent extremism as an essential element of the international community's response to this threat.	1
During the conflict, more than 2 million persons have died and 4.5 million persons have been forcibly displaced from their homes.	0
United Nations peace operations have adjusted their posture accordingly and show an increasing tendency to "bunker up and hunker down", constraining the ability of both uniformed personnel and civilian staff to engage with the local population, win hearts and minds, mediate local disputes, and gather information -- work critical to the implementation of peace agreements and the effort to resolve conflict.	1
The leaders of the Provisional Institutions of Self-Government frequently shirk their obligations under resolution 1244 (1999) and the Constitutional Framework.	1
Clear direction of the work of the Committee and its Executive Directorate requires plainly articulated policy guidance in all key areas of the Committee's mandate.	1
In their public statements, Colonel Al-Qadhafi and members of his family have continued to threaten citizens with a civil war and the possibility of mass killing if the protests continue.	1
At the same time, Cuba condemns suicide bomb attacks and other acts against Israeli civilians, who are innocent victims of the spiral of violence provoked by their Government's policy. We also object to the manipulation of such isolated acts in order to question the Palestinian people's legitimate exercise of self-defence and to justify activities, whether large-scale or selective, against the Palestinian population.	1
I also take this opportunity to underline my concerns regarding challenges in the context of Federal and gubernatorial elections to be held in Nigeria in February 2015, and the serious risks of violence that might occur either because of Boko Haram attacks or because of contestation of the election results.	1
The Monitoring Group noted that during this time, the opposition had purchased a number of anti-aircraft weapons and ammunition from BAM.	0
Most States have limited capacity to freeze funds and assets without delay, and no State implements adequate measures to protect nonprofit organizations from terrorist financing.	1
The Sudan does not target the United Nations. It is a faithful Member of the Organization that abides by the provisions of the Charter of the United Nations and appreciates its efforts to achieve security and stability and promote development in the Sudan. In addition, the Sudan assiduously strives to develop that relationship in accordance with the Charter and the relevant General Assembly and Security Council resolutions.	0
As the Prosecutor, I will deal with any judicial challenge brought by President Al-Bashir and other suspects in court.	1
ICAO and IATA have agreed to highlight the work of the 1267 Committee and to raise awareness of the Consolidated List among their members. F. INTERPOL	0
53. Integrated plans are being implemented to support the mandated withdrawal of the Mission's military and civilian components between 15 October and 31 December 2010.	0
In that case, the problem arises of whether the participants in the group other than the one who committed the crime, which had not been previously planned or envisaged, also bear criminal responsibility for such crime.	0
The Mission has re-evaluated its operational commitments in the light of the limited reinforcements authorized under the resolution.	0
There is no doubt today that the true intention was to prevent the details of his mindlessly destructive actions under CIA orders from becoming public.	1
The Council reminds States that they must ensure that any measures taken to combat terrorism comply with all their obligations under international law, in particular international human rights, refugee and humanitarian law.	0
We are also concerned by the resurgence of cholera cases, although the mortality rate seems to be slowly diminishing.	1
To date there has been no improvement in administrative reform at the national level.	1
What everyone needs to do is to reject the extremist voices thatwho find comfort in the old ways and thatwho believe that it is impossible for Serbs and Albanians to normalize their relations by reaching an historic compromise.	1
That the request by the Government of Kuwait concerning the real property claim in relation to a deceased detainee not be accepted on the grounds that this issue constitutes in fact a request for late filing of the real property portion of the claim outside the filing period for acceptance, and to request the secretariat to inform the Government of Kuwait accordingly.	1
I cannot stress strongly enough the risk posed by the lack of military helicopters to the operational effectiveness of the force.	1
60. Decides, in order to assist the Committee in fulfilling its mandate, as well as to support the Ombudsperson, to extend the mandate of the current New York-based Monitoring Team and its members, established pursuant to paragraph 7 of resolution 1526 (2004), for a further period of thirty months, under the direction of the Committee with the responsibilities outlined in annex I, and requests the Secretary-General to make the necessary arrangements to this effect;	0
It orders the Commission to examine the funding of ECOWAS activities with the view of ensuring that adequate resources are made available to the institutions.	1
An analysis of the threat posed by terrorist groups on the African continent gives rise to great concern; rightly or wrongly, it confounds political, religious and ideological extremism with organized crime.	1
Law no. 535/2004 on the prevention and fighting against terrorism was promulgated by the President of Romania with the Decree no. 994/2004 of 24 November 2004, and entered into force three days later.	0
o On 29 November 2014, regime warplanes launched 2 missiles on Nawawi Mosque in Raqqa city, killing 11 people, including a child, and injuring 16 others.	0
"The Security Council calls upon the Somali parties to build on the progress achieved and swiftly conclude the Somali National Reconciliation Conference with a durable and inclusive solution to the conflict in Somalia by establishing a viable transitional government.	0
Endorsing the work already carried out by the Committee established pursuant to resolution 1540 (2004), hereafter the 1540 Committee, in accordance with its fifth Programme of Work,	0
14. Invites the Secretary-General to bring to its attention situations where refugees and internally displaced persons are vulnerable to the threat of harassment or where their camps are vulnerable to infiltration by armed elements and where such situations may constitute a threat to international peace and security, expresses, in this regard, its willingness to consider such situations and, where necessary, adopt appropriate steps to help create a secure environment for civilians endangered by conflicts, including by providing support to States concerned in this regard, and recalls, in this regard, its resolution 1208 (1998) of 19 November 1998;	0
Respect for the rights of the other - including political opponents - has to become the key test for all those who aspire to lead the country towards stability, unity and prosperity.	0
The Government of the Syrian Arab Republic would like to express its appreciation for the efforts by the Department of Peacekeeping Operations and of UNDOF officials in the occupied Syrian Golan to maintain security and peace in the Force's area of operations, in accordance with its mandate. Since the Force was established in 1974, Syria has consistently supported and facilitated its work and respected its mandate. It has also maintained close ties with officials of UNDOF, the United Nations Truce Supervision Organization and the Department of Peacekeeping Operations. In his previous reports, the Secretary-General has always expressed his appreciation for Syria's cooperation, its assiduous efforts to ensure the safety of UNDOF troops and its respect for the Force's mandate.	0
Pristina has thus far rejected every initiative in that regard.	1
Disarmament and arrest of the perpetrators of these brutal acts is the single most important demand of the Council and the clearest case of failure by the Government to live up to its responsibilities.	1
"The Security Council continues to be gravely concerned by the threat that piracy and armed robbery at sea pose to international navigation, the safety of commercial maritime routes, and the security and economic development of States in the regions concerned, as well as to the safety and welfare of seafarers and other persons, including through their being taken as hostages, and the increasing violence employed by pirates and persons involved in piracy and armed robbery at sea. The Security Council condemns in the strongest terms hostage taking and the use of violence against hostages, and calls upon States to also cooperate, as appropriate, to secure the early release of hostages, including through sharing of information and intelligence.	1
In this climate of widespread insecurity, freedom of opinion of political parties is threatened or restricted.	1
Reaffirming that acts of terrorism must not be allowed to disrupt Iraq's political and economic transition, and further reaffirming the obligations of Member States under resolution 1618 (2005) of 4 August 2005 and other relevant resolutions and international conventions with respect, inter alia, to terrorist activities in and from Iraq or against its citizens,	1
271. The Commission found that while all parties involved in the conflict have committed crimes against the civilian population, the Government of the Sudan and the Janjaweed bear responsibility for an overwhelming majority of the murders of civilians committed during the conflict in Darfur.	1
The Security Council recognizes the Peacebuilding Commission, in its area of competence, as a forum for coordination in the area of post-conflict between the United Nations system and regional and subregional organizations, in accordance with its resolution 1645 (2005) and General Assembly resolution 60/180.	0
(d) The armed confrontation between F-FDTL soldiers and PNTL officers at the PNTL headquarters on 25 May which resulted in numerous injuries and the death of one F-FDTL soldier, Bure.	1
"The Security Council reiterates that the increasing threat posed by foreign terrorist fighters is part of the emerging issues, trends and developments related to resolutions 1373 (2001) and 1624 (2005), and encourages the Counter-Terrorism Committee to hold Special Meetings in 2015 with the participation of Member States and relevant international and regional organizations to discuss ways to stem the flow of foreign terrorist fighters, and to prevent terrorists from exploiting the Internet and social media to recruit and incite terrorist acts, while respecting human rights and fundamental freedoms, and in compliance with other obligations under international law; and in this regard notes the importance of the Committee holding meetings in affected regions on issues related to the mandate of the Committee.	1
Special measures to protect women and girls from gender based discrimination and violence, rape and other forms of sexual violence (access to legal redress; crisis centres; shelters; health care; counselling and other assistance programs; monitoring and reporting mechanisms).	0
143. Second, the Government and the rebel leaders must emphasize efforts to prevent excesses, to protect people at risk and to bringing to justice those responsible for excesses.	0
The concept note outlines the way forward for the Somali joint needs assessment and includes substantial participation by Somalis in the exercise, as both government and zonal counterparts and international experts from the Somali diaspora.	0
601. It is therefore proposed that an international compensation commission be established, consisting of 15 members, 10 appointed by the Secretary-General and 5 appointed by an independent Sudanese body.	0
She heard other girls screaming and thought that they were also being raped.	0
We consider any deviation from that principle unacceptable lest the fragile situation in the province descend into widespread destabilization.	1
Generally speaking the policy of attacking, killing and forcibly displacing members of some tribes does not evince a specific intent to annihilate, in whole or in part, a group distinguished on racial, ethnic, national or religious grounds.	1
Acknowledges the cooperative policy of neighbouring States, including [list of relevant States] in keeping their borders open for refugees ... and encourages these States to continue this policy and contribute to a stabilization of the situation wherever possible;	0
During our prior discussions, Belgium had shared the concern expressed by the Secretary-General about the danger that violence in Iraq poses to a society, institutions and a political process that remain fragile.	1
However, in Port-au-Prince, a marked rise in violence and criminality, including kidnappings, generated serious public anxiety in May and June.	0
In that connection, we think that destructive action aimed at obtaining unilateral political benefits should be categorically condemned.	1
32. Welcomes periodic briefings from the Government of Afghanistan on the content of the list, as well as on the impact of targeted sanctions on deterring threats to the peace, stability and security of Afghanistan, and supporting Afghan-led reconciliation;	0
18. In Beni, the local authorities and civil society have called for the more active involvement of the MONUSCO Force in military operations against ADF, including through conducting unilateral operations.	0
Secondly, Mr. Covic expressed concern over the quality of democracy in a place where the minority -- the Kosovo Serbs -- risks being outvoted. I would say that I find that the most important aspect of democracy is indeed that one participates, exercises the rights of a democracy and votes.	1
It is important to recall, however, that beyond those confidence-building measures, the Ivorian Government remains responsible for the safety and security of its citizens. On 6 September, in Abidjan, the Minister of Territorial Administration, Issa Diakite, was attacked by a group of Young Patriots.	0
"The Security Council reiterates its grave concern about Islamic State in Iraq and the Levant (ISIL), Al Nusrah Front (ANF) and other terrorist entities associated with Al-Qaida and the negative impact of their presence, violent extremist ideology, and actions on the stability of Iraq, Syria and the region, including the devastating humanitarian impact on the civilian populations which has led to the displacement of millions of people, and about their acts of violence that foment sectarian tensions.	1
The conflict has lasted more than half a century and cannot be addressed overnight.	0
It outlines issues of concern and concludes with the urging of Somali women that the international community raise issues of gender, including with Somali leaders.	1
Perpetrators of terrorist acts have been arrested and subsequently brought to justice in a number of jurisdictions.	0
216. Building on the findings of the Commission and Lebanese investigations to date and on the basis of the material and documentary evidence collected and the leads pursued until now, there is converging evidence pointing at both Lebanese and Syrian involvement in this terrorist act.	1
Statements such as "the Palestinian people do not love their children" or "the Palestinian people send their children to die because of their hatred of Israel" are statements that are full of racism and that reflect a kind of attitude that should be rejected out of hand -- and I am trying to do that now.	1
21. The Congolese Government has indicated that it will stand firm on the 2 January 2015 deadline.	1
For example, Europe has the European Union (EU) and the Schengen Agreement; Africa, the Economic Community of West African States (ECOWAS) and the Southern African Development Community (SADC); Asia, the Association of Southeast Asian Nations (ASEAN) and the Commonwealth of Independent States (CIS); North America, the North American Free Trade Agreement (NAFTA); Central America, the Central American Integration System (SICA); and South America, both the Andean Community and the Common Market of the South (MERCOSUR), which are moving towards a merger to create the South American Community of Nations.	0
Reiterating deep concern that, despite its repeated condemnation of violence against women and children including all forms of sexual violence in situations of armed conflict, and despite its calls addressed to all parties to armed conflict for the cessation of such acts with immediate effect, such acts continue to occur, and in some situations have become systematic or widespread.	1
Promoting security and stability remains a vital challenge.	1
C. Legal challenges to the sanctions 50. The Team is aware of 15 lawsuits filed around the world challenging Member States' implementation of some aspect of the United Nations Al-Qaida/Taliban sanctions.	0
It has been also reported that 18 women were raped during the attack on Adwa, Southern Darfur, at the beginning of December 2004.	0
Matters relating to crimes against humanity were assessed on the basis of definitions set out by customary international criminal law and in the Rome Statute of the International Criminal Court.	0
It is clear that all of the institutions of law and order in Iraq face severe challenges.	1
The UNOCI military component will continue to implement its new concept of operations, work with the Licorne force to assist the parties in implementing the Facilitator's proposals for the reintegration of Forces nouvelles personnel in the national police and the army and prepare contingency plans for possible stabilization interventions to prevent acts of violence aimed at disrupting the peace process.	0
"The Security Council stresses the importance of achieving durable solutions for refugees and internally displaced persons, in particular their voluntary, safe and dignified return, or local integration or resettlement.	0
29. In the meantime, the efforts of the UNOCI police component to advise the Government of National Reconciliation on the restructuring of the Ivorian Defence and Security Forces and assist in the restoration of a civilian policing presence throughout the country have been hampered by the uncooperative attitude of the local authorities, the absence of a comprehensive reform plan for the Ivorian Defence and Security Forces and the lack of agreement between the Ivorian parties on the deployment of Ivorian police and gendarmerie officers to the north.	1
States should refrain from inhibiting humanitarian actors in their efforts to engage non-State armed groups for humanitarian purposes, including undertaking activities aimed at promoting respect for international humanitarian law.	1
During the reporting period, the composition of the joint observation and verification team in Gao was adjusted to include all armed group members of the Coordination and the Platform, as well as representatives from Algeria, Chad, Mauritania and the Niger. From 19 to 22 November, the Gao team conducted a fact-finding mission in Didi, on both sides of the Niger River.	0
He firmly reiterated his personal condemnation of the incident, which he said was sending very undesirable and wrong signals ahead of the 2012 elections, and which could potentially negate and derail the national gains made in terms of rebranding the country's image, peacebuilding and peace consolidation, which were so painstakingly achieved with the help of our development partners and the international community.	1
Decides hereby to establish an international tribunal for the sole purpose of prosecuting persons responsible for serious violations of international humanitarian law committed in the territory of [the affected State] between [dates].	0
Areas of assessment 25. All visited States have introduced legislation giving their judicial, prosecutorial and law enforcement authorities the competences needed to counter terrorism.	0
Such criminal activities seem to have a ripple effect by feeding terrorism in Africa and criminal activities which prosper in other regions of the world.	1
