en	VerConf
3. By its resolution 1267 (1999), the Security Council imposed limited air and financial embargoes to compel the Taliban to cease providing sanctuary and training to terrorists, including Usama bin Laden.	0
22. On 9 April 2013, the Committee met with representatives of the Department of Political Affairs, the Department of Peacekeeping Operations, the Monitoring Team, the Executive Directorate of the Committee established pursuant to resolution 1373 (2001) concerning counter-terrorism and the Counter-Terrorism Implementation Task Force.	0
That is obviously because the States in question have rejected his measures.	1
We urge all parties to act with restraint and to avoid provocative actions or pronouncements that may trigger further violence.	1
The Special Representative regretted that the situation of human rights continued to be marked by constant violations, and she warned that the situation could get even worse with the adoption and implementation of a new security bill.	1
Given the longstanding hostility of these groups to the United Nations, this suggests an ongoing risk to mission personnel.	1
FALINTIL became the armed wing of the newly created National Council of Maubere Resistance (CNRM). This Council included FRETILIN, UDT and other nationalist parties. As a result, FRETILIN lost absolute control over the policies of the resistance.	0
51. The success of the transition would be threatened were the elections in the Democratic Republic of the Congo not to take place by 30 June 2006.	1
Similarly, counter-terrorism legislation has been adopted, providing judicial and prosecutorial authorities with adequate legal powers to bring terrorists to justice.	0
It also showed how differently the threat can be perceived, even by neighbours.	1
There is no doubt that the structure and development of public administration in Timor-Leste still presents us with significant challenges that must be taken into consideration.	1
In these States, there is an awareness of the importance of cooperation, information-sharing and coordination among the various agencies and between the regional and national levels.	0
Their involvement in terrorism encompasses a broad range of activities: bombing attacks including suicide bombings, hostage-taking resulting in death, bomb-making, terrorist intelligence operations, terrorist training, document forgery, and the provision of a range of financial and material support, including the funding and control of a website used to post Al-Qaida-related statements and images.	0
That makes the irresponsible and threatening rhetoric coming from the Iranian leadership all the more alarming.	1
Once again, the Russian Federation calls upon the Israeli and Palestinian sides to demonstrate restraint and a high level of responsibility and to reject unilateralism.	1
The Secretary-General's latest report on resolutions 1559 (2004) and 1701 (2006) clearly expressed the importance of Hizbollah disarmament and of ending arms smuggling across the Lebanese-Syrian border.	1
Increased women's representation on programme-related bodies. D.3. Provide systematic training to all categories of humanitarian personnel on gender issues. Raise awareness and build capacity on gender analysis and participatory tools of humanitarian staff and partners working in emergency and rehabilitation programmes and projects.	0
Notes that the excessive accumulation and destabilizing effect of small arms and light weapons pose a considerable impediment to the provision of humanitarian assistance and have a potential to exacerbate and prolong conflicts, endanger civilians and undermine security and the confidence required for a return to peace and stability ...	1
At the same time, my delegation considers that the elected representatives of the ethnic minorities in the Assembly, in particular the Serb representatives, would achieve better results and greater benefits for their electorate if they were to adopt a more participative attitude, instead of withdrawing from the legislature when they encounter a difficult situation.	1
396. However, through its own investigations the Commission was able to gather more substantial information on enforced disappearances.	0
The detention and physical assault of any United Nations personnel is entirely unacceptable.	1
They called for more decisive action by the United Nations generally on factors conducive to terrorism, such as Islamophobia.	0
Article 75 of the Statute provides that the Court may make an order directly against a convicted person specifying appropriate reparations to, or in respect of, victims, including restitution, compensation and rehabilitation.	0
A fourth element that carries equal significance in this context, which has emerged in the context of the withdrawal of Syrian troops, military assets and the intelligence apparatus, is the need for an agreement between Lebanon and the Syrian Arab Republic on the international border between them and its demarcation on the ground.	0
Women and the prevention and resolution of conflict Calls upon all concerned parties to ensure that the protection of women and children is addressed in the implementation of the [political agreement] as well as the post-conflict reconstruction and recovery phases, including continued monitoring and reporting of the situation of women and children.	0
Withholding that level of funding would cripple any Government, let alone an authority under occupation. If the funds are not immediately unblocked, this action will threaten the State-building gains made by the Palestinian Authority, including the increased good governance benefiting the Palestinian people and the development of the security forces that uphold law and order in the West Bank.	1
8. The purpose of the survey is to present current general trends in the implementation of the resolution with a view to identifying regional vulnerabilities or areas where groups of States are facing particular implementation difficulties and thus might benefit from a regional or subregional approach to counter-terrorism.	0
"The Security Council requests the Secretary General to report by the conclusion of the MINURCAT liquidation phase on 30 April 2011 on the progress made in eastern Chad on the protection of civilians, especially women and children, including (i) the status of refugees and internally displaced persons and durable solutions to their displacement, (ii) unimpeded, safe and timely humanitarian access, including the movement and security of humanitarian personnel and the delivery of humanitarian aid, (iii) on the measures taken to respond to violations of humanitarian, human rights and refugee law, and (iv) the overall security situation as it affects the humanitarian situation.	0
Last Sunday, on the occasion of the twenty-first anniversary of Hamas, Hamas leader Haniyeh challenged the continuation in office of President Abbas pending a resolution of the internal divide.	1
Officials also noted that small arms and light weapons, left over from earlier conflicts in the region, continue to be available.	0
57. The self-interest of those opposed to the establishment of a bona fide Government has been a constant, and the Monitoring Group has in its previous reports laid bare this central problem in Somalia. The problem abides, and the most conspicuous theme in the present report is the continuing trend of escalating potential violence in a pattern of protection of entrenched vested interests.	1
The Under-Secretary-General further noted that the United Nations had detected an increase in accusatory rhetoric directed by the Government of South Sudan towards UNMISS and violations of the UNMISS Status of Forces Agreement by the Government of South Sudan.	1
23. East Africa has been the victim of terrorism in the past, and there is a high level of terrorist threat, due to continued political instability.	0
Strongly condemns the recruitment and use of child soldiers by parties to armed conflict in violation of international obligations applicable to them, killing and maiming of children, rape and other sexual violence mostly committed against girls, abduction and forced displacement, denial of humanitarian access to children, attacks against schools and hospitals as well as trafficking, forced labour and all forms of slavery and all other violations and abuses committed against children affected by armed conflict.	1
UNMIS, together with the African Union High-Level Implementation Panel and other international partners, will continue their efforts to assist the parties in breaking the current deadlock.	0
The international community remains committed to combating terrorism in all its forms and manifestations, but should strengthen its efforts to achieve full implementation of the relevant resolutions and international counter-terrorism instruments.	0
We bring up the issue of violence in order to express our impatience as regards urgently finding satisfactory solutions to the enormous challenges to the unity of Iraqi society.	1
Fighting was again reported on 22 and 23 July in Elwak between the same clans, resulting in 32 deaths and injuries to over 60 persons.	0
Mr. Sidikou highlighted that, even if Al-Shabaab had suffered military reversals, the group still retained appreciable numbers of its fighters and equipment, mainly in rural areas, and he considered that this was probably designed to maintain a prolonged asymmetrical fight.	0
The Afghan Government has urged a more flexible response from the Committee to its proposals for de-listing, fearing that its inability to achieve de-listings robs it of an essential reward system for Taliban who reconcile, and so risks their return to the fighting.	1
The Commission cannot agree with the Government's position that the statistics representing the work of the committees indicate a much lower incidence of the crime of rape than is reported by sources such as the United Nations, AU and other national and international organizations.	1
Terrorist networks forged in the conflicts of today could pose a threat for decades to come.	0
The report of the assessment mission cites a growing concern regarding the humanitarian and economic impacts the crisis has had on the Sahel region.	1
6. Contemporary armed conflict is the main cause of people fleeing their homes, and is now the most common cause of food insecurity.	0
2. Calls upon the Syrian government to implement visibly its commitments in their entirety, as it agreed to do in the Preliminary Understanding and as stipulated in resolution 2042 (2012), to (a) cease troop movements towards population centres, (b) cease all use of heavy weapons in such centres, (c) complete pullback of military concentrations in and around population centres, as well as to withdraw its troops and heavy weapons from population centres to their barracks or temporary deployment places to facilitate a sustained cessation of violence;	1
1. Deplores and condemns in the strongest terms the terrorist acts of ISIL and its violent extremist ideology, and its continued gross, systematic and widespread abuses of human rights and violations of international humanitarian law;	1
 The prohibition against violence to life and person, in particular murder, mutilation, cruel treatment and torture; enforced disappearances; outrages upon personal dignity; and rape, sexual slavery, enforced prostitution, forced pregnancy, enforced sterilization, and any other form of sexual violence.	1
15. A particular threat has arisen through increased use by terrorist groups and individuals of new information and communication technologies for recruitment, incitement and fund-raising, often across international borders.	1
Other members noted the initiative of the Government of the Sudan to investigate the allegations through its national mechanism and called for the resolution of conflicts through negotiations under the auspices of the African Union High-level Implementation Panel for the Sudan, led by the former President of South Africa, Thabo Mbeki, and the Special Envoy of the Secretary-General for the Sudan and South Sudan, Haile Menkerios.	0
Stressing that the development and maintenance of fair and effective criminal justice systems should be a fundamental basis of any strategy to counter terrorism and transnational organized crime,	1
15. Since my report of 2 January 2008 to the Security Council (S/2008/1), UNOCI has removed all except 2 of the 17 observation posts it had established along the green line, in keeping with the provisions of the Ouagadougou Agreement.	0
Law enforcement efforts have been increased to combat transnational crime and could be adapted to counter terrorism as required.	0
A small number are unable to implement the measures at all and terrorists are able to breach the arms embargo at will.	0
Despite our assessment that a full ceasefire remains difficult to achieve at this time, I remain of the view that the international community must make its position clear on the need for an immediate cessation of hostilities and a far greater and more credible effort by Israel to protect civilians and civilian infrastructure while the conditions for such a cessation are urgently developed.	1
In Zoran Kupreki and others, the Trial Chamber of the International Tribunal for the Former Yugoslavia defined persecution as the gross or blatant denial, on discriminatory grounds, of a fundamental right, laid down in international customary or treaty law, reaching the same level of gravity as the other acts prohibited in article 5.	1
The second point I would like to underscore today is our continuing concern for the welfare of the innocent people of Gaza and in the towns and cities of southern Israel.	1
Although the President acted within his constitutional prerogatives, I discussed with him concerns that the pardons issued on 25 December 2009 could exacerbate perceptions of impunity.	1
First and foremost, concerns on the security front continue to remain paramount.	1
No State implements adequate measures to protect non-profit organizations from terrorist financing.	1
The Force continues to improve its crowd and riot control capabilities in order to be better prepared to counter any resurgence in violence.	0
In its turn, the Committee will need to continue to promote a wider sense of ownership of the sanctions regime and ensure that it provides real support for the national efforts of States that seek to address the threat from Al-Qaida and the Taliban.	1
The Monitoring Group notes, however, that the lack of an established central Government in Somalia and the current elevated threat of widespread hostilities has severely retarded, if not put on hold for the time being, serious countrywide capacity-building efforts.	1
In his last report on the protection of civilians in armed conflict (S/2012/376) the Secretary-General indicated that "the abysmal state of the protection of civilians has changed little" and that there is a clear need to translate normative commitments into concrete improvements in the protection of civilians on the ground.	1
Depending on the circumstances of each case, those individuals can thus be suspected, under the doctrine of joint criminal enterprise, of having committed the crimes against humanity of the murder of civilians and the rape, torture and forcible displacement of civilians and the war crimes of carrying out indiscriminate attacks on civilians, destruction of civilian objects and looting.	0
Expanding cooperation with the Peacebuilding Commission was seen as critical to the Council's programme of work. In particular, participants called for a more strategic outlook towards enhancing cooperation with the Peacebuilding Commission to underline the seamless flow of operational responsibilities between peacekeeping and peacebuilding and to enhance the accountability of both.	0
A military adviser to the Department of Peacekeeping Operations answered questions posed by Council members.	0
In view of the vulnerability of the subregion, there is a need for more steps to criminalize recruitment.	0
3. Over the past six months, the deepening crisis in the Syrian Arab Republic has continued to affect Lebanon, increasing political polarization and concern that the unrest in the Syrian Arab Republic could have negative ramifications for Lebanon's stability.	0
24. The Committee will consider information from the Executive Directorate in respect of its continuation to pay close attention to resolution 1624 (2005) in its dialogue with Member States; its work with Member States to develop, in accordance with their obligations under international law, strategies that include countering incitement of terrorist acts motivated by violent extremism and intolerance; and its facilitation of technical assistance for the implementation of resolution 1624 (2005).	0
The Council also deplored the Kosovo Assembly's adoption of the said resolution, and concurred with the Special Representative that such resolutions and decisions by the Assembly, on matters which did not fall within its field of competence, were null and void.	1
For instance, Uzbekistan set out rules for internal control and established penalties for entities failing to report, and Turkmenistan and Uzbekistan introduced strict customer identification and record-keeping procedures.	0
18. Although it is the first time that the United Nations system has embarked on a planning effort of such breadth and complexity, covering virtually all major areas of action in the field of women and peace and security, the system-wide action plan provides a wealth of information on activities being carried out by the United Nations system for women in conflict and post-conflict areas.	0
The great majority of land police border posts lack the tools and equipment to perform their missions, and national border-control agencies do not sufficiently cooperate among themselves or with their counterparts in neighbouring States.	1
Since January, MONUSCO has documented over 100 reported incidents targeting political opposition members and supporters, journalists and human rights defenders.	0
The Team also considers the growing international concern relating to terrorist use of the Internet, and presents views on that issue, as well as across the range of its monitoring activities.	1
8. We are also deeply concerned about the worsening of the scourge of terrorism and violent extremism in the Sahelo-Saharan region, as well as the close links that terrorist armed groups maintain with transnational organized crime, particularly drug and human trafficking, money-laundering and illicit arms trafficking.	1
217. The Commission would, for instance, encourage the establishment of a national programme for reparations. This would not equate simply to monetary compensation. Instead, consideration should be given to the range of necessary measures including acknowledgement of the wrongdoing, compensation for economically assessable damage, full public disclosure of the events in question (including through dissemination of this report), the establishment of rehabilitation programmes, and administrative sanctions against persons within institutions bearing responsibility.	0
Consider applying targeted and graduated measures against parties to armed conflict that threaten peace, attack or obstruct the action of United Nations Peacekeeping or other relevant mission, commit violations of applicable international humanitarian law and human rights law.	0
33. On 3 September, the Government of India informed the United Nations of its decision not to renew the contract for the deployment of six military utility helicopters (Mi-17) to UNMIS beyond 31 October.	0
They also followed the start of the mission by the United Nations Envoy, Mr. Kofi Annan, to reach a peaceful resolution to the Syrian crisis, without resorting to making threats or speaking of foreign intervention.	0
Although I have yet to receive formal responses from the remaining 36 Member States, it is my assessment that sufficient troop pledges to allow the deployment of a multinational force are unlikely to materialize.	0
Remaining funds will be used to support additional mitigation measures, including predeployment training and the establishment of surveillance and alert systems, including canine teams, in MINUSMA camps.	0
Remaining gravely concerned by the threat of terrorism and the risk that non state actors may acquire, develop, traffic in or use nuclear, chemical, and biological weapons and their means of delivery,	1
This invitation as well as the cooperation the Special Rapporteur received during his visit reflects the commitment of the Government of Burkina Faso to ensuring that its efforts to counter terrorism are in line with international human rights laws and standards.	0
Other background materials were also to be collected and analysed in order to identify issues that contributed to the crisis. The Commission would then verify the veracity of the information in these materials and reports, as well as establish further facts, by interviewing witnesses, officials and other persons occupying positions of authority, as well as persons in police custody or detained in prison, and by visiting places where crimes were reportedly perpetrated or other incidents took place.	0
"The Security Council stresses the urgent need to strengthen military and police institutions in Libya.	1
Gender-sensitive relief and social services procedures and eligibility criteria. E.1. Develop, implement and evaluate policies and strategies on gender mainstreaming in all post-conflict reconstruction and rehabilitation programmes.	0
If residents attempt to leave besieged eastern Ghouta, Syrian regime snipers directly target them, leading each month to dozens of civilian deaths.	0
Serious clashes had also erupted between armed factions in the Palestinian refugee camp of Ain el-Hilweh, and a school of the United Nations Relief and Works Agency for Palestine Refugees in the Near East had been hit, causing material damage.	0
After half an hour, three other jeeps arrived from Chad supported by a military helicopter and once again there was a confrontation with the Sudanese military unit in the course of which a soldier and a number of civilians were wounded.	0
10. Further to counter that threat, calls upon all States, in accordance with their national legal authorities and legislation and consistent with international law, to take cooperative action to prevent illicit trafficking in nuclear, chemical or biological weapons, their means of delivery, and related materials;	1
The Commission received evidence that civilians have been abducted by leaders of this camp and detained within the camp, where they were tortured and used for labour.	0
These abuses occurred between August 2002 and January 2003.	1
o On 16 November 2014, regime forces launched mortar shells on Madera Mosque in Rif Dimashq, injuring 4 civilians and heavily damaging the mosque.	0
In addition, many victims informed the Commission that they had little confidence in the impartiality of the Sudanese justice system and its ability to bring to justice the perpetrators of the serious crimes committed in Darfur.	1
However, the situation inside Kosovo today still gives us cause for concern.	1
Some States have begun to acknowledge this by developing comprehensive national counter-terrorism strategies that go beyond traditional law enforcement to involve multiple social actors.	0
Bosnia and Herzegovina expresses its concern about the current political stalemate in establishing a new Government and defining a clear constitutional reform process.	1
In addition, on 29 July, UNOMIG issued a violation report for the establishment of an Abkhaz "taxation" post 50 metres from a CIS peacekeeping force checkpoint in violation of the 12 May 2005 Gali Protocol (see S/2005/453, para. 4).	1
In some cases where the Committee found that the information available was not sufficient to make a decision as to whether a listing remained appropriate, it asked the Team to seek more information. This was especially true for cases where an individual was believed to be dead but for whom there was no death certificate or equivalent official documentation.	0
In consultations of the whole, Council members expressed concern over the ongoing deterioration of the humanitarian situation and condemned the violations of international humanitarian law by all parties to the Syrian conflict.	1
We are convinced that a speedy conclusion of these talks, with the signing of a comprehensive and final peace agreement, will greatly facilitate the efforts to combat terrorism and transnational organized crime in our region.	0
The Commission recommends that the following persons be prosecuted with respect to the illegal possession, use and movement of PNTL weapons on 8 May and/or 21 May: Rogerio Lobato, Eusebio Salsinha, Antonio da Cruz, Vicente da Conceio, aka Rai Los, Mateus dos Santos Pereira, aka Maurakat, Leandro Lobato, aka Grey Harana, Antonio Lurdes, aka 55, Marcos da Silva Piedade, aka Labadae, Francisco and Santa Cruz.	1
Condemning in particular sexual violence perpetrated by [militias and armed groups as well as elements of the national armed and police forces] and other security and intelligence services, stressing the urgent need for the [the affected State], in cooperation with [peacekeeping mission] and other relevant actors, to end such violence and bring the perpetrators, as well as the senior commanders under whom they serve, to justice, and calling on Member States to assist in this regard and to continue to provide medical, humanitarian and other assistance to victims.	1
