en_ar_TRANSFORMERS	MatConf
27 - وفقا للفقرة 13 من قرار مجلس الأمن 1822 (2008)، وبالتنسيق مع الدول المقدمة للأسماء، شرع الفريق في صياغة موجزات سردية لأسباب إدراج جميع الأسماء المدرجة في القائمة في القائمة.	0
وأصيب أحد الجنود بجروح طفيفة في إصبعه نتيجة انفجار قنبلة يدوية.	1
توفير الأمن الخارجي والداخلي (إجراءات الفرز لفصل العناصر المسلحة عن المدنيين؛ وتدابير التسريح ونزع السلاح؛ والمساعدة التقنية والتدريب من جانب الشرطة المدنية الدولية و/أو المراقبين العسكريين؛ وموقع المخيمات على مسافة بعيدة جدا من الحدود الدولية والمناطق المعرضة للخطر؛ والترتيبات الإقليمية ودون الإقليمية).	0
كما أن وجود عناصر متطرفة وما يُدّعى أنها تقوم به من أنشطة يثير القلق.	1
وأدعو السلطات اللبنانية إلى بذل كل جهد ممكن لإلقاء القبض على المسؤولين عن محاولة الاغتيال هذه وتقديمهم إلى العدالة.	0
(ب) تعزيز الأطر التشريعية والتنظيمية لمكافحة تمويل الإرهاب، بوسائل منها تجريم تمويل الإرهاب، واتخاذ التدابير اللازمة لتجميد الأموال دون تأخير، وإجراء تقييمات للمخاطر التي يتعرض لها القطاع غير الربحي؛	0
وقدمت حكومة السودان إلى اللجنة وثيقة تبين الهجمات التي تعرضت لها قوافل المساعدة الإنسانية.	1
وطلب مجلس الأمن مني أيضا في ذلك القرار أن أضع تصميم الميدالية وأن أقدم في الوقت المناسب إلى المجلس طرائق تحديد كيفية ترشيح واختيار الحاصلين على الميدالية، استنادا إلى المعايير المنصوص عليها في القرار.	0
(ب) ساهمت الاضطرابات الاجتماعية المرتبطة بقضايا الاستبعاد التي طال أمدها في استمرار نمط الاحتجاجات وظهور جماعات سياسية ومسلحة في سهول تيراي الجنوبية، مما أوجد مخاطر جديدة على الأطفال، بما في ذلك التشريد والقتل والتجنيد؛	1
ويراقب السكان الضحايا حراس يستخدمون السوط التي يحملونها للسيطرة عليهم وإذلالهم.	1
:: الاستفادة من حلقة العمل المشتركة بين المديرية التنفيذية ومنظمة الأمن والتعاون في أوروبا لوسط آسيا المقرر عقدها في تشرين الثاني/نوفمبر 2010 بشأن القرار 1624 (2005) ومكافحة التحريض بدافع التطرف، من خلال مبادرات مماثلة في مناطق أخرى	0
أعمال التعذيب التي يرتكبها السكان المدنيون	1
وكان بعض المحتجزين قد احتجزوا لمدة 11 شهراً دون توجيه تهمة إليهم أو الاتصال بمحام أو الاتصال بأسرهم.	1
وقامت حركات التمرد أيضا بأعمال نهب استهدفت أساسا مراكز الشرطة للحصول على الأسلحة؛ واستهدف المتمردون أيضا في بضع مناسبات الممتلكات الخاصة.	1
ويبدو أن الغرض منه هو أن تذهب قوات حركة تحرير الكونغو/التجمع الكونغولي من أجل الديمقراطية - الوطني من بلدة إلى أخرى لتدمر كل ما يمكن أن تضع أيديها عليه.	1
والدول مدعوة إلى فحص بصمات الأصابع الواردة في النسخ المقيدة للإخطارات عن طريق قواعد بيانات الشرطة الخاصة بها للتحقق من وجود مباريات داخل نظمها الخاصة (الفرع السادس - جيم، الفقرة 80)	0
وفي بعض الحالات، انطوت الاستجابة الوطنية لاحتواء الفيروس على الاستخدام المفرط للقوة أو الحجر الصحي للمجتمعات المحلية التي هي دون المعايير المعترف بها لكرامة الإنسان.	1
وكانت التدابير التي اتخذتها الحكومة حتى الآن لمعالجة الأزمة غير كافية وغير فعالة إلى حد كبير، مما أسهم في مناخ الإفلات التام تقريبا من العقاب على انتهاكات حقوق الإنسان في دارفور.	1
52- واستخدمت الدولة أيضاً التجويع المتعمد كوسيلة للمراقبة والعقاب في مرافق الاحتجاز.	1
الطلب أن تتضمن تقارير الأمين العام عن الحالات الخاصة ببلدان محددة العنف الجنسي كجانب محدد من جوانب التقرير، بما في ذلك، قدر الإمكان، بيانات مصنفة حسب نوع الجنس وسن الضحايا؛ وطلب وضع استراتيجيات وخطط عمل خاصة بالبعثات لمنع العنف الجنسي والتصدي له، كجزء من استراتيجية أوسع نطاقا لحماية المدنيين.	1
143 - ثانيا، يجب على الحكومة وزعماء المتمردين أن يؤكدوا على الجهود الرامية إلى منع التجاوزات، وحماية الأشخاص المعرضين للخطر، وتقديم المسؤولين عن التجاوزات إلى العدالة.	0
وأفاد بأن قيادة التجمع الكونغولي من أجل الديمقراطية قد أعادت السيطرة على نفسها، وهي في سبيلها إلى جمع خصومها.	1
12 - يهيب بالدول الأعضاء أن تتحرك بقوة وعلى نحو حاسم لوقف تدفق الأموال وغيرها من الأصول المالية والموارد الاقتصادية إلى الأفراد والكيانات المدرجة أسماؤهم في قائمة الجزاءات المفروضة على تنظيم القاعدة، على النحو المطلوب في الفقرة 1 (أ)، مع مراعاة التوصيات ذات الصلة الصادرة عن فرقة العمل المعنية بالإجراءات المالية والمعايير الدولية الرامية إلى منع إساءة استخدام المنظمات التي لا تستهدف الربح ونظم التحويلات غير الرسمية/البديلة وحركة العملات المادية عبر الحدود، مع العمل في الوقت نفسه على التخفيف من أثر ذلك على الأنشطة المشروعة من خلال هذه الوسائط؛	0
”ويقر مجلس الأمن بالجهود التي تبذلها جامعة الدول العربية للإسهام في المساعي الجماعية الرامية إلى تسوية الصراعات في الشرق الأوسط بالوسائل السلمية، فضلا عن تعزيز الاستجابات الدولية للتحولات التي تشهدها المنطقة، ويشجعها كذلك، ويؤكد من جديد التزامه القوي بسيادة واستقلال ووحدة وسلامة أراضي بلدان المنطقة وبمقاصد الميثاق ومبادئه.	0
115 - وهاجم أفراد من الحشود المتظاهرين في غلينو في 8 أيار/مايو اثنين من ضباط الوحدة الشرقية المنزوعين من السلاح، على النحو المبين في الفقرات 61 إلى 63 أعلاه.	1
دخلت شاحنة ميتسوبيشي ستر (Mitsubhishi Cantter) التي كانت تستخدم كحاملة قنابل لبنان من الجمهورية العربية السورية عبر حدود البقاع و"ممر حار" عسكري في الساعة 20/13 من يوم 21 كانون الثاني/يناير 2005 بقيادة عقيد سوري من الفرقة العسكرية العاشرة.	1
ورأت بعثة تقصي الحقائق أنه ينبغي إجراء تحقيق دولي مستقل لإثبات الحقيقة، نظراً إلى التشكيك في مصداقية السلطات اللبنانية التي تجري التحقيق.	0
وأذن المجلس بنشر عملية الأمم المتحدة في بوروندي بقوام أقصاه 650 5 فردا عسكريا، بمن فيهم 200 مراقب و 125 من ضباط الأركان، بحد أقصى يصل إلى 120 فردا من أفراد الشرطة المدنية والموظفين المدنيين المناسبين، على أن يتم نشر عملية الأمم المتحدة في بوروندي اعتبارا من 1 حزيران/يونيه 2004، لفترة أولية مدتها ستة أشهر، على أن تتألف في البداية من قوات البعثة الأفريقية في بوروندي.	1
وتحسنت بشكل كبير إمكانية وصول المساعدات الإنسانية إلى دارفور بسبب الرفع التدريجي للقيود المفروضة على إيصال المساعدات الإنسانية منذ الصيف الماضي.	0
”ويؤكد مجلس الأمن من جديد التزام جميع الدول الأعضاء بتسوية المنازعات وتسوية المنازعات وفقا لميثاق الأمم المتحدة، ويهيب بالمجتمع الدولي أن يساعد، حسب الاقتضاء، في الجهود التي تبذلها المنظمات الإقليمية ودون الإقليمية بهدف تسوية المنازعات بالوسائل السلمية ومنع نشوب الصراعات وحلها وفقا لميثاق الأمم المتحدة وقرارات مجلس الأمن ذات الصلة.	0
46 - واصلت البعثة تنسيق الدعم المقدم لتنفيذ الاستراتيجية الوطنية المتعلقة بالعنف الجنسي والجنساني، التي يجري في إطارها تنفيذ خمسة برامج في مجالات الوقاية والحماية، ومكافحة الإفلات من العقاب، والمساعدة المتعددة القطاعات، وإصلاح قطاع الأمن، والبيانات ورسم الخرائط في مقاطعة إيتوري وكيفو الجنوبية.	0
وهذه التحديات مجتمعة تفرض ضغوطا سياسية على الحكومات وتؤثر تأثيرا مباشرا وخطيرا على السلام والأمن والاستقرار في البلدان المعنية.	0
السيد موساييف (أذربيجان) (تكلم بالانكليزية): بادئ ذي بدء، أود أن أعتذر عن طلب الكلمة مرة أخرى، وكنا نعتقد أنه سيكون من غير المناسب ومن غير المجدي أن نتجاوز التعليقات التي أدلى بها ممثل أرمينيا ومحاولته تضليل مجلس الأمن في صمت.	0
وفي يوم الأحد الماضي، وبمناسبة الذكرى السنوية الحادية والعشرين لحماس، تحدى زعيم حماس هنية استمرار الرئيس عباس في منصبه ريثما يتم حل الانقسام الداخلي.	0
ويقدر عدد المتضررين من النزاع في شمال دارفور، الذي يسجل أقل عدد من ولايات دارفور الثلاث، بـ 200 685 شخص، منهم 000 403 من المشردين داخليا.	1
فعلى سبيل المثال، يتصل عدد كبير منها بالموت والتعذيب والإصابات الشخصية والآلام والكروب الذهنية وأخذ الرهائن والخسائر والأضرار التي تلحق بالممتلكات العقارية والشخصية.	1
ويبدو أن اجتماعا عقد في دمشق بين السيد الحريري والرئيس الأسد في 26 آب/أغسطس 2004 قد أدى إلى وقف الصراع.	1
59 - وسافر فريق الخبراء على نطاق واسع في كوت ديفوار وفي المنطقة دون الإقليمية وفي أماكن أخرى في إطار جهوده الرامية إلى تقييم الامتثال للحظر وتحديد التدابير الإضافية التي يمكن اتخاذها لتحسين فعاليته.	0
وأشار وكيل الأمين العام كذلك إلى أن الأمم المتحدة اكتشفت زيادة في الخطاب الاتهامي الذي توجهه حكومة جنوب السودان إلى بعثة الأمم المتحدة في جنوب السودان وانتهاكات حكومة جنوب السودان لاتفاق مركز قوات البعثة.	0
وسلط الممثل الخاص الضوء على التقدم السياسي الهام، ولا سيما في عملية تشكيل الدولة، ورحب بالعملية الجارية للمصالحة وإنشاء الإدارات المؤقتة.	0
إدانة الهجمات المتعمدة التي تستهدف العاملين في المجال الإنساني والدعوة إلى وقفها فورا.	1
(ج) إساءة معاملة أسرى الحرب الإريتريين؛	1
وقد وُضعت آليات للمساءلة إلى حد كبير لمعالجة المخالفات وضمان اتباع التشريعات والإجراءات المعمول بها، إلا أنها لا توفر الحماية الكافية.	0
ومن أجل التعجيل بالعملية وكفالة توافر عدد كاف من الموظفين المؤهلين، تؤيد اللجنة استكشاف سبل توسيع قاعدة المرشحين المحتملين.	0
وبينما يحتفظ القادة في أفغانستان بدعوتهم الشخصية ومصداقيتهم التاريخية كمؤسسين لتنظيم القاعدة، ومن الأفضل لهم أن يتظاهروا بأن هناك مبررا دينيا للإرهاب، فإن تنظيم القاعدة في العراق، سواء كان يرأسه أبو مصعب الزرقاوي أو خلف له، بتدفقه من الهجمات التي تتصدر عناوينها، يحظى بمناشدة أكبر لمن يطمحون إلى العمل.	1
وأغلقت المدارس التي ترفض التسجيل أو التي لها صلات بمنظمات إرهابية محظورة.	0
وشدد الفريق على أن المهمة الفورية تتمثل في تعميم وثيقة الدوحة لضمان قبولها من جانب سكان دارفور وإقناع بقية الجماعات المسلحة بالتوقيع على الوثيقة.	0
ويشدد على دور الهيئة العليا لوسائط الإعلام، واللجنة الدولية للشخصيات البارزة، واللجنة الدولية لدعم المرحلة الانتقالية، في التشجيع على سير العملية الانتخابية بسلاسة وعلى تهيئة مناخ سياسي هادئ، ويؤكد من جديد دعمه لها.	0
33 - اعتمدت جميع دول الجنوب الأفريقي بعض التدابير التشريعية وغيرها من التدابير ذات الصلة بمكافحة الإرهاب.	0
وتفيد التقارير بأن الأطفال كانوا يتامى نتيجة للنزاع وأن جيش تحرير السودان كان يتولى رعايتهم.	1
وفي حين أنه لا يزال يتعين تحديد العدد الدقيق للمشردين وعدد القرى التي دمرت، فإن التشريد الجماعي وتدمير القرى أمران لا جدال فيهما.	1
”ويشدد مجلس الأمن على أهمية التزام كل من إثيوبيا وإريتريا بإرساء أسس السلام المستدام في المنطقة، وإدراكا منه لمسؤوليات الأمم المتحدة بموجب اتفاقي الجزائر، فإنه لا يزال مصمما على تشجيع البلدين ومساعدتهما على تحقيق هذا الهدف.	0
وأبلغ الممثل الخاص كوبلر المجلس بعدة هجمات شنها تحالف القوى الديمقراطية في الفترة بين 5 و 18 تشرين الأول/أكتوبر، وتسببت في مقتل أكثر من 40 مدنيا ومئات من المشردين داخليا بالقرب من بلدة بيني، في الجزء الشرقي من جمهورية الكونغو الديمقراطية.	1
67 - واستخدمت جمهورية كوريا الشعبية الديمقراطية قواتها البرية والبحرية والاستخباراتية لإجراء عمليات الاختطاف والاعتقال.	1
ووجدت اللجنة أدلة تشير إلى أن القبائل العربية بدأت تستقر في مناطق كان يسكنها النازحون في السابق، مما زاد من الحيلولة دون عودة النازحين في نهاية المطاف.	1
وفي كانون الأول/ديسمبر 2003، هاجم الجنجويد والقوات الحكومية قرية نوري بالقرب من بلدة مورني في غرب دارفور.	1
وأُعرب أيضا عن القلق الشديد إزاء ما أُبلغ عنه من بيانات وشعارات تهديدية ضد موظفي الأمم المتحدة والموظفين الدوليين خلال المظاهرات الأخيرة في أبيدجان.	0
وإذ يشير إلى اتخاذ القرار 2122، وإذ يعيد تأكيد اعتزامه زيادة اهتمامه بقضايا المرأة والسلام والأمن في جميع مجالات العمل المواضيعية ذات الصلة المدرجة في جدول أعماله، بما في ذلك المجالات التي تهدد السلام والأمن الدوليين بسبب الأعمال الإرهابية،	0
وبعد ذلك، قُتل في سوريا.	1
ومن بين المسائل التي تم تحديدها ما يلي: الافتقار إلى سياسة جزاءات واضحة ومحددة جيدا، وعدم كفاية تدريب الموظفين، وإنشاء ثقافة فعالة للامتثال للجزاءات على نطاق المؤسسة، والكفاءة العامة لتكنولوجيات الفرز.	1
وتواصل الميليشيات الهجوم، مدعية أنها ليست جزءا من أي اتفاق، ولم توقفها الحكومة.	1
ويعزى ذلك إلى حد كبير إلى قيادة رئيس الوزراء غوسماو، وكذلك إلى تعاون جميع الأحزاب السياسية الممثلة في البرلمان، بما في ذلك المعارضة، التي أظهرت استعدادها للمضي قدما في مسألة وطنية ذات أولوية.	0
60 - غير أن انتهاكات حقوق الطفل، بما في ذلك العنف الجنسي، لا تزال تشكل مصدر قلق بالغ في جميع أنحاء البلد.	1
(ب) مواصلة الانتباه إلى تطور أحدث التقنيات، من أجل منع إساءة الاستخدام وكشف حالات تمويل الإرهاب من خلال أساليب دفع جديدة؛ ووضع القوانين والأنظمة المناسبة وتعزيز التعاون الدولي في التحقيق في الاشتباه في إساءة استخدام أساليب الدفع الجديدة لغرض تمويل الإرهاب ومقاضاة المسؤولين عن ذلك؛	0
وتم تعديل النظام بموجب القرارين 1333 (2000) و 1390 (2002) لفرض ثلاثة تدابير محددة الهدف (تجميد الأصول، وحظر السفر، وحظر توريد الأسلحة) ضد الأفراد والكيانات المرتبطة بحركة الطالبان وتنظيم القاعدة، والإعفاءات من تجميد الأصول وحظر السفر متاحة، وفي 17 حزيران/يونيه 2011، اتخذ المجلس بالإجماع القرارين 1988 (2011) و 1989 (2011) اللذين قسما النظام إلى اثنين، وأنشأ لجنة لتنظيم القاعدة ولجنة أخرى لحركة الطالبان.	1
ويشدد على أهمية بناء قدرات شرطة وطنية فعالة ومهنية في هايتي.	1
وفي ١١ آب/أغسطس ١٩٧٥، شن اتحاد القوى الديمقراطية هجوما مسلحا وقائيا على الجبهة الثورية لتيمور الشرقية، وشُن الهجوم المضاد في ٢٠ آب/أغسطس ١٩٧٥، وهو اليوم الذي يُحتفل فيه الآن بيوم تأسيس القوات المسلحة للتحرير الوطني لتيمور الشرقية.	1
وعند اختتام أعمال جميع أفرقة المفوضين التابعة للجنة الأمم المتحدة للتعويضات في حزيران/يونيه 2005، تبين أن 1.55 مليون مطالبة (من أصل 2.69 مليون مطالبة) كانت ناجحة.	0
”ويذكِّر مجلس الأمن الدول بأنه يجب عليها أن تكفل امتثال أي تدابير تتخذها لمكافحة الإرهاب لجميع التزاماتها بموجب القانون الدولي، ولا سيما القانون الدولي لحقوق الإنسان والقانون الدولي للاجئين والقانون الإنساني الدولي.	0
109- وقد أُبلغ السيد صادق بأن ت. ت. ت. وبعض المتفجرات الخاصة قد استُخدمت لتوجيه الشكوك نحو الجماعات الإسلامية المتطرفة، لأن هذه الأنواع من المتفجرات لم تُستخدم إلا في عمليات في العراق.	1
44 - وعلاوة على ذلك، تشيد الهيئة بالتقدم المحرز في محادثات الجزائر وتدعو جميع الأطراف، ولا سيما قادة الجماعات المسلحة، إلى المشاركة شخصيا في العملية بغية التوصل إلى اتفاق في أقرب وقت ممكن على أساس المشروع الذي قدمه فريق الوساطة إلى الطرفين، والذي يشكل أساسا صلبا للتفاوض.	0
9 - وبلغ عدد الأفراد العاملين في فيلق حماية كوسوفو 029 3 فردا عاملا، بمن فيهم 157 من الأقليات، في نهاية آب/أغسطس.	1
34 - وفي 8 شباط/فبراير، قام 418 ملتمسا بمسيرة في قصر الرئاسة.	1
وأطلق الرجال من هذه المركبات والجنود في الشارع النار على مركبات الشرطة، مما أدى إلى إصابة أحد ضباط الشرطة الوطنية لتيمور - ليشتي في ساقيه.	1
:: 14 شباط/فبراير 2005، قُتل رفيق الحريري و 22 فردا آخرين في انفجار واسع النطاق في منطقة واجهة بحرية في وسط بيروت.	1
ويشجع مجلس الأمن، في هذا الصدد، جميع دول المنطقة على التوقيع على مدونة قواعد السلوك وتنفيذها في أقرب وقت ممكن، ويدعوها إلى اتخاذ مزيد من التدابير الفعالة على الصعيد الوطني لمكافحة القرصنة والسطو المسلح في البحر في خليج غينيا.	0
ويطالب المجلس بالوقف الفوري لجميع الهجمات التي يشنها جيش الرب للمقاومة ويحث جيش الرب للمقاومة على الإفراج عن جميع المختطفين ونزع سلاحهم وتسريحهم.	0
ورأت الدول الأعضاء في مداخلاتها أن الإرهاب هو أحد أخطر التهديدات للسلم والأمن الدوليين وأن دحره يتطلب جهدا منسقا مستمرا.	0
والاستنتاج الواضح من المادة 33 هو أنه يجوز لأي فرد من أفراد أجهزة الأمن، تحت مظلة القانون، أن يعذب مشتبها فيه، حتى حتى الموت، إذا كانت أفعاله تتم أثناء أداء واجبه.	1
وأضاف أن مبادئ الأمم المتحدة لحفظ السلام، وهي موافقة الأطراف والحياد وعدم استخدام القوة إلا في حالة الدفاع عن النفس والدفاع عن الولاية، قد لا تنطبق دائما على الجماعات الإجرامية المسلحة في البعثات المعاصرة، وأن تطبيقها يمكن استعراضه وتعديله وفقا للتهديدات المعاصرة ولسياق العنف الذي يواجهه المدنيون الأبرياء وأفراد حفظ السلام في مناطق النزاع.	0
وهي تشجعها على مضاعفة جهودها من أجل توفير الأمن للسكان المدنيين الموجودين في أراضيها، بمن فيهم الأجانب الذين تمنحهم اللجوء.	0
