en_ar_TRANSFORMERS	MatConf
وخلال الفترة المشمولة بالتقرير، وُضعت اللمسات الأخيرة على استعراض أولي لتقييم المخاطر في كوسوفو، وبدأت عملية تقييم المخاطر في جميع المناطق.	0
- يجب أيضا منع الإرهابيين من استخدام أنشطة إجرامية أخرى مثل الجريمة المنظمة عبر الوطنية، والاتجار غير المشروع بالمخدرات والمخدرات، وغسل الأموال، والاتجار غير المشروع بالأسلحة؛	1
غير أنه في حين أن التدابير قد تكون محدودة التطبيق في المنطقة الحدودية بين أفغانستان وباكستان أو في المناطق غير المتمتعة بالحكم في الصحراء الجنوبية، فإنها مع ذلك تعالج ثلاثة متطلبات أساسية لجماعة إرهابية هي: المال، والحركة، ووسائل الهجوم.	0
شن الهجوم بشكل رئيسي من قبل الجيش وقام الشعب العربي بالسرقة	1
وستكون زيادة القدرات العسكرية وقدرات الشرطة المتاحة للبعثة إضافة إلى قدرات الشرطة الوطنية الهايتية و 600 3 مساعد محلي لشؤون أمن الانتخابات (انظر S/2005/313، الفقرة 10).	1
وأدى المرسوم إلى زيادة التطورات المتعلقة بإدماج الجماعات المسلحة الكونغولية في القوات المسلحة لجمهورية الكونغو الديمقراطية.	0
وفي مطار أبيدجان، شاهد الفريق في آب/أغسطس 2005 ثلاث مركبات جديدة من طراز ميتسوبيشي L-200 4x4 مسجلة لدى القوات الجوية لكوت ديفوار تُقاد نحو القاعدة العسكرية التي تحمل أفرادا ومعدات.	1
وفي بعض المناطق، توجد أدلة موثوقة على تعرض الأطفال المفرج عنهم من الجماعات المسلحة للمضايقة والتهديد بإعادة تجنيدهم، ولا يزال انعدام الأمن يعوق عملية إعادة الإدماج.	1
وفي آب/أغسطس، وعملا باتفاق أبرم في وقت سابق من عام 2010 بين الحكومة وجماعة المعارضة المسلحة التشادية المسماة حركة الديمقراطية والعدالة في تشاد، تم جمع شمل 58 طفلا، من بينهم 10 فتيات، مع أسرهم.	0
ويسلم مجلس الأمن بالحاجة إلى مشاركة الوكالات الإنسانية بصورة متسقة مع جميع الأطراف في الصراعات المسلحة للأغراض الإنسانية، بما في ذلك الأنشطة الرامية إلى كفالة احترام القانون الإنساني الدولي.	0
وتدرك تركيا إدراكا تاما نوايا الحكومة السورية التي وضعت موضع التنفيذ من خلال مختلف وسائل العدوان والاستفزاز، مثل استهداف المدنيين الأبرياء عبر الحدود.	1
وبناء على ذلك، تم الحصول على 317 مجموعة من الرفات من الأراضي العراقية، وتم التعرف على رفات 232 من أسرى الحرب الكويتيين الذين عُثر عليهم في الأراضي العراقية (تم التعرف على أربعة سجناء آخرين في موقع دفن سبحان في الكويت).	1
609- وتستند توصية اللجنة بإحالة مجلس الأمن إلى المحكمة الجنائية الدولية إلى الافتراض الصحيح بأن المحاكم السودانية غير راغبة وغير قادرة على مقاضاة مرتكبي الجرائم الدولية العديدة التي ارتكبت في دارفور منذ عام 2003.	0
ولم يطرأ حتى الآن أي تحسن على الإصلاح الإداري على الصعيد الوطني.	0
67 - وفي الختام، أود أن أشكر ممثلتي الخاصة، أميرة حق، على قيادتها، وجميع موظفي بعثة الأمم المتحدة المتكاملة في تيمور - ليشتي وفريق الأمم المتحدة القطري على جهودهم المتواصلة في دعم شعب تيمور - ليشتي للنهوض بقضايا السلام والاستقرار والتنمية.	0
وفي المناطق الوسطى، لا تزال الصراعات التي لم تحل تؤثر أيضا على سبل كسب الرزق وتؤخر الانتعاش.	1
وفي الفترة التي سبقت 20 أيار/مايو 2002، نظم السيد لوباتو ومؤيدوه مسيرات للمحاربين القدماء في ديلي.	1
وينبغي الإذن لأجهزة الشرطة والأمن باستخدام أساليب التحقيق الخاصة - مع إيلاء الاعتبار الواجب لحقوق الإنسان - أثناء التحقيقات المتصلة بالإرهاب وفي جمع الأدلة في قضايا مكافحة الإرهاب.	0
وتعرض العاملون في مجال المعونة الإنسانية للمضايقة والاعتداء المتكرر أثناء حوادث اللصوصية.	1
360 - ويتضح من المعلومات التي جمعتها اللجنة وتحققت منها أن الاغتصاب أو غيره من أشكال العنف الجنسي التي ارتكبها الجنجويد والجنود الحكوميون في دارفور كان واسع الانتشار ومنهجيا، وبالتالي يمكن أن يشكل جريمة ضد الإنسانية.	1
وترى هذه الدولة أن هذا النشاط، بأشد أشكاله تطرفاً، كثيراً ما يؤدي إلى التطرف العنيف وفقدان الأرواح.	1
ويتطلب هذا القطاع حماية خاصة من تمويل الإرهاب، لأن إساءة استخدام المنظمات التي لا تستهدف الربح يمكن أن تسبب ضررا دائما للمنظمات نفسها ويمكن أن تثبط العطاء الخيري بوجه عام.	0
”ويحيط مجلس الأمن علما بالتعاون الجاري بين المنظمة البحرية الدولية ومكتب الأمم المتحدة المعني بالمخدرات والجريمة وشعبة شؤون المحيطات وقانون البحار فيما يتعلق بتجميع التشريعات الوطنية المتعلقة بالقرصنة، ويشجع البلدان التي لم تقدم بعد تشريعاتها على القيام بذلك، ويلاحظ أن نسخا من التشريعات الوطنية التي تلقتها الأمانة العامة قد وضعت على موقع الأمم المتحدة على شبكة الإنترنت.	0
205 - وتتأهب دول المنطقة دون الإقليمية بشدة للتهديدات الإرهابية التي تواجهها، وقد استثمرت موارد هائلة في توسيع الأطر القانونية، وإنشاء مؤسسات مكافحة الإرهاب وتعزيزها، والجهود الرامية إلى تعزيز قدرات وكالات إنفاذ القانون والاستخبارات.	0
وما زال من دواعي قلقي البالغ أن الجهود التي يبذلها الليبريون لإعادة بناء نظام محاكمهم ستتطلب قدرا كبيرا من الوقت، ومن المرجح أن يظل النظام نفسه ضعيفا وقابلا للاختراق في الأجل القصير.	0
(أ) التشجيع على وضع أهداف قابلة للقياس للحد من العنف المسلح؛	0
ويجب على الخلايا أو المناطق الفرعية أو الجماعات المرتبطة بها أن تعمل الآن باستقلالية وأن تمول أنشطتها بنفسها.	1
20 - وعلى الرغم من أن اللجنة تعتزم معالجة مسألة التعاون مع المنظمات الدولية والإقليمية ذات الصلة بتعمق كبير في نيسان/أبريل 2007، فإنها تؤيد توصية فريق الرصد بدعوة ممثلي تلك المنظمات، على أساس كل حالة على حدة، إلى الاجتماع باللجنة من أجل تبادل الآراء على نحو يعود بالنفع المتبادل.	0
وتنفذ في ثماني دول تدابير لمنع حركة الأشخاص غير المشروعة عبر الحدود، وتقوم تسع دول برصد ومراقبة استيراد وتصدير الأسلحة والمتفجرات على نحو فعال.	0
في 16 تشرين الثاني/نوفمبر 2014، أعدم تنظيم الدولة الإسلامية في العراق والشام 17 شخصاً في سوق الطوقة في الرقة بعد اتهامهم بالتجسس والعمل مع قوات النظام.	1
وفحص الاستعراض 488 اسما من أسماء الأفراد والجماعات والكيانات الخاضعين لنظام الجزاءات المفروضة على تنظيم القاعدة وحركة الطالبان من أجل تحديث قيودها أو رفعها من القائمة حيثما قررت اللجنة أن إدراجها في القائمة لم يعد مناسبا.	0
وبالنسبة للمؤسسات المصرفية، ينص على هذا الالتزام أيضا لائحة المصرف الوطني التشيكي رقم 1 المؤرخة 8 أيلول/سبتمبر 2003.	0
يقرر بموجب هذا، وقد تلقى طلب [الدولة المتأثرة]، إنشاء محكمة دولية لغرض وحيد هو محاكمة الأشخاص المسؤولين عن الإبادة الجماعية وغيرها من الانتهاكات الجسيمة للقانون الإنساني الدولي المرتكبة في إقليم [الدولة المتضررة] ومواطني [الدولة المتضررة] المسؤولين عن الإبادة الجماعية وغيرها من الانتهاكات المماثلة المرتكبة في أراضي الدول المجاورة، بين [التاريخي.	1
ووردت تقارير عن مناقشات بين المتظاهرين المحتملين وقوات الأمن، وجها لوجه في بعض الحالات.	0
واعتبر أن المساءلة أساسية للمصالحة وأنه يتعين أيضا بذل جهود لمساءلة أعضاء الجماعات المسلحة الذين ارتكبوا انتهاكات جسيمة لحقوق الإنسان.	1
ووصف شهود عيان كيف أُخرجت عينا شاب وأُجبر مرة على الهرب ثم قُتل رميا بالرصاص.	1
(ز) دعم الجهود التي تبذلها الحكومة، إلى جانب الشركاء الدوليين والبلدان المجاورة، لتهيئة بيئة تفضي إلى العودة الطوعية والآمنة والكريمة للمشردين داخليا واللاجئين، أو الإدماج المحلي الطوعي أو إعادة التوطين الطوعيين.	0
ولا تعتبر محكمة دولية مناسبة بالنظر إلى أن الجرائم قيد النظر تتعارض مع القانون المحلي.	1
بيد أنه تجدر الإشارة إلى أنه بينما كان من المفترض رسمياً أن يظل الجيش "الطبقة الثالثة"، مع القيام بدور دفاعي في الغالب، بعد الشرطة والدرك، فإن المروحيات، فضلاً عن وحدات أخرى كالبحرية، قد أُبلغ على نطاق واسع عن نشرها.	1
وعند معالجة حالة هايتي في إطار الأمم المتحدة، يتركز الاهتمام دائما تقريبا على ما يسمى بالمسائل الأمنية، التي تقلل عمليا من الاهتمام العاجل بالمشاكل الهيكلية والاقتصادية والاجتماعية الخطيرة في البلد.	0
216 - واستنادا إلى النتائج التي توصلت إليها اللجنة وإلى التحقيقات اللبنانية حتى الآن، واستنادا إلى الأدلة المادية والوثائقية التي تم جمعها والأدلة التي تم التوصل إليها حتى الآن، هناك أدلة متقاربة تشير إلى تورط لبناني وسوري معا في هذا العمل الإرهابي.	0
ومع ذلك، ولئن كان صحيحاً أن قانون حقوق الإنسان يتيح بعض المرونة في التصدي للتحديات الأمنية، فإن على الدول أن تحترم مبادئ أساسية معينة في جميع الظروف، بما في ذلك مبادئ الضرورة والتناسب والشرعية وعدم التمييز.	0
وقدمت الدول الأعضاء خلال الاستعراض معلومات ستؤدي إلى ما مجموعه 465 تعديلا مقترحا على القائمة (وتغييرات في 217 موجزا سرديا لأسباب الإدراج في القائمة).	0
وقُتل العديد من الأشخاص وأصيب أكثر من 100 شخص بجروح.	1
تنفيذ سياسة بشأن المساواة بين الجنسين وتمكين النساء والفتيات.	0
وسينصب التركيز في الأجل القصير على مراقبة الحدود والموارد الطبيعية في إيتوري، وتقييد حركة عناصر تحالف القوى الديمقراطية/الجيش الوطني لتحرير أوغندا في كيفو الشمالية، والسيطرة على المناطق التي أخلتها القوات الديمقراطية لتحرير رواندا بعد العمليات المشتركة بين البعثة والقوات المسلحة لجمهورية الكونغو الديمقراطية، وتقديم المساعدة إلى الشرطة الوطنية في توفير الأمن للسكان في كيفو الجنوبية.	1
واعتمد في أديس أبابا في 8 تموز/يوليه 2004 بروتوكول إضافي لإنشاء آليات وأجهزة لتنفيذ الاتفاقية.	0
وهذه الآلية ضرورية للتحقيق الكامل في مصير الأشخاص المفقودين.	0
وإذ يعيد أيضا تأكيد قراريه 1368 (2001) المؤرخ 12 أيلول/سبتمبر 2001 و 1373 (2001) المؤرخ 28 أيلول/سبتمبر 2001، وإذ يكرر تأكيد دعمه للجهود الدولية الرامية إلى استئصال جذور الإرهاب، وفقا لميثاق الأمم المتحدة،	0
ويذكّر هذا الإعلان العالم بأنه ينبغي معاملة ضحايا الجريمة بالرحمة والاحترام، وينص على أنه يحق لهم الحصول على العدالة، والمعاملة العادلة، والانتصاف في شكل رد الحق، والتعويض، وغير ذلك من أشكال المساعدة فيما يتعلق بالإصابات التي لحقت بهم.	0
وبغية تسمية أشخاص معينين بوصفهم من المشتبه في ارتكابهم لهذه الجرائم، من الضروري تحديد الجرائم الدولية التي يمكن تحميلهم المسؤولية عنها.	1
ومع ذلك، سيظل للإرهاب أنصاره، لا سيما عندما يُرى أن المزيد من الاحتجاجات السياسية السافرة فاشلة، وعلى الرغم من أن تنظيم القاعدة لن يتمتع أبدا بنداء واسع النطاق، فإن الهجمات ستستمر.	1
38 - ويوصي الفريق بأن يشجع مجلس الأمن واللجنة الدول على تحديد أو إنشاء آليات وطنية لتحديد واستهداف الأفراد والكيانات لإدراجها في القائمة الموحدة استنادا إلى سلطة قانونية واضحة المعالم متميزة عن العملية الجنائية.	0
جلسة مجلس الأمن المواضيعية بشأن مكافحة الإرهاب	0
72 - يطلب إلى اللجنة أن تقدم تقريرا شفويا، عن طريق رئيسها، مرة واحدة في السنة على الأقل، إلى المجلس عن حالة مجمل عمل اللجنة وفريق الرصد، وأن تقدم، حسب الاقتضاء، بالاقتران مع التقارير المقدمة من رئيسي لجنة مكافحة الإرهاب واللجنة المنشأة عملا بالقرار 1540 (2004)، ويعرب عن اعتزامه عقد مشاورات غير رسمية مرة واحدة في السنة على الأقل بشأن عمل اللجنة، على أساس التقارير المقدمة من الرئيس إلى المجلس، ويطلب كذلك إلى الرئيس أن يعقد جلسات إحاطة دورية لجميع الدول الأعضاء المهتمة؛	0
وقد استغلت المجموعة الحدود التي يسهل اختراقها بين نيجيريا والكاميرون واختطفت مواطنين أجانب في الكاميرون.	1
وكلما ارتفع عدد الضحايا، أو زادت هجماتهم حدة، كلما زادت التغطية الإعلامية على الأرجح.	1
الاتجار بالمخدرات والجريمة المنظمة عبر الوطنية	1
وقد دعم الاتجار بالفحم عبر الحدود حركة الشباب، وشن غاراتها على كينيا.	1
ويُعتقد أن المدفوعات المتأتية من الإفراج عن السفن والبضائع المحجوزة وأطقم السفن المصادرة يمكن أن تستخدم في تمويل الجماعات أو الأنشطة الإرهابية.	0
وأُبلغ أيضاً عن وقوع حوادث حبس للسكان المدنيين، مصحوبة بحالات إعدام تعسفي، فضلاً عن وقوع وفيات بين المدنيين نتيجة للهجمات الجوية العشوائية التي تشنها القوات الحكومية.	1
وقد يكون هؤلاء الأفراد مسؤولين، بموجب مبدأ العمل الإجرامي المشترك، عن جرائم الحرب المرتكبة أثناء الهجمات، أي قتل المدنيين وتدمير الأعيان المدنية والنهب.	1
إن هذه التصريحات العدوانية والفظيعة وغير المقبولة والمهددة التي يدلي بها الرئيس الأوغندي تشكل انتهاكا صارخا لميثاق الأمم المتحدة، ولا سيما المادة 2 (4) التي تنص بوضوح على أن "يمتنع جميع الأعضاء في علاقاتهم الدولية عن التهديد باستعمال القوة أو استعمالها ضد السلامة الإقليمية أو الاستقلال السياسي لأي دولة، أو بأي طريقة أخرى لا تتفق مع مقاصد الأمم المتحدة".	0
ويمكن الاستدلال على وعي الجناة بأن أفعالهم العنيفة كانت جزءاً من هجوم منهجي على المدنيين من جملة أمور منها أنهم كانوا يدركون أنهم سيفلتون في الواقع من العقاب.	1
إن خطة الإرهابيين البشعة التي اختتمت صباح يوم 18 آذار/مارس بتفجير آخر في حلب، يواصل إرهابيو التكفير، جنبا إلى جنب مع من يقفون إلى جانبهم ويدعمونهم ويقدمون لهم الأموال والأسلحة علنا، القيام بعمليات إرهابية في إطار مؤامرة موجهة ضد سورية وشعبها ومؤسساتها.	1
11 - ومن الناحية النظرية، فإن أي واردات من الأسلحة الخفيفة يجب أن تمنحها الجماعة الاقتصادية لدول غرب أفريقيا استثناء في أبوجا.	1
94 - وعلى الرغم من التقدم المحرز مؤخرا، فإن القيود اللوجستية والسياسية والأمنية ستجعل من الصعب للغاية تسريح وإعادة إدماج 000 180 مقاتل سابق بحلول نهاية فترة اتفاق السلام الشامل.	1
424 - إن سطو الجنجويد على الشرطة هو اتجاه بدأ حتى قبل الأزمة الحالية ويمكن اكتشافه من المعلومات التي تقدمها الحكومة نفسها.	1
7 - وستواصل المديرية التنفيذية تعزيز تعاونها مع هيئات الأمم المتحدة ذات الصلة، بما في ذلك فريق الدعم التحليلي ورصد الجزاءات المنشأ عملا بقرار مجلس الأمن 1526 (2004) وفريق الخبراء الذي يساعد لجنة مجلس الأمن المنشأة عملا بالقرار 1540 (2004)، وكذلك مع مختلف المنظمات الدولية والإقليمية ودون الإقليمية، بما في ذلك في سياق زيارات اللجنة للدول.	0
يدعو [البعثة] إلى تعزيز قدرتها على إدارة النزاعات عن طريق إنجاز استراتيجيتها المتكاملة في أقرب وقت ممكن لدعم الآليات المحلية لتسوية النزاعات القبلية من أجل توفير أقصى قدر ممكن من الحماية للمدنيين؛ ويرحب بوضع استراتيجية شاملة بشأن حماية المدنيين ويشجع [البعثة] على مواصلة واستكمال عملها بشأن الاستراتيجية في الوقت المناسب؛ ويهيب مرة أخرى بـ [البعثة]، بما يتسق مع ولايتها وقدراتها الحالية، القيام بدوريات نشطة في المناطق المعرضة بشدة لخطر نشوب نزاع محلي.	0
ويرحب مجلس الأمن باختتام عملية التسجيل السلمي لاستفتاء جنوب السودان في السودان، ويشجع الطرفين على مواصلة هذا الزخم من أجل إجراء استفتاءات سلمية وذات مصداقية في 9 كانون الثاني/يناير 2011 تعكس إرادة الشعب.	0
وبغية تنفيذ برنامج العمل التاسع بمزيد من الكفاءة، ولكي يكون عمل الخبراء أكثر وضوحا وفعالية توجيها، ستقوم اللجنة بتشغيل نظام من الأفرقة العاملة، مفتوح لجميع أعضاء اللجنة المنشأة عملا بالقرار 1540 (2004) وسيركز الفريقان العاملان على المسائل الهامة والمتكررة.	0
وإذ يؤكد الحاجة الملحة إلى تنفيذ إصلاح شامل لقطاع الأمن وتحقيق نزع سلاح الجماعات المسلحة [الوطنية] وتسريحها وإعادة إدماجها، ونزع سلاح الجماعات المسلحة الأجنبية وتسريحها وإعادتها إلى الوطن وإعادة توطينها وإعادة إدماجها، حسب الاقتضاء، من أجل تحقيق الاستقرار في [البلد المتضرر] على المدى الطويل، بالنظر إلى ضرورة تهيئة الظروف الأمنية اللازمة لكفالة التنمية الاقتصادية المستدامة، وإذ يشدد على أهمية المساهمة التي يقدمها الشركاء الدوليون في هذه الميادين.	0
ويتعين علينا مرة أخرى أن نعلن أن العنف الذي اندلع في مقاطعة غالي هو نتيجة منطقية لتصاعد حالة الانتهاكات الجسيمة لحقوق السكان المسالمين من جانب النظام الأبخازي، التي تحرض على تهريب الأسلحة والمخدرات.	1
ومُوِّل جزء كبير من الجهد المكثف لتمكين الوحدات التابعة للبعثة المتكاملة من التصدي بشكل مستدام لخطر الألغام والأجهزة المتفجرة المرتجلة من خلال الصندوق الاستئماني للبعثة.	0
وعلى الرغم من تلك التحديات، لا يسعنا إلا أن نعترف بأن ما يقرب من 50 في المائة من السكان الأفغان يعيشون في مناطق تم فيها تسليم المسؤولية عن الأمن إلى قوات الأمن الأفغانية.	0
47 - تواصل الجماعات المدرجة في القائمة المنتسبة إلى تنظيم القاعدة وحركة الطالبان جمع الأموال بالوسائل القانونية، مثل الهبات والمؤسسات التجارية المشروعة، وبشكل غير قانوني، من قبيل الاختطاف طلبا للفدية، والابتزاز، والاتجار بالمخدرات، والضرائب غير المشروعة.	1
31 - وفيما يتعلق بالتنسيق الداخلي، أنشأت دول آسيوية كثيرة وكالات أو هيئات مركزية مكلفة بتنسيق أنشطة مكافحة الإرهاب وتحليل الاستخبارات ذات الصلة، بما في ذلك ما يتعلق بالتحريض.	0
