en_es_GOOGLE	MatCoop
El Consejo tiene la intención de seguir luchando enérgicamente contra la impunidad con medios apropiados y llama la atención sobre toda la gama de mecanismos de justicia y reconciliación que deben considerarse, incluidas cortes y tribunales penales nacionales, internacionales y &quot;mixtos&quot; y comisiones de verdad y reconciliación.	1
59. El Grupo de Expertos viajó mucho por Côte d&#39;Ivoire, la subregión y otros lugares en sus esfuerzos por evaluar el cumplimiento del embargo y determinar qué medidas adicionales podrían adoptarse para mejorar su eficacia.	1
&quot;El 30 de octubre de 2006, el Consejo de Seguridad escuchó al Sr. Elie Doté, Primer Ministro de la República Centroafricana, así como al General Lamine Cissé, Representante Especial del Secretario General.	1
Uganda no apoya a ninguna milicia congoleña, como afirma el Representante Permanente de la República Democrática del Congo.	0
En abril de 2004, un grupo de 40 mujeres desplazadas fue a recoger leña a las afueras de Mukjar, en Darfur occidental, y, según informes, fue atacado por seis Janjaweed armados.	0
67. Sigo preocupado por el continuo acceso restringido a los servicios básicos, incluidos la atención de salud y las escuelas, que enfrentan los ciudadanos comunes en todo el norte de Malí.	0
Se comparte constantemente información sobre las operaciones marroquíes de remoción de minas con el Centro de Coordinación de Actividades relativas a las Minas.	0
&quot;El Consejo de Seguridad considera que los refugios para terroristas siguen siendo una preocupación importante y reafirma la necesidad de que los Estados fortalezcan la cooperación para encontrar, negar refugio y llevar ante la justicia, sobre la base del principio de extraditar o procesar, a cualquier persona quien apoye, facilite, participe o intente participar en la financiación, planificación, preparación o comisión de actos terroristas o proporcione refugios seguros.	0
Mientras tanto, el Gobierno de Transición de la República Democrática del Congo sigue considerando emitir órdenes de detención internacionales contra los líderes de los grupos armados de Ituri.	0
La rehabilitación de las cárceles y centros de detención de Kosovo, que se encontraban en muy malas condiciones, también ha sido una alta prioridad para el Departamento de Justicia de la UNMIK.	1
140. En algunas de sus visitas, en particular a Estados menos desarrollados, el Equipo ha descubierto que los organismos nacionales pertinentes que participan en la lucha contra el terrorismo carecen de fondos suficientes, en particular en la esfera de la seguridad fronteriza, hasta el punto de que funcionarios relativamente superiores carecen de acceso a computadoras y otras tecnologías relevantes y otros tienen poco o ningún personal para realizar tareas críticas.	1
Fue especialmente preocupante la pauta de presuntas faltas graves de conducta de agentes de la Policía Nacional de Haití, incluida su presunta participación en la ejecución sumaria de al menos nueve personas el 20 de agosto en un partido de fútbol en la zona de Martissant, en Puerto Príncipe.	0
Al expresar su profunda solidaridad con las víctimas del terrorismo y sus familias, destaca la importancia de ayudar a las víctimas del terrorismo y brindarles a ellas y a sus familias apoyo para afrontar su pérdida y su dolor, reconoce el importante papel que desempeñan las redes de víctimas y supervivientes para contrarrestar terrorismo, incluso denunciando con valentía las ideologías violentas y extremistas y, en este sentido, acoge con beneplácito y alienta los esfuerzos y actividades de los Estados Miembros y del sistema de las Naciones Unidas, incluido el Equipo Especial sobre la Ejecución de la Lucha contra el Terrorismo (CTITF) en este ámbito,	0
Esto afecta la capacidad de la Misión para redesplegar rápidamente personal uniformado para proteger a los civiles amenazados en el oeste, si la situación así lo requiere, así como para apoyar las actividades más amplias del equipo en el país.	1
90. En el párrafo 4 de la resolución 1624 (2005) se destaca que &quot;los Estados deben garantizar que cualquier medida que adopten para aplicar los párrafos 1, 2 y 3 de esta resolución cumpla con todas sus obligaciones en virtud del derecho internacional, en particular el derecho internacional de los derechos humanos, el derecho de los refugiados y el derecho humanitario&quot;.	0
De manera similar, 26 Estados han informado sobre medidas plenas para regular y controlar la importación y exportación de armas y explosivos, mientras que falta información respecto de los 4 restantes.	1
c) Fortalecer los programas de supervisión judicial de las actividades policiales y promover el diálogo continuo con los mecanismos internacionales y regionales pertinentes con miras a garantizar el cumplimiento de las obligaciones internacionales de derechos humanos en el contexto de la lucha contra el terrorismo.	1
El Fiscal expresó su preocupación por las cuestiones no resueltas relativas a las personas detenidas en Libia y el desplazamiento masivo de los tawerghanos.	0
Insta a los Estados Miembros, de conformidad con el Programa de Acción de las Naciones Unidas sobre armas pequeñas y ligeras para prevenir, combatir y eliminar el tráfico ilícito de armas pequeñas y ligeras, a adoptar medidas eficaces mediante, entre otras cosas, la resolución de conflictos y el desarrollo y aplicación de la legislación nacional, de manera compatible con las responsabilidades existentes de los Estados en virtud del derecho internacional pertinente, para controlar el tráfico ilícito de armas pequeñas a partes en conflictos armados que no respetan plenamente las disposiciones pertinentes del derecho internacional aplicable relativas a los derechos y protección de los niños en los conflictos armados.	1
:: Es necesario un seguimiento más coherente de las conclusiones y recomendaciones de los mecanismos de investigación para garantizar su eficacia y credibilidad y satisfacer las expectativas que suscita su establecimiento, especialmente entre las víctimas.	0
429. El Gobierno citó también su reconocimiento de tres casos de atentados con bombas por error. Afirmó que indemnizó a las víctimas de Habila, Umm Gozin y Tulo.	0
Los repetidos ataques contra diplomáticos internacionales en Bengasi y Trípoli demuestran esa presencia.	0
Condenar y pedir el cese inmediato de los ataques dirigidos deliberadamente contra trabajadores humanitarios.	0
18. Toma nota de la entrada en vigor de la Convención sobre el empleo, almacenamiento, producción y transferencia de minas antipersonal y su destrucción, de 1997, y del Protocolo enmendado sobre prohibiciones o restricciones del empleo de minas, armas trampa y otros dispositivos (Protocolo II) anejo a la Convención sobre prohibiciones o restricciones del empleo de ciertas armas convencionales que pueden considerarse excesivamente nocivas o de efectos indiscriminados, de 1980, recuerda las disposiciones pertinentes contenidas en ella y señala el efecto beneficioso que su aplicación tendrá sobre la seguridad de los civiles;	1
27. Al final del período que abarca el informe, los efectivos policiales de la UNMIK se acercaban a los 4.400 agentes de 53 países, lo que representa más del 90% del total autorizado para la Misión.	0
b) Libre acceso a todos los lugares y establecimientos pertinentes para la labor de la Comisión;	1
Expediente: Orden de investigación emitida por el primer juez de instrucción del tribunal militar de Beirut Nº 23/2005, de fecha 14 de febrero de 2005.	1
Además, el propio Consejo ha sentado precedentes importantes, incluido el establecimiento de comisiones de investigación sobre Bosnia, Ruanda y Darfur que allanaron el camino para los tribunales internacionales para la ex Yugoslavia y Ruanda en 1993 y 1994, respectivamente, y la remisión del proceso situación en Darfur a la CPI en 2005.	1
Por lo tanto, al examinar la responsabilidad por las violaciones de derechos humanos perpetradas durante los acontecimientos del 25 y 26 de marzo, también habría que tener en cuenta las repercusiones del decreto presidencial del 22 de marzo y de las instrucciones dadas a los jefes de las fuerzas armadas nacionales. durante la reunión del 24 de marzo.	0
38. Alienta a todos los Estados miembros, en particular los Estados designantes y los Estados de residencia o nacionalidad, a presentar al Comité información adicional de identificación y de otro tipo, junto con documentación de respaldo, sobre las personas, grupos, empresas y entidades incluidos en la lista, incluidas actualizaciones sobre el estado operativo. de entidades, grupos y empresas incluidos en la lista, el movimiento, el encarcelamiento o la muerte de personas incluidas en la lista y otros acontecimientos importantes, a medida que dicha información esté disponible;	0
A finales de septiembre, la MINURCAT completó la remodelación de la prisión de Iriba, que mejoró tanto las condiciones de detención de los reclusos como la seguridad de la prisión.	1
Como se explica más adelante, la Comisión ha reunido material muy sustancial que considera que corrobora el uso del término Janjaweed, en el contexto limitado del mandato de la Comisión, como término genérico para describir a las milicias árabes que actúan, bajo la autoridad, con el apoyo, la complicidad o tolerancia de las autoridades del Estado sudanés y que gozan de impunidad por sus acciones.	1
Sin embargo, la situación siguió siendo precaria para muchos otros, con una escalada en la gravedad -si no en la frecuencia- de los ataques por motivos étnicos.	0
El Grupo de las Naciones Unidas para el Desarrollo colabora con los Comités Ejecutivos en apoyo del objetivo más amplio de la consolidación de la paz y desarrolla políticas, directrices y procedimientos para mejorar el trabajo de la red de equipos de las Naciones Unidas en los países.	1
La mayoría de los niños anteriormente asociados con grupos armados en Nepal han abandonado los grupos armados sin ninguna medida para su recuperación y reintegración, ni un marco para su protección.	1
Que los resultados finales de seguimiento y evaluación recibidos del estudio de la costa petrolera de Arabia Saudita se tengan en cuenta cuando la Comisión supervise el uso de adjudicaciones para actividades de remediación ambiental, incluida la adjudicación para la reclamación de la Comisión No. 5000451.	0
7. Observa con preocupación los informes de seguimiento de los medios de comunicación de la ONUCI y los medios de comunicación a los que se hace referencia en ellos por incitar a la violencia y la reanudación del conflicto interno y destaca que sigue dispuesta a imponer sanciones contra quienes obstruyan el proceso electoral, específicamente la acción de la Comisión Electoral Independiente y todos los demás operadores involucrados, y la proclamación y certificación de los resultados de las elecciones presidenciales y parlamentarias;	0
62. Con respecto a las tareas relacionadas con la matriz, el acuerdo por parte del Comité sobre un nuevo formato fue un importante paso adelante.	0
Si bien la Comisión consideró todos los acontecimientos relevantes para el actual conflicto en Darfur, se centró en particular en los incidentes que ocurrieron desde febrero de 2003, cuando la magnitud, intensidad y consistencia de los incidentes aumentaron notablemente, hasta mediados de enero de 2005, justo antes de que se requiriera a la Comisión. para presentar su informe. 3. Métodos de trabajo	1
No obstante, la UNCC parece ser un ejemplo excepcional en el que todos los miembros del Consejo pudieron llegar a un acuerdo y, posiblemente incluso más importante, se estableció un mecanismo para garantizar fondos para el pago de la compensación como resultado de la capacidad de las Naciones Unidas para controlar las exportaciones de petróleo de Irak.	1
El Comité reconoce que la falta de presentación de informes podría ser un signo de una &quot;fatiga general de presentación de informes&quot; causada por el número de informes que los Estados Miembros han tenido que presentar al Comité, al Comité contra el Terrorismo, al Comité establecido en virtud de la resolución 1540 (2004 ) y otros órganos de las Naciones Unidas.	1
26. Además, en el examen amplio se reconoció el importante número de medidas que los Estados han adoptado para cumplir las obligaciones dimanantes de la resolución 1540 (2004), pero se identificaron algunas esferas en las que los Estados han adoptado menos medidas, como las armas biológicas, los sistemas vectores, el control nacional listas, y acceso a materiales relacionados y financiación de actividades de proliferación prohibidas o ilícitas.	1
La Oficina de Información y Administración supervisará las evaluaciones de fin de ciclo en el sistema electrónico de evaluación del desempeño (e-PAS) de todo el personal de la Dirección Ejecutiva y ayudará a todos los funcionarios que participan en la nueva iniciativa voluntaria de intercambio de redes para promover la movilidad a través de transferencias laterales de personal en grupos en red, como la red ocupacional política, de paz y seguridad.	1
Más allá de la zona de responsabilidad de la MINURCAT, en el este del Chad, otros acontecimientos también son motivo de preocupación.	0
El órgano de supervisión, el Consejo Superior del Ministerio Público, aún no se ha creado.	0
Una mayor evolución de la situación en esa dirección amenazaría los esfuerzos por restaurar y reconstruir el país y, a largo plazo, amenazaría la paz y la estabilidad en toda la región.	0
Son accesibles a través del sitio web de INTERPOL y pueden imprimirse y distribuirse, junto con otra información policial, en los puestos fronterizos que no tienen conexión a Internet.	1
4. Durante todo el período de su mandato, el Grupo de Supervisión mantuvo informado al Comité del Consejo de Seguridad establecido en virtud de la resolución 751 (1992) de sus actividades presentando informes sobre los progresos realizados cada dos semanas a través de la Secretaría de las Naciones Unidas y proporcionando una sesión informativa de mitad de período en las Naciones Unidas. Sede en Nueva York en julio de 2005.	0
La implementación efectiva de las tareas de protección involucra a una amplia gama de actores. Requiere consultas estrechas, incluso entre el Consejo de Seguridad, la Secretaría y los países que aportan contingentes y policías, antes del establecimiento y durante todo el ciclo de vida de las misiones de mantenimiento de la paz.	1
Para ello, uno de los instrumentos a disposición de los Estados Miembros es el Registro de Armas Convencionales de las Naciones Unidas. Incluye datos proporcionados por los Estados sobre transferencias internacionales de armas, así como información sobre existencias militares, adquisiciones a través de la producción nacional y políticas pertinentes.	1
57. Además, la Organización de Aviación Civil Internacional y la Organización Marítima Internacional, así como asociaciones industriales no gubernamentales como la Asociación de Transporte Aéreo Internacional, han establecido y actualizado periódicamente normas de conducta para sus miembros y para el transporte de cargas peligrosas, incluidos envíos de municiones y explosivos.	1
En la resolución 1624 (2005) del Consejo de Seguridad, que se centra en la amenaza que plantea la incitación a cometer actos terroristas, el Consejo destaca que los Estados deben garantizar que cualquier medida que adopten para aplicar la resolución cumpla con todas sus obligaciones en virtud del derecho internacional, incluido el derecho internacional en materia de derechos humanos. ley de derechos.	0
El presidente Al-Bashir tomó represalias diplomáticas contra la decisión de Kenia y amenazó con sanciones económicas y comerciales.	0
La Comisión sabía que un comité creado por el Wali de Darfur del Sur estaba llevando a cabo una investigación administrativa en vista de la gravedad de la acusación y de sus consecuencias, que exigen acelerar las medidas pertinentes.	1
Anunció que el Secretario General había recibido la solicitud de admisión de Timor Oriental como Miembro de las Naciones Unidas y esperaba con interés que el Consejo la examinara.	0
Incorporación de la perspectiva de género en respuestas coordinadas para prevenir y responder a conflictos armados y emergencias humanitarias.	1
96. La Comisión observó que la Ley de las Fuerzas de Seguridad Nacional, modificada en 2001, otorga a las fuerzas de seguridad poderes de amplio alcance, incluida la facultad de detener sin cargos ni acceso a un juez por hasta nueve meses.	0
En relación con las F-FDTL, un decreto-ley establece la estructura del ejército, pero las leyes que rigen la disciplina y la carrera militar son las leyes de la UNTAET.	1
A través de sus tres grupos de trabajo, sobre estrategia marítima, marco jurídico y pesca, el Mecanismo ha estado apoyando, con financiación del Reino Unido, a los puntos focales de lucha contra la piratería en el Gobierno Federal y en cada región.	1
La Comisión ha contado con el informe de la Comisión de Expertos encargada de revisar el enjuiciamiento de violaciones graves de los derechos humanos en Timor-Leste (entonces Timor Oriental) en 1999 (véase S/2005/48). Esa evaluación observó con preocupación la interpretación del Fiscal General de que su responsabilidad ante el Presidente en virtud de la Constitución le exigía seguir la política de este último en relación con los procesamientos.	1
18. Durante el período que abarca el informe, los ataques de grupos extremistas en el norte de Malí y la escalada de violencia en el noreste de Nigeria tuvieron efectos adversos en la seguridad y la estabilidad de la región. De particular preocupación ha sido el impacto de la violencia relacionada con Boko Haram en la parte sur del Níger y en el extremo norte del Camerún.	0
En este contexto, la Unión Europea recuerda a Israel su obligación de garantizar el acceso pleno y seguro de las organizaciones humanitarias, incluida la Agencia de Obras Públicas y Socorro de las Naciones Unidas para los Refugiados de Palestina en el Cercano Oriente (OOPS).	0
Ha capacitado a más de 20 organizaciones de derechos humanos en técnicas de monitoreo y se ha asociado con una organización no gubernamental nacional para facilitar la producción y difusión de materiales de concientización a más de 30.000 personas y organizaciones de la sociedad civil, con el apoyo financiero de la Oficina del Alto Comisionado de las Naciones Unidas. de Derechos Humanos y la Embajada de Canadá.	1
En el caso de África, el Consejo abordó la grave situación en la frontera entre Ruanda y la República Democrática del Congo, revisó el continuo estancamiento político entre Etiopía y Eritrea, evaluó la implementación del embargo de armas a Somalia y reforzó los esfuerzos para reactivar el estancado proceso político en Costa de Marfil.	1
El Equipo informa sobre los progresos realizados por la comunidad internacional en la restricción de la circulación de los terroristas y sus partidarios, incluida la reciente iniciativa conjunta de Interpol y el Consejo de Seguridad, que dio lugar a un aviso internacional, completo con identidad, descripción, fotografías y huellas dactilares. para personas en la Lista Consolidada.	1
Medidas que garanticen la protección y el respeto de los derechos humanos de las mujeres y las niñas, en particular en lo que se refiere a la constitución, el sistema electoral, la policía y el poder judicial.	1
f) Adoptar medidas inmediatas para impedir que agentes de la República Popular Democrática de Corea lleven a cabo nuevos secuestros desde territorio chino; procesar y castigar adecuadamente a los autores de secuestros aprehendidos y exigir la extradición de quienes dieron esas órdenes para que puedan ser juzgados conforme a la ley.	0
El control fronterizo exige establecer medidas y prácticas para el control adecuado de los viajeros, refugiados y solicitantes de asilo, el control e inspección eficaces de la carga y el equipaje de los viajeros, y la detección y prevención del contrabando de armas pequeñas y ligeras, así como como efectivo e instrumentos negociables al portador.	1
Por ejemplo, la sentencia en un caso conocido como Jagre al-Hadi al-Makbul y otros describe cómo una combinación de 39 miembros de la policía y fuerzas populares armadas dejó a los habitantes de Thabit a merced de un gran contingente de atacantes fursan.	0
En el Iraq y el Afganistán, Al-Qaida, los talibanes y los grupos asociados seguirán utilizando material de grado militar para construir artefactos explosivos improvisados mientras se agoten los suministros y sea posible adquirirlos.	0
Subraya que está plenamente preparado para imponer medidas específicas contra personas... que estén determinadas a ser, entre otras cosas:...	0
En sus declaraciones públicas, el coronel Al-Qadhafi y miembros de su familia han seguido amenazando a los ciudadanos con una guerra civil y la posibilidad de matanzas en masa si continúan las protestas.	0
520. No se debe descartar la posibilidad de que en algunos casos individuos individuales, incluidos funcionarios gubernamentales, puedan tener una intención genocida o, en otras palabras, atacar a las víctimas con la intención específica de aniquilar, en parte, a un grupo percibido como hostil. grupo étnico.	0
El Consejo de Seguridad alienta a los Estados miembros a desarrollar estrategias antiterroristas amplias e integradas.	1
Exhorta a todas las partes interesadas a garantizar que todos los procesos de paz, los acuerdos de paz y los planes de recuperación y reconstrucción posconflicto... incluyan medidas específicas para la protección de los civiles, incluido el restablecimiento del Estado de derecho.	0
Sin embargo, los Estados del Caribe han adoptado el Tratado del Caribe sobre asistencia judicial recíproca en asuntos penales graves (incluidos los delitos relacionados con el terrorismo, la financiación del terrorismo, el blanqueo de dinero y el tráfico de drogas).	1
Como se señaló anteriormente, a estos grupos se les permitió marchar en diciembre de 2003 durante una prohibición previa de manifestaciones.	0
55. Para mejorar su apoyo logístico a los contingentes y la policía desplegados en los entornos más difíciles de Malí, la Misión ha asignado personal de apoyo civil para facilitar la planificación logística y la presentación de informes de algunas unidades militares desplegadas en Kidal y Tessalit.	1
&quot;El Consejo de Seguridad reitera su firme apoyo a la aprobación por la Asamblea General de la Estrategia global de las Naciones Unidas contra el terrorismo (A/60/288), de 8 de septiembre de 2006, y a la institucionalización del CTITF, de conformidad con la resolución 64/235 de la Asamblea General. , para garantizar la coordinación y coherencia generales en los esfuerzos antiterroristas del sistema de las Naciones Unidas, y la plena participación, dentro de sus mandatos, de los órganos subsidiarios pertinentes del Consejo de Seguridad en la labor del CTITF y sus grupos de trabajo, y acoge con satisfacción la aprobación por parte del Asamblea General de la resolución 64/297.	0
20. La situación en el valle de Kodori se mantuvo sin cambios. El 22 de septiembre, la UNOMIG y la fuerza de mantenimiento de la paz de la CEI realizaron una patrulla conjunta en el valle del bajo Kodori, controlado por Abjasia, y comunicaron que la situación allí estaba en calma.	1
:: El Comité concederá gran importancia a la coordinación con expertos de otros órganos subsidiarios del Consejo de Seguridad relacionados con la lucha contra el terrorismo a la hora de preparar visitas y simplificar la presentación de informes.	0
Para la región del Sahel, la UNODC elaboró dos guías prácticas para ayudar a los funcionarios de justicia penal a abordar las actividades terroristas.	1
En lugar del famoso logo de la Copa del Mundo de 2014, en el que tres manos victoriosas sostienen el globo, creando juntas el prestigioso trofeo, la caricatura de la Autoridad Palestina muestra un &quot;trofeo&quot; de tres manos que sostienen a tres personas con las manos en alto en señal de rendición.	0
Al final del período que abarca el informe, la AMIS contaba con una fuerza de protección de 4.100 soldados, 634 observadores militares, 862 agentes de policía y personal civil internacional.	1
23. El Comité desea expresar su agradecimiento al Equipo de Vigilancia por el informe de alta calidad y las recomendaciones que contiene, así como por el apoyo y la asistencia altamente profesionales brindados al Comité y espera recibir el séptimo informe, que se presentará por el Equipo de conformidad con el anexo II de la resolución 1735 (2006), el 30 de septiembre de 2007.	0
Decide que [la misión] tendrá el siguiente mandato en este orden de prioridad: Protección de los civiles g) Apoyar los esfuerzos del Gobierno, junto con los socios internacionales y los países vecinos, para crear un entorno propicio al regreso voluntario, seguro y digno de desplazados internos y refugiados, o integración o reasentamiento local voluntario.	1
El acceso humanitario en Darfur ha mejorado espectacularmente debido al levantamiento gradual de las restricciones a la prestación de asistencia humanitaria desde el verano pasado.	1
Las armas fueron confiscadas por el oficial de armas del buque estadounidense y posteriormente entregadas a las autoridades yemeníes.	0
