en_es_GOOGLE	MatCoop
12. Observando los avances en la reforma del poder judicial, incluido el establecimiento del Tribunal Constitucional, la Cour de Cassation y el Consejo de Estado previsto en la Constitución, el Ministro de Justicia destacó la importancia de establecer tribunales en cada uno de los 145 territorios para restaurar efectivamente la autoridad del Estado y resolver disputas a nivel local.	1
En la misma resolución, el Consejo también introdujo determinadas exenciones a las medidas específicas. El 5 de diciembre de 2011, el Consejo de Seguridad adoptó la resolución 2023 (2011), por la que ampliaba las medidas restrictivas relativas a Eritrea en los ámbitos de los &quot;impuestos a la diáspora&quot;, el sector minero de Eritrea y los servicios financieros.	1
Por este motivo, la Dirección Ejecutiva siempre plantea estas cuestiones durante las visitas a los países, los talleres de vídeo y otros intercambios, y considera que en el futuro será útil trabajar más intensamente con los Estados sobre los aspectos prácticos de esos enfoques.	0
37. La Misión siguió otorgando alta prioridad a la política de tolerancia cero con respecto a la explotación y los abusos sexuales, incluso mediante la organización de sesiones informativas introductorias y capacitación periódica para todo el personal de las Naciones Unidas sobre la prevención de la explotación y los abusos sexuales.	1
60. Bajo la dirección general del cuartel general de la Misión, los jefes de las oficinas regionales de la MONUC son responsables de elaborar y aplicar planes de acción regionales para la prevención de la explotación y los abusos sexuales en sus respectivas zonas.	1
285. La Comisión también ha constatado que los rebeldes han matado a civiles, aunque los incidentes y el número de muertes han sido pocos.	0
Estos países también enfrentan importantes desafíos relacionados con los flujos transfronterizos de refugiados.	0
Progresos en la eliminación de las armas químicas sirias por parte de los Estados partes que acogen actividades de destrucción	1
De los 168 niños, 135 fueron secuestrados con fines de reclutamiento, mientras que 33 fueron secuestrados con fines culturales y políticos o por otros motivos.	0
Los miembros del Consejo también afirmaron la importancia de un compromiso significativo de las partes con la IGAD en sus esfuerzos de mediación y el respeto del acuerdo de cese de hostilidades en aras de un pronto retorno de la paz y la estabilidad a Sudán del Sur.	1
76. Los Estados de la subregión deberían: a) Adoptar marcos jurídicos nacionales de lucha contra el terrorismo que sean integrales y coherentes y que incluyan todos los delitos terroristas establecidos en los instrumentos internacionales de lucha contra el terrorismo y aplicar eficazmente la lucha contra el blanqueo de dinero y la financiación del terrorismo. leyes y reglamentos, respetando al mismo tiempo las normas internacionales de derechos humanos;	1
Creemos, sin embargo, que una retirada abrupta sería contraproducente y crearía un vacío sin precedentes, sobre todo teniendo en cuenta que aún no se han creado del todo las condiciones propicias para las esperadas inversiones a gran escala y el desarrollo sostenible.	0
Los nacidos antes del 25 de mayo de 1988 o reclutados después del 25 de mayo de 2006 debían ser dados de baja inmediatamente, como lo exige el Acuerdo General de Paz.	1
Reconociendo que el fortalecimiento de las instituciones nacionales de derechos humanos y el respeto de los derechos humanos, el debido proceso, la lucha contra la criminalidad y la violencia sexual y de género y el fin de la impunidad son esenciales para garantizar el estado de derecho y la seguridad en [el país afectado],	1
La presencia de la fuerza de guardia es crucial para mantener una atmósfera de seguridad que impida el soborno de los testigos y les permita acceder a las instalaciones de la Corte sin temor.	1
También apoyó el desarrollo de la capacidad de hacer cumplir la ley marítima y puso en marcha un nuevo Fondo Fiduciario de Seguridad Marítima para África Occidental y Central con ese fin.	1
Capacitación para el personal de mantenimiento de la paz Solicita al Secretario General que garantice que el personal de las Naciones Unidas que participa en actividades de establecimiento, mantenimiento y consolidación de la paz tenga la capacitación adecuada en derecho internacional humanitario, derechos humanos y derecho de los refugiados, incluidas disposiciones relacionadas con los niños y el género, y habilidades de negociación y comunicación. , la conciencia cultural y la coordinación civil-militar, e insta a los Estados y a las organizaciones internacionales y regionales pertinentes a garantizar que se incluya en sus programas una capacitación adecuada para el personal involucrado en actividades similares.	1
a) La distinción entre combatientes y civiles, y la protección de los civiles, en particular contra la violencia contra la vida y las personas, en particular el asesinato (esta norma fue reafirmada en algunos acuerdos concertados por el Gobierno del Sudán con los rebeldes);	0
Todos los Estados son miembros de la OEA, que proporciona mecanismos regionales para la cooperación a nivel político y operativo.	1
450. Varias deficiencias graves impiden que el sistema de justicia del Sudán actúe con rapidez y de manera adecuada para abordar los abusos.	0
3. Bajo la dirección de mi Representante Especial, la UNOMIG continuó sus esfuerzos por promover la estabilidad en la zona del conflicto y promover el diálogo entre las partes georgiana y abjasia sobre cuestiones políticas y de seguridad, el regreso de los desplazados internos y los refugiados y la cooperación económica. respaldado por las reuniones de alto nivel del Grupo de Amigos celebradas en Ginebra presididas por las Naciones Unidas (véase S/2003/412, párr. 3).	1
3. Los avances logrados hacia la neutralización de los grupos armados extranjeros y congoleños en los Kivus siguieron siendo limitados.	1
18. Reitera que las misiones políticas especiales y de mantenimiento de la paz de las Naciones Unidas, si así lo encomienda el Consejo, pueden ayudar a crear capacidades para los gobiernos anfitriones, según lo soliciten, para implementar compromisos bajo los instrumentos globales y regionales existentes y abordar el tráfico ilícito de armas pequeñas. y armas ligeras, entre otras cosas mediante programas de recolección de armas, desarme, desmovilización y reintegración, mejora de la seguridad física y prácticas de gestión de arsenales, mantenimiento de registros y capacidades de rastreo, desarrollo de sistemas nacionales de control de exportaciones e importaciones, mejora de la seguridad fronteriza y fortalecimiento de las instituciones judiciales. , vigilancia y otras capacidades de aplicación de la ley;	1
Aunque el terrorismo no se menciona específicamente como un hecho constante, ciertamente es un área de preocupación, ya que muchos de los factores antes mencionados tienen el potencial de alimentar actos terroristas en la región.	0
La situación humanitaria en Somalia sigue siendo motivo de gran preocupación.	0
4. Me complace recordar que, desde la aprobación de la resolución 1559 (2004) del Consejo de Seguridad el 2 de septiembre de 2004, varias de sus disposiciones ya se han aplicado. Las elecciones presidenciales y parlamentarias se celebraron de manera libre y justa. La República Árabe Siria retiró sus tropas y activos militares del Líbano en abril de 2005. El Líbano y la República Árabe Siria establecieron relaciones diplomáticas plenas en 2009.	1
Instar a las partes en conflictos armados a respetar la independencia profesional de los periodistas, profesionales de los medios y personal asociado.	0
Los palestinos deben poner fin a la incitación pública a la violencia y hacer todo lo posible para impedir que los militantes ataquen a Israel y provoquen así su respuesta.	0
&quot;El Consejo de Seguridad observa con preocupación el aplazamiento de la primera vuelta de las elecciones presidenciales, prevista para el 29 de noviembre de 2009 en el comunicado del 18 de mayo de 2009 del Marco Consultivo Permanente del Acuerdo Político de Uagadugú, que fue respaldado por todos los principales actores políticos de Costa de Marfil. .	0
Las visitas del Comité a la región han demostrado que los Estados necesitan aumentar la implementación de legislación para prevenir el movimiento transfronterizo ilícito de efectivo e instrumentos negociables al portador mediante el desarrollo de indicadores de riesgo y la creación de capacidades en metodologías de detección.	1
c) Promover la adopción de controles internos más estrictos sobre armas y explosivos.	0
El recién creado Centro de Coordinación de Actividades relativas a las Minas está trabajando para mejorar la información sobre la contaminación y la respuesta a las minas, elevar el nivel de seguridad del personal de las Naciones Unidas que opera sobre el terreno y proporcionar apoyo técnico y material a los programas de actividades relativas a las minas en el Sáhara Occidental.	1
89. El ex Primer Ministro afirmó que durante la reunión aprovechó la oportunidad para discutir con el Ministro del Interior la necesidad de que un grupo de civiles apoyara a la URP PNTL, pero que no hubo discusión sobre el suministro de armas o uniformes a tal grupo.	0
Muchas personas murieron y más de 100 resultaron heridas.	0
66. La misión preguntó a los jefes militares del Gobierno si alguien había comparecido ante la justicia por excesos.	0
Solicitar el estricto cumplimiento por parte de las partes en conflictos armados del derecho internacional humanitario aplicable y de las normas de derechos humanos relativas a los niños afectados por conflictos armados.	0
Como resultado, la situación de seguridad en Mitrovica ha mejorado significativamente, al igual que la prestación de servicios judiciales y de detención. Sin embargo, se ha logrado poco o ningún progreso en el regreso de los serbios y albaneses de Kosovo desplazados a sus hogares en los respectivos lados del río Ibar.	1
Su trabajo con organizaciones regionales y subregionales debería centrarse en facilitar la interacción de las instituciones regionales y nacionales para remediar los desafíos de la implementación nacional, como conciliar prioridades, armonizar enfoques, facilitar servicios de asesoramiento y redacción, y hacer coincidir solicitudes y ofertas de asistencia.	1
Como parte de una estrategia de transición encaminada a establecer una institución policial independiente, se están realizando preparativos para la transferencia de responsabilidades de la Escuela del Servicio de Policía de Kosovo y la policía de la UNMIK al Servicio de Policía de Kosovo.	1
65. El Gobierno de Egipto confirmó el despliegue en julio de una unidad de policía constituida, que tendrá su base en Bukavu, Kivu del Sur, en cumplimiento de las necesidades adicionales descritas en la resolución 1843 (2008) del Consejo de Seguridad.	1
El desarme de las milicias es una preocupación prioritaria, especialmente en el período previo a una campaña electoral, con su potencial de violencia por motivos políticos.	0
Respeto al derecho de los refugiados y desplazados al regreso voluntario en condiciones de seguridad y dignidad a sus hogares.	1
En estos Estados existe conciencia de la importancia de la cooperación, el intercambio de información y la coordinación entre los distintos organismos y entre los niveles regional y nacional.	1
Además, la MINUSTAH está evaluando actualmente la necesidad de contar con aviones de observación especializados para realizar operaciones de vigilancia y patrullaje en las zonas costeras y fronterizas terrestres, generalmente inaccesibles. B. Seguridad electoral	1
UNIFEM, UNFPA Promover estrategias en países post-conflicto para abordar las dimensiones de género de la reconstrucción a través de evaluaciones de necesidades y mecanismos de transición.	0
Si bien la mayoría de las partes interesadas de Costa de Marfil, incluidos el Presidente Gbagbo y el Primer Ministro Soro, proporcionaron comentarios positivos sobre las operaciones de los tribunales móviles, el partido de oposición Rassemblement des républicains se quejó de que muchos marfileños no habían podido acceder a los tribunales móviles, en particular en el oeste, debido a la presencia de milicias, incluso si estaban inactivas.	0
66. El Programa de las Naciones Unidas para el Estado de Derecho y la Seguridad ha estado proporcionando apoyo técnico y financiero para un seminario sobre aplicación de la ley y un taller de capacitación para la Fuerza de Policía de Somalia en Kampala, desde agosto de 2005.	1
&quot;El Consejo de Seguridad condena en los términos más enérgicos los ataques terroristas ocurridos en Argel el 11 de diciembre de 2007 cerca del Tribunal Supremo y de las oficinas de las Naciones Unidas, que causaron numerosos muertos y heridos, y expresa su más sentido pésame y condolencias a las víctimas de este acto atroz del terrorismo y sus familias, y al pueblo y al Gobierno de Argelia.	0
212. Durante su investigación, la Comisión tomó conciencia de la importancia del sistema de justicia tradicional en Timor-Leste, así como del ejemplo de la forma modificada de justicia tradicional proporcionada mediante el proceso de reconciliación comunitaria de la Comisión de Recepción, Verdad y Conciliación por delitos penales &quot;menos graves&quot;.	1
7. Observa que dichos medios de financiación o apoyo incluyen, entre otros, el uso de ingresos derivados del delito, incluido el cultivo, la producción y el tráfico ilícitos de estupefacientes y sus precursores;	0
Se llevan a cabo operaciones específicas para recoger armas y municiones entregadas voluntariamente, en condiciones de amnistía o, si es necesario, en operaciones más dirigidas.	1
Ciento cuarenta y seis Estados, incluidos los Estados que no presentan informes, han dicho que distribuyen la Lista (y cualquier cambio) a los bancos y, hasta cierto punto, a otras instituciones financieras, así como a los puertos de entrada y otras autoridades pertinentes. , pero las visitas revelan que en muchos Estados la circulación de actualizaciones es lenta, especialmente en los puestos fronterizos.	1
B. Preservación de la escena del crimen	1
El movimiento Bakata Katanga ha desestabilizado gran parte de la provincia desde 2012, cuando, tras escapar de prisión, Kyunugu Mutanga Gédéon empezó a obligar a la población local, incluidos niños, a unirse a sus filas o huir.	0
Tras las consultas, el Presidente del Consejo pronunció un comunicado de prensa en el que los miembros del Consejo pidieron a las autoridades de Côte d&#39;Ivoire y a todas las partes interesadas que pusieran fin a los impedimentos a la libertad de circulación de las fuerzas imparciales e instaron a todas las partes a demostrar responsabilidad y moderación para que la próxima campaña electoral se desarrolle en un ambiente pacífico y según lo previsto.	0
Al mismo tiempo, la cuestión de garantizar el cumplimiento de las medidas antiterroristas con las obligaciones de derechos humanos sigue siendo un importante tema de debate en la subregión.	0
Incorporación del análisis de género en la evaluación de las necesidades posteriores al conflicto y en la capacitación conexa. Se puso a prueba una evaluación de las necesidades posteriores a los conflictos que tiene en cuenta las cuestiones de género.	1
La ONUCI sigue de cerca las incitaciones al odio y la violencia en los medios de comunicación de Costa de Marfil, proporcionando informes mensuales al Consejo de Seguridad, y reforzará aún más su capacidad de seguimiento y análisis de los medios de comunicación en el período previo a las elecciones.	1
iii) Mejora de la capacidad de las autoridades [nacionales] en [la zona afectada por la violencia], incluidos los organismos nacionales encargados de hacer cumplir la ley, el poder judicial y el sistema penitenciario, para brindar la seguridad necesaria a los refugiados, los desplazados internos, los civiles y los trabajadores humanitarios con respeto a las normas internacionales de derechos humanos.	1
:: Aplicar una estrategia de comunicaciones más proactiva con miras a mejorar la comprensión del papel del Comité y de la Dirección Ejecutiva en la esfera de la lucha contra el terrorismo.	0
43. En consultas informales celebradas el 2 de mayo, los miembros del Consejo escucharon otro informe provisional del Asesor Especial del Secretario General, Álvaro de Soto, sobre Chipre, sobre las conversaciones directas entre los dirigentes grecochipriotas y turcochipriotas que han estado en curso. desde enero en virtud de su acuerdo de 4 de diciembre de 2001.	0
Se avanzarían en la investigación y el análisis de políticas sobre una variedad de cuestiones, incluida la prevención de conflictos y los mecanismos de alerta temprana.	0
El Comité seguirá centrándose en promover la aplicación por parte de los Estados de la resolución 1373 (2001) y en adoptar medidas prácticas diseñadas para mejorar la capacidad de los Estados en la lucha contra el terrorismo.	1
A pesar de los notables avances, un complejo entorno político, económico y de seguridad continúa presentando desafíos formidables a los líderes electos encargados de la normalización de nuestro país.	0
Exhortar a las partes en conflictos armados a que adopten medidas apropiadas para abstenerse de cometer toda forma de violencia sexual, prevenirla y protegerla, entre otras cosas:	0
Varios testigos han declarado que se utilizaron términos abusivos e insultantes contra los detenidos, a quienes a menudo se les llamaba &quot;esclavos&quot;.	0
Tomando nota de los recientes acontecimientos e iniciativas a nivel internacional, regional y subregional para prevenir y reprimir el terrorismo internacional, tomando nota de la labor del Foro Mundial contra el Terrorismo (GCTF), en particular su reciente adopción de un conjunto integral de buenas prácticas para abordar el tema de los combatientes terroristas extranjeros. fenómeno, y su publicación de varios otros documentos marco y buenas prácticas, incluso en las áreas de lucha contra el extremismo violento, justicia penal, prisiones, secuestros para pedir rescate, prestación de apoyo a las víctimas del terrorismo y actuación policial orientada a la comunidad, para ayudar a los Estados interesados a la aplicación práctica del marco jurídico y normativo de las Naciones Unidas contra el terrorismo y complementar la labor de las entidades pertinentes de las Naciones Unidas contra el terrorismo en esas esferas,	1
Desarrollar un plan de acción departamental de género para integrar la perspectiva de género en sus actividades de prevención de conflictos, establecimiento de la paz y consolidación de la paz.	0
Está claro que estas circunstancias representan el mayor obstáculo para la estabilidad y el progreso en Afganistán y que, si se permite que continúen, amenazan con deshacer el progreso logrado durante casi tres años.	0
Por lo tanto, se ha limitado a recopilar información fiable sobre personas que podrían ser sospechosas de ser responsables de crímenes en Darfur.	1
25. Reitera su invitación al Secretario General a que siga remitiendo al Consejo información y análisis pertinentes sobre la protección de los civiles cuando crea que esa información o análisis podría contribuir a la solución de las cuestiones que tiene ante sí, le pide que siga incluyendo en sus informes escritos al Consejo sobre las cuestiones de las que se ocupa, según proceda, observaciones relativas a la protección de los civiles en los conflictos armados, y lo alienta a continuar las consultas y adoptar medidas concretas para mejorar la capacidad de las Naciones Unidas a este respecto ;	0
Eritrea ha estado organizando, entrenando y luego enviando a Etiopía todo tipo de gánsteres y elementos terroristas para causar estragos en nuestro país e inestabilidad política.	0
130. El viaje puso de relieve los problemas que afrontan los países en el proceso de establecimiento de marcos jurídicos e institucionales para luchar contra el terrorismo en un clima político, social y económico inestable.	0
d) Adopte un enfoque de la trata de personas centrado en las víctimas y basado en los derechos humanos, incluso proporcionando a las víctimas el derecho a permanecer en el país y acceso a protección jurídica y servicios básicos, como tratamiento médico, educación y oportunidades de empleo equivalentes. a los otorgados a sus propios ciudadanos;	0
Los Estados deben garantizar que su legislación y orientación sean lo suficientemente flexibles y sólidas para cubrir nuevas amenazas y mantener su función preventiva.	1
Desmantelamiento y desarme de todos los grupos armados, incluidas las llamadas fuerzas paralelas, teniendo debidamente en cuenta la posible integración de miembros de esas fuerzas en las estructuras regulares de seguridad del Estado, basándose en su reentrenamiento y su pleno cumplimiento de las normas internacionales de derechos humanos y normas internacionales aplicables. derecho humanitario;	1
En todas esas discusiones, me alentó encontrar una convergencia de opiniones: todos nos maravillamos de cómo Liberia ha logrado tanto desde el fin de los combates en 2003, pero todos nos dimos cuenta plenamente de cuán impresionantes son los desafíos que aún enfrenta Liberia, y que En última instancia, no damos nada por sentado.	0
&quot;El Consejo de Seguridad apoya firmemente los esfuerzos por promover el diálogo nacional, la reconciliación y una amplia participación política para garantizar la unidad, la paz, la seguridad y la estabilidad en Irak.	0
▪ Samira Ahmad al-Sahli, enfermera de 53 años del campo de Yarmuk, que fue arrestada por las fuerzas del régimen sirio el 11 de junio de 2014 debido a su trabajo médico. Su familia se enteró de que fue torturada hasta la muerte dentro de los centros de detención del régimen el 8 de noviembre de 2014.	0
La estrategia también apunta a ampliar el círculo de donantes incluyendo países en los que se han desarrollado enfoques o sistemas antiterroristas particularmente efectivos.	1
También reiteraron su grave preocupación por los problemas del terrorismo, la piratería, la toma de rehenes y la terrible situación humanitaria. En ese contexto, subrayaron la necesidad de aplicar rápidamente todas las resoluciones pertinentes del Consejo de Seguridad, incluso por parte de las instituciones federales de transición, según corresponda.	0
60. Para apoyar el restablecimiento y la extensión de un nivel mínimo de autoridad estatal sostenible a zonas libres de grupos armados se requiere un mayor compromiso del Gobierno para desplegar la administración del Estado, incluido el personal policial y judicial y penitenciario, con los recursos necesarios.	1
La Federación de Rusia también ha aprobado leyes para proteger los derechos de las víctimas del terrorismo y ha introducido medidas relativas a las condiciones de detención de las personas sospechosas de haber cometido un acto terrorista.	1
Los organismos encargados de hacer cumplir la ley están bien estructurados y han establecido agencias, comités y unidades especiales para luchar contra el terrorismo.	1
El componente militar sigue prestando servicio en el norte en condiciones extremadamente difíciles.	0
29. Mientras tanto, los esfuerzos del componente de policía de la ONUCI para asesorar al Gobierno de Reconciliación Nacional sobre la reestructuración de las Fuerzas de Defensa y Seguridad de Côte d&#39;Ivoire y ayudar a restablecer una presencia policial civil en todo el país se han visto obstaculizados por la actitud poco cooperativa de las autoridades locales, la ausencia de un plan integral de reforma de las Fuerzas de Defensa y Seguridad de Costa de Marfil y la falta de acuerdo entre las partes de Costa de Marfil sobre el despliegue de agentes de policía y gendarmería de Costa de Marfil en el norte.	0
27. Además, varios Estados han establecido medidas provisionales que permiten a sus funcionarios aplicar sanciones incluidas en una lista del Consejo de Seguridad incluso antes de que se hayan completado los procesos de validación nacional.	1
341. Otras fuentes informaron de que mujeres y niñas fueron secuestradas, recluidas durante varios días y violadas repetidamente por Janjaweed y soldados en aldeas atacadas, campamentos militares y escondites. Además, según informes, se utilizó la tortura para impedir que las mujeres escaparan.	0
&quot;El Consejo destaca la utilidad de seguir desarrollando asociaciones eficaces entre las Naciones Unidas y las organizaciones regionales y subregionales pertinentes, a fin de permitir respuestas tempranas a las controversias y las crisis emergentes y fortalecer el papel de las Naciones Unidas en la prevención de conflictos.	1
En Italia, por ejemplo, la Unidad Político-Militar establecida por la Oficina del Primer Ministro está integrada por altos representantes de todos los departamentos y organismos gubernamentales responsables de la lucha contra el terrorismo y tiene funciones amplias e integrales.	1
El PNUD y sus socios implementadores han hecho arreglos para brindar servicios de reintegración a otros 7.219 excombatientes, una vez desmovilizados.	1
La nota conceptual describe el camino a seguir para la evaluación conjunta de las necesidades de Somalia e incluye una participación sustancial de los somalíes en el ejercicio, como contrapartes gubernamentales y zonales y expertos internacionales de la diáspora somalí.	1
