en_es_GOOGLE	MatCoop
Como se dispone tanto en la resolución 1535 (2004) del Consejo de Seguridad como en el informe del Comité contra el Terrorismo sobre su revitalización (S/2004/124), el Comité espera con interés una relación estrecha y de cooperación con el Director Ejecutivo y su personal con el objetivo de mejorar la capacidad del Comité para supervisar eficazmente la aplicación de la resolución 1373 (2001) por todos los Estados Miembros.	0
Exhorta a todas las partes interesadas a garantizar que la protección, los derechos y el bienestar de los niños afectados por conflictos armados se integren específicamente en todos los procesos y acuerdos de paz y en los planes y programas de recuperación y reconstrucción posconflicto.	0
28. Declara su determinación de seguir de cerca cualquier situación que implique la proliferación de armas nucleares, sus sistemas vectores o materiales conexos, incluso hacia o por agentes no estatales, tal como se definen en la resolución 1540 (2004), y, según corresponda, a tomar las medidas que sean necesarias para garantizar el mantenimiento de la paz y la seguridad internacionales;	0
126. El Grupo investigó la cadena de suministro para la entrega de estos vehículos para determinar si los involucrados tenían conocimiento previo de que el usuario final sería el Ministerio de Defensa de Côte d&#39;Ivoire.	1
Las medidas para ayudar a aquellos cuyos familiares fueron asesinados, el reconocimiento por parte de las autoridades gubernamentales de su responsabilidad y las explicaciones sobre las medidas que se deben tomar para evitar que se repitan las violaciones parecen ser de importancia clave para la comunidad.	0
La reunión, organizada conjuntamente por la Dirección Ejecutiva y el Consejo de Europa, se centró en la prevención del terrorismo.	0
El Equipo cree que el embargo podría tener un mayor impacto contra ésta y otras amenazas de alta prioridad, como el uso de sistemas portátiles de defensa aérea, si estuviera más estrechamente vinculado a otros regímenes de contraproliferación y control de armamentos.	0
En ese sentido, estamos muy preocupados por la situación de seguridad en el Afganistán, que se ha deteriorado desde el año pasado como resultado de las actividades subversivas de elementos residuales de los talibanes y de Al Qaeda, los enfrentamientos entre los señores de la guerra y el tráfico de narcóticos.	0
1. Expresa su determinación de adoptar medidas apropiadas para seguir desarrollando la cooperación entre las Naciones Unidas y las organizaciones regionales y subregionales en el mantenimiento de la paz y la seguridad internacionales, de conformidad con el Capítulo VIII de la Carta de las Naciones Unidas, e invita a las organizaciones regionales y subregionales que tienen un capacidad para la prevención de conflictos o el mantenimiento de la paz para colocar dichas capacidades en el marco del Sistema de Acuerdos de Reserva de las Naciones Unidas;	1
Por lo tanto, el papel del Consejo a la hora de proporcionar compensación a las víctimas de violaciones del derecho internacional puede ser viable y eficaz.	1
El 21 de diciembre, el Consejo escuchó en una sesión pública una exposición informativa del Presidente del Comité establecido en virtud de la resolución 1737 (2006) y Representante Permanente de Colombia, Néstor Osorio, sobre la labor del Comité realizada del 1 de septiembre al 18 de diciembre de 2011.	0
La Misión está examinando con algunos líderes combatientes rwandeses y con el Gobierno de Transición las modalidades técnicas de repatriación, y ha hecho pública la decisión adoptada por el Gobierno de Ruanda de no enjuiciar a ningún combatiente que regresara y tuviera 14 años o menos en el momento del genocidio de 1994. .	0
275. La extradición de terroristas también sigue enfrentando muchos obstáculos y no es fácil ni fácil.	1
Sin embargo, ambas partes continuaron absteniéndose de tratar directamente entre sí. Todos los contactos conocidos entre las dos fuerzas armadas adoptaron la forma de reuniones y comunicaciones escritas con la MINURSO.	1
6. Recuerda las obligaciones mencionadas en el párrafo dispositivo 2 (e) de la resolución 1373 (2001) y las recuerda en particular en lo que respecta a los ataques terroristas contra el personal, el personal de mantenimiento de la paz y las instalaciones de las Naciones Unidas;	0
Acogiendo con beneplácito la adopción por la Asamblea General de la Estrategia global de las Naciones Unidas contra el terrorismo (A/60/288) de 8 de septiembre de 2006 y la creación del Grupo de Trabajo sobre la Ejecución de la Lucha contra el Terrorismo (CTITF) para asegurar la coordinación y coherencia generales en la lucha contra el terrorismo. -esfuerzos terroristas del sistema de las Naciones Unidas,	1
66. Se han establecido varios mecanismos de cooperación regional para mejorar la capacidad de los Estados de prevenir colectivamente la incitación y negar refugio seguro en la región de América Latina y el Caribe.	1
El Programa de Acción contiene sugerencias concretas para mejorar la legislación y los controles nacionales y la asistencia y cooperación internacionales. Exhorta a los Estados a abordar las necesidades especiales de los niños afectados por conflictos armados.	1
Estos ataques y provocaciones en ocasiones han perjudicado indirectamente el acceso humanitario.	0
Si bien ningún aldeano denunció ningún caso de violación al equipo de investigación de la UNAMID, las fuerzas armadas sudanesas y el personal de inteligencia militar estuvieron presentes en la aldea durante la investigación de la UNAMID.	1
Me complace informar que ya se han obtenido fondos para el establecimiento de una biblioteca jurídica bajo la custodia de los refugiados en Rabuni (véase S/2007/619, párr. 41).	1
El potencial de ataques internacionales por parte de AQAP persiste, pero por ahora el impacto de las actividades de AQAP se siente principalmente en Yemen.	0
190. Todos los Estados son partes en el Convenio sobre la Financiación del Terrorismo y todos han introducido legislación contra el blanqueo de dinero y la financiación del terrorismo y han establecido unidades de inteligencia financiera que son miembros del Grupo Egmont.	1
En este sentido, el Consejo elogia los esfuerzos realizados hasta ahora por la República Centroafricana (RCA), la República Democrática del Congo (RDC), la República de Sudán del Sur y Uganda para poner fin a la amenaza que representa el LRA, e insta a realizar mayores esfuerzos. de estos países, así como de otros países de la región.	0
Como sostiene la jurisprudencia pertinente, la responsabilidad por un delito distinto del acordado en el plan común sólo surge si, en las circunstancias del caso, era previsible que tal delito podría ser perpetrado por uno u otros miembros de el grupo y el acusado asumieron voluntariamente ese riesgo.	0
34. El Gobierno de Nepal ha logrado algunos avances en el cumplimiento de sus obligaciones en virtud del Acuerdo General de Paz de prever la rehabilitación de los niños anteriormente asociados con fuerzas y grupos armados.	1
El debate de hoy aborda una cuestión urgente.	0
Expresando su determinación de facilitar el cumplimiento de las obligaciones en materia de lucha contra el terrorismo de conformidad con las resoluciones pertinentes del Consejo de Seguridad,	0
Los miembros del Consejo reiteraron su apoyo a los esfuerzos del Enviado Especial para involucrar a las dos partes con el objetivo de superar el actual estancamiento en el proceso de paz. Instaron a ambas partes a explorar formas de hacer avanzar el proceso de demarcación.	0
a) Mamadou Cisse (cercano al partido Rassemblement des Républicains) y el sargento de marina Tarine, al parecer detenidos desde el 20 de septiembre de 2002;	0
El equipo estaba compuesto por siete expertos especializados en investigaciones posteriores a explosiones.	1
2. Recuerda a este respecto que los periodistas, los profesionales de los medios de comunicación y el personal asociado que realicen misiones profesionales peligrosas en zonas de conflicto armado serán considerados civiles y serán respetados y protegidos como tales, siempre que no realicen ninguna acción que afecte negativamente a su condición de civiles . Esto se entiende sin perjuicio del derecho de los corresponsales de guerra acreditados ante las fuerzas armadas al estatuto de prisioneros de guerra previsto en el artículo 4.A.4 del Tercer Convenio de Ginebra;	1
Hay pruebas abrumadoras que sugieren que estos asesinatos en su mayoría no fueron provocados y fueron innecesarios para tratar con los manifestantes.	0
En otros lugares, los controles efectivos y la necesidad de evadir la detección han obligado a los grupos a adaptar e improvisar dispositivos a partir de productos que se obtienen más fácilmente.	0
8. El 21 de septiembre, en respuesta a una solicitud de las partes en el Acuerdo General de Paz, anuncié el establecimiento de un grupo de tres miembros, encabezado por el ex Presidente de la República Unida de Tanzania, Benjamin Mkapa, para vigilar el Sudán meridional y Referendos de Abyei.	1
▪ Coordinación sistemática, entre los componentes civil y militar de la misión y con los actores humanitarios, para consolidar conocimientos sobre la protección de civiles.	1
En la República Árabe Siria, el posible nexo entre un gran número de combatientes extranjeros afiliados a Al-Qaida y Jabhat-al-Nusrah que crean asociaciones basadas en un lenguaje común podría dar lugar al surgimiento de nuevas redes panárabes y paneuropeas de extremistas.	0
Un oficial muerto y otro gravemente herido.	0
236. No se ha contado el número exacto de aldeas quemadas y destruidas, pero varias fuentes han estimado el alcance de la destrucción mediante relatos verbales, inspecciones de lugares y otras pruebas.	0
&quot;El Consejo de Seguridad observa con preocupación que el terrorismo sigue planteando una grave amenaza a la paz y la seguridad internacionales, el disfrute de los derechos humanos y el desarrollo social y económico de todos los Estados miembros, y socava la estabilidad y la prosperidad mundiales; que esta amenaza se ha vuelto más difuso, con un aumento, en varias regiones del mundo, de los actos terroristas, incluidos los motivados por la intolerancia o el extremismo, y expresa su determinación de combatir esta amenaza.	0
La colaboración con el GAFI, los controles anticorrupción, la cooperación internacional en investigaciones financieras y la ratificación de convenios internacionales relacionados con la lucha contra el terrorismo parecen mejorar el entorno regulatorio general en los Estados.	1
Además, ha habido advertencias sobre células de Al-Qaida en Zambia, y tanto Sudáfrica como Zambia han extraditado a presuntos terroristas en el pasado.	1
(b) Impedir la entrada o el tránsito por sus territorios de estas personas, siempre que nada en este párrafo obligará a ningún Estado a negar la entrada o exigir la salida de sus territorios de sus propios nacionales y este párrafo no se aplicará cuando la entrada o el tránsito es necesario para el cumplimiento de un proceso judicial o el Comité determina caso por caso únicamente que la entrada o el tránsito está justificado;	0
Los datos recopilados fueron posteriormente fusionados y analizados por la Unidad de Fusión de Información de Todas las Fuentes. La Unidad también comenzó a capacitar a unidades de infantería en materia de concienciación y procedimientos de intercambio de información para mejorar el flujo de información dentro de la fuerza de la MINUSMA.	1
&quot;El Consejo de Seguridad expresa su enérgica condena de este intento de desestabilizar las instituciones libanesas, en este caso particular las Fuerzas Armadas Libanesas.	0
En julio de 2009 se celebrará un taller para los Estados miembros de la Comunidad del Caribe sobre la redacción de respuestas a los tres comités del Consejo de Seguridad que se ocupan de la lucha contra el terrorismo.	1
Con ese fin, la Oficina de Información y Administración utilizará el sistema seguro de seguimiento y distribución de documentos en línea recientemente establecido en el sitio web del Comité para distribuir materiales de la Dirección Ejecutiva a los miembros del Comité y a la Secretaría.	1
Un total de 12 Estados han adoptado medidas para regular la producción, venta y transferencia de armas y explosivos, aunque sólo dos las han aplicado plenamente.	1
A nivel subregional, la Oficina aumentará su cooperación, en particular con la Comunidad Económica y Monetaria de África Central (CEMAC), la Comunidad Económica de los Estados de África Central y la Fuerza Multinacional de la Comunidad Económica y Monetaria de África Central (FOMUC) en las esferas de seguridad, alerta temprana y prevención.	1
De manera similar, en términos de destinatarios de reparaciones, era importante mirar más allá de las víctimas individuales y considerar también a las comunidades afectadas.	1
120. Todavía hay algunas actividades en la calle Minae Al-Hosn de Beirut antes de la explosión que deben investigarse más a fondo, lo que podría dilucidar detalles de la fase de planificación y, como tal, conducir a los perpetradores.	0
51. El éxito de la transición se vería amenazado si las elecciones en la República Democrática del Congo no se celebraran antes del 30 de junio de 2006.	0
25. El período de la UNTAET también fue testigo de la creación de muchas instituciones estatales modernas. Entre ellos se incluyen el Parlamento Nacional, el Consejo de Ministros, las estructuras de gobierno local, el servicio de policía y las fuerzas de defensa.	1
Celebrará su decimoséptima sesión plenaria en Dubai, Emiratos Árabes Unidos, en paralelo con la cuarta conferencia contra la piratería de los Emiratos Árabes Unidos, en la última semana de octubre de 2014.	0
Todos los Estados que presentaron informes creen que tienen protección efectiva contra personas o entidades incluidas en la lista que adquieran armas, pero sólo 38 Estados Miembros han dicho que han realizado cambios en las leyes y reglamentos existentes para incorporar las medidas de embargo de armas; 106 Estados no hicieron referencia a la Lista Consolidada al describir sus procesos regulatorios.	1
&quot;El Consejo de Seguridad observa los efectos nocivos de la proliferación de armas, en particular de armas pequeñas, en la seguridad de los civiles, incluidos los refugiados y otras poblaciones vulnerables.	0
El acto específico de reclutamiento de personas con el fin de cometer actos terroristas se trata en la Ley núm. 535/2004 sobre prevención y lucha contra el terrorismo.	0
Identificó una serie de medidas que debían adoptar y aplicar los Estados miembros y estableció el Comité contra el Terrorismo para supervisar la aplicación de esas medidas.	1
En mayo de 2000, Turabi encabezó una escisión del gobernante Congreso Nacional, estableciendo de hecho un nuevo partido llamado Congreso Popular.	1
3. Asesinato de militares enemigos detenidos	0
El 4 de marzo, instó a que se dictaran órdenes de detención contra funcionarios del Estado, lo que provocó indignación popular y socavó las esperanzas de paz y estabilidad.	0
Treinta graduados del primer programa de capacitación a mediano plazo de cuatro semanas para altos funcionarios municipales recibieron capacitación en derecho, economía, finanzas públicas, gestión de recursos humanos y resolución de conflictos.	1
Además, en este ataque murieron 17 policías, todos ellos pertenecientes a tribus africanas.	0
Con excepción de San Pedro y Abidján, los puertos y la costa carecían de infraestructura para importar cantidades significativas de armas y equipo militar.	1
La base de operaciones de Bir Lahlou fue reforzada con observadores militares adicionales de la base de operaciones de Tifariti y mantuvo estrechos contactos con el Frente Polisario.	1
La misión se dirigió a Daloa por carretera, escoltada por un destacamento militar de Costa de Marfil.	1
Posteriormente, en 2006, la Asamblea General adoptó por unanimidad la Estrategia Global de las Naciones Unidas contra el Terrorismo, que fue de gran importancia para reafirmar el compromiso colectivo de la comunidad internacional de combatir la amenaza común del terrorismo.	1
Menos de la mitad de los 140 Estados que presentaron informes en virtud de la resolución 1455 (2003) dijeron qué medidas habían adoptado para restringir o regular el movimiento de productos preciosos, y los que lo hicieron en general se refirieron únicamente a los controles establecidos en el marco de la legislación aduanera y fiscal.	1
Durante las consultas oficiosas del Comité celebradas el 22 de mayo, el Coordinador del Equipo de Vigilancia hizo una presentación oral sobre la actual amenaza a la paz y la seguridad internacionales que plantean AlQaida y sus afiliados.	0
73. El Departamento de Seguridad Civil y Preparación para Emergencias se creó oficialmente el 9 de noviembre mediante el reglamento Nº 2000/61 de la UNMIK.	1
Varias operaciones de paz recientes han incorporado el análisis de la delincuencia transfronteriza en la planificación de sus misiones y en sus estructuras conjuntas de análisis de misiones, en particular la MINUSMA.	0
19. La Liga de Jóvenes Comunistas parece haber absorbido a muchos miembros de las milicias disueltas del PCN-M. Muchos niños reclutados durante la campaña de reclutamiento posterior al alto el fuego de 2006 no se unieron al ejército maoísta.	0
&quot;Alrededor de las 8 de la mañana del segundo día en el wadi, fui violada por primera vez.	0
c) Impedir el suministro, la venta o la transferencia directa o indirecta, a estas personas, grupos, empresas y entidades desde sus territorios o por sus nacionales fuera de sus territorios, o utilizando buques o aeronaves de su pabellón, de armas y material conexo de todo tipo. incluyendo armas y municiones, vehículos y equipos militares, equipos paramilitares y repuestos para los mismos y asesoramiento, asistencia o entrenamiento técnico relacionado con actividades militares; y recuerda que todos los Estados aplicarán las medidas con respecto a las personas y entidades incluidas en la lista;	1
Revisión y mantenimiento de la Lista 25. Reconoce que el conflicto actual en Afganistán y la urgencia que el Gobierno de Afganistán y la comunidad internacional atribuyen a una solución política pacífica al conflicto requieren modificaciones oportunas y rápidas a la Lista, incluida la adición y eliminación de personas y entidades, insta al Comité a decidir sobre las solicitudes de exclusión de la lista de manera oportuna, solicita al Comité que revise cada entrada en la lista de manera regular, incluso, según corresponda, mediante revisiones de personas que se consideran conciliadas , personas cuyas entradas carecen de identificadores, personas presuntamente fallecidas y entidades cuya existencia se ha informado o confirmado que han dejado de existir, ordena al Comité que establezca directrices para dichas revisiones en consecuencia y solicita al Equipo de Vigilancia que distribuya al Comité cada seis meses:	0
El Consejo de Seguridad reafirma el principio de no devolución de refugiados, según lo dispuesto en los instrumentos pertinentes del derecho internacional, acoge con satisfacción los esfuerzos recientes de los países vecinos [al Estado afectado] para apoyar la repatriación voluntaria de los refugiados en condiciones de seguridad y dignidad, e insta a los países de acogida Los Estados deben continuar brindando protección internacional a [aquellos] refugiados que la necesitan. Alienta a la comunidad internacional a proporcionar la asistencia necesaria a este respecto.	0
Deben cesar esos actos de terror e intimidación, que constituyen una pauta de ataques no sólo contra los ciudadanos libaneses, sino también contra los principios de una sociedad democrática y abierta que incluye la libertad de prensa.	0
La cooperación en la gestión de fronteras regionales continúa mejorando, incluso mediante el establecimiento de patrullas conjuntas, el intercambio de información y mecanismos regionales para el control de fronteras y la cooperación aduanera.	1
Los grupos técnicos, cada uno de los cuales incluye al menos un representante de cada cluster, se ocupan respectivamente de la asistencia técnica; financiación del terrorismo; seguridad fronteriza, tráfico de armas y aplicación de la ley; cuestiones legales generales; y las cuestiones planteadas por el Consejo de Seguridad en la resolución 1624 (2005), así como los aspectos de derechos humanos de la lucha contra el terrorismo en el contexto de la resolución 1373 (2001). Las dos unidades se ocupan del control de calidad y de las comunicaciones públicas y la divulgación, respectivamente.	1
51. Tres Estados han introducido marcos jurídicos eficaces para garantizar la asistencia jurídica mutua y la extradición, así como mecanismos adecuados, de manera rápida y eficaz para intercambiar información con sus homólogos internacionales.	1
Para acelerar el proceso de aprobación, se podría alentar a los Estados a que proporcionen al Comité cualquier prueba o documentación de respaldo disponible, como órdenes de arresto, notificaciones de Interpol existentes, acusaciones o decisiones o transcripciones judiciales.	1
Por ejemplo, Croacia y Polonia, con el apoyo de la Oficina de Asuntos de Desarme, llevaron a cabo un examen por pares de su aplicación de la resolución, que consistió en dos rondas de debates y actividades en Varsovia y Zagreb, que fueron observados por expertos del Comité. Ese examen por pares ayudó a identificar prácticas eficaces y facilitó el intercambio de experiencias.	1
Sin embargo, mi delegación lamenta observar que la situación de seguridad sigue siendo motivo de preocupación.	0
Sin embargo, en Puerto Príncipe, un marcado aumento de la violencia y la criminalidad, incluidos los secuestros, generó una grave ansiedad pública en mayo y junio.	0
220. La Comisión recomienda que se tomen medidas especiales para garantizar la dignidad y evitar la retraumatización de las víctimas en cualquier proceso judicial o extrajudicial. VI. Conclusiones y hallazgos A. Conclusiones	0
Este sector requiere una protección especial contra la financiación del terrorismo, ya que el abuso de organizaciones sin fines de lucro puede crear daños duraderos a las propias organizaciones y puede desalentar las donaciones caritativas en general.	1
El Consejo de Seguridad pide a los Estados miembros que cooperen rápidamente para resolver todas las cuestiones pendientes con miras a aprobar el proyecto de convenio general sobre el terrorismo internacional.	1
103. La FACI ha trasladado todos sus activos aéreos supervivientes y dañados a su base aérea del Aeropuerto Internacional de Abidján.	1
La mayoría de los Estados tienen poca capacidad para congelar sin demora fondos y activos vinculados al terrorismo.	0
95. La estructura y organización de los servicios de inteligencia sirios y libaneses en el Líbano en el momento de la explosión, incluidos los protocolos para la presentación de informes, muestran un impacto generalizado en la vida cotidiana en el Líbano.	0
259. La resolución 1373 (2001) exige que los Estados impidan el movimiento transfronterizo de terroristas y grupos terroristas mediante controles sobre la expedición de documentos de identidad y de viaje seguros y válidos.	0
20. Aún no se ha puesto en marcha el programa de servicio cívico previsto, que pretende absorber un número de casos de 20.000 excombatientes y 20.000 jóvenes en situación de riesgo.	1
Además, cuando el uso de la violencia armada se convierte en un medio arraigado para resolver agravios y conflictos individuales y grupales, los mecanismos legales y pacíficos de resolución de disputas se erosionan y no se puede defender el estado de derecho.	0
Podría decirse que la ciudad de Kulbus era un objetivo militar, como lo demuestra el campamento militar allí.	0
2. Decide que todos los Estados adopten las siguientes medidas con respecto a Usama bin Laden, los miembros de la organización Al-Qaida y los talibanes y otras personas, grupos, empresas y entidades asociadas con ellos, según se menciona en la lista creada de conformidad con las resoluciones 1267 (1999) y 1333 (2000) serán actualizadas periódicamente por el Comité establecido en virtud de la resolución 1267 (1999), en adelante denominado &quot;el Comité&quot;;	1
Por ejemplo, en 2009, Bután estableció una unidad de fuerzas especiales de élite en su departamento de policía para combatir el terrorismo.	1
&quot;El Consejo de Seguridad recuerda su resolución 1645 (2005) y reconoce el importante papel de la Comisión de Consolidación de la Paz en la promoción y apoyo de un enfoque integrado y coherente para la consolidación de la paz, incluida la promoción de una mayor coherencia y alineación de las políticas de los socios en torno a las estrategias y prioridades nacionales de consolidación de la paz. El Consejo reitera su apoyo a la labor de la Comisión y expresa su continua voluntad de hacer uso de su función de asesoramiento, promoción y movilización de recursos, incluso mediante asesoramiento específico sobre el compromiso internacional y nacional con los objetivos de consolidación de la paz a largo plazo en los países que figuran en la agenda de la Comisión. El Consejo destaca además el papel de la Comisión de Consolidación de la Paz en apoyo de una transición fluida de las misiones encomendadas en los países incluidos en su agenda, en particular mediante la movilización de apoyo internacional sostenido para satisfacer las necesidades críticas de capacidad nacional.	0
